Sheet: Sheet1
A1: Purchase Date | B1: ID Fragment | C1: Name | D1: Quantity | E1: Individual Cost (at time of writing, Using the sourceâ€™s currency) | F1: Note | H1: Proportion | I1: Adjusted Item Cost (AUD) | J1: Calculated Shipping + Fees (AUD) | L1: Adjusted Item Cost (Rounded, AUD) | M1: Calculated Shipping + Fees (Rounded AUD) | N1: Item Cost Error (*10000) | O1: Shipping/Fees Error (*1000)
A2: 2022-05-02 | B2: ALL-CAPS-AU | C2: BuiltByNim Linear | D2: 1 | E2: of:=9.5/10 -> 0.95 | H2: of:=[.E2]/[.$E$13] -> 0.115974886641088 | I2: of:=[.H2]*[.$R$2] -> 1.15974886641088 | J2: of:=[.H2]*[.$R$3] -> 0.207595047087548 | L2: of:=MROUND([.I2];0.01) -> 1.16 | M2: of:=MROUND([.J2];0.01) -> 0.21 | Q2: Actual Total Item Cost (AUD) | R2: 10
A3: 2022-05-02 | B3: ALL-CAPS-AU | C3: Charue Design Ca Phe Sua Da | D3: 1 | E3: of:=8.5/10 -> 0.85 | H3: of:=[.E3]/[.$E$13] -> 0.103767003836763 | I3: of:=[.H3]*[.$R$2] -> 1.03767003836763 | J3: of:=[.H3]*[.$R$3] -> 0.185742936867806 | L3: of:=MROUND([.I3];0.01) -> 1.04 | M3: of:=MROUND([.J3];0.01) -> 0.19 | Q3: Actual Shipping Cost (AUD) | R3: 1.79
A4: 2022-05-02 | B4: ALL-CAPS-AU | C4: Charue Design Popcorn | D4: 1 | E4: of:=8.5/10 -> 0.85 | H4: of:=[.E4]/[.$E$13] -> 0.103767003836763 | I4: of:=[.H4]*[.$R$2] -> 1.03767003836763 | J4: of:=[.H4]*[.$R$3] -> 0.185742936867806 | L4: of:=MROUND([.I4];0.01) -> 1.04 | M4: of:=MROUND([.J4];0.01) -> 0.19
A5: 2022-05-02 | B5: ALL-CAPS-AU | C5: Cherry Hyperglide MX (Black) | D5: 1 | E5: of:=48/70 -> 0.685714285714286 | H5: of:=[.E5]/[.$E$13] -> 0.0837111963725148 | I5: of:=[.H5]*[.$R$2] -> 0.837111963725148 | J5: of:=[.H5]*[.$R$3] -> 0.149843041506802 | L5: of:=MROUND([.I5];0.01) -> 0.84 | M5: of:=MROUND([.J5];0.01)-0.01 -> 0.14
A6: 2022-05-02 | B6: ALL-CAPS-AU | C6: Cherry Hyperglide MX (Brown) | D6: 1 | E6: of:=48/70 -> 0.685714285714286 | H6: of:=[.E6]/[.$E$13] -> 0.0837111963725148 | I6: of:=[.H6]*[.$R$2] -> 0.837111963725148 | J6: of:=[.H6]*[.$R$3] -> 0.149843041506802 | L6: of:=MROUND([.I6];0.01) -> 0.84 | M6: of:=MROUND([.J6];0.01)-0.01 -> 0.14
A7: 2022-05-02 | B7: ALL-CAPS-AU | C7: Gateron Cap Yellow V2 | D7: 1 | E7: of:=46.9/70 -> 0.67 | H7: of:=[.E7]/[.$E$13] -> 0.081792814788978 | I7: of:=[.H7]*[.$R$2] -> 0.81792814788978 | J7: of:=[.H7]*[.$R$3] -> 0.146409138472271 | L7: of:=MROUND([.I7];0.01) -> 0.82 | M7: of:=MROUND([.J7];0.01) -> 0.15
A8: 2022-05-02 | B8: ALL-CAPS-AU | C8: Gateron Pro Milky Yellow | D8: 1 | E8: of:=23.1/70 -> 0.33 | H8: of:=[.E8]/[.$E$13] -> 0.0402860132542728 | I8: of:=[.H8]*[.$R$2] -> 0.402860132542728 | J8: of:=[.H8]*[.$R$3] -> 0.0721119637251482 | L8: of:=MROUND([.I8];0.01) -> 0.4 | M8: of:=MROUND([.J8];0.01) -> 0.07
A9: 2022-05-02 | B9: ALL-CAPS-AU | C9: Infinity Key Cow (POM Stem) | D9: 1 | E9: of:=9.1/10 -> 0.91 | H9: of:=[.E9]/[.$E$13] -> 0.111091733519358 | I9: of:=[.H9]*[.$R$2] -> 1.11091733519358 | J9: of:=[.H9]*[.$R$3] -> 0.198854202999651 | L9: of:=MROUND([.I9];0.01) -> 1.11 | M9: of:=MROUND([.J9];0.01) -> 0.2
A10: 2022-05-02 | B10: ALL-CAPS-AU | C10: Infinity Key Cow (UHMWPE Stem) | D10: 1 | E10: of:=9.1/10 -> 0.91 | H10: of:=[.E10]/[.$E$13] -> 0.111091733519358 | I10: of:=[.H10]*[.$R$2] -> 1.11091733519358 | J10: of:=[.H10]*[.$R$3] -> 0.198854202999651 | L10: of:=MROUND([.I10];0.01) -> 1.11 | M10: of:=MROUND([.J10];0.01) -> 0.2
A11: 2022-05-02 | B11: ALL-CAPS-AU | C11: Kailh Black | D11: 1 | E11: of:=4/10 -> 0.4 | H11: of:=[.E11]/[.$E$13] -> 0.0488315312173003 | I11: of:=[.H11]*[.$R$2] -> 0.488315312173003 | J11: of:=[.H11]*[.$R$3] -> 0.0874084408789676 | L11: of:=MROUND([.I11];0.01)-0.01 -> 0.48 | M11: of:=MROUND([.J11];0.01) -> 0.09
A12: 2022-05-02 | B12: ALL-CAPS-AU | C12: Rebult Keyboards Penyu | D12: 1 | E12: of:=9.5/10 -> 0.95 | H12: of:=[.E12]/[.$E$13] -> 0.115974886641088 | I12: of:=[.H12]*[.$R$2] -> 1.15974886641088 | J12: of:=[.H12]*[.$R$3] -> 0.207595047087548 | L12: of:=MROUND([.I12];0.01) -> 1.16 | M12: of:=MROUND([.J12];0.01) -> 0.21
C13: (TOTAL) | D13: of:=SUM([.D2:.D12]) -> 11 | E13: of:=SUM([.E2:.E12]) -> 8.19142857142857 | H13: of:=SUM([.H2:.H12]) -> 1 | I13: of:=SUM([.I2:.I12]) -> 10 | J13: of:=SUM([.J2:.J12]) -> 1.79 | L13: of:=SUM([.L2:.L12]) -> 10 | M13: of:=SUM([.M2:.M12]) -> 1.79
A15: 2022-05-02 | B15: KBDfans-CN | C15: Cherry Hyperglide MX (Red) | D15: 1 | E15: of:=3.5/10 -> 0.35 | H15: of:=[.E15]/[.$E$87] -> 0.0113562621674238 | I15: of:=[.H15]*[.$R$15] -> 0.529201817001947 | J15: of:=[.H15]*[.$R$16] -> 0.102206359506814 | L15: of:=MROUND([.I15];0.01)+0.01 -> 0.54 | M15: of:=MROUND([.J15];0.01) -> 0.1 | Q15: Actual Total Item Cost (AUD) | R15: 46.6
A16: 2022-05-02 | B16: KBDfans-CN | C16: Cherry Hyperglide MX (Black) | D16: 1 | E16: of:=3.5/10 -> 0.35 | H16: of:=[.E16]/[.$E$87] -> 0.0113562621674238 | I16: of:=[.H16]*[.$R$15] -> 0.529201817001947 | J16: of:=[.H16]*[.$R$16] -> 0.102206359506814 | L16: of:=MROUND([.I16];0.01)+0.01 -> 0.54 | M16: of:=MROUND([.J16];0.01) -> 0.1 | Q16: Actual Shipping Cost (AUD) | R16: 9
A17: 2022-05-02 | B17: KBDfans-CN | C17: Cherry Hyperglide MX (Brown) | D17: 1 | E17: of:=3.5/10 -> 0.35 | H17: of:=[.E17]/[.$E$87] -> 0.0113562621674238 | I17: of:=[.H17]*[.$R$15] -> 0.529201817001947 | J17: of:=[.H17]*[.$R$16] -> 0.102206359506814 | L17: of:=MROUND([.I17];0.01)+0.01 -> 0.54 | M17: of:=MROUND([.J17];0.01) -> 0.1
A18: 2022-05-02 | B18: KBDfans-CN | C18: Cherry Hyperglide MX (Clear) | D18: 1 | E18: of:=5.9/10 -> 0.59 | H18: of:=[.E18]/[.$E$87] -> 0.0191434133679429 | I18: of:=[.H18]*[.$R$15] -> 0.892083062946139 | J18: of:=[.H18]*[.$R$16] -> 0.172290720311486 | L18: of:=MROUND([.I18];0.01) -> 0.89 | M18: of:=MROUND([.J18];0.01)+0.01 -> 0.18
A19: 2022-05-02 | B19: KBDfans-CN | C19: Cherry Hyperglide MX (Blue) | D19: 1 | E19: of:=3.5/10 -> 0.35 | H19: of:=[.E19]/[.$E$87] -> 0.0113562621674238 | I19: of:=[.H19]*[.$R$15] -> 0.529201817001947 | J19: of:=[.H19]*[.$R$16] -> 0.102206359506814 | L19: of:=MROUND([.I19];0.01)+0.01 -> 0.54 | M19: of:=MROUND([.J19];0.01) -> 0.1
A20: 2022-05-02 | B20: KBDfans-CN | C20: Cherry Hyperglide MX (Green) | D20: 1 | E20: of:=3.5/10 -> 0.35 | H20: of:=[.E20]/[.$E$87] -> 0.0113562621674238 | I20: of:=[.H20]*[.$R$15] -> 0.529201817001947 | J20: of:=[.H20]*[.$R$16] -> 0.102206359506814 | L20: of:=MROUND([.I20];0.01)+0.01 -> 0.54 | M20: of:=MROUND([.J20];0.01) -> 0.1
A21: 2022-05-02 | B21: KBDfans-CN | C21: Cherry Hyperglide MX (Green) | D21: 1 | E21: of:=3.5/10 -> 0.35 | H21: of:=[.E21]/[.$E$87] -> 0.0113562621674238 | I21: of:=[.H21]*[.$R$15] -> 0.529201817001947 | J21: of:=[.H21]*[.$R$16] -> 0.102206359506814 | L21: of:=MROUND([.I21];0.01)+0.01 -> 0.54 | M21: of:=MROUND([.J21];0.01) -> 0.1
A22: 2022-05-02 | B22: KBDfans-CN | C22: Cherry Hyperglide MX (White) | D22: 1 | E22: of:=3.5/10 -> 0.35 | H22: of:=[.E22]/[.$E$87] -> 0.0113562621674238 | I22: of:=[.H22]*[.$R$15] -> 0.529201817001947 | J22: of:=[.H22]*[.$R$16] -> 0.102206359506814 | L22: of:=MROUND([.I22];0.01)+0.01 -> 0.54 | M22: of:=MROUND([.J22];0.01) -> 0.1
A23: 2022-05-02 | B23: KBDfans-CN | C23: Cherry Hyperglide MX (Speed Silver) | D23: 1 | E23: of:=3.8/10 -> 0.38 | H23: of:=[.E23]/[.$E$87] -> 0.0123296560674886 | I23: of:=[.H23]*[.$R$15] -> 0.574561972744971 | J23: of:=[.H23]*[.$R$16] -> 0.110966904607398 | L23: of:=MROUND([.I23];0.01) -> 0.57 | M23: of:=MROUND([.J23];0.01) -> 0.11
A24: 2022-05-02 | B24: KBDfans-CN | C24: Cherry Hyperglide MX (Gray) | D24: 1 | E24: of:=5.9/10 -> 0.59 | H24: of:=[.E24]/[.$E$87] -> 0.0191434133679429 | I24: of:=[.H24]*[.$R$15] -> 0.892083062946139 | J24: of:=[.H24]*[.$R$16] -> 0.172290720311486 | L24: of:=MROUND([.I24];0.01) -> 0.89 | M24: of:=MROUND([.J24];0.01) -> 0.17
A25: 2022-05-02 | B25: KBDfans-CN | C25: Cherry Hyperglide MX (Silent Red) | D25: 1 | E25: of:=5.5/10 -> 0.55 | H25: of:=[.E25]/[.$E$87] -> 0.017845554834523 | I25: of:=[.H25]*[.$R$15] -> 0.831602855288774 | J25: of:=[.H25]*[.$R$16] -> 0.160609993510707 | L25: of:=MROUND([.I25];0.01) -> 0.83 | M25: of:=MROUND([.J25];0.01) -> 0.16
A26: 2022-05-02 | B26: KBDfans-CN | C26: Cherry Hyperglide MX (Silent Black) | D26: 1 | E26: of:=5.5/10 -> 0.55 | H26: of:=[.E26]/[.$E$87] -> 0.017845554834523 | I26: of:=[.H26]*[.$R$15] -> 0.831602855288774 | J26: of:=[.H26]*[.$R$16] -> 0.160609993510707 | L26: of:=MROUND([.I26];0.01) -> 0.83 | M26: of:=MROUND([.J26];0.01) -> 0.16
A27: 2022-05-02 | B27: KBDfans-CN | C27: Cherry Hyperglide MX RGB (Red) | D27: 1 | E27: of:=4/10 -> 0.4 | H27: of:=[.E27]/[.$E$87] -> 0.0129785853341986 | I27: of:=[.H27]*[.$R$15] -> 0.604802076573654 | J27: of:=[.H27]*[.$R$16] -> 0.116807268007787 | L27: of:=MROUND([.I27];0.01) -> 0.6 | M27: of:=MROUND([.J27];0.01) -> 0.12
A28: 2022-05-02 | B28: KBDfans-CN | C28: Cherry Hyperglide MX RGB (Black) | D28: 1 | E28: of:=4/10 -> 0.4 | H28: of:=[.E28]/[.$E$87] -> 0.0129785853341986 | I28: of:=[.H28]*[.$R$15] -> 0.604802076573654 | J28: of:=[.H28]*[.$R$16] -> 0.116807268007787 | L28: of:=MROUND([.I28];0.01) -> 0.6 | M28: of:=MROUND([.J28];0.01) -> 0.12
A29: 2022-05-02 | B29: KBDfans-CN | C29: Cherry Hyperglide MX RGB (Brown) | D29: 1 | E29: of:=4/10 -> 0.4 | H29: of:=[.E29]/[.$E$87] -> 0.0129785853341986 | I29: of:=[.H29]*[.$R$15] -> 0.604802076573654 | J29: of:=[.H29]*[.$R$16] -> 0.116807268007787 | L29: of:=MROUND([.I29];0.01) -> 0.6 | M29: of:=MROUND([.J29];0.01) -> 0.12
A30: 2022-05-02 | B30: KBDfans-CN | C30: Cherry Hyperglide MX RGB (Blue) | D30: 1 | E30: of:=4/10 -> 0.4 | H30: of:=[.E30]/[.$E$87] -> 0.0129785853341986 | I30: of:=[.H30]*[.$R$15] -> 0.604802076573654 | J30: of:=[.H30]*[.$R$16] -> 0.116807268007787 | L30: of:=MROUND([.I30];0.01) -> 0.6 | M30: of:=MROUND([.J30];0.01) -> 0.12
A31: 2022-05-02 | B31: KBDfans-CN | C31: Cherry Hyperglide MX RGB (Speed Silver) | D31: 1 | E31: of:=5.5/10 -> 0.55 | H31: of:=[.E31]/[.$E$87] -> 0.017845554834523 | I31: of:=[.H31]*[.$R$15] -> 0.831602855288774 | J31: of:=[.H31]*[.$R$16] -> 0.160609993510707 | L31: of:=MROUND([.I31];0.01) -> 0.83 | M31: of:=MROUND([.J31];0.01) -> 0.16
A32: 2022-05-02 | B32: KBDfans-CN | C32: Gateron Aliaz (60g) | D32: 1 | E32: of:=8.5/10 -> 0.85 | H32: of:=[.E32]/[.$E$87] -> 0.027579493835172 | I32: of:=[.H32]*[.$R$15] -> 1.28520441271901 | J32: of:=[.H32]*[.$R$16] -> 0.248215444516548 | L32: of:=MROUND([.I32];0.01) -> 1.29 | M32: of:=MROUND([.J32];0.01) -> 0.25
A33: 2022-05-02 | B33: KBDfans-CN | C33: Gateron Aliaz (70g) | D33: 1 | E33: of:=8.5/10 -> 0.85 | H33: of:=[.E33]/[.$E$87] -> 0.027579493835172 | I33: of:=[.H33]*[.$R$15] -> 1.28520441271901 | J33: of:=[.H33]*[.$R$16] -> 0.248215444516548 | L33: of:=MROUND([.I33];0.01) -> 1.29 | M33: of:=MROUND([.J33];0.01) -> 0.25
A34: 2022-05-02 | B34: KBDfans-CN | C34: Gateron Aliaz (80g) | D34: 1 | E34: of:=8.5/10 -> 0.85 | H34: of:=[.E34]/[.$E$87] -> 0.027579493835172 | I34: of:=[.H34]*[.$R$15] -> 1.28520441271901 | J34: of:=[.H34]*[.$R$16] -> 0.248215444516548 | L34: of:=MROUND([.I34];0.01) -> 1.29 | M34: of:=MROUND([.J34];0.01) -> 0.25
A35: 2022-05-02 | B35: KBDfans-CN | C35: Gateron Aliaz (100g) | D35: 1 | E35: of:=8.5/10 -> 0.85 | H35: of:=[.E35]/[.$E$87] -> 0.027579493835172 | I35: of:=[.H35]*[.$R$15] -> 1.28520441271901 | J35: of:=[.H35]*[.$R$16] -> 0.248215444516548 | L35: of:=MROUND([.I35];0.01) -> 1.29 | M35: of:=MROUND([.J35];0.01) -> 0.25
A36: 2022-05-02 | B36: KBDfans-CN | C36: Gateron KS-8 (Clear) | D36: 1 | E36: of:=2/10 -> 0.2 | H36: of:=[.E36]/[.$E$87] -> 0.00648929266709929 | I36: of:=[.H36]*[.$R$15] -> 0.302401038286827 | J36: of:=[.H36]*[.$R$16] -> 0.0584036340038936 | L36: of:=MROUND([.I36];0.01) -> 0.3 | M36: of:=MROUND([.J36];0.01) -> 0.06
A37: 2022-05-02 | B37: KBDfans-CN | C37: Gateron KS-8 (Red) | D37: 1 | E37: of:=2/10 -> 0.2 | H37: of:=[.E37]/[.$E$87] -> 0.00648929266709929 | I37: of:=[.H37]*[.$R$15] -> 0.302401038286827 | J37: of:=[.H37]*[.$R$16] -> 0.0584036340038936 | L37: of:=MROUND([.I37];0.01) -> 0.3 | M37: of:=MROUND([.J37];0.01) -> 0.06
A38: 2022-05-02 | B38: KBDfans-CN | C38: Gateron KS-8 (Yellow) | D38: 1 | E38: of:=2/10 -> 0.2 | H38: of:=[.E38]/[.$E$87] -> 0.00648929266709929 | I38: of:=[.H38]*[.$R$15] -> 0.302401038286827 | J38: of:=[.H38]*[.$R$16] -> 0.0584036340038936 | L38: of:=MROUND([.I38];0.01) -> 0.3 | M38: of:=MROUND([.J38];0.01) -> 0.06
A39: 2022-05-02 | B39: KBDfans-CN | C39: Gateron KS-8 (Black) | D39: 1 | E39: of:=2/10 -> 0.2 | H39: of:=[.E39]/[.$E$87] -> 0.00648929266709929 | I39: of:=[.H39]*[.$R$15] -> 0.302401038286827 | J39: of:=[.H39]*[.$R$16] -> 0.0584036340038936 | L39: of:=MROUND([.I39];0.01) -> 0.3 | M39: of:=MROUND([.J39];0.01) -> 0.06
A40: 2022-05-02 | B40: KBDfans-CN | C40: Gateron KS-8 (Brown) | D40: 1 | E40: of:=2/10 -> 0.2 | H40: of:=[.E40]/[.$E$87] -> 0.00648929266709929 | I40: of:=[.H40]*[.$R$15] -> 0.302401038286827 | J40: of:=[.H40]*[.$R$16] -> 0.0584036340038936 | L40: of:=MROUND([.I40];0.01) -> 0.3 | M40: of:=MROUND([.J40];0.01) -> 0.06
A41: 2022-05-02 | B41: KBDfans-CN | C41: Gateron KS-8 (Blue) | D41: 1 | E41: of:=2/10 -> 0.2 | H41: of:=[.E41]/[.$E$87] -> 0.00648929266709929 | I41: of:=[.H41]*[.$R$15] -> 0.302401038286827 | J41: of:=[.H41]*[.$R$16] -> 0.0584036340038936 | L41: of:=MROUND([.I41];0.01) -> 0.3 | M41: of:=MROUND([.J41];0.01) -> 0.06
A42: 2022-05-02 | B42: KBDfans-CN | C42: Gateron KS-8 (Green) | D42: 1 | E42: of:=2/10 -> 0.2 | H42: of:=[.E42]/[.$E$87] -> 0.00648929266709929 | I42: of:=[.H42]*[.$R$15] -> 0.302401038286827 | J42: of:=[.H42]*[.$R$16] -> 0.0584036340038936 | L42: of:=MROUND([.I42];0.01) -> 0.3 | M42: of:=MROUND([.J42];0.01) -> 0.06
A43: 2022-05-02 | B43: KBDfans-CN | C43: Gateron KS-9 (Clear) | D43: 1 | E43: of:=2/10 -> 0.2 | H43: of:=[.E43]/[.$E$87] -> 0.00648929266709929 | I43: of:=[.H43]*[.$R$15] -> 0.302401038286827 | J43: of:=[.H43]*[.$R$16] -> 0.0584036340038936 | L43: of:=MROUND([.I43];0.01) -> 0.3 | M43: of:=MROUND([.J43];0.01) -> 0.06
A44: 2022-05-02 | B44: KBDfans-CN | C44: Gateron KS-9 (Red) | D44: 1 | E44: of:=2/10 -> 0.2 | H44: of:=[.E44]/[.$E$87] -> 0.00648929266709929 | I44: of:=[.H44]*[.$R$15] -> 0.302401038286827 | J44: of:=[.H44]*[.$R$16] -> 0.0584036340038936 | L44: of:=MROUND([.I44];0.01) -> 0.3 | M44: of:=MROUND([.J44];0.01) -> 0.06
A45: 2022-05-02 | B45: KBDfans-CN | C45: Gateron KS-9 (Yellow) | D45: 1 | E45: of:=2/10 -> 0.2 | H45: of:=[.E45]/[.$E$87] -> 0.00648929266709929 | I45: of:=[.H45]*[.$R$15] -> 0.302401038286827 | J45: of:=[.H45]*[.$R$16] -> 0.0584036340038936 | L45: of:=MROUND([.I45];0.01) -> 0.3 | M45: of:=MROUND([.J45];0.01) -> 0.06
A46: 2022-05-02 | B46: KBDfans-CN | C46: Gateron KS-9 (Black) | D46: 1 | E46: of:=2/10 -> 0.2 | H46: of:=[.E46]/[.$E$87] -> 0.00648929266709929 | I46: of:=[.H46]*[.$R$15] -> 0.302401038286827 | J46: of:=[.H46]*[.$R$16] -> 0.0584036340038936 | L46: of:=MROUND([.I46];0.01) -> 0.3 | M46: of:=MROUND([.J46];0.01) -> 0.06
A47: 2022-05-02 | B47: KBDfans-CN | C47: Gateron KS-9 (Brown) | D47: 1 | E47: of:=2/10 -> 0.2 | H47: of:=[.E47]/[.$E$87] -> 0.00648929266709929 | I47: of:=[.H47]*[.$R$15] -> 0.302401038286827 | J47: of:=[.H47]*[.$R$16] -> 0.0584036340038936 | L47: of:=MROUND([.I47];0.01) -> 0.3 | M47: of:=MROUND([.J47];0.01) -> 0.06
A48: 2022-05-02 | B48: KBDfans-CN | C48: Gateron KS-9 (Blue) | D48: 1 | E48: of:=2/10 -> 0.2 | H48: of:=[.E48]/[.$E$87] -> 0.00648929266709929 | I48: of:=[.H48]*[.$R$15] -> 0.302401038286827 | J48: of:=[.H48]*[.$R$16] -> 0.0584036340038936 | L48: of:=MROUND([.I48];0.01) -> 0.3 | M48: of:=MROUND([.J48];0.01) -> 0.06
A49: 2022-05-02 | B49: KBDfans-CN | C49: Gateron KS-9 (Green) | D49: 1 | E49: of:=2/10 -> 0.2 | H49: of:=[.E49]/[.$E$87] -> 0.00648929266709929 | I49: of:=[.H49]*[.$R$15] -> 0.302401038286827 | J49: of:=[.H49]*[.$R$16] -> 0.0584036340038936 | L49: of:=MROUND([.I49];0.01) -> 0.3 | M49: of:=MROUND([.J49];0.01) -> 0.06
A50: 2022-05-02 | B50: KBDfans-CN | C50: Gateron KS-3 (Clear) | D50: 1 | E50: of:=2.5/10 -> 0.25 | H50: of:=[.E50]/[.$E$87] -> 0.00811161583387411 | I50: of:=[.H50]*[.$R$15] -> 0.378001297858533 | J50: of:=[.H50]*[.$R$16] -> 0.073004542504867 | L50: of:=MROUND([.I50];0.01) -> 0.38 | M50: of:=MROUND([.J50];0.01) -> 0.07
A51: 2022-05-02 | B51: KBDfans-CN | C51: Gateron KS-3 (Red) | D51: 1 | E51: of:=2.5/10 -> 0.25 | H51: of:=[.E51]/[.$E$87] -> 0.00811161583387411 | I51: of:=[.H51]*[.$R$15] -> 0.378001297858533 | J51: of:=[.H51]*[.$R$16] -> 0.073004542504867 | L51: of:=MROUND([.I51];0.01) -> 0.38 | M51: of:=MROUND([.J51];0.01) -> 0.07
A52: 2022-05-02 | B52: KBDfans-CN | C52: Gateron KS-3 (Yellow) | D52: 1 | E52: of:=2.5/10 -> 0.25 | H52: of:=[.E52]/[.$E$87] -> 0.00811161583387411 | I52: of:=[.H52]*[.$R$15] -> 0.378001297858533 | J52: of:=[.H52]*[.$R$16] -> 0.073004542504867 | L52: of:=MROUND([.I52];0.01) -> 0.38 | M52: of:=MROUND([.J52];0.01) -> 0.07
A53: 2022-05-02 | B53: KBDfans-CN | C53: Gateron KS-3 (Black) | D53: 1 | E53: of:=2.5/10 -> 0.25 | H53: of:=[.E53]/[.$E$87] -> 0.00811161583387411 | I53: of:=[.H53]*[.$R$15] -> 0.378001297858533 | J53: of:=[.H53]*[.$R$16] -> 0.073004542504867 | L53: of:=MROUND([.I53];0.01) -> 0.38 | M53: of:=MROUND([.J53];0.01) -> 0.07
A54: 2022-05-02 | B54: KBDfans-CN | C54: Gateron KS-3 (Brown) | D54: 1 | E54: of:=2.4/10 -> 0.24 | H54: of:=[.E54]/[.$E$87] -> 0.00778715120051914 | I54: of:=[.H54]*[.$R$15] -> 0.362881245944192 | J54: of:=[.H54]*[.$R$16] -> 0.0700843608046723 | L54: of:=MROUND([.I54];0.01)+0.01 -> 0.37 | M54: of:=MROUND([.J54];0.01) -> 0.07
A55: 2022-05-02 | B55: KBDfans-CN | C55: Gateron KS-3 (Blue) | D55: 1 | E55: of:=2.5/10 -> 0.25 | H55: of:=[.E55]/[.$E$87] -> 0.00811161583387411 | I55: of:=[.H55]*[.$R$15] -> 0.378001297858533 | J55: of:=[.H55]*[.$R$16] -> 0.073004542504867 | L55: of:=MROUND([.I55];0.01) -> 0.38 | M55: of:=MROUND([.J55];0.01) -> 0.07
A56: 2022-05-02 | B56: KBDfans-CN | C56: Gateron KS-3 (Green) | D56: 1 | E56: of:=2.5/10 -> 0.25 | H56: of:=[.E56]/[.$E$87] -> 0.00811161583387411 | I56: of:=[.H56]*[.$R$15] -> 0.378001297858533 | J56: of:=[.H56]*[.$R$16] -> 0.073004542504867 | L56: of:=MROUND([.I56];0.01) -> 0.38 | M56: of:=MROUND([.J56];0.01) -> 0.07
A57: 2022-05-02 | B57: KBDfans-CN | C57: Gateron Silent (Red) | D57: 1 | E57: of:=3.8/10 -> 0.38 | H57: of:=[.E57]/[.$E$87] -> 0.0123296560674886 | I57: of:=[.H57]*[.$R$15] -> 0.574561972744971 | J57: of:=[.H57]*[.$R$16] -> 0.110966904607398 | L57: of:=MROUND([.I57];0.01) -> 0.57 | M57: of:=MROUND([.J57];0.01) -> 0.11
A58: 2022-05-02 | B58: KBDfans-CN | C58: Gateron Silent (Black) | D58: 1 | E58: of:=3.8/10 -> 0.38 | H58: of:=[.E58]/[.$E$87] -> 0.0123296560674886 | I58: of:=[.H58]*[.$R$15] -> 0.574561972744971 | J58: of:=[.H58]*[.$R$16] -> 0.110966904607398 | L58: of:=MROUND([.I58];0.01) -> 0.57 | M58: of:=MROUND([.J58];0.01) -> 0.11
A59: 2022-05-02 | B59: KBDfans-CN | C59: Gateron Silent (Brown) | D59: 1 | E59: of:=3.8/10 -> 0.38 | H59: of:=[.E59]/[.$E$87] -> 0.0123296560674886 | I59: of:=[.H59]*[.$R$15] -> 0.574561972744971 | J59: of:=[.H59]*[.$R$16] -> 0.110966904607398 | L59: of:=MROUND([.I59];0.01) -> 0.57 | M59: of:=MROUND([.J59];0.01) -> 0.11
A60: 2022-05-02 | B60: KBDfans-CN | C60: Kailh Box (Red) | D60: 1 | E60: of:=3.8/10 -> 0.38 | H60: of:=[.E60]/[.$E$87] -> 0.0123296560674886 | I60: of:=[.H60]*[.$R$15] -> 0.574561972744971 | J60: of:=[.H60]*[.$R$16] -> 0.110966904607398 | L60: of:=MROUND([.I60];0.01) -> 0.57 | M60: of:=MROUND([.J60];0.01) -> 0.11
A61: 2022-05-02 | B61: KBDfans-CN | C61: Kailh Box (Black) | D61: 1 | E61: of:=3.8/10 -> 0.38 | H61: of:=[.E61]/[.$E$87] -> 0.0123296560674886 | I61: of:=[.H61]*[.$R$15] -> 0.574561972744971 | J61: of:=[.H61]*[.$R$16] -> 0.110966904607398 | L61: of:=MROUND([.I61];0.01) -> 0.57 | M61: of:=MROUND([.J61];0.01) -> 0.11
A62: 2022-05-02 | B62: KBDfans-CN | C62: Kailh Box (Brown) | D62: 1 | E62: of:=3.8/10 -> 0.38 | H62: of:=[.E62]/[.$E$87] -> 0.0123296560674886 | I62: of:=[.H62]*[.$R$15] -> 0.574561972744971 | J62: of:=[.H62]*[.$R$16] -> 0.110966904607398 | L62: of:=MROUND([.I62];0.01) -> 0.57 | M62: of:=MROUND([.J62];0.01) -> 0.11
A63: 2022-05-02 | B63: KBDfans-CN | C63: Kailh Box (White) | D63: 1 | E63: of:=3.8/10 -> 0.38 | H63: of:=[.E63]/[.$E$87] -> 0.0123296560674886 | I63: of:=[.H63]*[.$R$15] -> 0.574561972744971 | J63: of:=[.H63]*[.$R$16] -> 0.110966904607398 | L63: of:=MROUND([.I63];0.01) -> 0.57 | M63: of:=MROUND([.J63];0.01) -> 0.11
A64: 2022-05-02 | B64: KBDfans-CN | C64: Kailh Box (Royal) | D64: 1 | E64: of:=5/10 -> 0.5 | H64: of:=[.E64]/[.$E$87] -> 0.0162232316677482 | I64: of:=[.H64]*[.$R$15] -> 0.756002595717067 | J64: of:=[.H64]*[.$R$16] -> 0.146009085009734 | L64: of:=MROUND([.I64];0.01) -> 0.76 | M64: of:=MROUND([.J64];0.01) -> 0.15
A65: 2022-05-02 | B65: KBDfans-CN | C65: Kailh Box Hako (True) | D65: 1 | E65: of:=5/10 -> 0.5 | H65: of:=[.E65]/[.$E$87] -> 0.0162232316677482 | I65: of:=[.H65]*[.$R$15] -> 0.756002595717067 | J65: of:=[.H65]*[.$R$16] -> 0.146009085009734 | L65: of:=MROUND([.I65];0.01) -> 0.76 | M65: of:=MROUND([.J65];0.01) -> 0.15
A66: 2022-05-02 | B66: KBDfans-CN | C66: Kailh Box Hako (Violet) | D66: 1 | E66: of:=5/10 -> 0.5 | H66: of:=[.E66]/[.$E$87] -> 0.0162232316677482 | I66: of:=[.H66]*[.$R$15] -> 0.756002595717067 | J66: of:=[.H66]*[.$R$16] -> 0.146009085009734 | L66: of:=MROUND([.I66];0.01) -> 0.76 | M66: of:=MROUND([.J66];0.01) -> 0.15
A67: 2022-05-02 | B67: KBDfans-CN | C67: Kailh Box Hako (Clear) | D67: 1 | E67: of:=16.5/30 -> 0.55 | H67: of:=[.E67]/[.$E$87] -> 0.017845554834523 | I67: of:=[.H67]*[.$R$15] -> 0.831602855288774 | J67: of:=[.H67]*[.$R$16] -> 0.160609993510707 | L67: of:=MROUND([.I67];0.01) -> 0.83 | M67: of:=MROUND([.J67];0.01) -> 0.16
A68: 2022-05-02 | B68: KBDfans-CN | C68: Kailh Box Hako (Royal Clear) | D68: 1 | E68: of:=16.5/30 -> 0.55 | H68: of:=[.E68]/[.$E$87] -> 0.017845554834523 | I68: of:=[.H68]*[.$R$15] -> 0.831602855288774 | J68: of:=[.H68]*[.$R$16] -> 0.160609993510707 | L68: of:=MROUND([.I68];0.01) -> 0.83 | M68: of:=MROUND([.J68];0.01) -> 0.16
A69: 2022-05-02 | B69: KBDfans-CN | C69: Kailh Pro (Burgundy) | D69: 1 | E69: of:=3/10 -> 0.3 | H69: of:=[.E69]/[.$E$87] -> 0.00973393900064893 | I69: of:=[.H69]*[.$R$15] -> 0.45360155743024 | J69: of:=[.H69]*[.$R$16] -> 0.0876054510058404 | L69: of:=MROUND([.I69];0.01) -> 0.45 | M69: of:=MROUND([.J69];0.01) -> 0.09
A70: 2022-05-02 | B70: KBDfans-CN | C70: Kailh Pro (Purple) | D70: 1 | E70: of:=9/30 -> 0.3 | H70: of:=[.E70]/[.$E$87] -> 0.00973393900064893 | I70: of:=[.H70]*[.$R$15] -> 0.45360155743024 | J70: of:=[.H70]*[.$R$16] -> 0.0876054510058404 | L70: of:=MROUND([.I70];0.01) -> 0.45 | M70: of:=MROUND([.J70];0.01) -> 0.09
A71: 2022-05-02 | B71: KBDfans-CN | C71: Kailh Pro (Light Green) | D71: 1 | E71: of:=3/10 -> 0.3 | H71: of:=[.E71]/[.$E$87] -> 0.00973393900064893 | I71: of:=[.H71]*[.$R$15] -> 0.45360155743024 | J71: of:=[.H71]*[.$R$16] -> 0.0876054510058404 | L71: of:=MROUND([.I71];0.01) -> 0.45 | M71: of:=MROUND([.J71];0.01) -> 0.09
A72: 2022-05-02 | B72: KBDfans-CN | C72: Kailh Speed (Silver) | D72: 1 | E72: of:=2.8/10 -> 0.28 | H72: of:=[.E72]/[.$E$87] -> 0.009085009733939 | I72: of:=[.H72]*[.$R$15] -> 0.423361453601557 | J72: of:=[.H72]*[.$R$16] -> 0.081765087605451 | L72: of:=MROUND([.I72];0.01) -> 0.42 | M72: of:=MROUND([.J72];0.01) -> 0.08
A73: 2022-05-02 | B73: KBDfans-CN | C73: Kailh Speed (Copper) | D73: 1 | E73: of:=2.8/10 -> 0.28 | H73: of:=[.E73]/[.$E$87] -> 0.009085009733939 | I73: of:=[.H73]*[.$R$15] -> 0.423361453601557 | J73: of:=[.H73]*[.$R$16] -> 0.081765087605451 | L73: of:=MROUND([.I73];0.01) -> 0.42 | M73: of:=MROUND([.J73];0.01) -> 0.08
A74: 2022-05-02 | B74: KBDfans-CN | C74: Kailh Speed (Gold) | D74: 1 | E74: of:=2.8/10 -> 0.28 | H74: of:=[.E74]/[.$E$87] -> 0.009085009733939 | I74: of:=[.H74]*[.$R$15] -> 0.423361453601557 | J74: of:=[.H74]*[.$R$16] -> 0.081765087605451 | L74: of:=MROUND([.I74];0.01) -> 0.42 | M74: of:=MROUND([.J74];0.01) -> 0.08
A75: 2022-05-02 | B75: KBDfans-CN | C75: Kailh Speed (Bronze) | D75: 1 | E75: of:=2.8/10 -> 0.28 | H75: of:=[.E75]/[.$E$87] -> 0.009085009733939 | I75: of:=[.H75]*[.$R$15] -> 0.423361453601557 | J75: of:=[.H75]*[.$R$16] -> 0.081765087605451 | L75: of:=MROUND([.I75];0.01) -> 0.42 | M75: of:=MROUND([.J75];0.01) -> 0.08
A76: 2022-05-02 | B76: KBDfans-CN | C76: NovelKeys x Kailh Cream | D76: 1 | E76: of:=6.5/10 -> 0.65 | H76: of:=[.E76]/[.$E$87] -> 0.0210902011680727 | I76: of:=[.H76]*[.$R$15] -> 0.982803374432187 | J76: of:=[.H76]*[.$R$16] -> 0.189811810512654 | L76: of:=MROUND([.I76];0.01)+0.01 -> 0.99 | M76: of:=MROUND([.J76];0.01) -> 0.19
A77: 2022-05-02 | B77: KBDfans-CN | C77: NovelKeys x Kailh Box (Dark Yellow) | D77: 1 | E77: of:=4.5/10 -> 0.45 | H77: of:=[.E77]/[.$E$87] -> 0.0146009085009734 | I77: of:=[.H77]*[.$R$15] -> 0.68040233614536 | J77: of:=[.H77]*[.$R$16] -> 0.131408176508761 | L77: of:=MROUND([.I77];0.01) -> 0.68 | M77: of:=MROUND([.J77];0.01) -> 0.13
A78: 2022-05-02 | B78: KBDfans-CN | C78: NovelKeys x Kailh Box (Burnt Orange) | D78: 1 | E78: of:=4.5/10 -> 0.45 | H78: of:=[.E78]/[.$E$87] -> 0.0146009085009734 | I78: of:=[.H78]*[.$R$15] -> 0.68040233614536 | J78: of:=[.H78]*[.$R$16] -> 0.131408176508761 | L78: of:=MROUND([.I78];0.01) -> 0.68 | M78: of:=MROUND([.J78];0.01) -> 0.13
A79: 2022-05-02 | B79: KBDfans-CN | C79: NovelKeys x Kailh Box (Pale Blue) | D79: 1 | E79: of:=4.5/10 -> 0.45 | H79: of:=[.E79]/[.$E$87] -> 0.0146009085009734 | I79: of:=[.H79]*[.$R$15] -> 0.68040233614536 | J79: of:=[.H79]*[.$R$16] -> 0.131408176508761 | L79: of:=MROUND([.I79];0.01) -> 0.68 | M79: of:=MROUND([.J79];0.01) -> 0.13
A80: 2022-05-02 | B80: KBDfans-CN | C80: NovelKeys x Kailh Box (Navy) | D80: 1 | E80: of:=4.2/10 -> 0.42 | H80: of:=[.E80]/[.$E$87] -> 0.0136275146009085 | I80: of:=[.H80]*[.$R$15] -> 0.635042180402336 | J80: of:=[.H80]*[.$R$16] -> 0.122647631408177 | L80: of:=MROUND([.I80];0.01) -> 0.64 | M80: of:=MROUND([.J80];0.01) -> 0.12
A81: 2022-05-02 | B81: KBDfans-CN | C81: NovelKeys x Kailh Box (Jade) | D81: 1 | E81: of:=4.2/10 -> 0.42 | H81: of:=[.E81]/[.$E$87] -> 0.0136275146009085 | I81: of:=[.H81]*[.$R$15] -> 0.635042180402336 | J81: of:=[.H81]*[.$R$16] -> 0.122647631408177 | L81: of:=MROUND([.I81];0.01) -> 0.64 | M81: of:=MROUND([.J81];0.01) -> 0.12
A82: 2022-05-02 | B82: KBDfans-CN | C82: Zeal Tealio V2 (67g) | D82: 1 | E82: of:=11/10 -> 1.1 | H82: of:=[.E82]/[.$E$87] -> 0.0356911096690461 | I82: of:=[.H82]*[.$R$15] -> 1.66320571057755 | J82: of:=[.H82]*[.$R$16] -> 0.321219987021415 | L82: of:=MROUND([.I82];0.01) -> 1.66 | M82: of:=MROUND([.J82];0.01) -> 0.32
A83: 2022-05-02 | B83: KBDfans-CN | C83: Zeal Zealio V2 (62g) | D83: 1 | E83: of:=11/10 -> 1.1 | H83: of:=[.E83]/[.$E$87] -> 0.0356911096690461 | I83: of:=[.H83]*[.$R$15] -> 1.66320571057755 | J83: of:=[.H83]*[.$R$16] -> 0.321219987021415 | L83: of:=MROUND([.I83];0.01) -> 1.66 | M83: of:=MROUND([.J83];0.01) -> 0.32
A84: 2022-05-02 | B84: KBDfans-CN | C84: Zeal Zealio V2 (65g) | D84: 1 | E84: of:=11/10 -> 1.1 | H84: of:=[.E84]/[.$E$87] -> 0.0356911096690461 | I84: of:=[.H84]*[.$R$15] -> 1.66320571057755 | J84: of:=[.H84]*[.$R$16] -> 0.321219987021415 | L84: of:=MROUND([.I84];0.01) -> 1.66 | M84: of:=MROUND([.J84];0.01) -> 0.32
A85: 2022-05-02 | B85: KBDfans-CN | C85: Zeal Zealio V2 (67g) | D85: 1 | E85: of:=11/10 -> 1.1 | H85: of:=[.E85]/[.$E$87] -> 0.0356911096690461 | I85: of:=[.H85]*[.$R$15] -> 1.66320571057755 | J85: of:=[.H85]*[.$R$16] -> 0.321219987021415 | L85: of:=MROUND([.I85];0.01) -> 1.66 | M85: of:=MROUND([.J85];0.01) -> 0.32
A86: 2022-05-02 | B86: KBDfans-CN | C86: Zeal Zealio V2 (78g) | D86: 1 | E86: of:=11/10 -> 1.1 | H86: of:=[.E86]/[.$E$87] -> 0.0356911096690461 | I86: of:=[.H86]*[.$R$15] -> 1.66320571057755 | J86: of:=[.H86]*[.$R$16] -> 0.321219987021415 | L86: of:=MROUND([.I86];0.01) -> 1.66 | M86: of:=MROUND([.J86];0.01) -> 0.32
C87: (TOTAL) | D87: of:=SUM([.D15:.D86]) -> 72 | E87: of:=SUM([.E15:.E86]) -> 30.82 | H87: of:=SUM([.H15:.H86]) -> 1 | I87: of:=SUM([.I15:.I86]) -> 46.6 | J87: of:=SUM([.J15:.J86]) -> 9 | L87: of:=SUM([.L15:.L86]) -> 46.6 | M87: of:=SUM([.M15:.M86]) -> 9.00000000000001
A89: 2022-05-15 | B89: INEDA-CN | C89: Outemu (Red) | D89: 1 | E89: of:=6.9/10 -> 0.69 | H89: of:=[.E89]/[.$E$107] -> 0.050061670173402 | I89: of:=[.H89]*[.$R$89] -> 0.617761009939781 | J89: of:=[.H89]*[.$R$90] -> 0.0640789378219546 | L89: of:=MROUND([.I89];0.01) -> 0.62 | M89: of:=MROUND([.J89];0.01) -> 0.06 | Q89: Actual Total Item Cost (AUD) | R89: 12.34
A90: 2022-05-15 | B90: INEDA-CN | C90: Outemu (Black) | D90: 1 | E90: of:=6.9/10 -> 0.69 | H90: of:=[.E90]/[.$E$107] -> 0.050061670173402 | I90: of:=[.H90]*[.$R$89] -> 0.617761009939781 | J90: of:=[.H90]*[.$R$90] -> 0.0640789378219546 | L90: of:=MROUND([.I90];0.01) -> 0.62 | M90: of:=MROUND([.J90];0.01) -> 0.06 | Q90: Actual Shipping Cost (AUD) | R90: 1.28
A91: 2022-05-15 | B91: INEDA-CN | C91: Outemu (Brown) | D91: 1 | E91: of:=6.9/10 -> 0.69 | H91: of:=[.E91]/[.$E$107] -> 0.050061670173402 | I91: of:=[.H91]*[.$R$89] -> 0.617761009939781 | J91: of:=[.H91]*[.$R$90] -> 0.0640789378219546 | L91: of:=MROUND([.I91];0.01) -> 0.62 | M91: of:=MROUND([.J91];0.01) -> 0.06
A92: 2022-05-15 | B92: INEDA-CN | C92: Outemu (Blue) | D92: 1 | E92: of:=6.9/10 -> 0.69 | H92: of:=[.E92]/[.$E$107] -> 0.050061670173402 | I92: of:=[.H92]*[.$R$89] -> 0.617761009939781 | J92: of:=[.H92]*[.$R$90] -> 0.0640789378219546 | L92: of:=MROUND([.I92];0.01) -> 0.62 | M92: of:=MROUND([.J92];0.01) -> 0.06
A93: 2022-05-15 | B93: INEDA-CN | C93: Outemu (Teal) | D93: 1 | E93: of:=6.9/10 -> 0.69 | H93: of:=[.E93]/[.$E$107] -> 0.050061670173402 | I93: of:=[.H93]*[.$R$89] -> 0.617761009939781 | J93: of:=[.H93]*[.$R$90] -> 0.0640789378219546 | L93: of:=MROUND([.I93];0.01) -> 0.62 | M93: of:=MROUND([.J93];0.01) -> 0.06
A94: 2022-05-15 | B94: INEDA-CN | C94: Outemu (Purple) | D94: 1 | E94: of:=6.9/10 -> 0.69 | H94: of:=[.E94]/[.$E$107] -> 0.050061670173402 | I94: of:=[.H94]*[.$R$89] -> 0.617761009939781 | J94: of:=[.H94]*[.$R$90] -> 0.0640789378219546 | L94: of:=MROUND([.I94];0.01) -> 0.62 | M94: of:=MROUND([.J94];0.01) -> 0.06
A95: 2022-05-15 | B95: INEDA-CN | C95: Outemu (Orange) | D95: 1 | E95: of:=6.9/10 -> 0.69 | H95: of:=[.E95]/[.$E$107] -> 0.050061670173402 | I95: of:=[.H95]*[.$R$89] -> 0.617761009939781 | J95: of:=[.H95]*[.$R$90] -> 0.0640789378219546 | L95: of:=MROUND([.I95];0.01) -> 0.62 | M95: of:=MROUND([.J95];0.01) -> 0.06
A96: 2022-05-15 | B96: INEDA-CN | C96: Outemu (Gold) | D96: 1 | E96: of:=6.9/10 -> 0.69 | H96: of:=[.E96]/[.$E$107] -> 0.050061670173402 | I96: of:=[.H96]*[.$R$89] -> 0.617761009939781 | J96: of:=[.H96]*[.$R$90] -> 0.0640789378219546 | L96: of:=MROUND([.I96];0.01) -> 0.62 | M96: of:=MROUND([.J96];0.01) -> 0.06
A97: 2022-05-15 | B97: INEDA-CN | C97: Outemu (Silver) | D97: 1 | E97: of:=6.9/10 -> 0.69 | H97: of:=[.E97]/[.$E$107] -> 0.050061670173402 | I97: of:=[.H97]*[.$R$89] -> 0.617761009939781 | J97: of:=[.H97]*[.$R$90] -> 0.0640789378219546 | L97: of:=MROUND([.I97];0.01) -> 0.62 | M97: of:=MROUND([.J97];0.01) -> 0.06
A98: 2022-05-15 | B98: INEDA-CN | C98: Outemu (Silent Gray) | D98: 1 | E98: of:=8.22/10 -> 0.822 | H98: of:=[.E98]/[.$E$107] -> 0.0596386853370094 | I98: of:=[.H98]*[.$R$89] -> 0.735941377058696 | J98: of:=[.H98]*[.$R$90] -> 0.076337517231372 | L98: of:=MROUND([.I98];0.01) -> 0.74 | M98: of:=MROUND([.J98];0.01) -> 0.08
A99: 2022-05-15 | B99: INEDA-CN | C99: Outemu (Silent White) | D99: 1 | E99: of:=8.22/10 -> 0.822 | H99: of:=[.E99]/[.$E$107] -> 0.0596386853370094 | I99: of:=[.H99]*[.$R$89] -> 0.735941377058696 | J99: of:=[.H99]*[.$R$90] -> 0.076337517231372 | L99: of:=MROUND([.I99];0.01) -> 0.74 | M99: of:=MROUND([.J99];0.01) -> 0.08
A100: 2022-05-15 | B100: INEDA-CN | C100: Outemu (Lime) | D100: 1 | E100: of:=8.47/10 -> 0.847 | H100: of:=[.E100]/[.$E$107] -> 0.0614525139664805 | I100: of:=[.H100]*[.$R$89] -> 0.758324022346369 | J100: of:=[.H100]*[.$R$90] -> 0.078659217877095 | L100: of:=MROUND([.I100];0.01) -> 0.76 | M100: of:=MROUND([.J100];0.01)+0.01 -> 0.09
A101: 2022-05-15 | B101: INEDA-CN | C101: Outemu (Honey Peach) | D101: 1 | E101: of:=8.47/10 -> 0.847 | H101: of:=[.E101]/[.$E$107] -> 0.0614525139664805 | I101: of:=[.H101]*[.$R$89] -> 0.758324022346369 | J101: of:=[.H101]*[.$R$90] -> 0.078659217877095 | L101: of:=MROUND([.I101];0.01) -> 0.76 | M101: of:=MROUND([.J101];0.01)+0.01 -> 0.09
A102: 2022-05-15 | B102: INEDA-CN | C102: Outemu (Red Panda) | D102: 1 | E102: of:=8.47/10 -> 0.847 | H102: of:=[.E102]/[.$E$107] -> 0.0614525139664805 | I102: of:=[.H102]*[.$R$89] -> 0.758324022346369 | J102: of:=[.H102]*[.$R$90] -> 0.078659217877095 | L102: of:=MROUND([.I102];0.01) -> 0.76 | M102: of:=MROUND([.J102];0.01) -> 0.08
A103: 2022-05-15 | B103: INEDA-CN | C103: Outemu (Crystal) | D103: 1 | E103: of:=8.47/10 -> 0.847 | H103: of:=[.E103]/[.$E$107] -> 0.0614525139664805 | I103: of:=[.H103]*[.$R$89] -> 0.758324022346369 | J103: of:=[.H103]*[.$R$90] -> 0.078659217877095 | L103: of:=MROUND([.I103];0.01)-0.01 -> 0.75 | M103: of:=MROUND([.J103];0.01) -> 0.08
A104: 2022-05-15 | B104: INEDA-CN | C104: Outemu (Yellow Silver) | D104: 1 | E104: of:=8.47/10 -> 0.847 | H104: of:=[.E104]/[.$E$107] -> 0.0614525139664805 | I104: of:=[.H104]*[.$R$89] -> 0.758324022346369 | J104: of:=[.H104]*[.$R$90] -> 0.078659217877095 | L104: of:=MROUND([.I104];0.01)-0.01 -> 0.75 | M104: of:=MROUND([.J104];0.01) -> 0.08
A105: 2022-05-15 | B105: INEDA-CN | C105: Outemu (Ocean Clicky) | D105: 1 | E105: of:=8.47/10 -> 0.847 | H105: of:=[.E105]/[.$E$107] -> 0.0614525139664805 | I105: of:=[.H105]*[.$R$89] -> 0.758324022346369 | J105: of:=[.H105]*[.$R$90] -> 0.078659217877095 | L105: of:=MROUND([.I105];0.01)-0.01 -> 0.75 | M105: of:=MROUND([.J105];0.01) -> 0.08
A106: 2022-05-15 | B106: INEDA-CN | C106: Outemu (Ocean Linear) | D106: 1 | E106: of:=8.47/10 -> 0.847 | H106: of:=[.E106]/[.$E$107] -> 0.0614525139664805 | I106: of:=[.H106]*[.$R$89] -> 0.758324022346369 | J106: of:=[.H106]*[.$R$90] -> 0.078659217877095 | L106: of:=MROUND([.I106];0.01)-0.01 -> 0.75 | M106: of:=MROUND([.J106];0.01) -> 0.08
C107: (TOTAL) | D107: of:=SUM([.D89:.D106]) -> 18 | E107: of:=SUM([.E89:.E106]) -> 13.783 | H107: of:=SUM([.H89:.H106]) -> 1 | I107: of:=SUM([.I89:.I106]) -> 12.34 | J107: of:=SUM([.J89:.J106]) -> 1.28 | L107: of:=SUM([.L89:.L106]) -> 12.34 | M107: of:=SUM([.M89:.M106]) -> 1.28
A109: 2022-05-11 | B109: HippoKeys-US | C109: CÂ³Equalz X TKC Dragon Fruit | D109: 1 | E109: of:=6.35/10 -> 0.635 | F109: Not sold. Guessed using other C3Equalz listings. | H109: of:=[.E109]/[.$E$141] -> 0.031648986983212 | I109: of:=[.H109]*[.$R$109] -> 1.44287731656463 | J109: of:=[.H109]*[.$R$110] -> 1.3814782818172 | L109: of:=MROUND([.I109];0.01) -> 1.44 | M109: of:=MROUND([.J109];0.01) -> 1.38 | N109: of:=MROUND( ([.I109]-[.L109])*10000 ;0.01) -> 28.77 | O109: of:=MROUND( ([.J109]-[.M109])*10000 ;0.01) -> 14.78 | Q109: Actual Total Item Cost (AUD) | R109: 45.59
A110: 2022-05-11 | B110: HippoKeys-US | C110: Candy Jade Green (62g) | D110: 1 | E110: of:=75.9/110 -> 0.69 | F110: Not sold. Guessed using Divinikey 110-piece price. | H110: of:=[.E110]/[.$E$141] -> 0.0343902378242776 | I110: of:=[.H110]*[.$R$109] -> 1.56785094240881 | J110: of:=[.H110]*[.$R$110] -> 1.50113388102972 | L110: of:=MROUND([.I110];0.01) -> 1.57 | M110: of:=MROUND([.J110];0.01) -> 1.5 | N110: of:=MROUND( ([.I110]-[.L110])*10000 ;0.01) -> -21.49 | O110: of:=MROUND( ([.J110]-[.M110])*10000 ;0.01) -> 11.34 | Q110: Actual Shipping Cost (AUD) | R110: 43.65
A111: 2022-05-11 | B111: HippoKeys-US | C111: Durock T1 | D111: 1 | E111: of:=5.6/10 -> 0.56 | H111: of:=[.E111]/[.$E$141] -> 0.0279109176544861 | I111: of:=[.H111]*[.$R$109] -> 1.27245873586802 | J111: of:=[.H111]*[.$R$110] -> 1.21831155561832 | L111: of:=MROUND([.I111];0.01) -> 1.27 | M111: of:=MROUND([.J111];0.01) -> 1.22 | N111: of:=MROUND( ([.I111]-[.L111])*10000 ;0.01) -> 24.59 | O111: of:=MROUND( ([.J111]-[.M111])*10000 ;0.01) -> -16.88
A112: 2022-05-11 | B112: HippoKeys-US | C112: Everglide Aqua King | D112: 1 | E112: of:=8.8/10 -> 0.88 | F112: [Drop also sells for about 0.79 per switch for 70 switches] | H112: of:=[.E112]/[.$E$141] -> 0.0438600134570497 | I112: of:=[.H112]*[.$R$109] -> 1.99957801350689 | J112: of:=[.H112]*[.$R$110] -> 1.91448958740022 | L112: of:=MROUND([.I112];0.01) -> 2 | M112: of:=MROUND([.J112];0.01)+0.01 -> 1.92 | N112: of:=MROUND( ([.I112]-[.L112])*10000 ;0.01) -> -4.22 | O112: of:=MROUND( ([.J112]-[.M112])*10000 ;0.01) -> -55.1 | Q112: Average Item Cost (AUD) | R112: of:=[.R109]/[.D141] -> 1.4246875
A113: 2022-05-11 | B113: HippoKeys-US | C113: Everglide Crystal Violet | D113: 1 | E113: of:=[.E112] -> 0.88 | F113: Not sold. Guessed using Aqua King. | H113: of:=[.E113]/[.$E$141] -> 0.0438600134570497 | I113: of:=[.H113]*[.$R$109] -> 1.99957801350689 | J113: of:=[.H113]*[.$R$110] -> 1.91448958740022 | L113: of:=MROUND([.I113];0.01) -> 2 | M113: of:=MROUND([.J113];0.01)+0.01 -> 1.92 | N113: of:=MROUND( ([.I113]-[.L113])*10000 ;0.01) -> -4.22 | O113: of:=MROUND( ([.J113]-[.M113])*10000 ;0.01) -> -55.1 | Q113: Average Shipping Cost (AUD) | R113: of:=[.R110]/[.D141] -> 1.3640625
A114: 2022-05-11 | B114: HippoKeys-US | C114: Everglide Oreo | D114: 1 | E114: of:=[.E113] -> 0.88 | F114: Not sold. Guessed using Aqua King. | H114: of:=[.E114]/[.$E$141] -> 0.0438600134570497 | I114: of:=[.H114]*[.$R$109] -> 1.99957801350689 | J114: of:=[.H114]*[.$R$110] -> 1.91448958740022 | L114: of:=MROUND([.I114];0.01) -> 2 | M114: of:=MROUND([.J114];0.01)+0.01 -> 1.92 | N114: of:=MROUND( ([.I114]-[.L114])*10000 ;0.01) -> -4.22 | O114: of:=MROUND( ([.J114]-[.M114])*10000 ;0.01) -> -55.1
A115: 2022-05-11 | B115: HippoKeys-US | C115: Gateron Box Ink V2 (Pink) | D115: 1 | E115: of:=15.3/18 -> 0.85 | F115: Not sold. Guessed using Divinikey price. | H115: of:=[.E115]/[.$E$141] -> 0.0423647857255593 | I115: of:=[.H115]*[.$R$109] -> 1.93141058122825 | J115: of:=[.H115]*[.$R$110] -> 1.84922289692066 | L115: of:=MROUND([.I115];0.01) -> 1.93 | M115: of:=MROUND([.J115];0.01) -> 1.85 | N115: of:=MROUND( ([.I115]-[.L115])*10000 ;0.01) -> 14.11 | O115: of:=MROUND( ([.J115]-[.M115])*10000 ;0.01) -> -7.77
A116: 2022-05-11 | B116: HippoKeys-US | C116: Gateron Cap V2 (Golden Yellow) | D116: 1 | E116: of:=8.64/18 -> 0.48 | F116: Not sold. Guessed using Divinikey price. | H116: of:=[.E116]/[.$E$141] -> 0.0239236437038453 | I116: of:=[.H116]*[.$R$109] -> 1.09067891645831 | J116: of:=[.H116]*[.$R$110] -> 1.04426704767285 | L116: of:=MROUND([.I116];0.01) -> 1.09 | M116: of:=MROUND([.J116];0.01) -> 1.04 | N116: of:=MROUND( ([.I116]-[.L116])*10000 ;0.01) -> 6.79 | O116: of:=MROUND( ([.J116]-[.M116])*10000 ;0.01) -> 42.67
A117: 2022-05-11 | B117: HippoKeys-US | C117: Gateron China Joy | D117: 1 | E117: of:=5.99/10 -> 0.599 | F117: [NovelKeys also sells for 0.6 each] | H117: of:=[.E117]/[.$E$141] -> 0.0298547137054236 | I117: of:=[.H117]*[.$R$109] -> 1.36107639783026 | J117: of:=[.H117]*[.$R$110] -> 1.30315825324174 | L117: of:=MROUND([.I117];0.01) -> 1.36 | M117: of:=MROUND([.J117];0.01) -> 1.3 | N117: of:=MROUND( ([.I117]-[.L117])*10000 ;0.01) -> 10.76 | O117: of:=MROUND( ([.J117]-[.M117])*10000 ;0.01) -> 31.58
A118: 2022-05-11 | B118: HippoKeys-US | C118: Gateron Ink V2 (Red) | D118: 1 | E118: of:=([.E119]+[.E120])/2 -> 0.7375 | F118: Not sold. Guessed using the other inks. | H118: of:=[.E118]/[.$E$141] -> 0.0367576817324706 | I118: of:=[.H118]*[.$R$109] -> 1.67578271018333 | J118: of:=[.H118]*[.$R$110] -> 1.60447280762234 | L118: of:=MROUND([.I118];0.01) -> 1.68 | M118: of:=MROUND([.J118];0.01) -> 1.6 | N118: of:=MROUND( ([.I118]-[.L118])*10000 ;0.01) -> -42.17 | O118: of:=MROUND( ([.J118]-[.M118])*10000 ;0.01) -> 44.73
A119: 2022-05-11 | B119: HippoKeys-US | C119: Gateron Ink V2 (Black) | D119: 1 | E119: of:=7.45/10 -> 0.745 | F119: [Normal price 7.50 each, Divinikey also sells for 7.50 each, and Ashkeebs at 0.75 each, and Prevail Key Co. 110 pieces at 0.75 each] | G119: . | H119: of:=[.E119]/[.$E$141] -> 0.0371314886653432 | I119: of:=[.H119]*[.$R$109] -> 1.692824568253 | J119: of:=[.H119]*[.$R$110] -> 1.62078948024223 | L119: of:=MROUND([.I119];0.01) -> 1.69 | M119: of:=MROUND([.J119];0.01) -> 1.62 | N119: of:=MROUND( ([.I119]-[.L119])*10000 ;0.01) -> 28.25 | O119: of:=MROUND( ([.J119]-[.M119])*10000 ;0.01) -> 7.89
A120: 2022-05-11 | B120: HippoKeys-US | C120: Gateron Ink V2 (Blue) | D120: 1 | E120: of:=7.3/10 -> 0.73 | F120: [Krepublic also sells for 7.30 each at 110 pieces] | H120: of:=[.E120]/[.$E$141] -> 0.036383874799598 | I120: of:=[.H120]*[.$R$109] -> 1.65874085211367 | J120: of:=[.H120]*[.$R$110] -> 1.58815613500245 | L120: of:=MROUND([.I120];0.01) -> 1.66 | M120: of:=MROUND([.J120];0.01) -> 1.59 | N120: of:=MROUND( ([.I120]-[.L120])*10000 ;0.01) -> -12.59 | O120: of:=MROUND( ([.J120]-[.M120])*10000 ;0.01) -> -18.44
A121: 2022-05-11 | B121: HippoKeys-US | C121: Gateron Mochi | D121: 1 | E121: of:=4.7/10 -> 0.47 | F121: Not sold. Guessed using Ashkeebs price. | H121: of:=[.E121]/[.$E$141] -> 0.0234252344600152 | I121: of:=[.H121]*[.$R$109] -> 1.06795643903209 | J121: of:=[.H121]*[.$R$110] -> 1.02251148417966 | L121: of:=MROUND([.I121];0.01) -> 1.07 | M121: of:=MROUND([.J121];0.01) -> 1.02 | N121: of:=MROUND( ([.I121]-[.L121])*10000 ;0.01) -> -20.44 | O121: of:=MROUND( ([.J121]-[.M121])*10000 ;0.01) -> 25.11
A122: 2022-05-11 | B122: HippoKeys-US | C122: Gateron Oil King | D122: 1 | E122: of:=6.45/10 -> 0.645 | H122: of:=[.E122]/[.$E$141] -> 0.0321473962270421 | I122: of:=[.H122]*[.$R$109] -> 1.46559979399085 | J122: of:=[.H122]*[.$R$110] -> 1.40323384531039 | L122: of:=MROUND([.I122];0.01) -> 1.47 | M122: of:=MROUND([.J122];0.01) -> 1.4 | N122: of:=MROUND( ([.I122]-[.L122])*10000 ;0.01) -> -44 | O122: of:=MROUND( ([.J122]-[.M122])*10000 ;0.01) -> 32.34
A123: 2022-05-11 | B123: HippoKeys-US | C123: Gazzew Bobagum (62g) | D123: 1 | E123: of:=6.5/10 -> 0.65 | F123: Not sold. Guessed using Ashkeebs price. | H123: of:=[.E123]/[.$E$141] -> 0.0323966008489571 | I123: of:=[.H123]*[.$R$109] -> 1.47696103270396 | J123: of:=[.H123]*[.$R$110] -> 1.41411162705698 | L123: of:=MROUND([.I123];0.01) -> 1.48 | M123: of:=MROUND([.J123];0.01) -> 1.41 | N123: of:=MROUND( ([.I123]-[.L123])*10000 ;0.01) -> -30.39 | O123: of:=MROUND( ([.J123]-[.M123])*10000 ;0.01) -> 41.12
A124: 2022-05-11 | B124: HippoKeys-US | C124: Gazzew Boba U4T (68g) | D124: 1 | E124: of:=6.5/10 -> 0.65 | F124: Not sold. Guessed using Ashkeebs price. [Swagkeys also sells for 6.5 each] | G124: . | H124: of:=[.E124]/[.$E$141] -> 0.0323966008489571 | I124: of:=[.H124]*[.$R$109] -> 1.47696103270396 | J124: of:=[.H124]*[.$R$110] -> 1.41411162705698 | L124: of:=MROUND([.I124];0.01) -> 1.48 | M124: of:=MROUND([.J124];0.01) -> 1.41 | N124: of:=MROUND( ([.I124]-[.L124])*10000 ;0.01) -> -30.39 | O124: of:=MROUND( ([.J124]-[.M124])*10000 ;0.01) -> 41.12
A125: 2022-05-11 | B125: HippoKeys-US | C125: Glorious Lynx | D125: 1 | E125: of:=24.99/36 -> 0.694166666666667 | F125: Not sold. Guessed using Divinikey price. | H125: of:=[.E125]/[.$E$141] -> 0.0345979083425401 | I125: of:=[.H125]*[.$R$109] -> 1.5773186413364 | J125: of:=[.H125]*[.$R$110] -> 1.51019869915188 | L125: of:=MROUND([.I125];0.01) -> 1.58 | M125: of:=MROUND([.J125];0.01) -> 1.51 | N125: of:=MROUND( ([.I125]-[.L125])*10000 ;0.01) -> -26.81 | O125: of:=MROUND( ([.J125]-[.M125])*10000 ;0.01) -> 1.99
A126: 2022-05-11 | B126: HippoKeys-US | C126: Glorious Panda | D126: 1 | E126: of:=24.99/36 -> 0.694166666666667 | F126: Not sold. Guessed using Divinikey price. | H126: of:=[.E126]/[.$E$141] -> 0.0345979083425401 | I126: of:=[.H126]*[.$R$109] -> 1.5773186413364 | J126: of:=[.H126]*[.$R$110] -> 1.51019869915188 | L126: of:=MROUND([.I126];0.01) -> 1.58 | M126: of:=MROUND([.J126];0.01) -> 1.51 | N126: of:=MROUND( ([.I126]-[.L126])*10000 ;0.01) -> -26.81 | O126: of:=MROUND( ([.J126]-[.M126])*10000 ;0.01) -> 1.99
A127: 2022-05-11 | B127: HippoKeys-US | C127: GoPolar Azure Dragon | D127: 1 | E127: of:=6.49/10 -> 0.649 | H127: of:=[.E127]/[.$E$141] -> 0.0323467599245741 | I127: of:=[.H127]*[.$R$109] -> 1.47468878496133 | J127: of:=[.H127]*[.$R$110] -> 1.41193607070766 | L127: of:=MROUND([.I127];0.01)-0.01 -> 1.46 | M127: of:=MROUND([.J127];0.01) -> 1.41 | N127: of:=MROUND( ([.I127]-[.L127])*10000 ;0.01) -> 146.89 | O127: of:=MROUND( ([.J127]-[.M127])*10000 ;0.01) -> 19.36
A128: 2022-05-11 | B128: HippoKeys-US | C128: Joininkeys Matcha | D128: 1 | E128: of:=66/110 -> 0.6 | F128: Not sold. Guessed using prevail key co. 110-piece price. | H128: of:=[.E128]/[.$E$141] -> 0.0299045546298066 | I128: of:=[.H128]*[.$R$109] -> 1.36334864557288 | J128: of:=[.H128]*[.$R$110] -> 1.30533380959106 | L128: of:=MROUND([.I128];0.01) -> 1.36 | M128: of:=MROUND([.J128];0.01) -> 1.31 | N128: of:=MROUND( ([.I128]-[.L128])*10000 ;0.01) -> 33.49 | O128: of:=MROUND( ([.J128]-[.M128])*10000 ;0.01) -> -46.66
A129: 2022-05-11 | B129: HippoKeys-US | C129: Kaihua Halo True | D129: 1 | E129: of:=(35/70)*1.11 -> 0.555 | F129: Not sold. Guessed using Drop price, multiplied by 1.11. | H129: of:=[.E129]/[.$E$141] -> 0.0276617130325711 | I129: of:=[.H129]*[.$R$109] -> 1.26109749715492 | J129: of:=[.H129]*[.$R$110] -> 1.20743377387173 | L129: of:=MROUND([.I129];0.01) -> 1.26 | M129: of:=MROUND([.J129];0.01) -> 1.21 | N129: of:=MROUND( ([.I129]-[.L129])*10000 ;0.01) -> 10.97 | O129: of:=MROUND( ([.J129]-[.M129])*10000 ;0.01) -> -25.66
A130: 2022-05-11 | B130: HippoKeys-US | C130: Kailh Box (White) | D130: 1 | E130: of:=10.8/36 -> 0.3 | F130: Not sold. Guessed using NovelKeys price. | H130: of:=[.E130]/[.$E$141] -> 0.0149522773149033 | I130: of:=[.H130]*[.$R$109] -> 0.681674322786441 | J130: of:=[.H130]*[.$R$110] -> 0.652666904795529 | L130: of:=MROUND([.I130];0.01) -> 0.68 | M130: of:=MROUND([.J130];0.01) -> 0.65 | N130: of:=MROUND( ([.I130]-[.L130])*10000 ;0.01) -> 16.74 | O130: of:=MROUND( ([.J130]-[.M130])*10000 ;0.01) -> 26.67
A131: 2022-05-11 | B131: HippoKeys-US | C131: Kailh Box (Royal) | D131: 1 | E131: of:=5/10 -> 0.5 | F131: Not sold. Guessed using Divinikey price. | H131: of:=[.E131]/[.$E$141] -> 0.0249204621915055 | I131: of:=[.H131]*[.$R$109] -> 1.13612387131074 | J131: of:=[.H131]*[.$R$110] -> 1.08777817465921 | L131: of:=MROUND([.I131];0.01) -> 1.14 | M131: of:=MROUND([.J131];0.01) -> 1.09 | N131: of:=MROUND( ([.I131]-[.L131])*10000 ;0.01) -> -38.76 | O131: of:=MROUND( ([.J131]-[.M131])*10000 ;0.01) -> -22.22
A132: 2022-05-11 | B132: HippoKeys-US | C132: Kinetic Labs Penguin | D132: 1 | E132: of:=67.1/110 -> 0.61 | F132: Not sold. Guessed using Kinetic Labs 110-piece price. (I have no frame of reference for Kinetic Labs prices. Iâ€™m using their prices as-is.) | G132: . | H132: of:=[.E132]/[.$E$141] -> 0.0304029638736367 | I132: of:=[.H132]*[.$R$109] -> 1.3860711229991 | J132: of:=[.H132]*[.$R$110] -> 1.32708937308424 | L132: of:=MROUND([.I132];0.01) -> 1.39 | M132: of:=MROUND([.J132];0.01) -> 1.33 | N132: of:=MROUND( ([.I132]-[.L132])*10000 ;0.01) -> -39.29 | O132: of:=MROUND( ([.J132]-[.M132])*10000 ;0.01) -> -29.11
A133: 2022-05-11 | B133: HippoKeys-US | C133: Kinetic Labs Salmon | D133: 1 | E133: of:=52.8/110 -> 0.48 | F133: Not sold. Guessed using Kinetic Labs 110-piece price. (I have no frame of reference for Kinetic Labs prices. Iâ€™m using their prices as-is.) | G133: . | H133: of:=[.E133]/[.$E$141] -> 0.0239236437038453 | I133: of:=[.H133]*[.$R$109] -> 1.09067891645831 | J133: of:=[.H133]*[.$R$110] -> 1.04426704767285 | L133: of:=MROUND([.I133];0.01) -> 1.09 | M133: of:=MROUND([.J133];0.01) -> 1.04 | N133: of:=MROUND( ([.I133]-[.L133])*10000 ;0.01) -> 6.79 | O133: of:=MROUND( ([.J133]-[.M133])*10000 ;0.01) -> 42.67
A134: 2022-05-11 | B134: HippoKeys-US | C134: NovelKeys x Kailh Cream | D134: 1 | E134: of:=11.7/18 -> 0.65 | H134: of:=[.E134]/[.$E$141] -> 0.0323966008489571 | I134: of:=[.H134]*[.$R$109] -> 1.47696103270396 | J134: of:=[.H134]*[.$R$110] -> 1.41411162705698 | L134: of:=MROUND([.I134];0.01) -> 1.48 | M134: of:=MROUND([.J134];0.01) -> 1.41 | N134: of:=MROUND( ([.I134]-[.L134])*10000 ;0.01) -> -30.39 | O134: of:=MROUND( ([.J134]-[.M134])*10000 ;0.01) -> 41.12
A135: 2022-05-11 | B135: HippoKeys-US | C135: NovelKeys x Kailh Cream Tactile | D135: 1 | E135: of:=11.7/18 -> 0.65 | H135: of:=[.E135]/[.$E$141] -> 0.0323966008489571 | I135: of:=[.H135]*[.$R$109] -> 1.47696103270396 | J135: of:=[.H135]*[.$R$110] -> 1.41411162705698 | L135: of:=MROUND([.I135];0.01) -> 1.48 | M135: of:=MROUND([.J135];0.01) -> 1.41 | N135: of:=MROUND( ([.I135]-[.L135])*10000 ;0.01) -> -30.39 | O135: of:=MROUND( ([.J135]-[.M135])*10000 ;0.01) -> 41.12
A136: 2022-05-11 | B136: HippoKeys-US | C136: NovelKeys Silk (Olivia) | D136: 1 | E136: of:=19.8/36 -> 0.55 | F136: Not sold. Guessed using NovelKeys price. | H136: of:=[.E136]/[.$E$141] -> 0.027412508410656 | I136: of:=[.H136]*[.$R$109] -> 1.24973625844181 | J136: of:=[.H136]*[.$R$110] -> 1.19655599212514 | L136: of:=MROUND([.I136];0.01) -> 1.25 | M136: of:=MROUND([.J136];0.01) -> 1.2 | N136: of:=MROUND( ([.I136]-[.L136])*10000 ;0.01) -> -2.64 | O136: of:=MROUND( ([.J136]-[.M136])*10000 ;0.01) -> -34.44
A137: 2022-05-11 | B137: HippoKeys-US | C137: NovelKeys x Kailh Box (Jade) | D137: 1 | E137: of:=6.3/18 -> 0.35 | F137: Not sold. Guessed using Divinikey price. | H137: of:=[.E137]/[.$E$141] -> 0.0174443235340538 | I137: of:=[.H137]*[.$R$109] -> 0.795286709917515 | J137: of:=[.H137]*[.$R$110] -> 0.76144472226145 | L137: of:=MROUND([.I137];0.01)-0.01 -> 0.79 | M137: of:=MROUND([.J137];0.01) -> 0.76 | N137: of:=MROUND( ([.I137]-[.L137])*10000 ;0.01) -> 52.87 | O137: of:=MROUND( ([.J137]-[.M137])*10000 ;0.01) -> 14.45
A138: 2022-05-11 | B138: HippoKeys-US | C138: Prime Keyboards Alpaca | D138: 1 | E138: of:=6/10 -> 0.6 | F138: Not sold. Guessed using Swagkeys price. | H138: of:=[.E138]/[.$E$141] -> 0.0299045546298066 | I138: of:=[.H138]*[.$R$109] -> 1.36334864557288 | J138: of:=[.H138]*[.$R$110] -> 1.30533380959106 | L138: of:=MROUND([.I138];0.01) -> 1.36 | M138: of:=MROUND([.J138];0.01) -> 1.31 | N138: of:=MROUND( ([.I138]-[.L138])*10000 ;0.01) -> 33.49 | O138: of:=MROUND( ([.J138]-[.M138])*10000 ;0.01) -> -46.66
A139: 2022-05-11 | B139: HippoKeys-US | C139: Tecsee Purple Panda | D139: 1 | E139: of:=5.5/10 -> 0.55 | H139: of:=[.E139]/[.$E$141] -> 0.027412508410656 | I139: of:=[.H139]*[.$R$109] -> 1.24973625844181 | J139: of:=[.H139]*[.$R$110] -> 1.19655599212514 | L139: of:=MROUND([.I139];0.01) -> 1.25 | M139: of:=MROUND([.J139];0.01) -> 1.2 | N139: of:=MROUND( ([.I139]-[.L139])*10000 ;0.01) -> -2.64 | O139: of:=MROUND( ([.J139]-[.M139])*10000 ;0.01) -> -34.44
A140: 2022-05-11 | B140: HippoKeys-US | C140: Tecsee Sapphire V2 | D140: 1 | E140: of:=5.5/10 -> 0.55 | H140: of:=[.E140]/[.$E$141] -> 0.027412508410656 | I140: of:=[.H140]*[.$R$109] -> 1.24973625844181 | J140: of:=[.H140]*[.$R$110] -> 1.19655599212514 | L140: of:=MROUND([.I140];0.01) -> 1.25 | M140: of:=MROUND([.J140];0.01) -> 1.2 | N140: of:=MROUND( ([.I140]-[.L140])*10000 ;0.01) -> -2.64 | O140: of:=MROUND( ([.J140]-[.M140])*10000 ;0.01) -> -34.44
C141: (TOTAL) | D141: of:=SUM([.D109:.D140]) -> 32 | E141: of:=SUM([.E109:.E140]) -> 20.0638333333333 | H141: of:=SUM([.H109:.H140]) -> 1 | I141: of:=SUM([.I109:.I140]) -> 45.59 | J141: of:=SUM([.J109:.J140]) -> 43.65 | L141: of:=SUM([.L109:.L140]) -> 45.59 | M141: of:=SUM([.M109:.M140]) -> 43.65
A143: 2022-05-17 | B143: MKCOID-ID | C143: Aflion Carrot | D143: 1 | E143: 0.3 | F143: All prices found on the receipt. | H143: of:=[.E143]/[.$E$285] -> 0.00373227170938044 | I143: of:=[.H143]*[.$R$143] -> 0.432197063946255 | J143: of:=[.H143]*[.$R$144] -> 0.196056232893755 | L143: of:=MROUND([.I143];0.01) -> 0.43 | M143: of:=MROUND([.J143];0.01) -> 0.2 | N143: of:=MROUND( ([.I143]-[.L143])*10000 ;0.01) -> 21.97 | O143: of:=MROUND( ([.J143]-[.M143])*10000 ;0.01) -> -39.44 | Q143: Actual Total Item Cost (AUD) | R143: 115.8
A144: 2022-05-17 | B144: MKCOID-ID | C144: Aflion Panda | D144: 1 | E144: 0.32 | H144: of:=[.E144]/[.$E$285] -> 0.00398108982333914 | I144: of:=[.H144]*[.$R$143] -> 0.461010201542672 | J144: of:=[.H144]*[.$R$144] -> 0.209126648420005 | L144: of:=MROUND([.I144];0.01) -> 0.46 | M144: of:=MROUND([.J144];0.01) -> 0.21 | N144: of:=MROUND( ([.I144]-[.L144])*10000 ;0.01) -> 10.1 | O144: of:=MROUND( ([.J144]-[.M144])*10000 ;0.01) -> -8.73 | Q144: Actual Shipping Cost (AUD) | R144: 52.53
A145: 2022-05-17 | B145: MKCOID-ID | C145: Aflion Shadow | D145: 1 | E145: 0.3 | H145: of:=[.E145]/[.$E$285] -> 0.00373227170938044 | I145: of:=[.H145]*[.$R$143] -> 0.432197063946255 | J145: of:=[.H145]*[.$R$144] -> 0.196056232893755 | L145: of:=MROUND([.I145];0.01) -> 0.43 | M145: of:=MROUND([.J145];0.01) -> 0.2 | N145: of:=MROUND( ([.I145]-[.L145])*10000 ;0.01) -> 21.97 | O145: of:=MROUND( ([.J145]-[.M145])*10000 ;0.01) -> -39.44
A146: 2022-05-17 | B146: MKCOID-ID | C146: Ajazz x Huano Banana | D146: 1 | E146: 0.35 | H146: of:=[.E146]/[.$E$285] -> 0.00435431699427718 | I146: of:=[.H146]*[.$R$143] -> 0.504229907937298 | J146: of:=[.H146]*[.$R$144] -> 0.22873227170938 | L146: of:=MROUND([.I146];0.01) -> 0.5 | M146: of:=MROUND([.J146];0.01) -> 0.23 | N146: of:=MROUND( ([.I146]-[.L146])*10000 ;0.01) -> 42.3 | O146: of:=MROUND( ([.J146]-[.M146])*10000 ;0.01) -> -12.68
A147: 2022-05-17 | B147: MKCOID-ID | C147: Ajazz x Huano Peach | D147: 1 | E147: 0.35 | H147: of:=[.E147]/[.$E$285] -> 0.00435431699427718 | I147: of:=[.H147]*[.$R$143] -> 0.504229907937298 | J147: of:=[.H147]*[.$R$144] -> 0.22873227170938 | L147: of:=MROUND([.I147];0.01) -> 0.5 | M147: of:=MROUND([.J147];0.01) -> 0.23 | N147: of:=MROUND( ([.I147]-[.L147])*10000 ;0.01) -> 42.3 | O147: of:=MROUND( ([.J147]-[.M147])*10000 ;0.01) -> -12.68 | Q147: Shown on the webpage:
A148: 2022-05-17 | B148: MKCOID-ID | C148: Durock Burgundy | D148: 1 | E148: 0.6 | H148: of:=[.E148]/[.$E$285] -> 0.00746454341876089 | I148: of:=[.H148]*[.$R$143] -> 0.864394127892511 | J148: of:=[.H148]*[.$R$144] -> 0.392112465787509 | L148: of:=MROUND([.I148];0.01) -> 0.86 | M148: of:=MROUND([.J148];0.01) -> 0.39 | N148: of:=MROUND( ([.I148]-[.L148])*10000 ;0.01) -> 43.94 | O148: of:=MROUND( ([.J148]-[.M148])*10000 ;0.01) -> 21.12 | Q148: Total Item Cost (AUD) | R148: of:=[.R143]-[.L194]-[.L195] -> 112.12
A149: 2022-05-17 | B149: MKCOID-ID | C149: Durock Daybreak | D149: 1 | E149: 0.86 | H149: of:=[.E149]/[.$E$285] -> 0.0106991789002239 | I149: of:=[.H149]*[.$R$143] -> 1.23896491664593 | J149: of:=[.H149]*[.$R$144] -> 0.562027867628763 | L149: of:=MROUND([.I149];0.01) -> 1.24 | M149: of:=MROUND([.J149];0.01) -> 0.56 | N149: of:=MROUND( ([.I149]-[.L149])*10000 ;0.01) -> -10.35 | O149: of:=MROUND( ([.J149]-[.M149])*10000 ;0.01) -> 20.28 | Q149: Shipping Cost (AUD) | R149: of:=[.R144]-[.M194]-[.M195] -> 50.85
A150: 2022-05-17 | B150: MKCOID-ID | C150: Durock Dolphin | D150: 1 | E150: 0.86 | H150: of:=[.E150]/[.$E$285] -> 0.0106991789002239 | I150: of:=[.H150]*[.$R$143] -> 1.23896491664593 | J150: of:=[.H150]*[.$R$144] -> 0.562027867628763 | L150: of:=MROUND([.I150];0.01) -> 1.24 | M150: of:=MROUND([.J150];0.01) -> 0.56 | N150: of:=MROUND( ([.I150]-[.L150])*10000 ;0.01) -> -10.35 | O150: of:=MROUND( ([.J150]-[.M150])*10000 ;0.01) -> 20.28
A151: 2022-05-17 | B151: MKCOID-ID | C151: Durock EV-01 | D151: 1 | E151: 0.64 | H151: of:=[.E151]/[.$E$285] -> 0.00796217964667828 | I151: of:=[.H151]*[.$R$143] -> 0.922020403085345 | J151: of:=[.H151]*[.$R$144] -> 0.41825329684001 | L151: of:=MROUND([.I151];0.01) -> 0.92 | M151: of:=MROUND([.J151];0.01) -> 0.42 | N151: of:=MROUND( ([.I151]-[.L151])*10000 ;0.01) -> 20.2 | O151: of:=MROUND( ([.J151]-[.M151])*10000 ;0.01) -> -17.47
A152: 2022-05-17 | B152: MKCOID-ID | C152: Durock EV-02 | D152: 1 | E152: 0.64 | H152: of:=[.E152]/[.$E$285] -> 0.00796217964667828 | I152: of:=[.H152]*[.$R$143] -> 0.922020403085345 | J152: of:=[.H152]*[.$R$144] -> 0.41825329684001 | L152: of:=MROUND([.I152];0.01) -> 0.92 | M152: of:=MROUND([.J152];0.01) -> 0.42 | N152: of:=MROUND( ([.I152]-[.L152])*10000 ;0.01) -> 20.2 | O152: of:=MROUND( ([.J152]-[.M152])*10000 ;0.01) -> -17.47
A153: 2022-05-17 | B153: MKCOID-ID | C153: Durock L1 [Creamy Yellow] (55g) | D153: 1 | E153: 0.6 | H153: of:=[.E153]/[.$E$285] -> 0.00746454341876089 | I153: of:=[.H153]*[.$R$143] -> 0.864394127892511 | J153: of:=[.H153]*[.$R$144] -> 0.392112465787509 | L153: of:=MROUND([.I153];0.01) -> 0.86 | M153: of:=MROUND([.J153];0.01) -> 0.39 | N153: of:=MROUND( ([.I153]-[.L153])*10000 ;0.01) -> 43.94 | O153: of:=MROUND( ([.J153]-[.M153])*10000 ;0.01) -> 21.12
A154: 2022-05-17 | B154: MKCOID-ID | C154: Durock L2 [Creamy Green] (62g) | D154: 1 | E154: 0.6 | H154: of:=[.E154]/[.$E$285] -> 0.00746454341876089 | I154: of:=[.H154]*[.$R$143] -> 0.864394127892511 | J154: of:=[.H154]*[.$R$144] -> 0.392112465787509 | L154: of:=MROUND([.I154];0.01) -> 0.86 | M154: of:=MROUND([.J154];0.01) -> 0.39 | N154: of:=MROUND( ([.I154]-[.L154])*10000 ;0.01) -> 43.94 | O154: of:=MROUND( ([.J154]-[.M154])*10000 ;0.01) -> 21.12
A155: 2022-05-17 | B155: MKCOID-ID | C155: Durock L3 [Pink] (65g) | D155: 1 | E155: 0.6 | H155: of:=[.E155]/[.$E$285] -> 0.00746454341876089 | I155: of:=[.H155]*[.$R$143] -> 0.864394127892511 | J155: of:=[.H155]*[.$R$144] -> 0.392112465787509 | L155: of:=MROUND([.I155];0.01) -> 0.86 | M155: of:=MROUND([.J155];0.01) -> 0.39 | N155: of:=MROUND( ([.I155]-[.L155])*10000 ;0.01) -> 43.94 | O155: of:=MROUND( ([.J155]-[.M155])*10000 ;0.01) -> 21.12
A156: 2022-05-17 | B156: MKCOID-ID | C156: Durock L5 [Blue] (67g) | D156: 1 | E156: 0.6 | H156: of:=[.E156]/[.$E$285] -> 0.00746454341876089 | I156: of:=[.H156]*[.$R$143] -> 0.864394127892511 | J156: of:=[.H156]*[.$R$144] -> 0.392112465787509 | L156: of:=MROUND([.I156];0.01) -> 0.86 | M156: of:=MROUND([.J156];0.01) -> 0.39 | N156: of:=MROUND( ([.I156]-[.L156])*10000 ;0.01) -> 43.94 | O156: of:=MROUND( ([.J156]-[.M156])*10000 ;0.01) -> 21.12
A157: 2022-05-17 | B157: MKCOID-ID | C157: Durock L7 [Black] (78g) | D157: 1 | E157: 0.6 | H157: of:=[.E157]/[.$E$285] -> 0.00746454341876089 | I157: of:=[.H157]*[.$R$143] -> 0.864394127892511 | J157: of:=[.H157]*[.$R$144] -> 0.392112465787509 | L157: of:=MROUND([.I157];0.01) -> 0.86 | M157: of:=MROUND([.J157];0.01) -> 0.39 | N157: of:=MROUND( ([.I157]-[.L157])*10000 ;0.01) -> 43.94 | O157: of:=MROUND( ([.J157]-[.M157])*10000 ;0.01) -> 21.12
A158: 2022-05-17 | B158: MKCOID-ID | C158: Durock POM | D158: 1 | E158: 0.79 | H158: of:=[.E158]/[.$E$285] -> 0.0098283155013685 | I158: of:=[.H158]*[.$R$143] -> 1.13811893505847 | J158: of:=[.H158]*[.$R$144] -> 0.516281413286887 | L158: of:=MROUND([.I158];0.01) -> 1.14 | M158: of:=MROUND([.J158];0.01) -> 0.52 | N158: of:=MROUND( ([.I158]-[.L158])*10000 ;0.01) -> -18.81 | O158: of:=MROUND( ([.J158]-[.M158])*10000 ;0.01) -> -37.19
A159: 2022-05-17 | B159: MKCOID-ID | C159: Durock Purple | D159: 1 | E159: 0.6 | H159: of:=[.E159]/[.$E$285] -> 0.00746454341876089 | I159: of:=[.H159]*[.$R$143] -> 0.864394127892511 | J159: of:=[.H159]*[.$R$144] -> 0.392112465787509 | L159: of:=MROUND([.I159];0.01) -> 0.86 | M159: of:=MROUND([.J159];0.01) -> 0.39 | N159: of:=MROUND( ([.I159]-[.L159])*10000 ;0.01) -> 43.94 | O159: of:=MROUND( ([.J159]-[.M159])*10000 ;0.01) -> 21.12
A160: 2022-05-17 | B160: MKCOID-ID | C160: Durock T1 POM Sunflower | D160: 1 | E160: 0.79 | H160: of:=[.E160]/[.$E$285] -> 0.0098283155013685 | I160: of:=[.H160]*[.$R$143] -> 1.13811893505847 | J160: of:=[.H160]*[.$R$144] -> 0.516281413286887 | L160: of:=MROUND([.I160];0.01) -> 1.14 | M160: of:=MROUND([.J160];0.01) -> 0.52 | N160: of:=MROUND( ([.I160]-[.L160])*10000 ;0.01) -> -18.81 | O160: of:=MROUND( ([.J160]-[.M160])*10000 ;0.01) -> -37.19
A161: 2022-05-17 | B161: MKCOID-ID | C161: Durock T1 Shrimp | D161: 1 | E161: 0.86 | H161: of:=[.E161]/[.$E$285] -> 0.0106991789002239 | I161: of:=[.H161]*[.$R$143] -> 1.23896491664593 | J161: of:=[.H161]*[.$R$144] -> 0.562027867628763 | L161: of:=MROUND([.I161];0.01) -> 1.24 | M161: of:=MROUND([.J161];0.01) -> 0.56 | N161: of:=MROUND( ([.I161]-[.L161])*10000 ;0.01) -> -10.35 | O161: of:=MROUND( ([.J161]-[.M161])*10000 ;0.01) -> 20.28
A162: 2022-05-17 | B162: MKCOID-ID | C162: Durock Koala (62g) | D162: 1 | E162: 0.6 | H162: of:=[.E162]/[.$E$285] -> 0.00746454341876089 | I162: of:=[.H162]*[.$R$143] -> 0.864394127892511 | J162: of:=[.H162]*[.$R$144] -> 0.392112465787509 | L162: of:=MROUND([.I162];0.01) -> 0.86 | M162: of:=MROUND([.J162];0.01) -> 0.39 | N162: of:=MROUND( ([.I162]-[.L162])*10000 ;0.01) -> 43.94 | O162: of:=MROUND( ([.J162]-[.M162])*10000 ;0.01) -> 21.12
A163: 2022-05-17 | B163: MKCOID-ID | C163: Durock Koala (67g) | D163: 1 | E163: 0.6 | H163: of:=[.E163]/[.$E$285] -> 0.00746454341876089 | I163: of:=[.H163]*[.$R$143] -> 0.864394127892511 | J163: of:=[.H163]*[.$R$144] -> 0.392112465787509 | L163: of:=MROUND([.I163];0.01) -> 0.86 | M163: of:=MROUND([.J163];0.01) -> 0.39 | N163: of:=MROUND( ([.I163]-[.L163])*10000 ;0.01) -> 43.94 | O163: of:=MROUND( ([.J163]-[.M163])*10000 ;0.01) -> 21.12
A164: 2022-05-17 | B164: MKCOID-ID | C164: Ethereal Panda | D164: 1 | E164: 0.94 | H164: of:=[.E164]/[.$E$285] -> 0.0116944513560587 | I164: of:=[.H164]*[.$R$143] -> 1.3542174670316 | J164: of:=[.H164]*[.$R$144] -> 0.614309529733765 | L164: of:=MROUND([.I164];0.01) -> 1.35 | M164: of:=MROUND([.J164];0.01) -> 0.61 | N164: of:=MROUND( ([.I164]-[.L164])*10000 ;0.01) -> 42.17 | O164: of:=MROUND( ([.J164]-[.M164])*10000 ;0.01) -> 43.1
A165: 2022-05-17 | B165: MKCOID-ID | C165: Everglide Aqua King V3 (55g) | D165: 1 | E165: 0.74 | H165: of:=[.E165]/[.$E$285] -> 0.00920627021647176 | I165: of:=[.H165]*[.$R$143] -> 1.06608609106743 | J165: of:=[.H165]*[.$R$144] -> 0.483605374471262 | L165: of:=MROUND([.I165];0.01) -> 1.07 | M165: of:=MROUND([.J165];0.01) -> 0.48 | N165: of:=MROUND( ([.I165]-[.L165])*10000 ;0.01) -> -39.14 | O165: of:=MROUND( ([.J165]-[.M165])*10000 ;0.01) -> 36.05
A166: 2022-05-17 | B166: MKCOID-ID | C166: Everglide Aqua King V3 (62g) | D166: 1 | E166: 0.74 | H166: of:=[.E166]/[.$E$285] -> 0.00920627021647176 | I166: of:=[.H166]*[.$R$143] -> 1.06608609106743 | J166: of:=[.H166]*[.$R$144] -> 0.483605374471262 | L166: of:=MROUND([.I166];0.01) -> 1.07 | M166: of:=MROUND([.J166];0.01) -> 0.48 | N166: of:=MROUND( ([.I166]-[.L166])*10000 ;0.01) -> -39.14 | O166: of:=MROUND( ([.J166]-[.M166])*10000 ;0.01) -> 36.05
A167: 2022-05-17 | B167: MKCOID-ID | C167: Everglide Aqua King V3 (67g) | D167: 1 | E167: 0.74 | H167: of:=[.E167]/[.$E$285] -> 0.00920627021647176 | I167: of:=[.H167]*[.$R$143] -> 1.06608609106743 | J167: of:=[.H167]*[.$R$144] -> 0.483605374471262 | L167: of:=MROUND([.I167];0.01) -> 1.07 | M167: of:=MROUND([.J167];0.01) -> 0.48 | N167: of:=MROUND( ([.I167]-[.L167])*10000 ;0.01) -> -39.14 | O167: of:=MROUND( ([.J167]-[.M167])*10000 ;0.01) -> 36.05
A168: 2022-05-17 | B168: MKCOID-ID | C168: Everglide Moyu Black | D168: 1 | E168: 1.09 | H168: of:=[.E168]/[.$E$285] -> 0.0135605872107489 | I168: of:=[.H168]*[.$R$143] -> 1.57031599900473 | J168: of:=[.H168]*[.$R$144] -> 0.712337646180642 | L168: of:=MROUND([.I168];0.01) -> 1.57 | M168: of:=MROUND([.J168];0.01) -> 0.71 | N168: of:=MROUND( ([.I168]-[.L168])*10000 ;0.01) -> 3.16 | O168: of:=MROUND( ([.J168]-[.M168])*10000 ;0.01) -> 23.38
A169: 2022-05-17 | B169: MKCOID-ID | C169: Gateron KS-8 (Blue) | D169: 1 | E169: 0.23 | H169: of:=[.E169]/[.$E$285] -> 0.00286140831052501 | I169: of:=[.H169]*[.$R$143] -> 0.331351082358796 | J169: of:=[.H169]*[.$R$144] -> 0.150309778551879 | L169: of:=MROUND([.I169];0.01) -> 0.33 | M169: of:=MROUND([.J169];0.01) -> 0.15 | N169: of:=MROUND( ([.I169]-[.L169])*10000 ;0.01) -> 13.51 | O169: of:=MROUND( ([.J169]-[.M169])*10000 ;0.01) -> 3.1
A170: 2022-05-17 | B170: MKCOID-ID | C170: Gateron KS-3 (Silent Yellow) | D170: 1 | E170: 0.47 | H170: of:=[.E170]/[.$E$285] -> 0.00584722567802936 | I170: of:=[.H170]*[.$R$143] -> 0.6771087335158 | J170: of:=[.H170]*[.$R$144] -> 0.307154764866882 | L170: of:=MROUND([.I170];0.01) -> 0.68 | M170: of:=MROUND([.J170];0.01) -> 0.31 | N170: of:=MROUND( ([.I170]-[.L170])*10000 ;0.01) -> -28.91 | O170: of:=MROUND( ([.J170]-[.M170])*10000 ;0.01) -> -28.45
A171: 2022-05-17 | B171: MKCOID-ID | C171: Gateron G Pro (Red) | D171: 1 | E171: 0.26 | H171: of:=[.E171]/[.$E$285] -> 0.00323463548146305 | I171: of:=[.H171]*[.$R$143] -> 0.374570788753421 | J171: of:=[.H171]*[.$R$144] -> 0.169915401841254 | L171: of:=MROUND([.I171];0.01)+0.01 -> 0.38 | M171: of:=MROUND([.J171];0.01) -> 0.17 | N171: of:=MROUND( ([.I171]-[.L171])*10000 ;0.01) -> -54.29 | O171: of:=MROUND( ([.J171]-[.M171])*10000 ;0.01) -> -0.85
A172: 2022-05-17 | B172: MKCOID-ID | C172: Gateron G Pro (Yellow) | D172: 1 | E172: 0.26 | H172: of:=[.E172]/[.$E$285] -> 0.00323463548146305 | I172: of:=[.H172]*[.$R$143] -> 0.374570788753421 | J172: of:=[.H172]*[.$R$144] -> 0.169915401841254 | L172: of:=MROUND([.I172];0.01)+0.01 -> 0.38 | M172: of:=MROUND([.J172];0.01) -> 0.17 | N172: of:=MROUND( ([.I172]-[.L172])*10000 ;0.01) -> -54.29 | O172: of:=MROUND( ([.J172]-[.M172])*10000 ;0.01) -> -0.85
A173: 2022-05-17 | B173: MKCOID-ID | C173: Gateron Cap V2 (Golden Brown) | D173: 1 | E173: 0.56 | H173: of:=[.E173]/[.$E$285] -> 0.00696690719084349 | I173: of:=[.H173]*[.$R$143] -> 0.806767852699677 | J173: of:=[.H173]*[.$R$144] -> 0.365971634735009 | L173: of:=MROUND([.I173];0.01) -> 0.81 | M173: of:=MROUND([.J173];0.01) -> 0.37 | N173: of:=MROUND( ([.I173]-[.L173])*10000 ;0.01) -> -32.32 | O173: of:=MROUND( ([.J173]-[.M173])*10000 ;0.01) -> -40.28
A174: 2022-05-17 | B174: MKCOID-ID | C174: Gateron Cap V2 (Golden Yellow) | D174: 1 | E174: 0.56 | H174: of:=[.E174]/[.$E$285] -> 0.00696690719084349 | I174: of:=[.H174]*[.$R$143] -> 0.806767852699677 | J174: of:=[.H174]*[.$R$144] -> 0.365971634735009 | L174: of:=MROUND([.I174];0.01) -> 0.81 | M174: of:=MROUND([.J174];0.01) -> 0.37 | N174: of:=MROUND( ([.I174]-[.L174])*10000 ;0.01) -> -32.32 | O174: of:=MROUND( ([.J174]-[.M174])*10000 ;0.01) -> -40.28
A175: 2022-05-17 | B175: MKCOID-ID | C175: Gateron Cap V2 (Milky Yellow) | D175: 1 | E175: 0.39 | H175: of:=[.E175]/[.$E$285] -> 0.00485195322219458 | I175: of:=[.H175]*[.$R$143] -> 0.561856183130132 | J175: of:=[.H175]*[.$R$144] -> 0.254873102761881 | L175: of:=MROUND([.I175];0.01) -> 0.56 | M175: of:=MROUND([.J175];0.01)+0.01 -> 0.26 | N175: of:=MROUND( ([.I175]-[.L175])*10000 ;0.01) -> 18.56 | O175: of:=MROUND( ([.J175]-[.M175])*10000 ;0.01) -> -51.27
A176: 2022-05-17 | B176: MKCOID-ID | C176: Gateron Ink V2 (Yellow) | D176: 1 | E176: 0.81 | H176: of:=[.E176]/[.$E$285] -> 0.0100771336153272 | I176: of:=[.H176]*[.$R$143] -> 1.16693207265489 | J176: of:=[.H176]*[.$R$144] -> 0.529351828813138 | L176: of:=MROUND([.I176];0.01) -> 1.17 | M176: of:=MROUND([.J176];0.01) -> 0.53 | N176: of:=MROUND( ([.I176]-[.L176])*10000 ;0.01) -> -30.68 | O176: of:=MROUND( ([.J176]-[.M176])*10000 ;0.01) -> -6.48
A177: 2022-05-17 | B177: MKCOID-ID | C177: Gateron Ink V2 (Black) Baltic Edition | D177: 1 | E177: 0.94 | H177: of:=[.E177]/[.$E$285] -> 0.0116944513560587 | I177: of:=[.H177]*[.$R$143] -> 1.3542174670316 | J177: of:=[.H177]*[.$R$144] -> 0.614309529733765 | L177: of:=MROUND([.I177];0.01) -> 1.35 | M177: of:=MROUND([.J177];0.01) -> 0.61 | N177: of:=MROUND( ([.I177]-[.L177])*10000 ;0.01) -> 42.17 | O177: of:=MROUND( ([.J177]-[.M177])*10000 ;0.01) -> 43.1
A178: 2022-05-17 | B178: MKCOID-ID | C178: Gateron Ink V2 (Kangaroo) | D178: 1 | E178: 0.94 | H178: of:=[.E178]/[.$E$285] -> 0.0116944513560587 | I178: of:=[.H178]*[.$R$143] -> 1.3542174670316 | J178: of:=[.H178]*[.$R$144] -> 0.614309529733765 | L178: of:=MROUND([.I178];0.01) -> 1.35 | M178: of:=MROUND([.J178];0.01) -> 0.61 | N178: of:=MROUND( ([.I178]-[.L178])*10000 ;0.01) -> 42.17 | O178: of:=MROUND( ([.J178]-[.M178])*10000 ;0.01) -> 43.1
A179: 2022-05-17 | B179: MKCOID-ID | C179: Gateron Pink | D179: 1 | E179: 0.6 | H179: of:=[.E179]/[.$E$285] -> 0.00746454341876089 | I179: of:=[.H179]*[.$R$143] -> 0.864394127892511 | J179: of:=[.H179]*[.$R$144] -> 0.392112465787509 | L179: of:=MROUND([.I179];0.01) -> 0.86 | M179: of:=MROUND([.J179];0.01) -> 0.39 | N179: of:=MROUND( ([.I179]-[.L179])*10000 ;0.01) -> 43.94 | O179: of:=MROUND( ([.J179]-[.M179])*10000 ;0.01) -> 21.12
A180: 2022-05-17 | B180: MKCOID-ID | C180: Gazzew Bobagum (52g) Clear Top | D180: 1 | E180: 0.68 | H180: of:=[.E180]/[.$E$285] -> 0.00845981587459567 | I180: of:=[.H180]*[.$R$143] -> 0.979646678278179 | J180: of:=[.H180]*[.$R$144] -> 0.444394127892511 | L180: of:=MROUND([.I180];0.01) -> 0.98 | M180: of:=MROUND([.J180];0.01)+0.01 -> 0.45 | N180: of:=MROUND( ([.I180]-[.L180])*10000 ;0.01) -> -3.53 | O180: of:=MROUND( ([.J180]-[.M180])*10000 ;0.01) -> -56.06
A181: 2022-05-17 | B181: MKCOID-ID | C181: Gazzew Bobagum (68g) Clear Top | D181: 1 | E181: 0.68 | H181: of:=[.E181]/[.$E$285] -> 0.00845981587459567 | I181: of:=[.H181]*[.$R$143] -> 0.979646678278179 | J181: of:=[.H181]*[.$R$144] -> 0.444394127892511 | L181: of:=MROUND([.I181];0.01) -> 0.98 | M181: of:=MROUND([.J181];0.01)+0.01 -> 0.45 | N181: of:=MROUND( ([.I181]-[.L181])*10000 ;0.01) -> -3.53 | O181: of:=MROUND( ([.J181]-[.M181])*10000 ;0.01) -> -56.06
A182: 2022-05-17 | B182: MKCOID-ID | C182: Gazzew Boba LT (55g) | D182: 1 | E182: 0.69 | H182: of:=[.E182]/[.$E$285] -> 0.00858422493157502 | I182: of:=[.H182]*[.$R$143] -> 0.994053247076387 | J182: of:=[.H182]*[.$R$144] -> 0.450929335655636 | L182: of:=MROUND([.I182];0.01) -> 0.99 | M182: of:=MROUND([.J182];0.01) -> 0.45 | N182: of:=MROUND( ([.I182]-[.L182])*10000 ;0.01) -> 40.53 | O182: of:=MROUND( ([.J182]-[.M182])*10000 ;0.01) -> 9.29
A183: 2022-05-17 | B183: MKCOID-ID | C183: Gazzew Boba LT (65g) | D183: 1 | E183: 0.69 | H183: of:=[.E183]/[.$E$285] -> 0.00858422493157502 | I183: of:=[.H183]*[.$R$143] -> 0.994053247076387 | J183: of:=[.H183]*[.$R$144] -> 0.450929335655636 | L183: of:=MROUND([.I183];0.01) -> 0.99 | M183: of:=MROUND([.J183];0.01) -> 0.45 | N183: of:=MROUND( ([.I183]-[.L183])*10000 ;0.01) -> 40.53 | O183: of:=MROUND( ([.J183]-[.M183])*10000 ;0.01) -> 9.29
A184: 2022-05-17 | B184: MKCOID-ID | C184: Gazzew Boba U4 (62g) Opaque Top | D184: 1 | E184: 0.75 | H184: of:=[.E184]/[.$E$285] -> 0.00933067927345111 | I184: of:=[.H184]*[.$R$143] -> 1.08049265986564 | J184: of:=[.H184]*[.$R$144] -> 0.490140582234387 | L184: of:=MROUND([.I184];0.01) -> 1.08 | M184: of:=MROUND([.J184];0.01) -> 0.49 | N184: of:=MROUND( ([.I184]-[.L184])*10000 ;0.01) -> 4.93 | O184: of:=MROUND( ([.J184]-[.M184])*10000 ;0.01) -> 1.41
A185: 2022-05-17 | B185: MKCOID-ID | C185: Gazzew Boba U4 (68g) Opaque Top | D185: 1 | E185: 0.75 | H185: of:=[.E185]/[.$E$285] -> 0.00933067927345111 | I185: of:=[.H185]*[.$R$143] -> 1.08049265986564 | J185: of:=[.H185]*[.$R$144] -> 0.490140582234387 | L185: of:=MROUND([.I185];0.01) -> 1.08 | M185: of:=MROUND([.J185];0.01) -> 0.49 | N185: of:=MROUND( ([.I185]-[.L185])*10000 ;0.01) -> 4.93 | O185: of:=MROUND( ([.J185]-[.M185])*10000 ;0.01) -> 1.41
A186: 2022-05-17 | B186: MKCOID-ID | C186: Gazzew Boba U4 (62g) Clear Top | D186: 1 | E186: 0.75 | H186: of:=[.E186]/[.$E$285] -> 0.00933067927345111 | I186: of:=[.H186]*[.$R$143] -> 1.08049265986564 | J186: of:=[.H186]*[.$R$144] -> 0.490140582234387 | L186: of:=MROUND([.I186];0.01) -> 1.08 | M186: of:=MROUND([.J186];0.01) -> 0.49 | N186: of:=MROUND( ([.I186]-[.L186])*10000 ;0.01) -> 4.93 | O186: of:=MROUND( ([.J186]-[.M186])*10000 ;0.01) -> 1.41
A187: 2022-05-17 | B187: MKCOID-ID | C187: Greetech GT02 (Red) | D187: 1 | E187: 0.23 | H187: of:=[.E187]/[.$E$285] -> 0.00286140831052501 | I187: of:=[.H187]*[.$R$143] -> 0.331351082358796 | J187: of:=[.H187]*[.$R$144] -> 0.150309778551879 | L187: of:=MROUND([.I187];0.01) -> 0.33 | M187: of:=MROUND([.J187];0.01) -> 0.15 | N187: of:=MROUND( ([.I187]-[.L187])*10000 ;0.01) -> 13.51 | O187: of:=MROUND( ([.J187]-[.M187])*10000 ;0.01) -> 3.1
A188: 2022-05-17 | B188: MKCOID-ID | C188: Greetech GT02 (Black) | D188: 1 | E188: 0.23 | H188: of:=[.E188]/[.$E$285] -> 0.00286140831052501 | I188: of:=[.H188]*[.$R$143] -> 0.331351082358796 | J188: of:=[.H188]*[.$R$144] -> 0.150309778551879 | L188: of:=MROUND([.I188];0.01) -> 0.33 | M188: of:=MROUND([.J188];0.01) -> 0.15 | N188: of:=MROUND( ([.I188]-[.L188])*10000 ;0.01) -> 13.51 | O188: of:=MROUND( ([.J188]-[.M188])*10000 ;0.01) -> 3.1
A189: 2022-05-17 | B189: MKCOID-ID | C189: Greetech GT02 (Brown) | D189: 1 | E189: 0.23 | H189: of:=[.E189]/[.$E$285] -> 0.00286140831052501 | I189: of:=[.H189]*[.$R$143] -> 0.331351082358796 | J189: of:=[.H189]*[.$R$144] -> 0.150309778551879 | L189: of:=MROUND([.I189];0.01) -> 0.33 | M189: of:=MROUND([.J189];0.01) -> 0.15 | N189: of:=MROUND( ([.I189]-[.L189])*10000 ;0.01) -> 13.51 | O189: of:=MROUND( ([.J189]-[.M189])*10000 ;0.01) -> 3.1
A190: 2022-05-17 | B190: MKCOID-ID | C190: Greetech GT02 (Blue) | D190: 1 | E190: 0.23 | H190: of:=[.E190]/[.$E$285] -> 0.00286140831052501 | I190: of:=[.H190]*[.$R$143] -> 0.331351082358796 | J190: of:=[.H190]*[.$R$144] -> 0.150309778551879 | L190: of:=MROUND([.I190];0.01) -> 0.33 | M190: of:=MROUND([.J190];0.01) -> 0.15 | N190: of:=MROUND( ([.I190]-[.L190])*10000 ;0.01) -> 13.51 | O190: of:=MROUND( ([.J190]-[.M190])*10000 ;0.01) -> 3.1
A191: 2022-05-17 | B191: MKCOID-ID | C191: Greetech GT02 (Green) | D191: 1 | E191: 0.23 | H191: of:=[.E191]/[.$E$285] -> 0.00286140831052501 | I191: of:=[.H191]*[.$R$143] -> 0.331351082358796 | J191: of:=[.H191]*[.$R$144] -> 0.150309778551879 | L191: of:=MROUND([.I191];0.01) -> 0.33 | M191: of:=MROUND([.J191];0.01) -> 0.15 | N191: of:=MROUND( ([.I191]-[.L191])*10000 ;0.01) -> 13.51 | O191: of:=MROUND( ([.J191]-[.M191])*10000 ;0.01) -> 3.1
A192: 2022-05-17 | B192: MKCOID-ID | C192: HHHH H1 | D192: 1 | E192: 0.74 | H192: of:=[.E192]/[.$E$285] -> 0.00920627021647176 | I192: of:=[.H192]*[.$R$143] -> 1.06608609106743 | J192: of:=[.H192]*[.$R$144] -> 0.483605374471262 | L192: of:=MROUND([.I192];0.01) -> 1.07 | M192: of:=MROUND([.J192];0.01) -> 0.48 | N192: of:=MROUND( ([.I192]-[.L192])*10000 ;0.01) -> -39.14 | O192: of:=MROUND( ([.J192]-[.M192])*10000 ;0.01) -> 36.05
A193: 2022-05-17 | B193: MKCOID-ID | C193: Invyr Holy Panda | D193: 1 | E193: 1.28 | H193: of:=[.E193]/[.$E$285] -> 0.0159243592933566 | I193: of:=[.H193]*[.$R$143] -> 1.84404080617069 | J193: of:=[.H193]*[.$R$144] -> 0.83650659368002 | L193: of:=MROUND([.I193];0.01) -> 1.84 | M193: of:=MROUND([.J193];0.01) -> 0.84 | N193: of:=MROUND( ([.I193]-[.L193])*10000 ;0.01) -> 40.41 | O193: of:=MROUND( ([.J193]-[.M193])*10000 ;0.01) -> -34.93
A194: 2022-05-17 | B194: MKCOID-ID | C194: Invyr Holy Panda | D194: 1 | E194: 1.28 | F194: This one is kept in my extras pile. | H194: of:=[.E194]/[.$E$285] -> 0.0159243592933566 | I194: of:=[.H194]*[.$R$143] -> 1.84404080617069 | J194: of:=[.H194]*[.$R$144] -> 0.83650659368002 | L194: of:=MROUND([.I194];0.01) -> 1.84 | M194: of:=MROUND([.J194];0.01) -> 0.84 | N194: of:=MROUND( ([.I194]-[.L194])*10000 ;0.01) -> 40.41 | O194: of:=MROUND( ([.J194]-[.M194])*10000 ;0.01) -> -34.93
A195: 2022-05-17 | B195: MKCOID-ID | C195: Invyr Holy Panda | D195: 1 | E195: 1.28 | F195: This one is kept in my extras pile. | H195: of:=[.E195]/[.$E$285] -> 0.0159243592933566 | I195: of:=[.H195]*[.$R$143] -> 1.84404080617069 | J195: of:=[.H195]*[.$R$144] -> 0.83650659368002 | L195: of:=MROUND([.I195];0.01) -> 1.84 | M195: of:=MROUND([.J195];0.01) -> 0.84 | N195: of:=MROUND( ([.I195]-[.L195])*10000 ;0.01) -> 40.41 | O195: of:=MROUND( ([.J195]-[.M195])*10000 ;0.01) -> -34.93
A196: 2022-05-17 | B196: MKCOID-ID | C196: Joininkeys Epsilon | D196: 1 | E196: 0.74 | H196: of:=[.E196]/[.$E$285] -> 0.00920627021647176 | I196: of:=[.H196]*[.$R$143] -> 1.06608609106743 | J196: of:=[.H196]*[.$R$144] -> 0.483605374471262 | L196: of:=MROUND([.I196];0.01) -> 1.07 | M196: of:=MROUND([.J196];0.01) -> 0.48 | N196: of:=MROUND( ([.I196]-[.L196])*10000 ;0.01) -> -39.14 | O196: of:=MROUND( ([.J196]-[.M196])*10000 ;0.01) -> 36.05
A197: 2022-05-17 | B197: MKCOID-ID | C197: Joininkeys Matcha | D197: 1 | E197: 0.71 | H197: of:=[.E197]/[.$E$285] -> 0.00883304304553371 | I197: of:=[.H197]*[.$R$143] -> 1.0228663846728 | J197: of:=[.H197]*[.$R$144] -> 0.463999751181886 | L197: of:=MROUND([.I197];0.01) -> 1.02 | M197: of:=MROUND([.J197];0.01) -> 0.46 | N197: of:=MROUND( ([.I197]-[.L197])*10000 ;0.01) -> 28.66 | O197: of:=MROUND( ([.J197]-[.M197])*10000 ;0.01) -> 40
A198: 2022-05-17 | B198: MKCOID-ID | C198: Joininkeys Prince | D198: 1 | E198: 0.71 | H198: of:=[.E198]/[.$E$285] -> 0.00883304304553371 | I198: of:=[.H198]*[.$R$143] -> 1.0228663846728 | J198: of:=[.H198]*[.$R$144] -> 0.463999751181886 | L198: of:=MROUND([.I198];0.01) -> 1.02 | M198: of:=MROUND([.J198];0.01) -> 0.46 | N198: of:=MROUND( ([.I198]-[.L198])*10000 ;0.01) -> 28.66 | O198: of:=MROUND( ([.J198]-[.M198])*10000 ;0.01) -> 40
A199: 2022-05-17 | B199: MKCOID-ID | C199: Joininkeys Sunset (58g) | D199: 1 | E199: 0.71 | H199: of:=[.E199]/[.$E$285] -> 0.00883304304553371 | I199: of:=[.H199]*[.$R$143] -> 1.0228663846728 | J199: of:=[.H199]*[.$R$144] -> 0.463999751181886 | L199: of:=MROUND([.I199];0.01) -> 1.02 | M199: of:=MROUND([.J199];0.01) -> 0.46 | N199: of:=MROUND( ([.I199]-[.L199])*10000 ;0.01) -> 28.66 | O199: of:=MROUND( ([.J199]-[.M199])*10000 ;0.01) -> 40
A200: 2022-05-17 | B200: MKCOID-ID | C200: Joininkeys Sunset (63.5g) | D200: 1 | E200: 0.71 | H200: of:=[.E200]/[.$E$285] -> 0.00883304304553371 | I200: of:=[.H200]*[.$R$143] -> 1.0228663846728 | J200: of:=[.H200]*[.$R$144] -> 0.463999751181886 | L200: of:=MROUND([.I200];0.01) -> 1.02 | M200: of:=MROUND([.J200];0.01) -> 0.46 | N200: of:=MROUND( ([.I200]-[.L200])*10000 ;0.01) -> 28.66 | O200: of:=MROUND( ([.J200]-[.M200])*10000 ;0.01) -> 40
A201: 2022-05-17 | B201: MKCOID-ID | C201: Jwick Black | D201: 1 | E201: 0.26 | H201: of:=[.E201]/[.$E$285] -> 0.00323463548146305 | I201: of:=[.H201]*[.$R$143] -> 0.374570788753421 | J201: of:=[.H201]*[.$R$144] -> 0.169915401841254 | L201: of:=MROUND([.I201];0.01)+0.01 -> 0.38 | M201: of:=MROUND([.J201];0.01) -> 0.17 | N201: of:=MROUND( ([.I201]-[.L201])*10000 ;0.01) -> -54.29 | O201: of:=MROUND( ([.J201]-[.M201])*10000 ;0.01) -> -0.85
A202: 2022-05-17 | B202: MKCOID-ID | C202: Jwick Red | D202: 1 | E202: 0.26 | H202: of:=[.E202]/[.$E$285] -> 0.00323463548146305 | I202: of:=[.H202]*[.$R$143] -> 0.374570788753421 | J202: of:=[.H202]*[.$R$144] -> 0.169915401841254 | L202: of:=MROUND([.I202];0.01)+0.01 -> 0.38 | M202: of:=MROUND([.J202];0.01) -> 0.17 | N202: of:=MROUND( ([.I202]-[.L202])*10000 ;0.01) -> -54.29 | O202: of:=MROUND( ([.J202]-[.M202])*10000 ;0.01) -> -0.85
A203: 2022-05-17 | B203: MKCOID-ID | C203: Jwick T1 | D203: 1 | E203: 0.3 | H203: of:=[.E203]/[.$E$285] -> 0.00373227170938044 | I203: of:=[.H203]*[.$R$143] -> 0.432197063946255 | J203: of:=[.H203]*[.$R$144] -> 0.196056232893755 | L203: of:=MROUND([.I203];0.01) -> 0.43 | M203: of:=MROUND([.J203];0.01) -> 0.2 | N203: of:=MROUND( ([.I203]-[.L203])*10000 ;0.01) -> 21.97 | O203: of:=MROUND( ([.J203]-[.M203])*10000 ;0.01) -> -39.44
A204: 2022-05-17 | B204: MKCOID-ID | C204: Jwick Ultimate Black Opaque Top | D204: 1 | E204: 0.3 | H204: of:=[.E204]/[.$E$285] -> 0.00373227170938044 | I204: of:=[.H204]*[.$R$143] -> 0.432197063946255 | J204: of:=[.H204]*[.$R$144] -> 0.196056232893755 | L204: of:=MROUND([.I204];0.01) -> 0.43 | M204: of:=MROUND([.J204];0.01) -> 0.2 | N204: of:=MROUND( ([.I204]-[.L204])*10000 ;0.01) -> 21.97 | O204: of:=MROUND( ([.J204]-[.M204])*10000 ;0.01) -> -39.44
A205: 2022-05-17 | B205: MKCOID-ID | C205: Jwick Ultimate Black Smokey Top | D205: 1 | E205: 0.3 | H205: of:=[.E205]/[.$E$285] -> 0.00373227170938044 | I205: of:=[.H205]*[.$R$143] -> 0.432197063946255 | J205: of:=[.H205]*[.$R$144] -> 0.196056232893755 | L205: of:=MROUND([.I205];0.01) -> 0.43 | M205: of:=MROUND([.J205];0.01) -> 0.2 | N205: of:=MROUND( ([.I205]-[.L205])*10000 ;0.01) -> 21.97 | O205: of:=MROUND( ([.J205]-[.M205])*10000 ;0.01) -> -39.44
A206: 2022-05-17 | B206: MKCOID-ID | C206: Jwick White | D206: 1 | E206: 0.26 | H206: of:=[.E206]/[.$E$285] -> 0.00323463548146305 | I206: of:=[.H206]*[.$R$143] -> 0.374570788753421 | J206: of:=[.H206]*[.$R$144] -> 0.169915401841254 | L206: of:=MROUND([.I206];0.01)+0.01 -> 0.38 | M206: of:=MROUND([.J206];0.01) -> 0.17 | N206: of:=MROUND( ([.I206]-[.L206])*10000 ;0.01) -> -54.29 | O206: of:=MROUND( ([.J206]-[.M206])*10000 ;0.01) -> -0.85
A207: 2022-05-17 | B207: MKCOID-ID | C207: Jwick Yellow | D207: 1 | E207: 0.26 | H207: of:=[.E207]/[.$E$285] -> 0.00323463548146305 | I207: of:=[.H207]*[.$R$143] -> 0.374570788753421 | J207: of:=[.H207]*[.$R$144] -> 0.169915401841254 | L207: of:=MROUND([.I207];0.01)+0.01 -> 0.38 | M207: of:=MROUND([.J207];0.01) -> 0.17 | N207: of:=MROUND( ([.I207]-[.L207])*10000 ;0.01) -> -54.29 | O207: of:=MROUND( ([.J207]-[.M207])*10000 ;0.01) -> -0.85
A208: 2022-05-17 | B208: MKCOID-ID | C208: JWK Space Blue | D208: 1 | E208: 0.71 | H208: of:=[.E208]/[.$E$285] -> 0.00883304304553371 | I208: of:=[.H208]*[.$R$143] -> 1.0228663846728 | J208: of:=[.H208]*[.$R$144] -> 0.463999751181886 | L208: of:=MROUND([.I208];0.01) -> 1.02 | M208: of:=MROUND([.J208];0.01) -> 0.46 | N208: of:=MROUND( ([.I208]-[.L208])*10000 ;0.01) -> 28.66 | O208: of:=MROUND( ([.J208]-[.M208])*10000 ;0.01) -> 40
A209: 2022-05-17 | B209: MKCOID-ID | C209: Kailh Box (Silent Brown) | D209: 1 | E209: 0.64 | H209: of:=[.E209]/[.$E$285] -> 0.00796217964667828 | I209: of:=[.H209]*[.$R$143] -> 0.922020403085345 | J209: of:=[.H209]*[.$R$144] -> 0.41825329684001 | L209: of:=MROUND([.I209];0.01) -> 0.92 | M209: of:=MROUND([.J209];0.01) -> 0.42 | N209: of:=MROUND( ([.I209]-[.L209])*10000 ;0.01) -> 20.2 | O209: of:=MROUND( ([.J209]-[.M209])*10000 ;0.01) -> -17.47
A210: 2022-05-17 | B210: MKCOID-ID | C210: Kailh Box (Silent Pink) | D210: 1 | E210: 0.64 | H210: of:=[.E210]/[.$E$285] -> 0.00796217964667828 | I210: of:=[.H210]*[.$R$143] -> 0.922020403085345 | J210: of:=[.H210]*[.$R$144] -> 0.41825329684001 | L210: of:=MROUND([.I210];0.01) -> 0.92 | M210: of:=MROUND([.J210];0.01) -> 0.42 | N210: of:=MROUND( ([.I210]-[.L210])*10000 ;0.01) -> 20.2 | O210: of:=MROUND( ([.J210]-[.M210])*10000 ;0.01) -> -17.47
A211: 2022-05-17 | B211: MKCOID-ID | C211: Kailh Box (Ancient Gray) | D211: 1 | E211: 0.41 | H211: of:=[.E211]/[.$E$285] -> 0.00510077133615327 | I211: of:=[.H211]*[.$R$143] -> 0.590669320726549 | J211: of:=[.H211]*[.$R$144] -> 0.267943518288131 | L211: of:=MROUND([.I211];0.01) -> 0.59 | M211: of:=MROUND([.J211];0.01) -> 0.27 | N211: of:=MROUND( ([.I211]-[.L211])*10000 ;0.01) -> 6.69 | O211: of:=MROUND( ([.J211]-[.M211])*10000 ;0.01) -> -20.56
A212: 2022-05-17 | B212: MKCOID-ID | C212: Kailh Box (Chinese Red) | D212: 1 | E212: 0.41 | H212: of:=[.E212]/[.$E$285] -> 0.00510077133615327 | I212: of:=[.H212]*[.$R$143] -> 0.590669320726549 | J212: of:=[.H212]*[.$R$144] -> 0.267943518288131 | L212: of:=MROUND([.I212];0.01) -> 0.59 | M212: of:=MROUND([.J212];0.01) -> 0.27 | N212: of:=MROUND( ([.I212]-[.L212])*10000 ;0.01) -> 6.69 | O212: of:=MROUND( ([.J212]-[.M212])*10000 ;0.01) -> -20.56
A213: 2022-05-17 | B213: MKCOID-ID | C213: Kailh Box (Crystal) (62g) | D213: 1 | E213: 0.86 | H213: of:=[.E213]/[.$E$285] -> 0.0106991789002239 | I213: of:=[.H213]*[.$R$143] -> 1.23896491664593 | J213: of:=[.H213]*[.$R$144] -> 0.562027867628763 | L213: of:=MROUND([.I213];0.01) -> 1.24 | M213: of:=MROUND([.J213];0.01) -> 0.56 | N213: of:=MROUND( ([.I213]-[.L213])*10000 ;0.01) -> -10.35 | O213: of:=MROUND( ([.J213]-[.M213])*10000 ;0.01) -> 20.28
A214: 2022-05-17 | B214: MKCOID-ID | C214: Kailh Box (Crystal) (67g) | D214: 1 | E214: 0.86 | H214: of:=[.E214]/[.$E$285] -> 0.0106991789002239 | I214: of:=[.H214]*[.$R$143] -> 1.23896491664593 | J214: of:=[.H214]*[.$R$144] -> 0.562027867628763 | L214: of:=MROUND([.I214];0.01) -> 1.24 | M214: of:=MROUND([.J214];0.01) -> 0.56 | N214: of:=MROUND( ([.I214]-[.L214])*10000 ;0.01) -> -10.35 | O214: of:=MROUND( ([.J214]-[.M214])*10000 ;0.01) -> 20.28
A215: 2022-05-17 | B215: MKCOID-ID | C215: Kailh Box (Crystal) (72g) | D215: 1 | E215: 0.86 | H215: of:=[.E215]/[.$E$285] -> 0.0106991789002239 | I215: of:=[.H215]*[.$R$143] -> 1.23896491664593 | J215: of:=[.H215]*[.$R$144] -> 0.562027867628763 | L215: of:=MROUND([.I215];0.01) -> 1.24 | M215: of:=MROUND([.J215];0.01) -> 0.56 | N215: of:=MROUND( ([.I215]-[.L215])*10000 ;0.01) -> -10.35 | O215: of:=MROUND( ([.J215]-[.M215])*10000 ;0.01) -> 20.28
A216: 2022-05-17 | B216: MKCOID-ID | C216: Kailh Box (Crystal Pro) (62g) | D216: 1 | E216: 0.86 | H216: of:=[.E216]/[.$E$285] -> 0.0106991789002239 | I216: of:=[.H216]*[.$R$143] -> 1.23896491664593 | J216: of:=[.H216]*[.$R$144] -> 0.562027867628763 | L216: of:=MROUND([.I216];0.01) -> 1.24 | M216: of:=MROUND([.J216];0.01) -> 0.56 | N216: of:=MROUND( ([.I216]-[.L216])*10000 ;0.01) -> -10.35 | O216: of:=MROUND( ([.J216]-[.M216])*10000 ;0.01) -> 20.28
A217: 2022-05-17 | B217: MKCOID-ID | C217: Kailh Box (Crystal Pro) (67g) | D217: 1 | E217: 0.86 | H217: of:=[.E217]/[.$E$285] -> 0.0106991789002239 | I217: of:=[.H217]*[.$R$143] -> 1.23896491664593 | J217: of:=[.H217]*[.$R$144] -> 0.562027867628763 | L217: of:=MROUND([.I217];0.01) -> 1.24 | M217: of:=MROUND([.J217];0.01) -> 0.56 | N217: of:=MROUND( ([.I217]-[.L217])*10000 ;0.01) -> -10.35 | O217: of:=MROUND( ([.J217]-[.M217])*10000 ;0.01) -> 20.28
A218: 2022-05-17 | B218: MKCOID-ID | C218: Kailh Box (Crystal Pro) (72g) | D218: 1 | E218: 0.86 | H218: of:=[.E218]/[.$E$285] -> 0.0106991789002239 | I218: of:=[.H218]*[.$R$143] -> 1.23896491664593 | J218: of:=[.H218]*[.$R$144] -> 0.562027867628763 | L218: of:=MROUND([.I218];0.01) -> 1.24 | M218: of:=MROUND([.J218];0.01) -> 0.56 | N218: of:=MROUND( ([.I218]-[.L218])*10000 ;0.01) -> -10.35 | O218: of:=MROUND( ([.J218]-[.M218])*10000 ;0.01) -> 20.28
A219: 2022-05-17 | B219: MKCOID-ID | C219: Kailh Box (Deep Sea) | D219: 1 | E219: 0.66 | H219: of:=[.E219]/[.$E$285] -> 0.00821099776063697 | I219: of:=[.H219]*[.$R$143] -> 0.950833540681762 | J219: of:=[.H219]*[.$R$144] -> 0.43132371236626 | L219: of:=MROUND([.I219];0.01) -> 0.95 | M219: of:=MROUND([.J219];0.01) -> 0.43 | N219: of:=MROUND( ([.I219]-[.L219])*10000 ;0.01) -> 8.34 | O219: of:=MROUND( ([.J219]-[.M219])*10000 ;0.01) -> 13.24
A220: 2022-05-17 | B220: MKCOID-ID | C220: Kailh Box (Glazed Green) | D220: 1 | E220: 0.41 | H220: of:=[.E220]/[.$E$285] -> 0.00510077133615327 | I220: of:=[.H220]*[.$R$143] -> 0.590669320726549 | J220: of:=[.H220]*[.$R$144] -> 0.267943518288131 | L220: of:=MROUND([.I220];0.01) -> 0.59 | M220: of:=MROUND([.J220];0.01) -> 0.27 | N220: of:=MROUND( ([.I220]-[.L220])*10000 ;0.01) -> 6.69 | O220: of:=MROUND( ([.J220]-[.M220])*10000 ;0.01) -> -20.56
A221: 2022-05-17 | B221: MKCOID-ID | C221: Kailh Box (Jellyfish X) | D221: 1 | E221: 0.75 | H221: of:=[.E221]/[.$E$285] -> 0.00933067927345111 | I221: of:=[.H221]*[.$R$143] -> 1.08049265986564 | J221: of:=[.H221]*[.$R$144] -> 0.490140582234387 | L221: of:=MROUND([.I221];0.01) -> 1.08 | M221: of:=MROUND([.J221];0.01) -> 0.49 | N221: of:=MROUND( ([.I221]-[.L221])*10000 ;0.01) -> 4.93 | O221: of:=MROUND( ([.J221]-[.M221])*10000 ;0.01) -> 1.41
A222: 2022-05-17 | B222: MKCOID-ID | C222: Kailh Box (Noble Yellow) | D222: 1 | E222: 0.41 | H222: of:=[.E222]/[.$E$285] -> 0.00510077133615327 | I222: of:=[.H222]*[.$R$143] -> 0.590669320726549 | J222: of:=[.H222]*[.$R$144] -> 0.267943518288131 | L222: of:=MROUND([.I222];0.01) -> 0.59 | M222: of:=MROUND([.J222];0.01) -> 0.27 | N222: of:=MROUND( ([.I222]-[.L222])*10000 ;0.01) -> 6.69 | O222: of:=MROUND( ([.J222]-[.M222])*10000 ;0.01) -> -20.56
A223: 2022-05-17 | B223: MKCOID-ID | C223: Kailh Box (Red Pro) | D223: 1 | E223: 0.45 | H223: of:=[.E223]/[.$E$285] -> 0.00559840756407067 | I223: of:=[.H223]*[.$R$143] -> 0.648295595919383 | J223: of:=[.H223]*[.$R$144] -> 0.294084349340632 | L223: of:=MROUND([.I223];0.01) -> 0.65 | M223: of:=MROUND([.J223];0.01) -> 0.29 | N223: of:=MROUND( ([.I223]-[.L223])*10000 ;0.01) -> -17.04 | O223: of:=MROUND( ([.J223]-[.M223])*10000 ;0.01) -> 40.84
A224: 2022-05-17 | B224: MKCOID-ID | C224: Kailh Speed (Burnt Orange) | D224: 1 | E224: 0.34 | H224: of:=[.E224]/[.$E$285] -> 0.00422990793729784 | I224: of:=[.H224]*[.$R$143] -> 0.489823339139089 | J224: of:=[.H224]*[.$R$144] -> 0.222197063946255 | L224: of:=MROUND([.I224];0.01) -> 0.49 | M224: of:=MROUND([.J224];0.01) -> 0.22 | N224: of:=MROUND( ([.I224]-[.L224])*10000 ;0.01) -> -1.77 | O224: of:=MROUND( ([.J224]-[.M224])*10000 ;0.01) -> 21.97
A225: 2022-05-17 | B225: MKCOID-ID | C225: Kailh Speed (Dark Yellow) | D225: 1 | E225: 0.34 | H225: of:=[.E225]/[.$E$285] -> 0.00422990793729784 | I225: of:=[.H225]*[.$R$143] -> 0.489823339139089 | J225: of:=[.H225]*[.$R$144] -> 0.222197063946255 | L225: of:=MROUND([.I225];0.01) -> 0.49 | M225: of:=MROUND([.J225];0.01) -> 0.22 | N225: of:=MROUND( ([.I225]-[.L225])*10000 ;0.01) -> -1.77 | O225: of:=MROUND( ([.J225]-[.M225])*10000 ;0.01) -> 21.97
A226: 2022-05-17 | B226: MKCOID-ID | C226: Kailh Speed (Pale Blue) | D226: 1 | E226: 0.34 | H226: of:=[.E226]/[.$E$285] -> 0.00422990793729784 | I226: of:=[.H226]*[.$R$143] -> 0.489823339139089 | J226: of:=[.H226]*[.$R$144] -> 0.222197063946255 | L226: of:=MROUND([.I226];0.01) -> 0.49 | M226: of:=MROUND([.J226];0.01) -> 0.22 | N226: of:=MROUND( ([.I226]-[.L226])*10000 ;0.01) -> -1.77 | O226: of:=MROUND( ([.J226]-[.M226])*10000 ;0.01) -> 21.97
A227: 2022-05-17 | B227: MKCOID-ID | C227: Kailh Speed (Rose Pink) | D227: 1 | E227: 0.32 | H227: of:=[.E227]/[.$E$285] -> 0.00398108982333914 | I227: of:=[.H227]*[.$R$143] -> 0.461010201542672 | J227: of:=[.H227]*[.$R$144] -> 0.209126648420005 | L227: of:=MROUND([.I227];0.01) -> 0.46 | M227: of:=MROUND([.J227];0.01) -> 0.21 | N227: of:=MROUND( ([.I227]-[.L227])*10000 ;0.01) -> 10.1 | O227: of:=MROUND( ([.J227]-[.M227])*10000 ;0.01) -> -8.73
A228: 2022-05-17 | B228: MKCOID-ID | C228: Kailh Canary | D228: 1 | E228: 0.74 | H228: of:=[.E228]/[.$E$285] -> 0.00920627021647176 | I228: of:=[.H228]*[.$R$143] -> 1.06608609106743 | J228: of:=[.H228]*[.$R$144] -> 0.483605374471262 | L228: of:=MROUND([.I228];0.01) -> 1.07 | M228: of:=MROUND([.J228];0.01) -> 0.48 | N228: of:=MROUND( ([.I228]-[.L228])*10000 ;0.01) -> -39.14 | O228: of:=MROUND( ([.J228]-[.M228])*10000 ;0.01) -> 36.05
A229: 2022-05-17 | B229: MKCOID-ID | C229: Kailh Polia | D229: 1 | E229: 0.68 | H229: of:=[.E229]/[.$E$285] -> 0.00845981587459567 | I229: of:=[.H229]*[.$R$143] -> 0.979646678278179 | J229: of:=[.H229]*[.$R$144] -> 0.444394127892511 | L229: of:=MROUND([.I229];0.01) -> 0.98 | M229: of:=MROUND([.J229];0.01)+0.01 -> 0.45 | N229: of:=MROUND( ([.I229]-[.L229])*10000 ;0.01) -> -3.53 | O229: of:=MROUND( ([.J229]-[.M229])*10000 ;0.01) -> -56.06
A230: 2022-05-17 | B230: MKCOID-ID | C230: Keyfirst Cream | D230: 1 | E230: 0.68 | H230: of:=[.E230]/[.$E$285] -> 0.00845981587459567 | I230: of:=[.H230]*[.$R$143] -> 0.979646678278179 | J230: of:=[.H230]*[.$R$144] -> 0.444394127892511 | L230: of:=MROUND([.I230];0.01) -> 0.98 | M230: of:=MROUND([.J230];0.01)+0.01 -> 0.45 | N230: of:=MROUND( ([.I230]-[.L230])*10000 ;0.01) -> -3.53 | O230: of:=MROUND( ([.J230]-[.M230])*10000 ;0.01) -> -56.06
A231: 2022-05-17 | B231: MKCOID-ID | C231: KTT Cabbage Tofu | D231: 1 | E231: 0.24 | H231: of:=[.E231]/[.$E$285] -> 0.00298581736750435 | I231: of:=[.H231]*[.$R$143] -> 0.345757651157004 | J231: of:=[.H231]*[.$R$144] -> 0.156844986315004 | L231: of:=MROUND([.I231];0.01) -> 0.35 | M231: of:=MROUND([.J231];0.01) -> 0.16 | N231: of:=MROUND( ([.I231]-[.L231])*10000 ;0.01) -> -42.42 | O231: of:=MROUND( ([.J231]-[.M231])*10000 ;0.01) -> -31.55
A232: 2022-05-17 | B232: MKCOID-ID | C232: KTT Pine Green | D232: 1 | E232: 0.38 | H232: of:=[.E232]/[.$E$285] -> 0.00472754416521523 | I232: of:=[.H232]*[.$R$143] -> 0.547449614331923 | J232: of:=[.H232]*[.$R$144] -> 0.248337894998756 | L232: of:=MROUND([.I232];0.01) -> 0.55 | M232: of:=MROUND([.J232];0.01) -> 0.25 | N232: of:=MROUND( ([.I232]-[.L232])*10000 ;0.01) -> -25.5 | O232: of:=MROUND( ([.J232]-[.M232])*10000 ;0.01) -> -16.62
A233: 2022-05-17 | B233: MKCOID-ID | C233: KTT Red Wine | D233: 1 | E233: 0.23 | H233: of:=[.E233]/[.$E$285] -> 0.00286140831052501 | I233: of:=[.H233]*[.$R$143] -> 0.331351082358796 | J233: of:=[.H233]*[.$R$144] -> 0.150309778551879 | L233: of:=MROUND([.I233];0.01) -> 0.33 | M233: of:=MROUND([.J233];0.01) -> 0.15 | N233: of:=MROUND( ([.I233]-[.L233])*10000 ;0.01) -> 13.51 | O233: of:=MROUND( ([.J233]-[.M233])*10000 ;0.01) -> 3.1
A234: 2022-05-17 | B234: MKCOID-ID | C234: KTT Sea Salt Lemon | D234: 1 | E234: 0.26 | H234: of:=[.E234]/[.$E$285] -> 0.00323463548146305 | I234: of:=[.H234]*[.$R$143] -> 0.374570788753421 | J234: of:=[.H234]*[.$R$144] -> 0.169915401841254 | L234: of:=MROUND([.I234];0.01)+0.01 -> 0.38 | M234: of:=MROUND([.J234];0.01) -> 0.17 | N234: of:=MROUND( ([.I234]-[.L234])*10000 ;0.01) -> -54.29 | O234: of:=MROUND( ([.J234]-[.M234])*10000 ;0.01) -> -0.85
A235: 2022-05-17 | B235: MKCOID-ID | C235: KTT Strawberry | D235: 1 | E235: 0.38 | H235: of:=[.E235]/[.$E$285] -> 0.00472754416521523 | I235: of:=[.H235]*[.$R$143] -> 0.547449614331923 | J235: of:=[.H235]*[.$R$144] -> 0.248337894998756 | L235: of:=MROUND([.I235];0.01) -> 0.55 | M235: of:=MROUND([.J235];0.01) -> 0.25 | N235: of:=MROUND( ([.I235]-[.L235])*10000 ;0.01) -> -25.5 | O235: of:=MROUND( ([.J235]-[.M235])*10000 ;0.01) -> -16.62
A236: 2022-05-17 | B236: MKCOID-ID | C236: Lumia Matcha (45g) | D236: 1 | E236: 0.56 | H236: of:=[.E236]/[.$E$285] -> 0.00696690719084349 | I236: of:=[.H236]*[.$R$143] -> 0.806767852699677 | J236: of:=[.H236]*[.$R$144] -> 0.365971634735009 | L236: of:=MROUND([.I236];0.01) -> 0.81 | M236: of:=MROUND([.J236];0.01) -> 0.37 | N236: of:=MROUND( ([.I236]-[.L236])*10000 ;0.01) -> -32.32 | O236: of:=MROUND( ([.J236]-[.M236])*10000 ;0.01) -> -40.28
A237: 2022-05-17 | B237: MKCOID-ID | C237: Lumia Matcha (62g) | D237: 1 | E237: 0.56 | H237: of:=[.E237]/[.$E$285] -> 0.00696690719084349 | I237: of:=[.H237]*[.$R$143] -> 0.806767852699677 | J237: of:=[.H237]*[.$R$144] -> 0.365971634735009 | L237: of:=MROUND([.I237];0.01) -> 0.81 | M237: of:=MROUND([.J237];0.01) -> 0.37 | N237: of:=MROUND( ([.I237]-[.L237])*10000 ;0.01) -> -32.32 | O237: of:=MROUND( ([.J237]-[.M237])*10000 ;0.01) -> -40.28
A238: 2022-05-17 | B238: MKCOID-ID | C238: Lumia Switch | D238: 1 | E238: 0.68 | H238: of:=[.E238]/[.$E$285] -> 0.00845981587459567 | I238: of:=[.H238]*[.$R$143] -> 0.979646678278179 | J238: of:=[.H238]*[.$R$144] -> 0.444394127892511 | L238: of:=MROUND([.I238];0.01) -> 0.98 | M238: of:=MROUND([.J238];0.01)+0.01 -> 0.45 | N238: of:=MROUND( ([.I238]-[.L238])*10000 ;0.01) -> -3.53 | O238: of:=MROUND( ([.J238]-[.M238])*10000 ;0.01) -> -56.06
A239: 2022-05-17 | B239: MKCOID-ID | C239: MMD Cream | D239: 1 | E239: 0.45 | H239: of:=[.E239]/[.$E$285] -> 0.00559840756407067 | I239: of:=[.H239]*[.$R$143] -> 0.648295595919383 | J239: of:=[.H239]*[.$R$144] -> 0.294084349340632 | L239: of:=MROUND([.I239];0.01) -> 0.65 | M239: of:=MROUND([.J239];0.01) -> 0.29 | N239: of:=MROUND( ([.I239]-[.L239])*10000 ;0.01) -> -17.04 | O239: of:=MROUND( ([.J239]-[.M239])*10000 ;0.01) -> 40.84
A240: 2022-05-17 | B240: MKCOID-ID | C240: MMD HT | D240: 1 | E240: 0.45 | H240: of:=[.E240]/[.$E$285] -> 0.00559840756407067 | I240: of:=[.H240]*[.$R$143] -> 0.648295595919383 | J240: of:=[.H240]*[.$R$144] -> 0.294084349340632 | L240: of:=MROUND([.I240];0.01) -> 0.65 | M240: of:=MROUND([.J240];0.01) -> 0.29 | N240: of:=MROUND( ([.I240]-[.L240])*10000 ;0.01) -> -17.04 | O240: of:=MROUND( ([.J240]-[.M240])*10000 ;0.01) -> 40.84
A241: 2022-05-17 | B241: MKCOID-ID | C241: MOMOKA Christmas Bell | D241: 1 | E241: 0.64 | H241: of:=[.E241]/[.$E$285] -> 0.00796217964667828 | I241: of:=[.H241]*[.$R$143] -> 0.922020403085345 | J241: of:=[.H241]*[.$R$144] -> 0.41825329684001 | L241: of:=MROUND([.I241];0.01) -> 0.92 | M241: of:=MROUND([.J241];0.01) -> 0.42 | N241: of:=MROUND( ([.I241]-[.L241])*10000 ;0.01) -> 20.2 | O241: of:=MROUND( ([.J241]-[.M241])*10000 ;0.01) -> -17.47
A242: 2022-05-17 | B242: MKCOID-ID | C242: MOMOKA Flamingo | D242: 1 | E242: 0.6 | H242: of:=[.E242]/[.$E$285] -> 0.00746454341876089 | I242: of:=[.H242]*[.$R$143] -> 0.864394127892511 | J242: of:=[.H242]*[.$R$144] -> 0.392112465787509 | L242: of:=MROUND([.I242];0.01) -> 0.86 | M242: of:=MROUND([.J242];0.01) -> 0.39 | N242: of:=MROUND( ([.I242]-[.L242])*10000 ;0.01) -> 43.94 | O242: of:=MROUND( ([.J242]-[.M242])*10000 ;0.01) -> 21.12
A243: 2022-05-17 | B243: MKCOID-ID | C243: MOMOKA Frog | D243: 1 | E243: 0.56 | H243: of:=[.E243]/[.$E$285] -> 0.00696690719084349 | I243: of:=[.H243]*[.$R$143] -> 0.806767852699677 | J243: of:=[.H243]*[.$R$144] -> 0.365971634735009 | L243: of:=MROUND([.I243];0.01) -> 0.81 | M243: of:=MROUND([.J243];0.01) -> 0.37 | N243: of:=MROUND( ([.I243]-[.L243])*10000 ;0.01) -> -32.32 | O243: of:=MROUND( ([.J243]-[.M243])*10000 ;0.01) -> -40.28
A244: 2022-05-17 | B244: MKCOID-ID | C244: Outemu (Silent Yellow) | D244: 1 | E244: 0.32 | H244: of:=[.E244]/[.$E$285] -> 0.00398108982333914 | I244: of:=[.H244]*[.$R$143] -> 0.461010201542672 | J244: of:=[.H244]*[.$R$144] -> 0.209126648420005 | L244: of:=MROUND([.I244];0.01) -> 0.46 | M244: of:=MROUND([.J244];0.01) -> 0.21 | N244: of:=MROUND( ([.I244]-[.L244])*10000 ;0.01) -> 10.1 | O244: of:=MROUND( ([.J244]-[.M244])*10000 ;0.01) -> -8.73
A245: 2022-05-17 | B245: MKCOID-ID | C245: Outemu Dustproof (Crystal Red) | D245: 1 | E245: 0.34 | H245: of:=[.E245]/[.$E$285] -> 0.00422990793729784 | I245: of:=[.H245]*[.$R$143] -> 0.489823339139089 | J245: of:=[.H245]*[.$R$144] -> 0.222197063946255 | L245: of:=MROUND([.I245];0.01) -> 0.49 | M245: of:=MROUND([.J245];0.01) -> 0.22 | N245: of:=MROUND( ([.I245]-[.L245])*10000 ;0.01) -> -1.77 | O245: of:=MROUND( ([.J245]-[.M245])*10000 ;0.01) -> 21.97
A246: 2022-05-17 | B246: MKCOID-ID | C246: Outemu Dustproof (Teal) | D246: 1 | E246: 0.26 | H246: of:=[.E246]/[.$E$285] -> 0.00323463548146305 | I246: of:=[.H246]*[.$R$143] -> 0.374570788753421 | J246: of:=[.H246]*[.$R$144] -> 0.169915401841254 | L246: of:=MROUND([.I246];0.01) -> 0.37 | M246: of:=MROUND([.J246];0.01) -> 0.17 | N246: of:=MROUND( ([.I246]-[.L246])*10000 ;0.01) -> 45.71 | O246: of:=MROUND( ([.J246]-[.M246])*10000 ;0.01) -> -0.85
A247: 2022-05-17 | B247: MKCOID-ID | C247: Outemu Ice V2 (Clear) | D247: 1 | E247: 0.38 | H247: of:=[.E247]/[.$E$285] -> 0.00472754416521523 | I247: of:=[.H247]*[.$R$143] -> 0.547449614331923 | J247: of:=[.H247]*[.$R$144] -> 0.248337894998756 | L247: of:=MROUND([.I247];0.01) -> 0.55 | M247: of:=MROUND([.J247];0.01) -> 0.25 | N247: of:=MROUND( ([.I247]-[.L247])*10000 ;0.01) -> -25.5 | O247: of:=MROUND( ([.J247]-[.M247])*10000 ;0.01) -> -16.62
A248: 2022-05-17 | B248: MKCOID-ID | C248: Outemu Ice V2 (Dark Purple) | D248: 1 | E248: 0.38 | H248: of:=[.E248]/[.$E$285] -> 0.00472754416521523 | I248: of:=[.H248]*[.$R$143] -> 0.547449614331923 | J248: of:=[.H248]*[.$R$144] -> 0.248337894998756 | L248: of:=MROUND([.I248];0.01) -> 0.55 | M248: of:=MROUND([.J248];0.01) -> 0.25 | N248: of:=MROUND( ([.I248]-[.L248])*10000 ;0.01) -> -25.5 | O248: of:=MROUND( ([.J248]-[.M248])*10000 ;0.01) -> -16.62
A249: 2022-05-17 | B249: MKCOID-ID | C249: Outemu Ice V2 (Gray) | D249: 1 | E249: 0.38 | H249: of:=[.E249]/[.$E$285] -> 0.00472754416521523 | I249: of:=[.H249]*[.$R$143] -> 0.547449614331923 | J249: of:=[.H249]*[.$R$144] -> 0.248337894998756 | L249: of:=MROUND([.I249];0.01) -> 0.55 | M249: of:=MROUND([.J249];0.01) -> 0.25 | N249: of:=MROUND( ([.I249]-[.L249])*10000 ;0.01) -> -25.5 | O249: of:=MROUND( ([.J249]-[.M249])*10000 ;0.01) -> -16.62
A250: 2022-05-17 | B250: MKCOID-ID | C250: Outemu Ice V2 (Light Purple) | D250: 1 | E250: 0.38 | H250: of:=[.E250]/[.$E$285] -> 0.00472754416521523 | I250: of:=[.H250]*[.$R$143] -> 0.547449614331923 | J250: of:=[.H250]*[.$R$144] -> 0.248337894998756 | L250: of:=MROUND([.I250];0.01) -> 0.55 | M250: of:=MROUND([.J250];0.01) -> 0.25 | N250: of:=MROUND( ([.I250]-[.L250])*10000 ;0.01) -> -25.5 | O250: of:=MROUND( ([.J250]-[.M250])*10000 ;0.01) -> -16.62
A251: 2022-05-17 | B251: MKCOID-ID | C251: Outemu Ice V2 (Teal) | D251: 1 | E251: 0.38 | H251: of:=[.E251]/[.$E$285] -> 0.00472754416521523 | I251: of:=[.H251]*[.$R$143] -> 0.547449614331923 | J251: of:=[.H251]*[.$R$144] -> 0.248337894998756 | L251: of:=MROUND([.I251];0.01) -> 0.55 | M251: of:=MROUND([.J251];0.01) -> 0.25 | N251: of:=MROUND( ([.I251]-[.L251])*10000 ;0.01) -> -25.5 | O251: of:=MROUND( ([.J251]-[.M251])*10000 ;0.01) -> -16.62
A252: 2022-05-17 | B252: MKCOID-ID | C252: Outemu (Phoenix) (62g) | D252: 1 | E252: 0.69 | H252: of:=[.E252]/[.$E$285] -> 0.00858422493157502 | I252: of:=[.H252]*[.$R$143] -> 0.994053247076387 | J252: of:=[.H252]*[.$R$144] -> 0.450929335655636 | L252: of:=MROUND([.I252];0.01) -> 0.99 | M252: of:=MROUND([.J252];0.01) -> 0.45 | N252: of:=MROUND( ([.I252]-[.L252])*10000 ;0.01) -> 40.53 | O252: of:=MROUND( ([.J252]-[.M252])*10000 ;0.01) -> 9.29
A253: 2022-05-17 | B253: MKCOID-ID | C253: Outemu (Phoenix) (68g) | D253: 1 | E253: 0.69 | H253: of:=[.E253]/[.$E$285] -> 0.00858422493157502 | I253: of:=[.H253]*[.$R$143] -> 0.994053247076387 | J253: of:=[.H253]*[.$R$144] -> 0.450929335655636 | L253: of:=MROUND([.I253];0.01) -> 0.99 | M253: of:=MROUND([.J253];0.01) -> 0.45 | N253: of:=MROUND( ([.I253]-[.L253])*10000 ;0.01) -> 40.53 | O253: of:=MROUND( ([.J253]-[.M253])*10000 ;0.01) -> 9.29
A254: 2022-05-17 | B254: MKCOID-ID | C254: Outemu Sky V2.2 | D254: 1 | E254: 0.49 | H254: of:=[.E254]/[.$E$285] -> 0.00609604379198806 | I254: of:=[.H254]*[.$R$143] -> 0.705921871112217 | J254: of:=[.H254]*[.$R$144] -> 0.320225180393133 | L254: of:=MROUND([.I254];0.01) -> 0.71 | M254: of:=MROUND([.J254];0.01) -> 0.32 | N254: of:=MROUND( ([.I254]-[.L254])*10000 ;0.01) -> -40.78 | O254: of:=MROUND( ([.J254]-[.M254])*10000 ;0.01) -> 2.25
A255: 2022-05-17 | B255: MKCOID-ID | C255: SP-Star Blue Pink | D255: 1 | E255: 0.49 | H255: of:=[.E255]/[.$E$285] -> 0.00609604379198806 | I255: of:=[.H255]*[.$R$143] -> 0.705921871112217 | J255: of:=[.H255]*[.$R$144] -> 0.320225180393133 | L255: of:=MROUND([.I255];0.01) -> 0.71 | M255: of:=MROUND([.J255];0.01) -> 0.32 | N255: of:=MROUND( ([.I255]-[.L255])*10000 ;0.01) -> -40.78 | O255: of:=MROUND( ([.J255]-[.M255])*10000 ;0.01) -> 2.25
A256: 2022-05-17 | B256: MKCOID-ID | C256: SP-Star Duck | D256: 1 | E256: 0.49 | H256: of:=[.E256]/[.$E$285] -> 0.00609604379198806 | I256: of:=[.H256]*[.$R$143] -> 0.705921871112217 | J256: of:=[.H256]*[.$R$144] -> 0.320225180393133 | L256: of:=MROUND([.I256];0.01) -> 0.71 | M256: of:=MROUND([.J256];0.01) -> 0.32 | N256: of:=MROUND( ([.I256]-[.L256])*10000 ;0.01) -> -40.78 | O256: of:=MROUND( ([.J256]-[.M256])*10000 ;0.01) -> 2.25
A257: 2022-05-17 | B257: MKCOID-ID | C257: SP-Star Luminous Cyber | D257: 1 | E257: 0.6 | H257: of:=[.E257]/[.$E$285] -> 0.00746454341876089 | I257: of:=[.H257]*[.$R$143] -> 0.864394127892511 | J257: of:=[.H257]*[.$R$144] -> 0.392112465787509 | L257: of:=MROUND([.I257];0.01) -> 0.86 | M257: of:=MROUND([.J257];0.01) -> 0.39 | N257: of:=MROUND( ([.I257]-[.L257])*10000 ;0.01) -> 43.94 | O257: of:=MROUND( ([.J257]-[.M257])*10000 ;0.01) -> 21.12
A258: 2022-05-17 | B258: MKCOID-ID | C258: SP-Star Luminous Starry Night | D258: 1 | E258: 0.6 | H258: of:=[.E258]/[.$E$285] -> 0.00746454341876089 | I258: of:=[.H258]*[.$R$143] -> 0.864394127892511 | J258: of:=[.H258]*[.$R$144] -> 0.392112465787509 | L258: of:=MROUND([.I258];0.01) -> 0.86 | M258: of:=MROUND([.J258];0.01) -> 0.39 | N258: of:=MROUND( ([.I258]-[.L258])*10000 ;0.01) -> 43.94 | O258: of:=MROUND( ([.J258]-[.M258])*10000 ;0.01) -> 21.12
A259: 2022-05-17 | B259: MKCOID-ID | C259: SP-Star Meteor White | D259: 1 | E259: 0.48 | H259: of:=[.E259]/[.$E$285] -> 0.00597163473500871 | I259: of:=[.H259]*[.$R$143] -> 0.691515302314008 | J259: of:=[.H259]*[.$R$144] -> 0.313689972630007 | L259: of:=MROUND([.I259];0.01) -> 0.69 | M259: of:=MROUND([.J259];0.01) -> 0.31 | N259: of:=MROUND( ([.I259]-[.L259])*10000 ;0.01) -> 15.15 | O259: of:=MROUND( ([.J259]-[.M259])*10000 ;0.01) -> 36.9
A260: 2022-05-17 | B260: MKCOID-ID | C260: SP-Star Polaris Gray | D260: 1 | E260: 0.49 | H260: of:=[.E260]/[.$E$285] -> 0.00609604379198806 | I260: of:=[.H260]*[.$R$143] -> 0.705921871112217 | J260: of:=[.H260]*[.$R$144] -> 0.320225180393133 | L260: of:=MROUND([.I260];0.01) -> 0.71 | M260: of:=MROUND([.J260];0.01) -> 0.32 | N260: of:=MROUND( ([.I260]-[.L260])*10000 ;0.01) -> -40.78 | O260: of:=MROUND( ([.J260]-[.M260])*10000 ;0.01) -> 2.25
A261: 2022-05-17 | B261: MKCOID-ID | C261: SP-Star Polaris Purple | D261: 1 | E261: 0.49 | H261: of:=[.E261]/[.$E$285] -> 0.00609604379198806 | I261: of:=[.H261]*[.$R$143] -> 0.705921871112217 | J261: of:=[.H261]*[.$R$144] -> 0.320225180393133 | L261: of:=MROUND([.I261];0.01) -> 0.71 | M261: of:=MROUND([.J261];0.01) -> 0.32 | N261: of:=MROUND( ([.I261]-[.L261])*10000 ;0.01) -> -40.78 | O261: of:=MROUND( ([.J261]-[.M261])*10000 ;0.01) -> 2.25
A262: 2022-05-17 | B262: MKCOID-ID | C262: SP-Star Polaris White | D262: 1 | E262: 0.49 | H262: of:=[.E262]/[.$E$285] -> 0.00609604379198806 | I262: of:=[.H262]*[.$R$143] -> 0.705921871112217 | J262: of:=[.H262]*[.$R$144] -> 0.320225180393133 | L262: of:=MROUND([.I262];0.01) -> 0.71 | M262: of:=MROUND([.J262];0.01) -> 0.32 | N262: of:=MROUND( ([.I262]-[.L262])*10000 ;0.01) -> -40.78 | O262: of:=MROUND( ([.J262]-[.M262])*10000 ;0.01) -> 2.25
A263: 2022-05-17 | B263: MKCOID-ID | C263: SP-Star Red Blue CP | D263: 1 | E263: 0.49 | H263: of:=[.E263]/[.$E$285] -> 0.00609604379198806 | I263: of:=[.H263]*[.$R$143] -> 0.705921871112217 | J263: of:=[.H263]*[.$R$144] -> 0.320225180393133 | L263: of:=MROUND([.I263];0.01) -> 0.71 | M263: of:=MROUND([.J263];0.01) -> 0.32 | N263: of:=MROUND( ([.I263]-[.L263])*10000 ;0.01) -> -40.78 | O263: of:=MROUND( ([.J263]-[.M263])*10000 ;0.01) -> 2.25
A264: 2022-05-17 | B264: MKCOID-ID | C264: SP-Star Vanilla | D264: 1 | E264: 0.48 | H264: of:=[.E264]/[.$E$285] -> 0.00597163473500871 | I264: of:=[.H264]*[.$R$143] -> 0.691515302314008 | J264: of:=[.H264]*[.$R$144] -> 0.313689972630007 | L264: of:=MROUND([.I264];0.01) -> 0.69 | M264: of:=MROUND([.J264];0.01) -> 0.31 | N264: of:=MROUND( ([.I264]-[.L264])*10000 ;0.01) -> 15.15 | O264: of:=MROUND( ([.J264]-[.M264])*10000 ;0.01) -> 36.9
A265: 2022-05-17 | B265: MKCOID-ID | C265: SP-Star Yanyu | D265: 1 | E265: 0.49 | H265: of:=[.E265]/[.$E$285] -> 0.00609604379198806 | I265: of:=[.H265]*[.$R$143] -> 0.705921871112217 | J265: of:=[.H265]*[.$R$144] -> 0.320225180393133 | L265: of:=MROUND([.I265];0.01) -> 0.71 | M265: of:=MROUND([.J265];0.01) -> 0.32 | N265: of:=MROUND( ([.I265]-[.L265])*10000 ;0.01) -> -40.78 | O265: of:=MROUND( ([.J265]-[.M265])*10000 ;0.01) -> 2.25
A266: 2022-05-17 | B266: MKCOID-ID | C266: Tecsee Aurora | D266: 1 | E266: 0.45 | H266: of:=[.E266]/[.$E$285] -> 0.00559840756407067 | I266: of:=[.H266]*[.$R$143] -> 0.648295595919383 | J266: of:=[.H266]*[.$R$144] -> 0.294084349340632 | L266: of:=MROUND([.I266];0.01) -> 0.65 | M266: of:=MROUND([.J266];0.01) -> 0.29 | N266: of:=MROUND( ([.I266]-[.L266])*10000 ;0.01) -> -17.04 | O266: of:=MROUND( ([.J266]-[.M266])*10000 ;0.01) -> 40.84
A267: 2022-05-17 | B267: MKCOID-ID | C267: Tecsee Blue Sky (Linear) | D267: 1 | E267: 0.53 | H267: of:=[.E267]/[.$E$285] -> 0.00659368001990545 | I267: of:=[.H267]*[.$R$143] -> 0.763548146305051 | J267: of:=[.H267]*[.$R$144] -> 0.346366011445633 | L267: of:=MROUND([.I267];0.01) -> 0.76 | M267: of:=MROUND([.J267];0.01) -> 0.35 | N267: of:=MROUND( ([.I267]-[.L267])*10000 ;0.01) -> 35.48 | O267: of:=MROUND( ([.J267]-[.M267])*10000 ;0.01) -> -36.34
A268: 2022-05-17 | B268: MKCOID-ID | C268: Tecsee Blue Sky (Tactile) | D268: 1 | E268: 0.53 | H268: of:=[.E268]/[.$E$285] -> 0.00659368001990545 | I268: of:=[.H268]*[.$R$143] -> 0.763548146305051 | J268: of:=[.H268]*[.$R$144] -> 0.346366011445633 | L268: of:=MROUND([.I268];0.01) -> 0.76 | M268: of:=MROUND([.J268];0.01) -> 0.35 | N268: of:=MROUND( ([.I268]-[.L268])*10000 ;0.01) -> 35.48 | O268: of:=MROUND( ([.J268]-[.M268])*10000 ;0.01) -> -36.34
A269: 2022-05-17 | B269: MKCOID-ID | C269: Tecsee Carrot | D269: 1 | E269: 0.45 | H269: of:=[.E269]/[.$E$285] -> 0.00559840756407067 | I269: of:=[.H269]*[.$R$143] -> 0.648295595919383 | J269: of:=[.H269]*[.$R$144] -> 0.294084349340632 | L269: of:=MROUND([.I269];0.01) -> 0.65 | M269: of:=MROUND([.J269];0.01) -> 0.29 | N269: of:=MROUND( ([.I269]-[.L269])*10000 ;0.01) -> -17.04 | O269: of:=MROUND( ([.J269]-[.M269])*10000 ;0.01) -> 40.84
A270: 2022-05-17 | B270: MKCOID-ID | C270: Tecsee Coral | D270: 1 | E270: 0.64 | H270: of:=[.E270]/[.$E$285] -> 0.00796217964667828 | I270: of:=[.H270]*[.$R$143] -> 0.922020403085345 | J270: of:=[.H270]*[.$R$144] -> 0.41825329684001 | L270: of:=MROUND([.I270];0.01) -> 0.92 | M270: of:=MROUND([.J270];0.01) -> 0.42 | N270: of:=MROUND( ([.I270]-[.L270])*10000 ;0.01) -> 20.2 | O270: of:=MROUND( ([.J270]-[.M270])*10000 ;0.01) -> -17.47
A271: 2022-05-17 | B271: MKCOID-ID | C271: Tecsee Creamsicle | D271: 1 | E271: 0.45 | H271: of:=[.E271]/[.$E$285] -> 0.00559840756407067 | I271: of:=[.H271]*[.$R$143] -> 0.648295595919383 | J271: of:=[.H271]*[.$R$144] -> 0.294084349340632 | L271: of:=MROUND([.I271];0.01) -> 0.65 | M271: of:=MROUND([.J271];0.01) -> 0.29 | N271: of:=MROUND( ([.I271]-[.L271])*10000 ;0.01) -> -17.04 | O271: of:=MROUND( ([.J271]-[.M271])*10000 ;0.01) -> 40.84
A272: 2022-05-17 | B272: MKCOID-ID | C272: Tecsee Ice Candy | D272: 1 | E272: 0.64 | H272: of:=[.E272]/[.$E$285] -> 0.00796217964667828 | I272: of:=[.H272]*[.$R$143] -> 0.922020403085345 | J272: of:=[.H272]*[.$R$144] -> 0.41825329684001 | L272: of:=MROUND([.I272];0.01) -> 0.92 | M272: of:=MROUND([.J272];0.01) -> 0.42 | N272: of:=MROUND( ([.I272]-[.L272])*10000 ;0.01) -> 20.2 | O272: of:=MROUND( ([.J272]-[.M272])*10000 ;0.01) -> -17.47
A273: 2022-05-17 | B273: MKCOID-ID | C273: Tecsee Ice Grape | D273: 1 | E273: 0.64 | H273: of:=[.E273]/[.$E$285] -> 0.00796217964667828 | I273: of:=[.H273]*[.$R$143] -> 0.922020403085345 | J273: of:=[.H273]*[.$R$144] -> 0.41825329684001 | L273: of:=MROUND([.I273];0.01) -> 0.92 | M273: of:=MROUND([.J273];0.01) -> 0.42 | N273: of:=MROUND( ([.I273]-[.L273])*10000 ;0.01) -> 20.2 | O273: of:=MROUND( ([.J273]-[.M273])*10000 ;0.01) -> -17.47
A274: 2022-05-17 | B274: MKCOID-ID | C274: Tecsee Ice Mint | D274: 1 | E274: 0.64 | H274: of:=[.E274]/[.$E$285] -> 0.00796217964667828 | I274: of:=[.H274]*[.$R$143] -> 0.922020403085345 | J274: of:=[.H274]*[.$R$144] -> 0.41825329684001 | L274: of:=MROUND([.I274];0.01) -> 0.92 | M274: of:=MROUND([.J274];0.01) -> 0.42 | N274: of:=MROUND( ([.I274]-[.L274])*10000 ;0.01) -> 20.2 | O274: of:=MROUND( ([.J274]-[.M274])*10000 ;0.01) -> -17.47
A275: 2022-05-17 | B275: MKCOID-ID | C275: Tecsee Jadeite | D275: 1 | E275: 0.64 | H275: of:=[.E275]/[.$E$285] -> 0.00796217964667828 | I275: of:=[.H275]*[.$R$143] -> 0.922020403085345 | J275: of:=[.H275]*[.$R$144] -> 0.41825329684001 | L275: of:=MROUND([.I275];0.01) -> 0.92 | M275: of:=MROUND([.J275];0.01) -> 0.42 | N275: of:=MROUND( ([.I275]-[.L275])*10000 ;0.01) -> 20.2 | O275: of:=MROUND( ([.J275]-[.M275])*10000 ;0.01) -> -17.47
A276: 2022-05-17 | B276: MKCOID-ID | C276: Tecsee Oreo | D276: 1 | E276: 0.64 | H276: of:=[.E276]/[.$E$285] -> 0.00796217964667828 | I276: of:=[.H276]*[.$R$143] -> 0.922020403085345 | J276: of:=[.H276]*[.$R$144] -> 0.41825329684001 | L276: of:=MROUND([.I276];0.01) -> 0.92 | M276: of:=MROUND([.J276];0.01) -> 0.42 | N276: of:=MROUND( ([.I276]-[.L276])*10000 ;0.01) -> 20.2 | O276: of:=MROUND( ([.J276]-[.M276])*10000 ;0.01) -> -17.47
A277: 2022-05-17 | B277: MKCOID-ID | C277: Tecsee Ruby V1 | D277: 1 | E277: 0.49 | H277: of:=[.E277]/[.$E$285] -> 0.00609604379198806 | I277: of:=[.H277]*[.$R$143] -> 0.705921871112217 | J277: of:=[.H277]*[.$R$144] -> 0.320225180393133 | L277: of:=MROUND([.I277];0.01) -> 0.71 | M277: of:=MROUND([.J277];0.01) -> 0.32 | N277: of:=MROUND( ([.I277]-[.L277])*10000 ;0.01) -> -40.78 | O277: of:=MROUND( ([.J277]-[.M277])*10000 ;0.01) -> 2.25
A278: 2022-05-17 | B278: MKCOID-ID | C278: Tecsee Ruby V2 | D278: 1 | E278: 0.49 | H278: of:=[.E278]/[.$E$285] -> 0.00609604379198806 | I278: of:=[.H278]*[.$R$143] -> 0.705921871112217 | J278: of:=[.H278]*[.$R$144] -> 0.320225180393133 | L278: of:=MROUND([.I278];0.01) -> 0.71 | M278: of:=MROUND([.J278];0.01) -> 0.32 | N278: of:=MROUND( ([.I278]-[.L278])*10000 ;0.01) -> -40.78 | O278: of:=MROUND( ([.J278]-[.M278])*10000 ;0.01) -> 2.25
A279: 2022-05-17 | B279: MKCOID-ID | C279: Tecsee Sapphire V1 | D279: 1 | E279: 0.49 | H279: of:=[.E279]/[.$E$285] -> 0.00609604379198806 | I279: of:=[.H279]*[.$R$143] -> 0.705921871112217 | J279: of:=[.H279]*[.$R$144] -> 0.320225180393133 | L279: of:=MROUND([.I279];0.01) -> 0.71 | M279: of:=MROUND([.J279];0.01) -> 0.32 | N279: of:=MROUND( ([.I279]-[.L279])*10000 ;0.01) -> -40.78 | O279: of:=MROUND( ([.J279]-[.M279])*10000 ;0.01) -> 2.25
A280: 2022-05-17 | B280: MKCOID-ID | C280: TTC Bluish White | D280: 1 | E280: 0.56 | H280: of:=[.E280]/[.$E$285] -> 0.00696690719084349 | I280: of:=[.H280]*[.$R$143] -> 0.806767852699677 | J280: of:=[.H280]*[.$R$144] -> 0.365971634735009 | L280: of:=MROUND([.I280];0.01) -> 0.81 | M280: of:=MROUND([.J280];0.01) -> 0.37 | N280: of:=MROUND( ([.I280]-[.L280])*10000 ;0.01) -> -32.32 | O280: of:=MROUND( ([.J280]-[.M280])*10000 ;0.01) -> -40.28
A281: 2022-05-17 | B281: MKCOID-ID | C281: TTC Gold Pink V1 | D281: 1 | E281: 0.49 | H281: of:=[.E281]/[.$E$285] -> 0.00609604379198806 | I281: of:=[.H281]*[.$R$143] -> 0.705921871112217 | J281: of:=[.H281]*[.$R$144] -> 0.320225180393133 | L281: of:=MROUND([.I281];0.01) -> 0.71 | M281: of:=MROUND([.J281];0.01) -> 0.32 | N281: of:=MROUND( ([.I281]-[.L281])*10000 ;0.01) -> -40.78 | O281: of:=MROUND( ([.J281]-[.M281])*10000 ;0.01) -> 2.25
A282: 2022-05-17 | B282: MKCOID-ID | C282: TTC Honey | D282: 1 | E282: 0.98 | H282: of:=[.E282]/[.$E$285] -> 0.0121920875839761 | I282: of:=[.H282]*[.$R$143] -> 1.41184374222443 | J282: of:=[.H282]*[.$R$144] -> 0.640450360786265 | L282: of:=MROUND([.I282];0.01) -> 1.41 | M282: of:=MROUND([.J282];0.01) -> 0.64 | N282: of:=MROUND( ([.I282]-[.L282])*10000 ;0.01) -> 18.44 | O282: of:=MROUND( ([.J282]-[.M282])*10000 ;0.01) -> 4.5
A283: 2022-05-17 | B283: MKCOID-ID | C283: TTC Quick Silver | D283: 1 | E283: 0.56 | H283: of:=[.E283]/[.$E$285] -> 0.00696690719084349 | I283: of:=[.H283]*[.$R$143] -> 0.806767852699677 | J283: of:=[.H283]*[.$R$144] -> 0.365971634735009 | L283: of:=MROUND([.I283];0.01) -> 0.81 | M283: of:=MROUND([.J283];0.01) -> 0.37 | N283: of:=MROUND( ([.I283]-[.L283])*10000 ;0.01) -> -32.32 | O283: of:=MROUND( ([.J283]-[.M283])*10000 ;0.01) -> -40.28
A284: 2022-05-17 | B284: MKCOID-ID | C284: Wuque Studio Onion | D284: 1 | E284: 0.74 | H284: of:=[.E284]/[.$E$285] -> 0.00920627021647176 | I284: of:=[.H284]*[.$R$143] -> 1.06608609106743 | J284: of:=[.H284]*[.$R$144] -> 0.483605374471262 | L284: of:=MROUND([.I284];0.01) -> 1.07 | M284: of:=MROUND([.J284];0.01) -> 0.48 | N284: of:=MROUND( ([.I284]-[.L284])*10000 ;0.01) -> -39.14 | O284: of:=MROUND( ([.J284]-[.M284])*10000 ;0.01) -> 36.05
C285: (TOTAL) | D285: of:=SUM([.D143:.D284]) -> 142 | E285: of:=SUM([.E143:.E284]) -> 80.38 | H285: of:=SUM([.H143:.H284]) -> 1 | I285: of:=SUM([.I143:.I284]) -> 115.8 | J285: of:=SUM([.J143:.J284]) -> 52.53 | L285: of:=SUM([.L143:.L284]) -> 115.8 | M285: of:=SUM([.M143:.M284]) -> 52.53
A287: 2022-06-08 | B287: ANNE-CN | C287: Akko Custom Series Lavender Purple | D287: 1 | E287: of:=9.99/45 -> 0.222 | F287: Taken from en.akkogear.com | H287: of:=[.E287]/[.$E$301] -> 0.0500025026277591 | I287: of:=[.H287]*[.$R$287] -> 0.511025576855699 | J287: 0 | L287: of:=MROUND([.I287];0.01) -> 0.51 | M287: 0 | N287: of:=MROUND( ([.I287]-[.L287])*10000 ;0.01) -> 10.26 | Q287: Actual Total Item Cost (AUD) | R287: 10.22
A288: 2022-06-08 | B288: ANNE-CN | C288: Akko Custom Series Matcha Green | D288: 1 | E288: of:=9.99/45 -> 0.222 | F288: Taken from en.akkogear.com | H288: of:=[.E288]/[.$E$301] -> 0.0500025026277591 | I288: of:=[.H288]*[.$R$287] -> 0.511025576855699 | J288: 0 | L288: of:=MROUND([.I288];0.01) -> 0.51 | M288: 0 | N288: of:=MROUND( ([.I288]-[.L288])*10000 ;0.01) -> 10.26
A289: 2022-06-08 | B289: ANNE-CN | C289: Akko Custom Series Ocean Blue | D289: 1 | E289: of:=9.99/45 -> 0.222 | F289: Taken from en.akkogear.com | H289: of:=[.E289]/[.$E$301] -> 0.0500025026277591 | I289: of:=[.H289]*[.$R$287] -> 0.511025576855699 | J289: 0 | L289: of:=MROUND([.I289];0.01) -> 0.51 | M289: 0 | N289: of:=MROUND( ([.I289]-[.L289])*10000 ;0.01) -> 10.26
A290: 2022-06-08 | B290: ANNE-CN | C290: Akko Custom Series Radiant Red | D290: 1 | E290: of:=9.99/45 -> 0.222 | F290: Taken from en.akkogear.com | H290: of:=[.E290]/[.$E$301] -> 0.0500025026277591 | I290: of:=[.H290]*[.$R$287] -> 0.511025576855699 | J290: 0 | L290: of:=MROUND([.I290];0.01) -> 0.51 | M290: 0 | N290: of:=MROUND( ([.I290]-[.L290])*10000 ;0.01) -> 10.26
A291: 2022-06-08 | B291: ANNE-CN | C291: Akko Custom Series Rose Red | D291: 1 | E291: of:=9.99/45 -> 0.222 | F291: Taken from en.akkogear.com | H291: of:=[.E291]/[.$E$301] -> 0.0500025026277591 | I291: of:=[.H291]*[.$R$287] -> 0.511025576855699 | J291: 0 | L291: of:=MROUND([.I291];0.01) -> 0.51 | M291: 0 | N291: of:=MROUND( ([.I291]-[.L291])*10000 ;0.01) -> 10.26
A292: 2022-06-08 | B292: ANNE-CN | C292: Akko Custom Series Vintage White | D292: 1 | E292: of:=9.99/45 -> 0.222 | F292: Taken from en.akkogear.com | H292: of:=[.E292]/[.$E$301] -> 0.0500025026277591 | I292: of:=[.H292]*[.$R$287] -> 0.511025576855699 | J292: 0 | L292: of:=MROUND([.I292];0.01) -> 0.51 | M292: 0 | N292: of:=MROUND( ([.I292]-[.L292])*10000 ;0.01) -> 10.26
A293: 2022-06-08 | B293: ANNE-CN | C293: Akko Custom Series Jelly Black | D293: 1 | E293: of:=16.99/45 -> 0.377555555555555 | F293: Taken from en.akkogear.com | H293: of:=[.E293]/[.$E$301] -> 0.0850392912558186 | I293: of:=[.H293]*[.$R$287] -> 0.869101556634466 | J293: 0 | L293: of:=MROUND([.I293];0.01) -> 0.87 | M293: 0 | N293: of:=MROUND( ([.I293]-[.L293])*10000 ;0.01) -> -8.98
A294: 2022-06-08 | B294: ANNE-CN | C294: Akko Custom Series Jelly Blue | D294: 1 | E294: of:=11.99/45 -> 0.266444444444444 | F294: Taken from en.akkogear.com | H294: of:=[.E294]/[.$E$301] -> 0.0600130136643476 | I294: of:=[.H294]*[.$R$287] -> 0.613332999649632 | J294: 0 | L294: of:=MROUND([.I294];0.01) -> 0.61 | M294: 0 | N294: of:=MROUND( ([.I294]-[.L294])*10000 ;0.01) -> 33.33
A295: 2022-06-08 | B295: ANNE-CN | C295: Akko Custom Series Jelly Pink | D295: 1 | E295: of:=11.99/45 -> 0.266444444444444 | F295: Taken from en.akkogear.com | H295: of:=[.E295]/[.$E$301] -> 0.0600130136643476 | I295: of:=[.H295]*[.$R$287] -> 0.613332999649632 | J295: 0 | L295: of:=MROUND([.I295];0.01) -> 0.61 | M295: 0 | N295: of:=MROUND( ([.I295]-[.L295])*10000 ;0.01) -> 33.33
A296: 2022-06-08 | B296: ANNE-CN | C296: Akko Custom Series Jelly White | D296: 1 | E296: of:=11.99/45 -> 0.266444444444444 | F296: Taken from en.akkogear.com | H296: of:=[.E296]/[.$E$301] -> 0.0600130136643476 | I296: of:=[.H296]*[.$R$287] -> 0.613332999649632 | J296: 0 | L296: of:=MROUND([.I296];0.01) -> 0.61 | M296: 0 | N296: of:=MROUND( ([.I296]-[.L296])*10000 ;0.01) -> 33.33
A297: 2022-06-08 | B297: ANNE-CN | C297: Akko Custom Series Sponge | D297: 1 | E297: of:=11.99/45 -> 0.266444444444444 | F297: Taken from en.akkogear.com | H297: of:=[.E297]/[.$E$301] -> 0.0600130136643476 | I297: of:=[.H297]*[.$R$287] -> 0.613332999649632 | J297: 0 | L297: of:=MROUND([.I297];0.01) -> 0.61 | M297: 0 | N297: of:=MROUND( ([.I297]-[.L297])*10000 ;0.01) -> 33.33
A298: 2022-06-08 | B298: ANNE-CN | C298: Akko Custom Series Starfish | D298: 1 | E298: of:=11.99/45 -> 0.266444444444444 | F298: Taken from en.akkogear.com | H298: of:=[.E298]/[.$E$301] -> 0.0600130136643476 | I298: of:=[.H298]*[.$R$287] -> 0.613332999649632 | J298: 0 | L298: of:=MROUND([.I298];0.01) -> 0.61 | M298: 0 | N298: of:=MROUND( ([.I298]-[.L298])*10000 ;0.01) -> 33.33
A299: 2022-06-08 | B299: ANNE-CN | C299: Akko x TTC Demon | D299: 1 | E299: of:=6.99/10 -> 0.699 | F299: Taken from en.akkogear.com | H299: of:=[.E299]/[.$E$301] -> 0.157440312327944 | I299: of:=[.H299]*[.$R$287] -> 1.60903999199159 | J299: 0 | L299: of:=MROUND([.I299];0.01)+0.01 -> 1.62 | M299: 0 | N299: of:=MROUND( ([.I299]-[.L299])*10000 ;0.01) -> -109.6
A300: 2022-06-08 | B300: ANNE-CN | C300: Akko x TTC Princess | D300: 1 | E300: of:=6.99/10 -> 0.699 | F300: Taken from en.akkogear.com | H300: of:=[.E300]/[.$E$301] -> 0.157440312327944 | I300: of:=[.H300]*[.$R$287] -> 1.60903999199159 | J300: 0 | L300: of:=MROUND([.I300];0.01)+0.01 -> 1.62 | M300: 0 | N300: of:=MROUND( ([.I300]-[.L300])*10000 ;0.01) -> -109.6
C301: (TOTAL) | D301: of:=SUM([.D287:.D300]) -> 14 | E301: of:=SUM([.E287:.E300]) -> 4.43977777777778 | H301: of:=SUM([.H287:.H300]) -> 1 | I301: of:=SUM([.I287:.I300]) -> 10.22 | J301: of:=SUM([.J287:.J300]) -> 0 | L301: of:=SUM([.L287:.L300]) -> 10.22 | M301: of:=SUM([.M287:.M300]) -> 0