Sheet: Sheet1
A1: Monster HP | B1: 25600 | E1: Iteration | F1: Raw Damage | G1: Total Blast Buildup | I1: AUTO | J1: a term | K1: b term | L1: c term | M1: ArithProg n | N1: Num Procs | P1: MANUAL | Q1: Num Procs | R1: ArithProg n | S1: Curr Thres | T1: Sum Thres | U1: Under Thres | V1: Blast Damage | W1: Total Damage | X1: Monster Dead | Y1: blast damage/total damage | Z1: raw damage/total damage | AA1: blast/raw | AB1: blast damage per attack | AD1: AUTO | AE1: sample health | AF1: left left * P^2 | AG1: right left | AH1: right right | AI1: right | AJ1: left right * P^2 | AK1: left | AL1: B | AM1: blast damage per attack
E2: 0 | F2: of:=[.E2]*[.$B$3] -> 0 | G2: of:=[.E2]*[.$B$4] -> 0 | J2: of:=[.$B$7] -> 20 | K2: of:=(2*[.$B$6])-[.$B$7] -> 60 | L2: of:=-2*[.T2] -> -80 | M2: of:=((-[.K2])+SQRT(([.K2]^2) - (4*[.J2]*[.L2])))/(2*[.J2]) -> 1 | N2: of:=[.M2]-1 -> 0 | Q2: 0 | R2: of:=[.Q2]+1 -> 1 | S2: of:=[.$B$6] + (([.R2]-1) * [.$B$7]) -> 40 | T2: of:=([.R2]/2)*([.$B$6]+[.S2]) -> 40 | U2: of:=[.T2]>=[.G2] -> true | V2: of:=[.Q2]*[.$B$9] -> 0 | W2: of:=[.F2]+[.V2] -> 0 | X2: of:=[.W2]>=[.$B$1] -> false | Y2: of:=[.V2]/[.W2] ->  | Z2: of:=1-[.Y2] ->  | AA2: of:=[.Y2]/[.Z2] ->  | AB2: of:=[.$B$3]*[.AA2] ->  | AE2: of:=[.W2] -> 0 | AF2: of:=(2*[.AE2]*[.$B$4]*([.$B$9]^2))/([.$B$3]*[.$B$7]) -> 0 | AG2: of:=([.$B$9]^2)/(2*[.$B$7]) -> 250 | AH2: of:=(((2*[.$B$6])-[.$B$7])/[.$B$9])+((2*[.$B$4])/[.$B$3]) -> 0.69064 | AI2: of:=[.AG2]*[.AH2] -> 172.66 | AJ2: of:=[.AI2]^2 -> 29811.4756 | AK2: of:=SQRT([.AF2]+[.AJ2]) -> 172.66 | AL2: of:=[.AK2]-[.AI2] -> 0 | AM2: of:=[.$B$3]*([.AL2]/([.AE2]-[.AL2])) -> 
A3: Raw Damage | B3: 250 | E3: 1 | F3: of:=[.E3]*[.$B$3] -> 250 | G3: of:=[.E3]*[.$B$4] -> 11.33 | J3: of:=[.$B$7] -> 20 | K3: of:=(2*[.$B$6])-[.$B$7] -> 60 | L3: of:=-2*[.T3] -> -80 | M3: of:=((-[.K3])+SQRT(([.K3]^2) - (4*[.J3]*[.L3])))/(2*[.J3]) -> 1 | N3: of:=[.M3]-1 -> 0 | Q3: 0 | R3: of:=[.Q3]+1 -> 1 | S3: of:=[.$B$6] + (([.R3]-1) * [.$B$7]) -> 40 | T3: of:=([.R3]/2)*([.$B$6]+[.S3]) -> 40 | U3: of:=[.T3]>=[.G3] -> true | V3: of:=[.Q3]*[.$B$9] -> 0 | W3: of:=[.F3]+[.V3] -> 250 | X3: of:=[.W3]>=[.$B$1] -> false | Y3: of:=[.V3]/[.W3] -> 0 | Z3: of:=1-[.Y3] -> 1 | AA3: of:=[.Y3]/[.Z3] -> 0 | AB3: of:=[.$B$3]*[.AA3] -> 0 | AE3: of:=[.W3] -> 250 | AF3: of:=(2*[.AE3]*[.$B$4]*([.$B$9]^2))/([.$B$3]*[.$B$7]) -> 11330 | AG3: of:=([.$B$9]^2)/(2*[.$B$7]) -> 250 | AH3: of:=(((2*[.$B$6])-[.$B$7])/[.$B$9])+((2*[.$B$4])/[.$B$3]) -> 0.69064 | AI3: of:=[.AG3]*[.AH3] -> 172.66 | AJ3: of:=[.AI3]^2 -> 29811.4756 | AK3: of:=SQRT([.AF3]+[.AJ3]) -> 202.833615557185 | AL3: of:=[.AK3]-[.AI3] -> 30.1736155571852 | AM3: of:=[.$B$3]*([.AL3]/([.AE3]-[.AL3])) -> 34.3152797987206
A4: EFS | B4: 11.33 | E4: 2 | F4: of:=[.E4]*[.$B$3] -> 500 | G4: of:=[.E4]*[.$B$4] -> 22.66 | J4: of:=[.$B$7] -> 20 | K4: of:=(2*[.$B$6])-[.$B$7] -> 60 | L4: of:=-2*[.T4] -> -80 | M4: of:=((-[.K4])+SQRT(([.K4]^2) - (4*[.J4]*[.L4])))/(2*[.J4]) -> 1 | N4: of:=[.M4]-1 -> 0 | Q4: 0 | R4: of:=[.Q4]+1 -> 1 | S4: of:=[.$B$6] + (([.R4]-1) * [.$B$7]) -> 40 | T4: of:=([.R4]/2)*([.$B$6]+[.S4]) -> 40 | U4: of:=[.T4]>=[.G4] -> true | V4: of:=[.Q4]*[.$B$9] -> 0 | W4: of:=[.F4]+[.V4] -> 500 | X4: of:=[.W4]>=[.$B$1] -> false | Y4: of:=[.V4]/[.W4] -> 0 | Z4: of:=1-[.Y4] -> 1 | AA4: of:=[.Y4]/[.Z4] -> 0 | AB4: of:=[.$B$3]*[.AA4] -> 0 | AE4: of:=[.W4] -> 500 | AF4: of:=(2*[.AE4]*[.$B$4]*([.$B$9]^2))/([.$B$3]*[.$B$7]) -> 22660 | AG4: of:=([.$B$9]^2)/(2*[.$B$7]) -> 250 | AH4: of:=(((2*[.$B$6])-[.$B$7])/[.$B$9])+((2*[.$B$4])/[.$B$3]) -> 0.69064 | AI4: of:=[.AG4]*[.AH4] -> 172.66 | AJ4: of:=[.AI4]^2 -> 29811.4756 | AK4: of:=SQRT([.AF4]+[.AJ4]) -> 229.066530946797 | AL4: of:=[.AK4]-[.AI4] -> 56.4065309467972 | AM4: of:=[.$B$3]*([.AL4]/([.AE4]-[.AL4])) -> 31.7895409208741
E5: 3 | F5: of:=[.E5]*[.$B$3] -> 750 | G5: of:=[.E5]*[.$B$4] -> 33.99 | J5: of:=[.$B$7] -> 20 | K5: of:=(2*[.$B$6])-[.$B$7] -> 60 | L5: of:=-2*[.T5] -> -80 | M5: of:=((-[.K5])+SQRT(([.K5]^2) - (4*[.J5]*[.L5])))/(2*[.J5]) -> 1 | N5: of:=[.M5]-1 -> 0 | Q5: 0 | R5: of:=[.Q5]+1 -> 1 | S5: of:=[.$B$6] + (([.R5]-1) * [.$B$7]) -> 40 | T5: of:=([.R5]/2)*([.$B$6]+[.S5]) -> 40 | U5: of:=[.T5]>=[.G5] -> true | V5: of:=[.Q5]*[.$B$9] -> 0 | W5: of:=[.F5]+[.V5] -> 750 | X5: of:=[.W5]>=[.$B$1] -> false | Y5: of:=[.V5]/[.W5] -> 0 | Z5: of:=1-[.Y5] -> 1 | AA5: of:=[.Y5]/[.Z5] -> 0 | AB5: of:=[.$B$3]*[.AA5] -> 0 | AE5: of:=[.W5] -> 750 | AF5: of:=(2*[.AE5]*[.$B$4]*([.$B$9]^2))/([.$B$3]*[.$B$7]) -> 33990 | AG5: of:=([.$B$9]^2)/(2*[.$B$7]) -> 250 | AH5: of:=(((2*[.$B$6])-[.$B$7])/[.$B$9])+((2*[.$B$4])/[.$B$3]) -> 0.69064 | AI5: of:=[.AG5]*[.AH5] -> 172.66 | AJ5: of:=[.AI5]^2 -> 29811.4756 | AK5: of:=SQRT([.AF5]+[.AJ5]) -> 252.589539767584 | AL5: of:=[.AK5]-[.AI5] -> 79.9295397675842 | AM5: of:=[.$B$3]*([.AL5]/([.AE5]-[.AL5])) -> 29.8213189922819
A6: Blast Base | B6: 40 | E6: 4 | F6: of:=[.E6]*[.$B$3] -> 1000 | G6: of:=[.E6]*[.$B$4] -> 45.32 | J6: of:=[.$B$7] -> 20 | K6: of:=(2*[.$B$6])-[.$B$7] -> 60 | L6: of:=-2*[.T6] -> -200 | M6: of:=((-[.K6])+SQRT(([.K6]^2) - (4*[.J6]*[.L6])))/(2*[.J6]) -> 2 | N6: of:=[.M6]-1 -> 1 | Q6: 1 | R6: of:=[.Q6]+1 -> 2 | S6: of:=[.$B$6] + (([.R6]-1) * [.$B$7]) -> 60 | T6: of:=([.R6]/2)*([.$B$6]+[.S6]) -> 100 | U6: of:=[.T6]>=[.G6] -> true | V6: of:=[.Q6]*[.$B$9] -> 100 | W6: of:=[.F6]+[.V6] -> 1100 | X6: of:=[.W6]>=[.$B$1] -> false | Y6: of:=[.V6]/[.W6] -> 0.0909090909090909 | Z6: of:=1-[.Y6] -> 0.909090909090909 | AA6: of:=[.Y6]/[.Z6] -> 0.1 | AB6: of:=[.$B$3]*[.AA6] -> 25 | AE6: of:=[.W6] -> 1100 | AF6: of:=(2*[.AE6]*[.$B$4]*([.$B$9]^2))/([.$B$3]*[.$B$7]) -> 49852 | AG6: of:=([.$B$9]^2)/(2*[.$B$7]) -> 250 | AH6: of:=(((2*[.$B$6])-[.$B$7])/[.$B$9])+((2*[.$B$4])/[.$B$3]) -> 0.69064 | AI6: of:=[.AG6]*[.AH6] -> 172.66 | AJ6: of:=[.AI6]^2 -> 29811.4756 | AK6: of:=SQRT([.AF6]+[.AJ6]) -> 282.247188825682 | AL6: of:=[.AK6]-[.AI6] -> 109.587188825682 | AM6: of:=[.$B$3]*([.AL6]/([.AE6]-[.AL6])) -> 27.661998004586
A7: Blast ThresInc | B7: 20 | E7: 5 | F7: of:=[.E7]*[.$B$3] -> 1250 | G7: of:=[.E7]*[.$B$4] -> 56.65 | J7: of:=[.$B$7] -> 20 | K7: of:=(2*[.$B$6])-[.$B$7] -> 60 | L7: of:=-2*[.T7] -> -200 | M7: of:=((-[.K7])+SQRT(([.K7]^2) - (4*[.J7]*[.L7])))/(2*[.J7]) -> 2 | N7: of:=[.M7]-1 -> 1 | Q7: 1 | R7: of:=[.Q7]+1 -> 2 | S7: of:=[.$B$6] + (([.R7]-1) * [.$B$7]) -> 60 | T7: of:=([.R7]/2)*([.$B$6]+[.S7]) -> 100 | U7: of:=[.T7]>=[.G7] -> true | V7: of:=[.Q7]*[.$B$9] -> 100 | W7: of:=[.F7]+[.V7] -> 1350 | X7: of:=[.W7]>=[.$B$1] -> false | Y7: of:=[.V7]/[.W7] -> 0.0740740740740741 | Z7: of:=1-[.Y7] -> 0.925925925925926 | AA7: of:=[.Y7]/[.Z7] -> 0.08 | AB7: of:=[.$B$3]*[.AA7] -> 20 | AE7: of:=[.W7] -> 1350 | AF7: of:=(2*[.AE7]*[.$B$4]*([.$B$9]^2))/([.$B$3]*[.$B$7]) -> 61182 | AG7: of:=([.$B$9]^2)/(2*[.$B$7]) -> 250 | AH7: of:=(((2*[.$B$6])-[.$B$7])/[.$B$9])+((2*[.$B$4])/[.$B$3]) -> 0.69064 | AI7: of:=[.AG7]*[.AH7] -> 172.66 | AJ7: of:=[.AI7]^2 -> 29811.4756 | AK7: of:=SQRT([.AF7]+[.AJ7]) -> 301.651248298428 | AL7: of:=[.AK7]-[.AI7] -> 128.991248298428 | AM7: of:=[.$B$3]*([.AL7]/([.AE7]-[.AL7])) -> 26.4107951967315
A8: Blast Cap | B8: 440 | E8: 6 | F8: of:=[.E8]*[.$B$3] -> 1500 | G8: of:=[.E8]*[.$B$4] -> 67.98 | J8: of:=[.$B$7] -> 20 | K8: of:=(2*[.$B$6])-[.$B$7] -> 60 | L8: of:=-2*[.T8] -> -200 | M8: of:=((-[.K8])+SQRT(([.K8]^2) - (4*[.J8]*[.L8])))/(2*[.J8]) -> 2 | N8: of:=[.M8]-1 -> 1 | Q8: 1 | R8: of:=[.Q8]+1 -> 2 | S8: of:=[.$B$6] + (([.R8]-1) * [.$B$7]) -> 60 | T8: of:=([.R8]/2)*([.$B$6]+[.S8]) -> 100 | U8: of:=[.T8]>=[.G8] -> true | V8: of:=[.Q8]*[.$B$9] -> 100 | W8: of:=[.F8]+[.V8] -> 1600 | X8: of:=[.W8]>=[.$B$1] -> false | Y8: of:=[.V8]/[.W8] -> 0.0625 | Z8: of:=1-[.Y8] -> 0.9375 | AA8: of:=[.Y8]/[.Z8] -> 0.0666666666666667 | AB8: of:=[.$B$3]*[.AA8] -> 16.6666666666667 | AE8: of:=[.W8] -> 1600 | AF8: of:=(2*[.AE8]*[.$B$4]*([.$B$9]^2))/([.$B$3]*[.$B$7]) -> 72512 | AG8: of:=([.$B$9]^2)/(2*[.$B$7]) -> 250 | AH8: of:=(((2*[.$B$6])-[.$B$7])/[.$B$9])+((2*[.$B$4])/[.$B$3]) -> 0.69064 | AI8: of:=[.AG8]*[.AH8] -> 172.66 | AJ8: of:=[.AI8]^2 -> 29811.4756 | AK8: of:=SQRT([.AF8]+[.AJ8]) -> 319.880408277844 | AL8: of:=[.AK8]-[.AI8] -> 147.220408277844 | AM8: of:=[.$B$3]*([.AL8]/([.AE8]-[.AL8])) -> 25.3342642470847
A9: Blast Damage | B9: 100 | E9: 7 | F9: of:=[.E9]*[.$B$3] -> 1750 | G9: of:=[.E9]*[.$B$4] -> 79.31 | J9: of:=[.$B$7] -> 20 | K9: of:=(2*[.$B$6])-[.$B$7] -> 60 | L9: of:=-2*[.T9] -> -200 | M9: of:=((-[.K9])+SQRT(([.K9]^2) - (4*[.J9]*[.L9])))/(2*[.J9]) -> 2 | N9: of:=[.M9]-1 -> 1 | Q9: 1 | R9: of:=[.Q9]+1 -> 2 | S9: of:=[.$B$6] + (([.R9]-1) * [.$B$7]) -> 60 | T9: of:=([.R9]/2)*([.$B$6]+[.S9]) -> 100 | U9: of:=[.T9]>=[.G9] -> true | V9: of:=[.Q9]*[.$B$9] -> 100 | W9: of:=[.F9]+[.V9] -> 1850 | X9: of:=[.W9]>=[.$B$1] -> false | Y9: of:=[.V9]/[.W9] -> 0.0540540540540541 | Z9: of:=1-[.Y9] -> 0.945945945945946 | AA9: of:=[.Y9]/[.Z9] -> 0.0571428571428571 | AB9: of:=[.$B$3]*[.AA9] -> 14.2857142857143 | AE9: of:=[.W9] -> 1850 | AF9: of:=(2*[.AE9]*[.$B$4]*([.$B$9]^2))/([.$B$3]*[.$B$7]) -> 83842 | AG9: of:=([.$B$9]^2)/(2*[.$B$7]) -> 250 | AH9: of:=(((2*[.$B$6])-[.$B$7])/[.$B$9])+((2*[.$B$4])/[.$B$3]) -> 0.69064 | AI9: of:=[.AG9]*[.AH9] -> 172.66 | AJ9: of:=[.AI9]^2 -> 29811.4756 | AK9: of:=SQRT([.AF9]+[.AJ9]) -> 337.125311419953 | AL9: of:=[.AK9]-[.AI9] -> 164.465311419953 | AM9: of:=[.$B$3]*([.AL9]/([.AE9]-[.AL9])) -> 24.3936408627852
E10: 8 | F10: of:=[.E10]*[.$B$3] -> 2000 | G10: of:=[.E10]*[.$B$4] -> 90.64 | J10: of:=[.$B$7] -> 20 | K10: of:=(2*[.$B$6])-[.$B$7] -> 60 | L10: of:=-2*[.T10] -> -200 | M10: of:=((-[.K10])+SQRT(([.K10]^2) - (4*[.J10]*[.L10])))/(2*[.J10]) -> 2 | N10: of:=[.M10]-1 -> 1 | Q10: 1 | R10: of:=[.Q10]+1 -> 2 | S10: of:=[.$B$6] + (([.R10]-1) * [.$B$7]) -> 60 | T10: of:=([.R10]/2)*([.$B$6]+[.S10]) -> 100 | U10: of:=[.T10]>=[.G10] -> true | V10: of:=[.Q10]*[.$B$9] -> 100 | W10: of:=[.F10]+[.V10] -> 2100 | X10: of:=[.W10]>=[.$B$1] -> false | Y10: of:=[.V10]/[.W10] -> 0.0476190476190476 | Z10: of:=1-[.Y10] -> 0.952380952380952 | AA10: of:=[.Y10]/[.Z10] -> 0.05 | AB10: of:=[.$B$3]*[.AA10] -> 12.5 | AE10: of:=[.W10] -> 2100 | AF10: of:=(2*[.AE10]*[.$B$4]*([.$B$9]^2))/([.$B$3]*[.$B$7]) -> 95172 | AG10: of:=([.$B$9]^2)/(2*[.$B$7]) -> 250 | AH10: of:=(((2*[.$B$6])-[.$B$7])/[.$B$9])+((2*[.$B$4])/[.$B$3]) -> 0.69064 | AI10: of:=[.AG10]*[.AH10] -> 172.66 | AJ10: of:=[.AI10]^2 -> 29811.4756 | AK10: of:=SQRT([.AF10]+[.AJ10]) -> 353.530020790314 | AL10: of:=[.AK10]-[.AI10] -> 180.870020790314 | AM10: of:=[.$B$3]*([.AL10]/([.AE10]-[.AL10])) -> 23.5614604989911
E11: 9 | F11: of:=[.E11]*[.$B$3] -> 2250 | G11: of:=[.E11]*[.$B$4] -> 101.97 | J11: of:=[.$B$7] -> 20 | K11: of:=(2*[.$B$6])-[.$B$7] -> 60 | L11: of:=-2*[.T11] -> -360 | M11: of:=((-[.K11])+SQRT(([.K11]^2) - (4*[.J11]*[.L11])))/(2*[.J11]) -> 3 | N11: of:=[.M11]-1 -> 2 | Q11: 2 | R11: of:=[.Q11]+1 -> 3 | S11: of:=[.$B$6] + (([.R11]-1) * [.$B$7]) -> 80 | T11: of:=([.R11]/2)*([.$B$6]+[.S11]) -> 180 | U11: of:=[.T11]>=[.G11] -> true | V11: of:=[.Q11]*[.$B$9] -> 200 | W11: of:=[.F11]+[.V11] -> 2450 | X11: of:=[.W11]>=[.$B$1] -> false | Y11: of:=[.V11]/[.W11] -> 0.0816326530612245 | Z11: of:=1-[.Y11] -> 0.918367346938775 | AA11: of:=[.Y11]/[.Z11] -> 0.0888888888888889 | AB11: of:=[.$B$3]*[.AA11] -> 22.2222222222222 | AE11: of:=[.W11] -> 2450 | AF11: of:=(2*[.AE11]*[.$B$4]*([.$B$9]^2))/([.$B$3]*[.$B$7]) -> 111034 | AG11: of:=([.$B$9]^2)/(2*[.$B$7]) -> 250 | AH11: of:=(((2*[.$B$6])-[.$B$7])/[.$B$9])+((2*[.$B$4])/[.$B$3]) -> 0.69064 | AI11: of:=[.AG11]*[.AH11] -> 172.66 | AJ11: of:=[.AI11]^2 -> 29811.4756 | AK11: of:=SQRT([.AF11]+[.AJ11]) -> 375.293852334407 | AL11: of:=[.AK11]-[.AI11] -> 202.633852334407 | AM11: of:=[.$B$3]*([.AL11]/([.AE11]-[.AL11])) -> 22.5412593031279
E12: 10 | F12: of:=[.E12]*[.$B$3] -> 2500 | G12: of:=[.E12]*[.$B$4] -> 113.3 | J12: of:=[.$B$7] -> 20 | K12: of:=(2*[.$B$6])-[.$B$7] -> 60 | L12: of:=-2*[.T12] -> -360 | M12: of:=((-[.K12])+SQRT(([.K12]^2) - (4*[.J12]*[.L12])))/(2*[.J12]) -> 3 | N12: of:=[.M12]-1 -> 2 | Q12: 2 | R12: of:=[.Q12]+1 -> 3 | S12: of:=[.$B$6] + (([.R12]-1) * [.$B$7]) -> 80 | T12: of:=([.R12]/2)*([.$B$6]+[.S12]) -> 180 | U12: of:=[.T12]>=[.G12] -> true | V12: of:=[.Q12]*[.$B$9] -> 200 | W12: of:=[.F12]+[.V12] -> 2700 | X12: of:=[.W12]>=[.$B$1] -> false | Y12: of:=[.V12]/[.W12] -> 0.0740740740740741 | Z12: of:=1-[.Y12] -> 0.925925925925926 | AA12: of:=[.Y12]/[.Z12] -> 0.08 | AB12: of:=[.$B$3]*[.AA12] -> 20 | AE12: of:=[.W12] -> 2700 | AF12: of:=(2*[.AE12]*[.$B$4]*([.$B$9]^2))/([.$B$3]*[.$B$7]) -> 122364 | AG12: of:=([.$B$9]^2)/(2*[.$B$7]) -> 250 | AH12: of:=(((2*[.$B$6])-[.$B$7])/[.$B$9])+((2*[.$B$4])/[.$B$3]) -> 0.69064 | AI12: of:=[.AG12]*[.AH12] -> 172.66 | AJ12: of:=[.AI12]^2 -> 29811.4756 | AK12: of:=SQRT([.AF12]+[.AJ12]) -> 390.096751588628 | AL12: of:=[.AK12]-[.AI12] -> 217.436751588628 | AM12: of:=[.$B$3]*([.AL12]/([.AE12]-[.AL12])) -> 21.896395965719
E13: 11 | F13: of:=[.E13]*[.$B$3] -> 2750 | G13: of:=[.E13]*[.$B$4] -> 124.63 | J13: of:=[.$B$7] -> 20 | K13: of:=(2*[.$B$6])-[.$B$7] -> 60 | L13: of:=-2*[.T13] -> -360 | M13: of:=((-[.K13])+SQRT(([.K13]^2) - (4*[.J13]*[.L13])))/(2*[.J13]) -> 3 | N13: of:=[.M13]-1 -> 2 | Q13: 2 | R13: of:=[.Q13]+1 -> 3 | S13: of:=[.$B$6] + (([.R13]-1) * [.$B$7]) -> 80 | T13: of:=([.R13]/2)*([.$B$6]+[.S13]) -> 180 | U13: of:=[.T13]>=[.G13] -> true | V13: of:=[.Q13]*[.$B$9] -> 200 | W13: of:=[.F13]+[.V13] -> 2950 | X13: of:=[.W13]>=[.$B$1] -> false | Y13: of:=[.V13]/[.W13] -> 0.0677966101694915 | Z13: of:=1-[.Y13] -> 0.932203389830508 | AA13: of:=[.Y13]/[.Z13] -> 0.0727272727272727 | AB13: of:=[.$B$3]*[.AA13] -> 18.1818181818182 | AE13: of:=[.W13] -> 2950 | AF13: of:=(2*[.AE13]*[.$B$4]*([.$B$9]^2))/([.$B$3]*[.$B$7]) -> 133694 | AG13: of:=([.$B$9]^2)/(2*[.$B$7]) -> 250 | AH13: of:=(((2*[.$B$6])-[.$B$7])/[.$B$9])+((2*[.$B$4])/[.$B$3]) -> 0.69064 | AI13: of:=[.AG13]*[.AH13] -> 172.66 | AJ13: of:=[.AI13]^2 -> 29811.4756 | AK13: of:=SQRT([.AF13]+[.AJ13]) -> 404.358103170939 | AL13: of:=[.AK13]-[.AI13] -> 231.698103170939 | AM13: of:=[.$B$3]*([.AL13]/([.AE13]-[.AL13])) -> 21.309084859303
E14: 12 | F14: of:=[.E14]*[.$B$3] -> 3000 | G14: of:=[.E14]*[.$B$4] -> 135.96 | J14: of:=[.$B$7] -> 20 | K14: of:=(2*[.$B$6])-[.$B$7] -> 60 | L14: of:=-2*[.T14] -> -360 | M14: of:=((-[.K14])+SQRT(([.K14]^2) - (4*[.J14]*[.L14])))/(2*[.J14]) -> 3 | N14: of:=[.M14]-1 -> 2 | Q14: 2 | R14: of:=[.Q14]+1 -> 3 | S14: of:=[.$B$6] + (([.R14]-1) * [.$B$7]) -> 80 | T14: of:=([.R14]/2)*([.$B$6]+[.S14]) -> 180 | U14: of:=[.T14]>=[.G14] -> true | V14: of:=[.Q14]*[.$B$9] -> 200 | W14: of:=[.F14]+[.V14] -> 3200 | X14: of:=[.W14]>=[.$B$1] -> false | Y14: of:=[.V14]/[.W14] -> 0.0625 | Z14: of:=1-[.Y14] -> 0.9375 | AA14: of:=[.Y14]/[.Z14] -> 0.0666666666666667 | AB14: of:=[.$B$3]*[.AA14] -> 16.6666666666667 | AE14: of:=[.W14] -> 3200 | AF14: of:=(2*[.AE14]*[.$B$4]*([.$B$9]^2))/([.$B$3]*[.$B$7]) -> 145024 | AG14: of:=([.$B$9]^2)/(2*[.$B$7]) -> 250 | AH14: of:=(((2*[.$B$6])-[.$B$7])/[.$B$9])+((2*[.$B$4])/[.$B$3]) -> 0.69064 | AI14: of:=[.AG14]*[.AH14] -> 172.66 | AJ14: of:=[.AI14]^2 -> 29811.4756 | AK14: of:=SQRT([.AF14]+[.AJ14]) -> 418.133322757228 | AL14: of:=[.AK14]-[.AI14] -> 245.473322757228 | AM14: of:=[.$B$3]*([.AL14]/([.AE14]-[.AL14])) -> 20.7709516255163
E15: 13 | F15: of:=[.E15]*[.$B$3] -> 3250 | G15: of:=[.E15]*[.$B$4] -> 147.29 | J15: of:=[.$B$7] -> 20 | K15: of:=(2*[.$B$6])-[.$B$7] -> 60 | L15: of:=-2*[.T15] -> -360 | M15: of:=((-[.K15])+SQRT(([.K15]^2) - (4*[.J15]*[.L15])))/(2*[.J15]) -> 3 | N15: of:=[.M15]-1 -> 2 | Q15: 2 | R15: of:=[.Q15]+1 -> 3 | S15: of:=[.$B$6] + (([.R15]-1) * [.$B$7]) -> 80 | T15: of:=([.R15]/2)*([.$B$6]+[.S15]) -> 180 | U15: of:=[.T15]>=[.G15] -> true | V15: of:=[.Q15]*[.$B$9] -> 200 | W15: of:=[.F15]+[.V15] -> 3450 | X15: of:=[.W15]>=[.$B$1] -> false | Y15: of:=[.V15]/[.W15] -> 0.0579710144927536 | Z15: of:=1-[.Y15] -> 0.942028985507246 | AA15: of:=[.Y15]/[.Z15] -> 0.0615384615384615 | AB15: of:=[.$B$3]*[.AA15] -> 15.3846153846154 | AE15: of:=[.W15] -> 3450 | AF15: of:=(2*[.AE15]*[.$B$4]*([.$B$9]^2))/([.$B$3]*[.$B$7]) -> 156354 | AG15: of:=([.$B$9]^2)/(2*[.$B$7]) -> 250 | AH15: of:=(((2*[.$B$6])-[.$B$7])/[.$B$9])+((2*[.$B$4])/[.$B$3]) -> 0.69064 | AI15: of:=[.AG15]*[.AH15] -> 172.66 | AJ15: of:=[.AI15]^2 -> 29811.4756 | AK15: of:=SQRT([.AF15]+[.AJ15]) -> 431.468974087361 | AL15: of:=[.AK15]-[.AI15] -> 258.808974087361 | AM15: of:=[.$B$3]*([.AL15]/([.AE15]-[.AL15])) -> 20.2752649391574
E16: 14 | F16: of:=[.E16]*[.$B$3] -> 3500 | G16: of:=[.E16]*[.$B$4] -> 158.62 | J16: of:=[.$B$7] -> 20 | K16: of:=(2*[.$B$6])-[.$B$7] -> 60 | L16: of:=-2*[.T16] -> -360 | M16: of:=((-[.K16])+SQRT(([.K16]^2) - (4*[.J16]*[.L16])))/(2*[.J16]) -> 3 | N16: of:=[.M16]-1 -> 2 | Q16: 2 | R16: of:=[.Q16]+1 -> 3 | S16: of:=[.$B$6] + (([.R16]-1) * [.$B$7]) -> 80 | T16: of:=([.R16]/2)*([.$B$6]+[.S16]) -> 180 | U16: of:=[.T16]>=[.G16] -> true | V16: of:=[.Q16]*[.$B$9] -> 200 | W16: of:=[.F16]+[.V16] -> 3700 | X16: of:=[.W16]>=[.$B$1] -> false | Y16: of:=[.V16]/[.W16] -> 0.0540540540540541 | Z16: of:=1-[.Y16] -> 0.945945945945946 | AA16: of:=[.Y16]/[.Z16] -> 0.0571428571428571 | AB16: of:=[.$B$3]*[.AA16] -> 14.2857142857143 | AE16: of:=[.W16] -> 3700 | AF16: of:=(2*[.AE16]*[.$B$4]*([.$B$9]^2))/([.$B$3]*[.$B$7]) -> 167684 | AG16: of:=([.$B$9]^2)/(2*[.$B$7]) -> 250 | AH16: of:=(((2*[.$B$6])-[.$B$7])/[.$B$9])+((2*[.$B$4])/[.$B$3]) -> 0.69064 | AI16: of:=[.AG16]*[.AH16] -> 172.66 | AJ16: of:=[.AI16]^2 -> 29811.4756 | AK16: of:=SQRT([.AF16]+[.AJ16]) -> 444.404630488927 | AL16: of:=[.AK16]-[.AI16] -> 271.744630488927 | AM16: of:=[.$B$3]*([.AL16]/([.AE16]-[.AL16])) -> 19.816539405558
E17: 15 | F17: of:=[.E17]*[.$B$3] -> 3750 | G17: of:=[.E17]*[.$B$4] -> 169.95 | J17: of:=[.$B$7] -> 20 | K17: of:=(2*[.$B$6])-[.$B$7] -> 60 | L17: of:=-2*[.T17] -> -360 | M17: of:=((-[.K17])+SQRT(([.K17]^2) - (4*[.J17]*[.L17])))/(2*[.J17]) -> 3 | N17: of:=[.M17]-1 -> 2 | Q17: 2 | R17: of:=[.Q17]+1 -> 3 | S17: of:=[.$B$6] + (([.R17]-1) * [.$B$7]) -> 80 | T17: of:=([.R17]/2)*([.$B$6]+[.S17]) -> 180 | U17: of:=[.T17]>=[.G17] -> true | V17: of:=[.Q17]*[.$B$9] -> 200 | W17: of:=[.F17]+[.V17] -> 3950 | X17: of:=[.W17]>=[.$B$1] -> false | Y17: of:=[.V17]/[.W17] -> 0.0506329113924051 | Z17: of:=1-[.Y17] -> 0.949367088607595 | AA17: of:=[.Y17]/[.Z17] -> 0.0533333333333333 | AB17: of:=[.$B$3]*[.AA17] -> 13.3333333333333 | AE17: of:=[.W17] -> 3950 | AF17: of:=(2*[.AE17]*[.$B$4]*([.$B$9]^2))/([.$B$3]*[.$B$7]) -> 179014 | AG17: of:=([.$B$9]^2)/(2*[.$B$7]) -> 250 | AH17: of:=(((2*[.$B$6])-[.$B$7])/[.$B$9])+((2*[.$B$4])/[.$B$3]) -> 0.69064 | AI17: of:=[.AG17]*[.AH17] -> 172.66 | AJ17: of:=[.AI17]^2 -> 29811.4756 | AK17: of:=SQRT([.AF17]+[.AJ17]) -> 456.974261419612 | AL17: of:=[.AK17]-[.AI17] -> 284.314261419612 | AM17: of:=[.$B$3]*([.AL17]/([.AE17]-[.AL17])) -> 19.3902506717419
E18: 16 | F18: of:=[.E18]*[.$B$3] -> 4000 | G18: of:=[.E18]*[.$B$4] -> 181.28 | J18: of:=[.$B$7] -> 20 | K18: of:=(2*[.$B$6])-[.$B$7] -> 60 | L18: of:=-2*[.T18] -> -560 | M18: of:=((-[.K18])+SQRT(([.K18]^2) - (4*[.J18]*[.L18])))/(2*[.J18]) -> 4 | N18: of:=[.M18]-1 -> 3 | Q18: 3 | R18: of:=[.Q18]+1 -> 4 | S18: of:=[.$B$6] + (([.R18]-1) * [.$B$7]) -> 100 | T18: of:=([.R18]/2)*([.$B$6]+[.S18]) -> 280 | U18: of:=[.T18]>=[.G18] -> true | V18: of:=[.Q18]*[.$B$9] -> 300 | W18: of:=[.F18]+[.V18] -> 4300 | X18: of:=[.W18]>=[.$B$1] -> false | Y18: of:=[.V18]/[.W18] -> 0.0697674418604651 | Z18: of:=1-[.Y18] -> 0.930232558139535 | AA18: of:=[.Y18]/[.Z18] -> 0.075 | AB18: of:=[.$B$3]*[.AA18] -> 18.75 | AE18: of:=[.W18] -> 4300 | AF18: of:=(2*[.AE18]*[.$B$4]*([.$B$9]^2))/([.$B$3]*[.$B$7]) -> 194876 | AG18: of:=([.$B$9]^2)/(2*[.$B$7]) -> 250 | AH18: of:=(((2*[.$B$6])-[.$B$7])/[.$B$9])+((2*[.$B$4])/[.$B$3]) -> 0.69064 | AI18: of:=[.AG18]*[.AH18] -> 172.66 | AJ18: of:=[.AI18]^2 -> 29811.4756 | AK18: of:=SQRT([.AF18]+[.AJ18]) -> 474.012104908725 | AL18: of:=[.AK18]-[.AI18] -> 301.352104908725 | AM18: of:=[.$B$3]*([.AL18]/([.AE18]-[.AL18])) -> 18.8408752667785
E19: 17 | F19: of:=[.E19]*[.$B$3] -> 4250 | G19: of:=[.E19]*[.$B$4] -> 192.61 | J19: of:=[.$B$7] -> 20 | K19: of:=(2*[.$B$6])-[.$B$7] -> 60 | L19: of:=-2*[.T19] -> -560 | M19: of:=((-[.K19])+SQRT(([.K19]^2) - (4*[.J19]*[.L19])))/(2*[.J19]) -> 4 | N19: of:=[.M19]-1 -> 3 | Q19: 3 | R19: of:=[.Q19]+1 -> 4 | S19: of:=[.$B$6] + (([.R19]-1) * [.$B$7]) -> 100 | T19: of:=([.R19]/2)*([.$B$6]+[.S19]) -> 280 | U19: of:=[.T19]>=[.G19] -> true | V19: of:=[.Q19]*[.$B$9] -> 300 | W19: of:=[.F19]+[.V19] -> 4550 | X19: of:=[.W19]>=[.$B$1] -> false | Y19: of:=[.V19]/[.W19] -> 0.0659340659340659 | Z19: of:=1-[.Y19] -> 0.934065934065934 | AA19: of:=[.Y19]/[.Z19] -> 0.0705882352941176 | AB19: of:=[.$B$3]*[.AA19] -> 17.6470588235294 | AE19: of:=[.W19] -> 4550 | AF19: of:=(2*[.AE19]*[.$B$4]*([.$B$9]^2))/([.$B$3]*[.$B$7]) -> 206206 | AG19: of:=([.$B$9]^2)/(2*[.$B$7]) -> 250 | AH19: of:=(((2*[.$B$6])-[.$B$7])/[.$B$9])+((2*[.$B$4])/[.$B$3]) -> 0.69064 | AI19: of:=[.AG19]*[.AH19] -> 172.66 | AJ19: of:=[.AI19]^2 -> 29811.4756 | AK19: of:=SQRT([.AF19]+[.AJ19]) -> 485.816298203344 | AL19: of:=[.AK19]-[.AI19] -> 313.156298203344 | AM19: of:=[.$B$3]*([.AL19]/([.AE19]-[.AL19])) -> 18.4781597012033
E20: 18 | F20: of:=[.E20]*[.$B$3] -> 4500 | G20: of:=[.E20]*[.$B$4] -> 203.94 | J20: of:=[.$B$7] -> 20 | K20: of:=(2*[.$B$6])-[.$B$7] -> 60 | L20: of:=-2*[.T20] -> -560 | M20: of:=((-[.K20])+SQRT(([.K20]^2) - (4*[.J20]*[.L20])))/(2*[.J20]) -> 4 | N20: of:=[.M20]-1 -> 3 | Q20: 3 | R20: of:=[.Q20]+1 -> 4 | S20: of:=[.$B$6] + (([.R20]-1) * [.$B$7]) -> 100 | T20: of:=([.R20]/2)*([.$B$6]+[.S20]) -> 280 | U20: of:=[.T20]>=[.G20] -> true | V20: of:=[.Q20]*[.$B$9] -> 300 | W20: of:=[.F20]+[.V20] -> 4800 | X20: of:=[.W20]>=[.$B$1] -> false | Y20: of:=[.V20]/[.W20] -> 0.0625 | Z20: of:=1-[.Y20] -> 0.9375 | AA20: of:=[.Y20]/[.Z20] -> 0.0666666666666667 | AB20: of:=[.$B$3]*[.AA20] -> 16.6666666666667 | AE20: of:=[.W20] -> 4800 | AF20: of:=(2*[.AE20]*[.$B$4]*([.$B$9]^2))/([.$B$3]*[.$B$7]) -> 217536 | AG20: of:=([.$B$9]^2)/(2*[.$B$7]) -> 250 | AH20: of:=(((2*[.$B$6])-[.$B$7])/[.$B$9])+((2*[.$B$4])/[.$B$3]) -> 0.69064 | AI20: of:=[.AG20]*[.AH20] -> 172.66 | AJ20: of:=[.AI20]^2 -> 29811.4756 | AK20: of:=SQRT([.AF20]+[.AJ20]) -> 497.340402139219 | AL20: of:=[.AK20]-[.AI20] -> 324.680402139219 | AM20: of:=[.$B$3]*([.AL20]/([.AE20]-[.AL20])) -> 18.1372746146676
E21: 19 | F21: of:=[.E21]*[.$B$3] -> 4750 | G21: of:=[.E21]*[.$B$4] -> 215.27 | J21: of:=[.$B$7] -> 20 | K21: of:=(2*[.$B$6])-[.$B$7] -> 60 | L21: of:=-2*[.T21] -> -560 | M21: of:=((-[.K21])+SQRT(([.K21]^2) - (4*[.J21]*[.L21])))/(2*[.J21]) -> 4 | N21: of:=[.M21]-1 -> 3 | Q21: 3 | R21: of:=[.Q21]+1 -> 4 | S21: of:=[.$B$6] + (([.R21]-1) * [.$B$7]) -> 100 | T21: of:=([.R21]/2)*([.$B$6]+[.S21]) -> 280 | U21: of:=[.T21]>=[.G21] -> true | V21: of:=[.Q21]*[.$B$9] -> 300 | W21: of:=[.F21]+[.V21] -> 5050 | X21: of:=[.W21]>=[.$B$1] -> false | Y21: of:=[.V21]/[.W21] -> 0.0594059405940594 | Z21: of:=1-[.Y21] -> 0.940594059405941 | AA21: of:=[.Y21]/[.Z21] -> 0.0631578947368421 | AB21: of:=[.$B$3]*[.AA21] -> 15.7894736842105 | AE21: of:=[.W21] -> 5050 | AF21: of:=(2*[.AE21]*[.$B$4]*([.$B$9]^2))/([.$B$3]*[.$B$7]) -> 228866 | AG21: of:=([.$B$9]^2)/(2*[.$B$7]) -> 250 | AH21: of:=(((2*[.$B$6])-[.$B$7])/[.$B$9])+((2*[.$B$4])/[.$B$3]) -> 0.69064 | AI21: of:=[.AG21]*[.AH21] -> 172.66 | AJ21: of:=[.AI21]^2 -> 29811.4756 | AK21: of:=SQRT([.AF21]+[.AJ21]) -> 508.603456142406 | AL21: of:=[.AK21]-[.AI21] -> 335.943456142406 | AM21: of:=[.$B$3]*([.AL21]/([.AE21]-[.AL21])) -> 17.8160493524489
E22: 20 | F22: of:=[.E22]*[.$B$3] -> 5000 | G22: of:=[.E22]*[.$B$4] -> 226.6 | J22: of:=[.$B$7] -> 20 | K22: of:=(2*[.$B$6])-[.$B$7] -> 60 | L22: of:=-2*[.T22] -> -560 | M22: of:=((-[.K22])+SQRT(([.K22]^2) - (4*[.J22]*[.L22])))/(2*[.J22]) -> 4 | N22: of:=[.M22]-1 -> 3 | Q22: 3 | R22: of:=[.Q22]+1 -> 4 | S22: of:=[.$B$6] + (([.R22]-1) * [.$B$7]) -> 100 | T22: of:=([.R22]/2)*([.$B$6]+[.S22]) -> 280 | U22: of:=[.T22]>=[.G22] -> true | V22: of:=[.Q22]*[.$B$9] -> 300 | W22: of:=[.F22]+[.V22] -> 5300 | X22: of:=[.W22]>=[.$B$1] -> false | Y22: of:=[.V22]/[.W22] -> 0.0566037735849057 | Z22: of:=1-[.Y22] -> 0.943396226415094 | AA22: of:=[.Y22]/[.Z22] -> 0.06 | AB22: of:=[.$B$3]*[.AA22] -> 15 | AE22: of:=[.W22] -> 5300 | AF22: of:=(2*[.AE22]*[.$B$4]*([.$B$9]^2))/([.$B$3]*[.$B$7]) -> 240196 | AG22: of:=([.$B$9]^2)/(2*[.$B$7]) -> 250 | AH22: of:=(((2*[.$B$6])-[.$B$7])/[.$B$9])+((2*[.$B$4])/[.$B$3]) -> 0.69064 | AI22: of:=[.AG22]*[.AH22] -> 172.66 | AJ22: of:=[.AI22]^2 -> 29811.4756 | AK22: of:=SQRT([.AF22]+[.AJ22]) -> 519.622435620326 | AL22: of:=[.AK22]-[.AI22] -> 346.962435620326 | AM22: of:=[.$B$3]*([.AL22]/([.AE22]-[.AL22])) -> 17.5126087330503
E23: 21 | F23: of:=[.E23]*[.$B$3] -> 5250 | G23: of:=[.E23]*[.$B$4] -> 237.93 | J23: of:=[.$B$7] -> 20 | K23: of:=(2*[.$B$6])-[.$B$7] -> 60 | L23: of:=-2*[.T23] -> -560 | M23: of:=((-[.K23])+SQRT(([.K23]^2) - (4*[.J23]*[.L23])))/(2*[.J23]) -> 4 | N23: of:=[.M23]-1 -> 3 | Q23: 3 | R23: of:=[.Q23]+1 -> 4 | S23: of:=[.$B$6] + (([.R23]-1) * [.$B$7]) -> 100 | T23: of:=([.R23]/2)*([.$B$6]+[.S23]) -> 280 | U23: of:=[.T23]>=[.G23] -> true | V23: of:=[.Q23]*[.$B$9] -> 300 | W23: of:=[.F23]+[.V23] -> 5550 | X23: of:=[.W23]>=[.$B$1] -> false | Y23: of:=[.V23]/[.W23] -> 0.0540540540540541 | Z23: of:=1-[.Y23] -> 0.945945945945946 | AA23: of:=[.Y23]/[.Z23] -> 0.0571428571428571 | AB23: of:=[.$B$3]*[.AA23] -> 14.2857142857143 | AE23: of:=[.W23] -> 5550 | AF23: of:=(2*[.AE23]*[.$B$4]*([.$B$9]^2))/([.$B$3]*[.$B$7]) -> 251526 | AG23: of:=([.$B$9]^2)/(2*[.$B$7]) -> 250 | AH23: of:=(((2*[.$B$6])-[.$B$7])/[.$B$9])+((2*[.$B$4])/[.$B$3]) -> 0.69064 | AI23: of:=[.AG23]*[.AH23] -> 172.66 | AJ23: of:=[.AI23]^2 -> 29811.4756 | AK23: of:=SQRT([.AF23]+[.AJ23]) -> 530.412552264744 | AL23: of:=[.AK23]-[.AI23] -> 357.752552264744 | AM23: of:=[.$B$3]*([.AL23]/([.AE23]-[.AL23])) -> 17.2253227463566
E24: 22 | F24: of:=[.E24]*[.$B$3] -> 5500 | G24: of:=[.E24]*[.$B$4] -> 249.26 | J24: of:=[.$B$7] -> 20 | K24: of:=(2*[.$B$6])-[.$B$7] -> 60 | L24: of:=-2*[.T24] -> -560 | M24: of:=((-[.K24])+SQRT(([.K24]^2) - (4*[.J24]*[.L24])))/(2*[.J24]) -> 4 | N24: of:=[.M24]-1 -> 3 | Q24: 3 | R24: of:=[.Q24]+1 -> 4 | S24: of:=[.$B$6] + (([.R24]-1) * [.$B$7]) -> 100 | T24: of:=([.R24]/2)*([.$B$6]+[.S24]) -> 280 | U24: of:=[.T24]>=[.G24] -> true | V24: of:=[.Q24]*[.$B$9] -> 300 | W24: of:=[.F24]+[.V24] -> 5800 | X24: of:=[.W24]>=[.$B$1] -> false | Y24: of:=[.V24]/[.W24] -> 0.0517241379310345 | Z24: of:=1-[.Y24] -> 0.948275862068966 | AA24: of:=[.Y24]/[.Z24] -> 0.0545454545454545 | AB24: of:=[.$B$3]*[.AA24] -> 13.6363636363636 | AE24: of:=[.W24] -> 5800 | AF24: of:=(2*[.AE24]*[.$B$4]*([.$B$9]^2))/([.$B$3]*[.$B$7]) -> 262856 | AG24: of:=([.$B$9]^2)/(2*[.$B$7]) -> 250 | AH24: of:=(((2*[.$B$6])-[.$B$7])/[.$B$9])+((2*[.$B$4])/[.$B$3]) -> 0.69064 | AI24: of:=[.AG24]*[.AH24] -> 172.66 | AJ24: of:=[.AI24]^2 -> 29811.4756 | AK24: of:=SQRT([.AF24]+[.AJ24]) -> 540.98750041013 | AL24: of:=[.AK24]-[.AI24] -> 368.32750041013 | AM24: of:=[.$B$3]*([.AL24]/([.AE24]-[.AL24])) -> 16.9527664102512
E25: 23 | F25: of:=[.E25]*[.$B$3] -> 5750 | G25: of:=[.E25]*[.$B$4] -> 260.59 | J25: of:=[.$B$7] -> 20 | K25: of:=(2*[.$B$6])-[.$B$7] -> 60 | L25: of:=-2*[.T25] -> -560 | M25: of:=((-[.K25])+SQRT(([.K25]^2) - (4*[.J25]*[.L25])))/(2*[.J25]) -> 4 | N25: of:=[.M25]-1 -> 3 | Q25: 3 | R25: of:=[.Q25]+1 -> 4 | S25: of:=[.$B$6] + (([.R25]-1) * [.$B$7]) -> 100 | T25: of:=([.R25]/2)*([.$B$6]+[.S25]) -> 280 | U25: of:=[.T25]>=[.G25] -> true | V25: of:=[.Q25]*[.$B$9] -> 300 | W25: of:=[.F25]+[.V25] -> 6050 | X25: of:=[.W25]>=[.$B$1] -> false | Y25: of:=[.V25]/[.W25] -> 0.0495867768595041 | Z25: of:=1-[.Y25] -> 0.950413223140496 | AA25: of:=[.Y25]/[.Z25] -> 0.0521739130434783 | AB25: of:=[.$B$3]*[.AA25] -> 13.0434782608696 | AE25: of:=[.W25] -> 6050 | AF25: of:=(2*[.AE25]*[.$B$4]*([.$B$9]^2))/([.$B$3]*[.$B$7]) -> 274186 | AG25: of:=([.$B$9]^2)/(2*[.$B$7]) -> 250 | AH25: of:=(((2*[.$B$6])-[.$B$7])/[.$B$9])+((2*[.$B$4])/[.$B$3]) -> 0.69064 | AI25: of:=[.AG25]*[.AH25] -> 172.66 | AJ25: of:=[.AI25]^2 -> 29811.4756 | AK25: of:=SQRT([.AF25]+[.AJ25]) -> 551.359660838549 | AL25: of:=[.AK25]-[.AI25] -> 378.699660838549 | AM25: of:=[.$B$3]*([.AL25]/([.AE25]-[.AL25])) -> 16.6936874345886
E26: 24 | F26: of:=[.E26]*[.$B$3] -> 6000 | G26: of:=[.E26]*[.$B$4] -> 271.92 | J26: of:=[.$B$7] -> 20 | K26: of:=(2*[.$B$6])-[.$B$7] -> 60 | L26: of:=-2*[.T26] -> -560 | M26: of:=((-[.K26])+SQRT(([.K26]^2) - (4*[.J26]*[.L26])))/(2*[.J26]) -> 4 | N26: of:=[.M26]-1 -> 3 | Q26: 3 | R26: of:=[.Q26]+1 -> 4 | S26: of:=[.$B$6] + (([.R26]-1) * [.$B$7]) -> 100 | T26: of:=([.R26]/2)*([.$B$6]+[.S26]) -> 280 | U26: of:=[.T26]>=[.G26] -> true | V26: of:=[.Q26]*[.$B$9] -> 300 | W26: of:=[.F26]+[.V26] -> 6300 | X26: of:=[.W26]>=[.$B$1] -> false | Y26: of:=[.V26]/[.W26] -> 0.0476190476190476 | Z26: of:=1-[.Y26] -> 0.952380952380952 | AA26: of:=[.Y26]/[.Z26] -> 0.05 | AB26: of:=[.$B$3]*[.AA26] -> 12.5 | AE26: of:=[.W26] -> 6300 | AF26: of:=(2*[.AE26]*[.$B$4]*([.$B$9]^2))/([.$B$3]*[.$B$7]) -> 285516 | AG26: of:=([.$B$9]^2)/(2*[.$B$7]) -> 250 | AH26: of:=(((2*[.$B$6])-[.$B$7])/[.$B$9])+((2*[.$B$4])/[.$B$3]) -> 0.69064 | AI26: of:=[.AG26]*[.AH26] -> 172.66 | AJ26: of:=[.AI26]^2 -> 29811.4756 | AK26: of:=SQRT([.AF26]+[.AJ26]) -> 561.540270684125 | AL26: of:=[.AK26]-[.AI26] -> 388.880270684125 | AM26: of:=[.$B$3]*([.AL26]/([.AE26]-[.AL26])) -> 16.4469799501562
E27: 25 | F27: of:=[.E27]*[.$B$3] -> 6250 | G27: of:=[.E27]*[.$B$4] -> 283.25 | J27: of:=[.$B$7] -> 20 | K27: of:=(2*[.$B$6])-[.$B$7] -> 60 | L27: of:=-2*[.T27] -> -800 | M27: of:=((-[.K27])+SQRT(([.K27]^2) - (4*[.J27]*[.L27])))/(2*[.J27]) -> 5 | N27: of:=[.M27]-1 -> 4 | Q27: 4 | R27: of:=[.Q27]+1 -> 5 | S27: of:=[.$B$6] + (([.R27]-1) * [.$B$7]) -> 120 | T27: of:=([.R27]/2)*([.$B$6]+[.S27]) -> 400 | U27: of:=[.T27]>=[.G27] -> true | V27: of:=[.Q27]*[.$B$9] -> 400 | W27: of:=[.F27]+[.V27] -> 6650 | X27: of:=[.W27]>=[.$B$1] -> false | Y27: of:=[.V27]/[.W27] -> 0.0601503759398496 | Z27: of:=1-[.Y27] -> 0.93984962406015 | AA27: of:=[.Y27]/[.Z27] -> 0.064 | AB27: of:=[.$B$3]*[.AA27] -> 16 | AE27: of:=[.W27] -> 6650 | AF27: of:=(2*[.AE27]*[.$B$4]*([.$B$9]^2))/([.$B$3]*[.$B$7]) -> 301378 | AG27: of:=([.$B$9]^2)/(2*[.$B$7]) -> 250 | AH27: of:=(((2*[.$B$6])-[.$B$7])/[.$B$9])+((2*[.$B$4])/[.$B$3]) -> 0.69064 | AI27: of:=[.AG27]*[.AH27] -> 172.66 | AJ27: of:=[.AI27]^2 -> 29811.4756 | AK27: of:=SQRT([.AF27]+[.AJ27]) -> 575.490639020306 | AL27: of:=[.AK27]-[.AI27] -> 402.830639020306 | AM27: of:=[.$B$3]*([.AL27]/([.AE27]-[.AL27])) -> 16.1205265834642
E28: 26 | F28: of:=[.E28]*[.$B$3] -> 6500 | G28: of:=[.E28]*[.$B$4] -> 294.58 | J28: of:=[.$B$7] -> 20 | K28: of:=(2*[.$B$6])-[.$B$7] -> 60 | L28: of:=-2*[.T28] -> -800 | M28: of:=((-[.K28])+SQRT(([.K28]^2) - (4*[.J28]*[.L28])))/(2*[.J28]) -> 5 | N28: of:=[.M28]-1 -> 4 | Q28: 4 | R28: of:=[.Q28]+1 -> 5 | S28: of:=[.$B$6] + (([.R28]-1) * [.$B$7]) -> 120 | T28: of:=([.R28]/2)*([.$B$6]+[.S28]) -> 400 | U28: of:=[.T28]>=[.G28] -> true | V28: of:=[.Q28]*[.$B$9] -> 400 | W28: of:=[.F28]+[.V28] -> 6900 | X28: of:=[.W28]>=[.$B$1] -> false | Y28: of:=[.V28]/[.W28] -> 0.0579710144927536 | Z28: of:=1-[.Y28] -> 0.942028985507246 | AA28: of:=[.Y28]/[.Z28] -> 0.0615384615384615 | AB28: of:=[.$B$3]*[.AA28] -> 15.3846153846154 | AE28: of:=[.W28] -> 6900 | AF28: of:=(2*[.AE28]*[.$B$4]*([.$B$9]^2))/([.$B$3]*[.$B$7]) -> 312708 | AG28: of:=([.$B$9]^2)/(2*[.$B$7]) -> 250 | AH28: of:=(((2*[.$B$6])-[.$B$7])/[.$B$9])+((2*[.$B$4])/[.$B$3]) -> 0.69064 | AI28: of:=[.AG28]*[.AH28] -> 172.66 | AJ28: of:=[.AI28]^2 -> 29811.4756 | AK28: of:=SQRT([.AF28]+[.AJ28]) -> 585.251634427449 | AL28: of:=[.AK28]-[.AI28] -> 412.591634427449 | AM28: of:=[.$B$3]*([.AL28]/([.AE28]-[.AL28])) -> 15.8997095287309
E29: 27 | F29: of:=[.E29]*[.$B$3] -> 6750 | G29: of:=[.E29]*[.$B$4] -> 305.91 | J29: of:=[.$B$7] -> 20 | K29: of:=(2*[.$B$6])-[.$B$7] -> 60 | L29: of:=-2*[.T29] -> -800 | M29: of:=((-[.K29])+SQRT(([.K29]^2) - (4*[.J29]*[.L29])))/(2*[.J29]) -> 5 | N29: of:=[.M29]-1 -> 4 | Q29: 4 | R29: of:=[.Q29]+1 -> 5 | S29: of:=[.$B$6] + (([.R29]-1) * [.$B$7]) -> 120 | T29: of:=([.R29]/2)*([.$B$6]+[.S29]) -> 400 | U29: of:=[.T29]>=[.G29] -> true | V29: of:=[.Q29]*[.$B$9] -> 400 | W29: of:=[.F29]+[.V29] -> 7150 | X29: of:=[.W29]>=[.$B$1] -> false | Y29: of:=[.V29]/[.W29] -> 0.0559440559440559 | Z29: of:=1-[.Y29] -> 0.944055944055944 | AA29: of:=[.Y29]/[.Z29] -> 0.0592592592592593 | AB29: of:=[.$B$3]*[.AA29] -> 14.8148148148148 | AE29: of:=[.W29] -> 7150 | AF29: of:=(2*[.AE29]*[.$B$4]*([.$B$9]^2))/([.$B$3]*[.$B$7]) -> 324038 | AG29: of:=([.$B$9]^2)/(2*[.$B$7]) -> 250 | AH29: of:=(((2*[.$B$6])-[.$B$7])/[.$B$9])+((2*[.$B$4])/[.$B$3]) -> 0.69064 | AI29: of:=[.AG29]*[.AH29] -> 172.66 | AJ29: of:=[.AI29]^2 -> 29811.4756 | AK29: of:=SQRT([.AF29]+[.AJ29]) -> 594.85248221723 | AL29: of:=[.AK29]-[.AI29] -> 422.19248221723 | AM29: of:=[.$B$3]*([.AL29]/([.AE29]-[.AL29])) -> 15.6883383294373
E30: 28 | F30: of:=[.E30]*[.$B$3] -> 7000 | G30: of:=[.E30]*[.$B$4] -> 317.24 | J30: of:=[.$B$7] -> 20 | K30: of:=(2*[.$B$6])-[.$B$7] -> 60 | L30: of:=-2*[.T30] -> -800 | M30: of:=((-[.K30])+SQRT(([.K30]^2) - (4*[.J30]*[.L30])))/(2*[.J30]) -> 5 | N30: of:=[.M30]-1 -> 4 | Q30: 4 | R30: of:=[.Q30]+1 -> 5 | S30: of:=[.$B$6] + (([.R30]-1) * [.$B$7]) -> 120 | T30: of:=([.R30]/2)*([.$B$6]+[.S30]) -> 400 | U30: of:=[.T30]>=[.G30] -> true | V30: of:=[.Q30]*[.$B$9] -> 400 | W30: of:=[.F30]+[.V30] -> 7400 | X30: of:=[.W30]>=[.$B$1] -> false | Y30: of:=[.V30]/[.W30] -> 0.0540540540540541 | Z30: of:=1-[.Y30] -> 0.945945945945946 | AA30: of:=[.Y30]/[.Z30] -> 0.0571428571428571 | AB30: of:=[.$B$3]*[.AA30] -> 14.2857142857143 | AE30: of:=[.W30] -> 7400 | AF30: of:=(2*[.AE30]*[.$B$4]*([.$B$9]^2))/([.$B$3]*[.$B$7]) -> 335368 | AG30: of:=([.$B$9]^2)/(2*[.$B$7]) -> 250 | AH30: of:=(((2*[.$B$6])-[.$B$7])/[.$B$9])+((2*[.$B$4])/[.$B$3]) -> 0.69064 | AI30: of:=[.AG30]*[.AH30] -> 172.66 | AJ30: of:=[.AI30]^2 -> 29811.4756 | AK30: of:=SQRT([.AF30]+[.AJ30]) -> 604.300815488445 | AL30: of:=[.AK30]-[.AI30] -> 431.640815488445 | AM30: of:=[.$B$3]*([.AL30]/([.AE30]-[.AL30])) -> 15.4857407626119
E31: 29 | F31: of:=[.E31]*[.$B$3] -> 7250 | G31: of:=[.E31]*[.$B$4] -> 328.57 | J31: of:=[.$B$7] -> 20 | K31: of:=(2*[.$B$6])-[.$B$7] -> 60 | L31: of:=-2*[.T31] -> -800 | M31: of:=((-[.K31])+SQRT(([.K31]^2) - (4*[.J31]*[.L31])))/(2*[.J31]) -> 5 | N31: of:=[.M31]-1 -> 4 | Q31: 4 | R31: of:=[.Q31]+1 -> 5 | S31: of:=[.$B$6] + (([.R31]-1) * [.$B$7]) -> 120 | T31: of:=([.R31]/2)*([.$B$6]+[.S31]) -> 400 | U31: of:=[.T31]>=[.G31] -> true | V31: of:=[.Q31]*[.$B$9] -> 400 | W31: of:=[.F31]+[.V31] -> 7650 | X31: of:=[.W31]>=[.$B$1] -> false | Y31: of:=[.V31]/[.W31] -> 0.0522875816993464 | Z31: of:=1-[.Y31] -> 0.947712418300653 | AA31: of:=[.Y31]/[.Z31] -> 0.0551724137931035 | AB31: of:=[.$B$3]*[.AA31] -> 13.7931034482759 | AE31: of:=[.W31] -> 7650 | AF31: of:=(2*[.AE31]*[.$B$4]*([.$B$9]^2))/([.$B$3]*[.$B$7]) -> 346698 | AG31: of:=([.$B$9]^2)/(2*[.$B$7]) -> 250 | AH31: of:=(((2*[.$B$6])-[.$B$7])/[.$B$9])+((2*[.$B$4])/[.$B$3]) -> 0.69064 | AI31: of:=[.AG31]*[.AH31] -> 172.66 | AJ31: of:=[.AI31]^2 -> 29811.4756 | AK31: of:=SQRT([.AF31]+[.AJ31]) -> 613.603679584795 | AL31: of:=[.AK31]-[.AI31] -> 440.943679584795 | AM31: of:=[.$B$3]*([.AL31]/([.AE31]-[.AL31])) -> 15.2913106787671
E32: 30 | F32: of:=[.E32]*[.$B$3] -> 7500 | G32: of:=[.E32]*[.$B$4] -> 339.9 | J32: of:=[.$B$7] -> 20 | K32: of:=(2*[.$B$6])-[.$B$7] -> 60 | L32: of:=-2*[.T32] -> -800 | M32: of:=((-[.K32])+SQRT(([.K32]^2) - (4*[.J32]*[.L32])))/(2*[.J32]) -> 5 | N32: of:=[.M32]-1 -> 4 | Q32: 4 | R32: of:=[.Q32]+1 -> 5 | S32: of:=[.$B$6] + (([.R32]-1) * [.$B$7]) -> 120 | T32: of:=([.R32]/2)*([.$B$6]+[.S32]) -> 400 | U32: of:=[.T32]>=[.G32] -> true | V32: of:=[.Q32]*[.$B$9] -> 400 | W32: of:=[.F32]+[.V32] -> 7900 | X32: of:=[.W32]>=[.$B$1] -> false | Y32: of:=[.V32]/[.W32] -> 0.0506329113924051 | Z32: of:=1-[.Y32] -> 0.949367088607595 | AA32: of:=[.Y32]/[.Z32] -> 0.0533333333333333 | AB32: of:=[.$B$3]*[.AA32] -> 13.3333333333333 | AE32: of:=[.W32] -> 7900 | AF32: of:=(2*[.AE32]*[.$B$4]*([.$B$9]^2))/([.$B$3]*[.$B$7]) -> 358028 | AG32: of:=([.$B$9]^2)/(2*[.$B$7]) -> 250 | AH32: of:=(((2*[.$B$6])-[.$B$7])/[.$B$9])+((2*[.$B$4])/[.$B$3]) -> 0.69064 | AI32: of:=[.AG32]*[.AH32] -> 172.66 | AJ32: of:=[.AI32]^2 -> 29811.4756 | AK32: of:=SQRT([.AF32]+[.AJ32]) -> 622.767593569222 | AL32: of:=[.AK32]-[.AI32] -> 450.107593569222 | AM32: of:=[.$B$3]*([.AL32]/([.AE32]-[.AL32])) -> 15.1044998039397
E33: 31 | F33: of:=[.E33]*[.$B$3] -> 7750 | G33: of:=[.E33]*[.$B$4] -> 351.23 | J33: of:=[.$B$7] -> 20 | K33: of:=(2*[.$B$6])-[.$B$7] -> 60 | L33: of:=-2*[.T33] -> -800 | M33: of:=((-[.K33])+SQRT(([.K33]^2) - (4*[.J33]*[.L33])))/(2*[.J33]) -> 5 | N33: of:=[.M33]-1 -> 4 | Q33: 4 | R33: of:=[.Q33]+1 -> 5 | S33: of:=[.$B$6] + (([.R33]-1) * [.$B$7]) -> 120 | T33: of:=([.R33]/2)*([.$B$6]+[.S33]) -> 400 | U33: of:=[.T33]>=[.G33] -> true | V33: of:=[.Q33]*[.$B$9] -> 400 | W33: of:=[.F33]+[.V33] -> 8150 | X33: of:=[.W33]>=[.$B$1] -> false | Y33: of:=[.V33]/[.W33] -> 0.049079754601227 | Z33: of:=1-[.Y33] -> 0.950920245398773 | AA33: of:=[.Y33]/[.Z33] -> 0.0516129032258065 | AB33: of:=[.$B$3]*[.AA33] -> 12.9032258064516 | AE33: of:=[.W33] -> 8150 | AF33: of:=(2*[.AE33]*[.$B$4]*([.$B$9]^2))/([.$B$3]*[.$B$7]) -> 369358 | AG33: of:=([.$B$9]^2)/(2*[.$B$7]) -> 250 | AH33: of:=(((2*[.$B$6])-[.$B$7])/[.$B$9])+((2*[.$B$4])/[.$B$3]) -> 0.69064 | AI33: of:=[.AG33]*[.AH33] -> 172.66 | AJ33: of:=[.AI33]^2 -> 29811.4756 | AK33: of:=SQRT([.AF33]+[.AJ33]) -> 631.798603670505 | AL33: of:=[.AK33]-[.AI33] -> 459.138603670505 | AM33: of:=[.$B$3]*([.AL33]/([.AE33]-[.AL33])) -> 14.9248107594824
E34: 32 | F34: of:=[.E34]*[.$B$3] -> 8000 | G34: of:=[.E34]*[.$B$4] -> 362.56 | J34: of:=[.$B$7] -> 20 | K34: of:=(2*[.$B$6])-[.$B$7] -> 60 | L34: of:=-2*[.T34] -> -800 | M34: of:=((-[.K34])+SQRT(([.K34]^2) - (4*[.J34]*[.L34])))/(2*[.J34]) -> 5 | N34: of:=[.M34]-1 -> 4 | Q34: 4 | R34: of:=[.Q34]+1 -> 5 | S34: of:=[.$B$6] + (([.R34]-1) * [.$B$7]) -> 120 | T34: of:=([.R34]/2)*([.$B$6]+[.S34]) -> 400 | U34: of:=[.T34]>=[.G34] -> true | V34: of:=[.Q34]*[.$B$9] -> 400 | W34: of:=[.F34]+[.V34] -> 8400 | X34: of:=[.W34]>=[.$B$1] -> false | Y34: of:=[.V34]/[.W34] -> 0.0476190476190476 | Z34: of:=1-[.Y34] -> 0.952380952380952 | AA34: of:=[.Y34]/[.Z34] -> 0.05 | AB34: of:=[.$B$3]*[.AA34] -> 12.5 | AE34: of:=[.W34] -> 8400 | AF34: of:=(2*[.AE34]*[.$B$4]*([.$B$9]^2))/([.$B$3]*[.$B$7]) -> 380688 | AG34: of:=([.$B$9]^2)/(2*[.$B$7]) -> 250 | AH34: of:=(((2*[.$B$6])-[.$B$7])/[.$B$9])+((2*[.$B$4])/[.$B$3]) -> 0.69064 | AI34: of:=[.AG34]*[.AH34] -> 172.66 | AJ34: of:=[.AI34]^2 -> 29811.4756 | AK34: of:=SQRT([.AF34]+[.AJ34]) -> 640.702329947379 | AL34: of:=[.AK34]-[.AI34] -> 468.042329947379 | AM34: of:=[.$B$3]*([.AL34]/([.AE34]-[.AL34])) -> 14.7517910904419
E35: 33 | F35: of:=[.E35]*[.$B$3] -> 8250 | G35: of:=[.E35]*[.$B$4] -> 373.89 | J35: of:=[.$B$7] -> 20 | K35: of:=(2*[.$B$6])-[.$B$7] -> 60 | L35: of:=-2*[.T35] -> -800 | M35: of:=((-[.K35])+SQRT(([.K35]^2) - (4*[.J35]*[.L35])))/(2*[.J35]) -> 5 | N35: of:=[.M35]-1 -> 4 | Q35: 4 | R35: of:=[.Q35]+1 -> 5 | S35: of:=[.$B$6] + (([.R35]-1) * [.$B$7]) -> 120 | T35: of:=([.R35]/2)*([.$B$6]+[.S35]) -> 400 | U35: of:=[.T35]>=[.G35] -> true | V35: of:=[.Q35]*[.$B$9] -> 400 | W35: of:=[.F35]+[.V35] -> 8650 | X35: of:=[.W35]>=[.$B$1] -> false | Y35: of:=[.V35]/[.W35] -> 0.046242774566474 | Z35: of:=1-[.Y35] -> 0.953757225433526 | AA35: of:=[.Y35]/[.Z35] -> 0.0484848484848485 | AB35: of:=[.$B$3]*[.AA35] -> 12.1212121212121 | AE35: of:=[.W35] -> 8650 | AF35: of:=(2*[.AE35]*[.$B$4]*([.$B$9]^2))/([.$B$3]*[.$B$7]) -> 392018 | AG35: of:=([.$B$9]^2)/(2*[.$B$7]) -> 250 | AH35: of:=(((2*[.$B$6])-[.$B$7])/[.$B$9])+((2*[.$B$4])/[.$B$3]) -> 0.69064 | AI35: of:=[.AG35]*[.AH35] -> 172.66 | AJ35: of:=[.AI35]^2 -> 29811.4756 | AK35: of:=SQRT([.AF35]+[.AJ35]) -> 649.484007193403 | AL35: of:=[.AK35]-[.AI35] -> 476.824007193403 | AM35: of:=[.$B$3]*([.AL35]/([.AE35]-[.AL35])) -> 14.5850281338939
E36: 34 | F36: of:=[.E36]*[.$B$3] -> 8500 | G36: of:=[.E36]*[.$B$4] -> 385.22 | J36: of:=[.$B$7] -> 20 | K36: of:=(2*[.$B$6])-[.$B$7] -> 60 | L36: of:=-2*[.T36] -> -800 | M36: of:=((-[.K36])+SQRT(([.K36]^2) - (4*[.J36]*[.L36])))/(2*[.J36]) -> 5 | N36: of:=[.M36]-1 -> 4 | Q36: 4 | R36: of:=[.Q36]+1 -> 5 | S36: of:=[.$B$6] + (([.R36]-1) * [.$B$7]) -> 120 | T36: of:=([.R36]/2)*([.$B$6]+[.S36]) -> 400 | U36: of:=[.T36]>=[.G36] -> true | V36: of:=[.Q36]*[.$B$9] -> 400 | W36: of:=[.F36]+[.V36] -> 8900 | X36: of:=[.W36]>=[.$B$1] -> false | Y36: of:=[.V36]/[.W36] -> 0.0449438202247191 | Z36: of:=1-[.Y36] -> 0.955056179775281 | AA36: of:=[.Y36]/[.Z36] -> 0.0470588235294118 | AB36: of:=[.$B$3]*[.AA36] -> 11.7647058823529 | AE36: of:=[.W36] -> 8900 | AF36: of:=(2*[.AE36]*[.$B$4]*([.$B$9]^2))/([.$B$3]*[.$B$7]) -> 403348 | AG36: of:=([.$B$9]^2)/(2*[.$B$7]) -> 250 | AH36: of:=(((2*[.$B$6])-[.$B$7])/[.$B$9])+((2*[.$B$4])/[.$B$3]) -> 0.69064 | AI36: of:=[.AG36]*[.AH36] -> 172.66 | AJ36: of:=[.AI36]^2 -> 29811.4756 | AK36: of:=SQRT([.AF36]+[.AJ36]) -> 658.148520928217 | AL36: of:=[.AK36]-[.AI36] -> 485.488520928217 | AM36: of:=[.$B$3]*([.AL36]/([.AE36]-[.AL36])) -> 14.4241445904407
E37: 35 | F37: of:=[.E37]*[.$B$3] -> 8750 | G37: of:=[.E37]*[.$B$4] -> 396.55 | J37: of:=[.$B$7] -> 20 | K37: of:=(2*[.$B$6])-[.$B$7] -> 60 | L37: of:=-2*[.T37] -> -800 | M37: of:=((-[.K37])+SQRT(([.K37]^2) - (4*[.J37]*[.L37])))/(2*[.J37]) -> 5 | N37: of:=[.M37]-1 -> 4 | Q37: 4 | R37: of:=[.Q37]+1 -> 5 | S37: of:=[.$B$6] + (([.R37]-1) * [.$B$7]) -> 120 | T37: of:=([.R37]/2)*([.$B$6]+[.S37]) -> 400 | U37: of:=[.T37]>=[.G37] -> true | V37: of:=[.Q37]*[.$B$9] -> 400 | W37: of:=[.F37]+[.V37] -> 9150 | X37: of:=[.W37]>=[.$B$1] -> false | Y37: of:=[.V37]/[.W37] -> 0.0437158469945355 | Z37: of:=1-[.Y37] -> 0.956284153005464 | AA37: of:=[.Y37]/[.Z37] -> 0.0457142857142857 | AB37: of:=[.$B$3]*[.AA37] -> 11.4285714285714 | AE37: of:=[.W37] -> 9150 | AF37: of:=(2*[.AE37]*[.$B$4]*([.$B$9]^2))/([.$B$3]*[.$B$7]) -> 414678 | AG37: of:=([.$B$9]^2)/(2*[.$B$7]) -> 250 | AH37: of:=(((2*[.$B$6])-[.$B$7])/[.$B$9])+((2*[.$B$4])/[.$B$3]) -> 0.69064 | AI37: of:=[.AG37]*[.AH37] -> 172.66 | AJ37: of:=[.AI37]^2 -> 29811.4756 | AK37: of:=SQRT([.AF37]+[.AJ37]) -> 666.700439177896 | AL37: of:=[.AK37]-[.AI37] -> 494.040439177897 | AM37: of:=[.$B$3]*([.AL37]/([.AE37]-[.AL37])) -> 14.2687946872459
E38: 36 | F38: of:=[.E38]*[.$B$3] -> 9000 | G38: of:=[.E38]*[.$B$4] -> 407.88 | J38: of:=[.$B$7] -> 20 | K38: of:=(2*[.$B$6])-[.$B$7] -> 60 | L38: of:=-2*[.T38] -> -1080 | M38: of:=((-[.K38])+SQRT(([.K38]^2) - (4*[.J38]*[.L38])))/(2*[.J38]) -> 6 | N38: of:=[.M38]-1 -> 5 | Q38: 5 | R38: of:=[.Q38]+1 -> 6 | S38: of:=[.$B$6] + (([.R38]-1) * [.$B$7]) -> 140 | T38: of:=([.R38]/2)*([.$B$6]+[.S38]) -> 540 | U38: of:=[.T38]>=[.G38] -> true | V38: of:=[.Q38]*[.$B$9] -> 500 | W38: of:=[.F38]+[.V38] -> 9500 | X38: of:=[.W38]>=[.$B$1] -> false | Y38: of:=[.V38]/[.W38] -> 0.0526315789473684 | Z38: of:=1-[.Y38] -> 0.947368421052632 | AA38: of:=[.Y38]/[.Z38] -> 0.0555555555555556 | AB38: of:=[.$B$3]*[.AA38] -> 13.8888888888889 | AE38: of:=[.W38] -> 9500 | AF38: of:=(2*[.AE38]*[.$B$4]*([.$B$9]^2))/([.$B$3]*[.$B$7]) -> 430540 | AG38: of:=([.$B$9]^2)/(2*[.$B$7]) -> 250 | AH38: of:=(((2*[.$B$6])-[.$B$7])/[.$B$9])+((2*[.$B$4])/[.$B$3]) -> 0.69064 | AI38: of:=[.AG38]*[.AH38] -> 172.66 | AJ38: of:=[.AI38]^2 -> 29811.4756 | AK38: of:=SQRT([.AF38]+[.AJ38]) -> 678.492060086189 | AL38: of:=[.AK38]-[.AI38] -> 505.832060086189 | AM38: of:=[.$B$3]*([.AL38]/([.AE38]-[.AL38])) -> 14.0600015328109
E39: 37 | F39: of:=[.E39]*[.$B$3] -> 9250 | G39: of:=[.E39]*[.$B$4] -> 419.21 | J39: of:=[.$B$7] -> 20 | K39: of:=(2*[.$B$6])-[.$B$7] -> 60 | L39: of:=-2*[.T39] -> -1080 | M39: of:=((-[.K39])+SQRT(([.K39]^2) - (4*[.J39]*[.L39])))/(2*[.J39]) -> 6 | N39: of:=[.M39]-1 -> 5 | Q39: 5 | R39: of:=[.Q39]+1 -> 6 | S39: of:=[.$B$6] + (([.R39]-1) * [.$B$7]) -> 140 | T39: of:=([.R39]/2)*([.$B$6]+[.S39]) -> 540 | U39: of:=[.T39]>=[.G39] -> true | V39: of:=[.Q39]*[.$B$9] -> 500 | W39: of:=[.F39]+[.V39] -> 9750 | X39: of:=[.W39]>=[.$B$1] -> false | Y39: of:=[.V39]/[.W39] -> 0.0512820512820513 | Z39: of:=1-[.Y39] -> 0.948717948717949 | AA39: of:=[.Y39]/[.Z39] -> 0.0540540540540541 | AB39: of:=[.$B$3]*[.AA39] -> 13.5135135135135 | AE39: of:=[.W39] -> 9750 | AF39: of:=(2*[.AE39]*[.$B$4]*([.$B$9]^2))/([.$B$3]*[.$B$7]) -> 441870 | AG39: of:=([.$B$9]^2)/(2*[.$B$7]) -> 250 | AH39: of:=(((2*[.$B$6])-[.$B$7])/[.$B$9])+((2*[.$B$4])/[.$B$3]) -> 0.69064 | AI39: of:=[.AG39]*[.AH39] -> 172.66 | AJ39: of:=[.AI39]^2 -> 29811.4756 | AK39: of:=SQRT([.AF39]+[.AJ39]) -> 686.790707275513 | AL39: of:=[.AK39]-[.AI39] -> 514.130707275513 | AM39: of:=[.$B$3]*([.AL39]/([.AE39]-[.AL39])) -> 13.9166842605849
E40: 38 | F40: of:=[.E40]*[.$B$3] -> 9500 | G40: of:=[.E40]*[.$B$4] -> 430.54 | J40: of:=[.$B$7] -> 20 | K40: of:=(2*[.$B$6])-[.$B$7] -> 60 | L40: of:=-2*[.T40] -> -1080 | M40: of:=((-[.K40])+SQRT(([.K40]^2) - (4*[.J40]*[.L40])))/(2*[.J40]) -> 6 | N40: of:=[.M40]-1 -> 5 | Q40: 5 | R40: of:=[.Q40]+1 -> 6 | S40: of:=[.$B$6] + (([.R40]-1) * [.$B$7]) -> 140 | T40: of:=([.R40]/2)*([.$B$6]+[.S40]) -> 540 | U40: of:=[.T40]>=[.G40] -> true | V40: of:=[.Q40]*[.$B$9] -> 500 | W40: of:=[.F40]+[.V40] -> 10000 | X40: of:=[.W40]>=[.$B$1] -> false | Y40: of:=[.V40]/[.W40] -> 0.05 | Z40: of:=1-[.Y40] -> 0.95 | AA40: of:=[.Y40]/[.Z40] -> 0.0526315789473684 | AB40: of:=[.$B$3]*[.AA40] -> 13.1578947368421 | AE40: of:=[.W40] -> 10000 | AF40: of:=(2*[.AE40]*[.$B$4]*([.$B$9]^2))/([.$B$3]*[.$B$7]) -> 453200 | AG40: of:=([.$B$9]^2)/(2*[.$B$7]) -> 250 | AH40: of:=(((2*[.$B$6])-[.$B$7])/[.$B$9])+((2*[.$B$4])/[.$B$3]) -> 0.69064 | AI40: of:=[.AG40]*[.AH40] -> 172.66 | AJ40: of:=[.AI40]^2 -> 29811.4756 | AK40: of:=SQRT([.AF40]+[.AJ40]) -> 694.990270147719 | AL40: of:=[.AK40]-[.AI40] -> 522.33027014772 | AM40: of:=[.$B$3]*([.AL40]/([.AE40]-[.AL40])) -> 13.7779191783427
E41: 39 | F41: of:=[.E41]*[.$B$3] -> 9750 | G41: of:=[.E41]*[.$B$4] -> 441.87 | J41: of:=[.$B$7] -> 20 | K41: of:=(2*[.$B$6])-[.$B$7] -> 60 | L41: of:=-2*[.T41] -> -1080 | M41: of:=((-[.K41])+SQRT(([.K41]^2) - (4*[.J41]*[.L41])))/(2*[.J41]) -> 6 | N41: of:=[.M41]-1 -> 5 | Q41: 5 | R41: of:=[.Q41]+1 -> 6 | S41: of:=[.$B$6] + (([.R41]-1) * [.$B$7]) -> 140 | T41: of:=([.R41]/2)*([.$B$6]+[.S41]) -> 540 | U41: of:=[.T41]>=[.G41] -> true | V41: of:=[.Q41]*[.$B$9] -> 500 | W41: of:=[.F41]+[.V41] -> 10250 | X41: of:=[.W41]>=[.$B$1] -> false | Y41: of:=[.V41]/[.W41] -> 0.0487804878048781 | Z41: of:=1-[.Y41] -> 0.951219512195122 | AA41: of:=[.Y41]/[.Z41] -> 0.0512820512820513 | AB41: of:=[.$B$3]*[.AA41] -> 12.8205128205128 | AE41: of:=[.W41] -> 10250 | AF41: of:=(2*[.AE41]*[.$B$4]*([.$B$9]^2))/([.$B$3]*[.$B$7]) -> 464530 | AG41: of:=([.$B$9]^2)/(2*[.$B$7]) -> 250 | AH41: of:=(((2*[.$B$6])-[.$B$7])/[.$B$9])+((2*[.$B$4])/[.$B$3]) -> 0.69064 | AI41: of:=[.AG41]*[.AH41] -> 172.66 | AJ41: of:=[.AI41]^2 -> 29811.4756 | AK41: of:=SQRT([.AF41]+[.AJ41]) -> 703.094215308304 | AL41: of:=[.AK41]-[.AI41] -> 530.434215308304 | AM41: of:=[.$B$3]*([.AL41]/([.AE41]-[.AL41])) -> 13.6434648177323
E42: 40 | F42: of:=[.E42]*[.$B$3] -> 10000 | G42: of:=[.E42]*[.$B$4] -> 453.2 | J42: of:=[.$B$7] -> 20 | K42: of:=(2*[.$B$6])-[.$B$7] -> 60 | L42: of:=-2*[.T42] -> -1080 | M42: of:=((-[.K42])+SQRT(([.K42]^2) - (4*[.J42]*[.L42])))/(2*[.J42]) -> 6 | N42: of:=[.M42]-1 -> 5 | Q42: 5 | R42: of:=[.Q42]+1 -> 6 | S42: of:=[.$B$6] + (([.R42]-1) * [.$B$7]) -> 140 | T42: of:=([.R42]/2)*([.$B$6]+[.S42]) -> 540 | U42: of:=[.T42]>=[.G42] -> true | V42: of:=[.Q42]*[.$B$9] -> 500 | W42: of:=[.F42]+[.V42] -> 10500 | X42: of:=[.W42]>=[.$B$1] -> false | Y42: of:=[.V42]/[.W42] -> 0.0476190476190476 | Z42: of:=1-[.Y42] -> 0.952380952380952 | AA42: of:=[.Y42]/[.Z42] -> 0.05 | AB42: of:=[.$B$3]*[.AA42] -> 12.5 | AE42: of:=[.W42] -> 10500 | AF42: of:=(2*[.AE42]*[.$B$4]*([.$B$9]^2))/([.$B$3]*[.$B$7]) -> 475860 | AG42: of:=([.$B$9]^2)/(2*[.$B$7]) -> 250 | AH42: of:=(((2*[.$B$6])-[.$B$7])/[.$B$9])+((2*[.$B$4])/[.$B$3]) -> 0.69064 | AI42: of:=[.AG42]*[.AH42] -> 172.66 | AJ42: of:=[.AI42]^2 -> 29811.4756 | AK42: of:=SQRT([.AF42]+[.AJ42]) -> 711.10581181706 | AL42: of:=[.AK42]-[.AI42] -> 538.44581181706 | AM42: of:=[.$B$3]*([.AL42]/([.AE42]-[.AL42])) -> 13.5130974957653
E43: 41 | F43: of:=[.E43]*[.$B$3] -> 10250 | G43: of:=[.E43]*[.$B$4] -> 464.53 | J43: of:=[.$B$7] -> 20 | K43: of:=(2*[.$B$6])-[.$B$7] -> 60 | L43: of:=-2*[.T43] -> -1080 | M43: of:=((-[.K43])+SQRT(([.K43]^2) - (4*[.J43]*[.L43])))/(2*[.J43]) -> 6 | N43: of:=[.M43]-1 -> 5 | Q43: 5 | R43: of:=[.Q43]+1 -> 6 | S43: of:=[.$B$6] + (([.R43]-1) * [.$B$7]) -> 140 | T43: of:=([.R43]/2)*([.$B$6]+[.S43]) -> 540 | U43: of:=[.T43]>=[.G43] -> true | V43: of:=[.Q43]*[.$B$9] -> 500 | W43: of:=[.F43]+[.V43] -> 10750 | X43: of:=[.W43]>=[.$B$1] -> false | Y43: of:=[.V43]/[.W43] -> 0.0465116279069768 | Z43: of:=1-[.Y43] -> 0.953488372093023 | AA43: of:=[.Y43]/[.Z43] -> 0.048780487804878 | AB43: of:=[.$B$3]*[.AA43] -> 12.1951219512195 | AE43: of:=[.W43] -> 10750 | AF43: of:=(2*[.AE43]*[.$B$4]*([.$B$9]^2))/([.$B$3]*[.$B$7]) -> 487190 | AG43: of:=([.$B$9]^2)/(2*[.$B$7]) -> 250 | AH43: of:=(((2*[.$B$6])-[.$B$7])/[.$B$9])+((2*[.$B$4])/[.$B$3]) -> 0.69064 | AI43: of:=[.AG43]*[.AH43] -> 172.66 | AJ43: of:=[.AI43]^2 -> 29811.4756 | AK43: of:=SQRT([.AF43]+[.AJ43]) -> 719.028146597892 | AL43: of:=[.AK43]-[.AI43] -> 546.368146597892 | AM43: of:=[.$B$3]*([.AL43]/([.AE43]-[.AL43])) -> 13.386609651536
E44: 42 | F44: of:=[.E44]*[.$B$3] -> 10500 | G44: of:=[.E44]*[.$B$4] -> 475.86 | J44: of:=[.$B$7] -> 20 | K44: of:=(2*[.$B$6])-[.$B$7] -> 60 | L44: of:=-2*[.T44] -> -1080 | M44: of:=((-[.K44])+SQRT(([.K44]^2) - (4*[.J44]*[.L44])))/(2*[.J44]) -> 6 | N44: of:=[.M44]-1 -> 5 | Q44: 5 | R44: of:=[.Q44]+1 -> 6 | S44: of:=[.$B$6] + (([.R44]-1) * [.$B$7]) -> 140 | T44: of:=([.R44]/2)*([.$B$6]+[.S44]) -> 540 | U44: of:=[.T44]>=[.G44] -> true | V44: of:=[.Q44]*[.$B$9] -> 500 | W44: of:=[.F44]+[.V44] -> 11000 | X44: of:=[.W44]>=[.$B$1] -> false | Y44: of:=[.V44]/[.W44] -> 0.0454545454545455 | Z44: of:=1-[.Y44] -> 0.954545454545455 | AA44: of:=[.Y44]/[.Z44] -> 0.0476190476190476 | AB44: of:=[.$B$3]*[.AA44] -> 11.9047619047619 | AE44: of:=[.W44] -> 11000 | AF44: of:=(2*[.AE44]*[.$B$4]*([.$B$9]^2))/([.$B$3]*[.$B$7]) -> 498520 | AG44: of:=([.$B$9]^2)/(2*[.$B$7]) -> 250 | AH44: of:=(((2*[.$B$6])-[.$B$7])/[.$B$9])+((2*[.$B$4])/[.$B$3]) -> 0.69064 | AI44: of:=[.AG44]*[.AH44] -> 172.66 | AJ44: of:=[.AI44]^2 -> 29811.4756 | AK44: of:=SQRT([.AF44]+[.AJ44]) -> 726.864138336732 | AL44: of:=[.AK44]-[.AI44] -> 554.204138336732 | AM44: of:=[.$B$3]*([.AL44]/([.AE44]-[.AL44])) -> 13.2638083702817
E45: 43 | F45: of:=[.E45]*[.$B$3] -> 10750 | G45: of:=[.E45]*[.$B$4] -> 487.19 | J45: of:=[.$B$7] -> 20 | K45: of:=(2*[.$B$6])-[.$B$7] -> 60 | L45: of:=-2*[.T45] -> -1080 | M45: of:=((-[.K45])+SQRT(([.K45]^2) - (4*[.J45]*[.L45])))/(2*[.J45]) -> 6 | N45: of:=[.M45]-1 -> 5 | Q45: 5 | R45: of:=[.Q45]+1 -> 6 | S45: of:=[.$B$6] + (([.R45]-1) * [.$B$7]) -> 140 | T45: of:=([.R45]/2)*([.$B$6]+[.S45]) -> 540 | U45: of:=[.T45]>=[.G45] -> true | V45: of:=[.Q45]*[.$B$9] -> 500 | W45: of:=[.F45]+[.V45] -> 11250 | X45: of:=[.W45]>=[.$B$1] -> false | Y45: of:=[.V45]/[.W45] -> 0.0444444444444444 | Z45: of:=1-[.Y45] -> 0.955555555555556 | AA45: of:=[.Y45]/[.Z45] -> 0.0465116279069768 | AB45: of:=[.$B$3]*[.AA45] -> 11.6279069767442 | AE45: of:=[.W45] -> 11250 | AF45: of:=(2*[.AE45]*[.$B$4]*([.$B$9]^2))/([.$B$3]*[.$B$7]) -> 509850 | AG45: of:=([.$B$9]^2)/(2*[.$B$7]) -> 250 | AH45: of:=(((2*[.$B$6])-[.$B$7])/[.$B$9])+((2*[.$B$4])/[.$B$3]) -> 0.69064 | AI45: of:=[.AG45]*[.AH45] -> 172.66 | AJ45: of:=[.AI45]^2 -> 29811.4756 | AK45: of:=SQRT([.AF45]+[.AJ45]) -> 734.616550044988 | AL45: of:=[.AK45]-[.AI45] -> 561.956550044988 | AM45: of:=[.$B$3]*([.AL45]/([.AE45]-[.AL45])) -> 13.1445140702378
E46: 44 | F46: of:=[.E46]*[.$B$3] -> 11000 | G46: of:=[.E46]*[.$B$4] -> 498.52 | J46: of:=[.$B$7] -> 20 | K46: of:=(2*[.$B$6])-[.$B$7] -> 60 | L46: of:=-2*[.T46] -> -1080 | M46: of:=((-[.K46])+SQRT(([.K46]^2) - (4*[.J46]*[.L46])))/(2*[.J46]) -> 6 | N46: of:=[.M46]-1 -> 5 | Q46: 5 | R46: of:=[.Q46]+1 -> 6 | S46: of:=[.$B$6] + (([.R46]-1) * [.$B$7]) -> 140 | T46: of:=([.R46]/2)*([.$B$6]+[.S46]) -> 540 | U46: of:=[.T46]>=[.G46] -> true | V46: of:=[.Q46]*[.$B$9] -> 500 | W46: of:=[.F46]+[.V46] -> 11500 | X46: of:=[.W46]>=[.$B$1] -> false | Y46: of:=[.V46]/[.W46] -> 0.0434782608695652 | Z46: of:=1-[.Y46] -> 0.956521739130435 | AA46: of:=[.Y46]/[.Z46] -> 0.0454545454545455 | AB46: of:=[.$B$3]*[.AA46] -> 11.3636363636364 | AE46: of:=[.W46] -> 11500 | AF46: of:=(2*[.AE46]*[.$B$4]*([.$B$9]^2))/([.$B$3]*[.$B$7]) -> 521180 | AG46: of:=([.$B$9]^2)/(2*[.$B$7]) -> 250 | AH46: of:=(((2*[.$B$6])-[.$B$7])/[.$B$9])+((2*[.$B$4])/[.$B$3]) -> 0.69064 | AI46: of:=[.AG46]*[.AH46] -> 172.66 | AJ46: of:=[.AI46]^2 -> 29811.4756 | AK46: of:=SQRT([.AF46]+[.AJ46]) -> 742.288000441877 | AL46: of:=[.AK46]-[.AI46] -> 569.628000441877 | AM46: of:=[.$B$3]*([.AL46]/([.AE46]-[.AL46])) -> 13.0285593313957
E47: 45 | F47: of:=[.E47]*[.$B$3] -> 11250 | G47: of:=[.E47]*[.$B$4] -> 509.85 | J47: of:=[.$B$7] -> 20 | K47: of:=(2*[.$B$6])-[.$B$7] -> 60 | L47: of:=-2*[.T47] -> -1080 | M47: of:=((-[.K47])+SQRT(([.K47]^2) - (4*[.J47]*[.L47])))/(2*[.J47]) -> 6 | N47: of:=[.M47]-1 -> 5 | Q47: 5 | R47: of:=[.Q47]+1 -> 6 | S47: of:=[.$B$6] + (([.R47]-1) * [.$B$7]) -> 140 | T47: of:=([.R47]/2)*([.$B$6]+[.S47]) -> 540 | U47: of:=[.T47]>=[.G47] -> true | V47: of:=[.Q47]*[.$B$9] -> 500 | W47: of:=[.F47]+[.V47] -> 11750 | X47: of:=[.W47]>=[.$B$1] -> false | Y47: of:=[.V47]/[.W47] -> 0.0425531914893617 | Z47: of:=1-[.Y47] -> 0.957446808510638 | AA47: of:=[.Y47]/[.Z47] -> 0.0444444444444444 | AB47: of:=[.$B$3]*[.AA47] -> 11.1111111111111 | AE47: of:=[.W47] -> 11750 | AF47: of:=(2*[.AE47]*[.$B$4]*([.$B$9]^2))/([.$B$3]*[.$B$7]) -> 532510 | AG47: of:=([.$B$9]^2)/(2*[.$B$7]) -> 250 | AH47: of:=(((2*[.$B$6])-[.$B$7])/[.$B$9])+((2*[.$B$4])/[.$B$3]) -> 0.69064 | AI47: of:=[.AG47]*[.AH47] -> 172.66 | AJ47: of:=[.AI47]^2 -> 29811.4756 | AK47: of:=SQRT([.AF47]+[.AJ47]) -> 749.880974288587 | AL47: of:=[.AK47]-[.AI47] -> 577.220974288587 | AM47: of:=[.$B$3]*([.AL47]/([.AE47]-[.AL47])) -> 12.9157878483109
E48: 46 | F48: of:=[.E48]*[.$B$3] -> 11500 | G48: of:=[.E48]*[.$B$4] -> 521.18 | J48: of:=[.$B$7] -> 20 | K48: of:=(2*[.$B$6])-[.$B$7] -> 60 | L48: of:=-2*[.T48] -> -1080 | M48: of:=((-[.K48])+SQRT(([.K48]^2) - (4*[.J48]*[.L48])))/(2*[.J48]) -> 6 | N48: of:=[.M48]-1 -> 5 | Q48: 5 | R48: of:=[.Q48]+1 -> 6 | S48: of:=[.$B$6] + (([.R48]-1) * [.$B$7]) -> 140 | T48: of:=([.R48]/2)*([.$B$6]+[.S48]) -> 540 | U48: of:=[.T48]>=[.G48] -> true | V48: of:=[.Q48]*[.$B$9] -> 500 | W48: of:=[.F48]+[.V48] -> 12000 | X48: of:=[.W48]>=[.$B$1] -> false | Y48: of:=[.V48]/[.W48] -> 0.0416666666666667 | Z48: of:=1-[.Y48] -> 0.958333333333333 | AA48: of:=[.Y48]/[.Z48] -> 0.0434782608695652 | AB48: of:=[.$B$3]*[.AA48] -> 10.8695652173913 | AE48: of:=[.W48] -> 12000 | AF48: of:=(2*[.AE48]*[.$B$4]*([.$B$9]^2))/([.$B$3]*[.$B$7]) -> 543840 | AG48: of:=([.$B$9]^2)/(2*[.$B$7]) -> 250 | AH48: of:=(((2*[.$B$6])-[.$B$7])/[.$B$9])+((2*[.$B$4])/[.$B$3]) -> 0.69064 | AI48: of:=[.AG48]*[.AH48] -> 172.66 | AJ48: of:=[.AI48]^2 -> 29811.4756 | AK48: of:=SQRT([.AF48]+[.AJ48]) -> 757.397831789872 | AL48: of:=[.AK48]-[.AI48] -> 584.737831789873 | AM48: of:=[.$B$3]*([.AL48]/([.AE48]-[.AL48])) -> 12.8060534916641
E49: 47 | F49: of:=[.E49]*[.$B$3] -> 11750 | G49: of:=[.E49]*[.$B$4] -> 532.51 | J49: of:=[.$B$7] -> 20 | K49: of:=(2*[.$B$6])-[.$B$7] -> 60 | L49: of:=-2*[.T49] -> -1080 | M49: of:=((-[.K49])+SQRT(([.K49]^2) - (4*[.J49]*[.L49])))/(2*[.J49]) -> 6 | N49: of:=[.M49]-1 -> 5 | Q49: 5 | R49: of:=[.Q49]+1 -> 6 | S49: of:=[.$B$6] + (([.R49]-1) * [.$B$7]) -> 140 | T49: of:=([.R49]/2)*([.$B$6]+[.S49]) -> 540 | U49: of:=[.T49]>=[.G49] -> true | V49: of:=[.Q49]*[.$B$9] -> 500 | W49: of:=[.F49]+[.V49] -> 12250 | X49: of:=[.W49]>=[.$B$1] -> false | Y49: of:=[.V49]/[.W49] -> 0.0408163265306122 | Z49: of:=1-[.Y49] -> 0.959183673469388 | AA49: of:=[.Y49]/[.Z49] -> 0.0425531914893617 | AB49: of:=[.$B$3]*[.AA49] -> 10.6382978723404 | AE49: of:=[.W49] -> 12250 | AF49: of:=(2*[.AE49]*[.$B$4]*([.$B$9]^2))/([.$B$3]*[.$B$7]) -> 555170 | AG49: of:=([.$B$9]^2)/(2*[.$B$7]) -> 250 | AH49: of:=(((2*[.$B$6])-[.$B$7])/[.$B$9])+((2*[.$B$4])/[.$B$3]) -> 0.69064 | AI49: of:=[.AG49]*[.AH49] -> 172.66 | AJ49: of:=[.AI49]^2 -> 29811.4756 | AK49: of:=SQRT([.AF49]+[.AJ49]) -> 764.840817163938 | AL49: of:=[.AK49]-[.AI49] -> 592.180817163938 | AM49: of:=[.$B$3]*([.AL49]/([.AE49]-[.AL49])) -> 12.6992194654171
E50: 48 | F50: of:=[.E50]*[.$B$3] -> 12000 | G50: of:=[.E50]*[.$B$4] -> 543.84 | J50: of:=[.$B$7] -> 20 | K50: of:=(2*[.$B$6])-[.$B$7] -> 60 | L50: of:=-2*[.T50] -> -1400 | M50: of:=((-[.K50])+SQRT(([.K50]^2) - (4*[.J50]*[.L50])))/(2*[.J50]) -> 7 | N50: of:=[.M50]-1 -> 6 | Q50: 6 | R50: of:=[.Q50]+1 -> 7 | S50: of:=[.$B$6] + (([.R50]-1) * [.$B$7]) -> 160 | T50: of:=([.R50]/2)*([.$B$6]+[.S50]) -> 700 | U50: of:=[.T50]>=[.G50] -> true | V50: of:=[.Q50]*[.$B$9] -> 600 | W50: of:=[.F50]+[.V50] -> 12600 | X50: of:=[.W50]>=[.$B$1] -> false | Y50: of:=[.V50]/[.W50] -> 0.0476190476190476 | Z50: of:=1-[.Y50] -> 0.952380952380952 | AA50: of:=[.Y50]/[.Z50] -> 0.05 | AB50: of:=[.$B$3]*[.AA50] -> 12.5 | AE50: of:=[.W50] -> 12600 | AF50: of:=(2*[.AE50]*[.$B$4]*([.$B$9]^2))/([.$B$3]*[.$B$7]) -> 571032 | AG50: of:=([.$B$9]^2)/(2*[.$B$7]) -> 250 | AH50: of:=(((2*[.$B$6])-[.$B$7])/[.$B$9])+((2*[.$B$4])/[.$B$3]) -> 0.69064 | AI50: of:=[.AG50]*[.AH50] -> 172.66 | AJ50: of:=[.AI50]^2 -> 29811.4756 | AK50: of:=SQRT([.AF50]+[.AJ50]) -> 775.14093918461 | AL50: of:=[.AK50]-[.AI50] -> 602.480939184611 | AM50: of:=[.$B$3]*([.AL50]/([.AE50]-[.AL50])) -> 12.5542817671436
E51: 49 | F51: of:=[.E51]*[.$B$3] -> 12250 | G51: of:=[.E51]*[.$B$4] -> 555.17 | J51: of:=[.$B$7] -> 20 | K51: of:=(2*[.$B$6])-[.$B$7] -> 60 | L51: of:=-2*[.T51] -> -1400 | M51: of:=((-[.K51])+SQRT(([.K51]^2) - (4*[.J51]*[.L51])))/(2*[.J51]) -> 7 | N51: of:=[.M51]-1 -> 6 | Q51: 6 | R51: of:=[.Q51]+1 -> 7 | S51: of:=[.$B$6] + (([.R51]-1) * [.$B$7]) -> 160 | T51: of:=([.R51]/2)*([.$B$6]+[.S51]) -> 700 | U51: of:=[.T51]>=[.G51] -> true | V51: of:=[.Q51]*[.$B$9] -> 600 | W51: of:=[.F51]+[.V51] -> 12850 | X51: of:=[.W51]>=[.$B$1] -> false | Y51: of:=[.V51]/[.W51] -> 0.0466926070038911 | Z51: of:=1-[.Y51] -> 0.953307392996109 | AA51: of:=[.Y51]/[.Z51] -> 0.0489795918367347 | AB51: of:=[.$B$3]*[.AA51] -> 12.2448979591837 | AE51: of:=[.W51] -> 12850 | AF51: of:=(2*[.AE51]*[.$B$4]*([.$B$9]^2))/([.$B$3]*[.$B$7]) -> 582362 | AG51: of:=([.$B$9]^2)/(2*[.$B$7]) -> 250 | AH51: of:=(((2*[.$B$6])-[.$B$7])/[.$B$9])+((2*[.$B$4])/[.$B$3]) -> 0.69064 | AI51: of:=[.AG51]*[.AH51] -> 172.66 | AJ51: of:=[.AI51]^2 -> 29811.4756 | AK51: of:=SQRT([.AF51]+[.AJ51]) -> 782.415155528061 | AL51: of:=[.AK51]-[.AI51] -> 609.755155528061 | AM51: of:=[.$B$3]*([.AL51]/([.AE51]-[.AL51])) -> 12.4539002952103
E52: 50 | F52: of:=[.E52]*[.$B$3] -> 12500 | G52: of:=[.E52]*[.$B$4] -> 566.5 | J52: of:=[.$B$7] -> 20 | K52: of:=(2*[.$B$6])-[.$B$7] -> 60 | L52: of:=-2*[.T52] -> -1400 | M52: of:=((-[.K52])+SQRT(([.K52]^2) - (4*[.J52]*[.L52])))/(2*[.J52]) -> 7 | N52: of:=[.M52]-1 -> 6 | Q52: 6 | R52: of:=[.Q52]+1 -> 7 | S52: of:=[.$B$6] + (([.R52]-1) * [.$B$7]) -> 160 | T52: of:=([.R52]/2)*([.$B$6]+[.S52]) -> 700 | U52: of:=[.T52]>=[.G52] -> true | V52: of:=[.Q52]*[.$B$9] -> 600 | W52: of:=[.F52]+[.V52] -> 13100 | X52: of:=[.W52]>=[.$B$1] -> false | Y52: of:=[.V52]/[.W52] -> 0.0458015267175573 | Z52: of:=1-[.Y52] -> 0.954198473282443 | AA52: of:=[.Y52]/[.Z52] -> 0.048 | AB52: of:=[.$B$3]*[.AA52] -> 12 | AE52: of:=[.W52] -> 13100 | AF52: of:=(2*[.AE52]*[.$B$4]*([.$B$9]^2))/([.$B$3]*[.$B$7]) -> 593692 | AG52: of:=([.$B$9]^2)/(2*[.$B$7]) -> 250 | AH52: of:=(((2*[.$B$6])-[.$B$7])/[.$B$9])+((2*[.$B$4])/[.$B$3]) -> 0.69064 | AI52: of:=[.AG52]*[.AH52] -> 172.66 | AJ52: of:=[.AI52]^2 -> 29811.4756 | AK52: of:=SQRT([.AF52]+[.AJ52]) -> 789.62236265192 | AL52: of:=[.AK52]-[.AI52] -> 616.96236265192 | AM52: of:=[.$B$3]*([.AL52]/([.AE52]-[.AL52])) -> 12.3560142285806
E53: 51 | F53: of:=[.E53]*[.$B$3] -> 12750 | G53: of:=[.E53]*[.$B$4] -> 577.83 | J53: of:=[.$B$7] -> 20 | K53: of:=(2*[.$B$6])-[.$B$7] -> 60 | L53: of:=-2*[.T53] -> -1400 | M53: of:=((-[.K53])+SQRT(([.K53]^2) - (4*[.J53]*[.L53])))/(2*[.J53]) -> 7 | N53: of:=[.M53]-1 -> 6 | Q53: 6 | R53: of:=[.Q53]+1 -> 7 | S53: of:=[.$B$6] + (([.R53]-1) * [.$B$7]) -> 160 | T53: of:=([.R53]/2)*([.$B$6]+[.S53]) -> 700 | U53: of:=[.T53]>=[.G53] -> true | V53: of:=[.Q53]*[.$B$9] -> 600 | W53: of:=[.F53]+[.V53] -> 13350 | X53: of:=[.W53]>=[.$B$1] -> false | Y53: of:=[.V53]/[.W53] -> 0.0449438202247191 | Z53: of:=1-[.Y53] -> 0.955056179775281 | AA53: of:=[.Y53]/[.Z53] -> 0.0470588235294118 | AB53: of:=[.$B$3]*[.AA53] -> 11.7647058823529 | AE53: of:=[.W53] -> 13350 | AF53: of:=(2*[.AE53]*[.$B$4]*([.$B$9]^2))/([.$B$3]*[.$B$7]) -> 605022 | AG53: of:=([.$B$9]^2)/(2*[.$B$7]) -> 250 | AH53: of:=(((2*[.$B$6])-[.$B$7])/[.$B$9])+((2*[.$B$4])/[.$B$3]) -> 0.69064 | AI53: of:=[.AG53]*[.AH53] -> 172.66 | AJ53: of:=[.AI53]^2 -> 29811.4756 | AK53: of:=SQRT([.AF53]+[.AJ53]) -> 796.764378972855 | AL53: of:=[.AK53]-[.AI53] -> 624.104378972855 | AM53: of:=[.$B$3]*([.AL53]/([.AE53]-[.AL53])) -> 12.2605197614076
E54: 52 | F54: of:=[.E54]*[.$B$3] -> 13000 | G54: of:=[.E54]*[.$B$4] -> 589.16 | J54: of:=[.$B$7] -> 20 | K54: of:=(2*[.$B$6])-[.$B$7] -> 60 | L54: of:=-2*[.T54] -> -1400 | M54: of:=((-[.K54])+SQRT(([.K54]^2) - (4*[.J54]*[.L54])))/(2*[.J54]) -> 7 | N54: of:=[.M54]-1 -> 6 | Q54: 6 | R54: of:=[.Q54]+1 -> 7 | S54: of:=[.$B$6] + (([.R54]-1) * [.$B$7]) -> 160 | T54: of:=([.R54]/2)*([.$B$6]+[.S54]) -> 700 | U54: of:=[.T54]>=[.G54] -> true | V54: of:=[.Q54]*[.$B$9] -> 600 | W54: of:=[.F54]+[.V54] -> 13600 | X54: of:=[.W54]>=[.$B$1] -> false | Y54: of:=[.V54]/[.W54] -> 0.0441176470588235 | Z54: of:=1-[.Y54] -> 0.955882352941176 | AA54: of:=[.Y54]/[.Z54] -> 0.0461538461538462 | AB54: of:=[.$B$3]*[.AA54] -> 11.5384615384615 | AE54: of:=[.W54] -> 13600 | AF54: of:=(2*[.AE54]*[.$B$4]*([.$B$9]^2))/([.$B$3]*[.$B$7]) -> 616352 | AG54: of:=([.$B$9]^2)/(2*[.$B$7]) -> 250 | AH54: of:=(((2*[.$B$6])-[.$B$7])/[.$B$9])+((2*[.$B$4])/[.$B$3]) -> 0.69064 | AI54: of:=[.AG54]*[.AH54] -> 172.66 | AJ54: of:=[.AI54]^2 -> 29811.4756 | AK54: of:=SQRT([.AF54]+[.AJ54]) -> 803.842942122402 | AL54: of:=[.AK54]-[.AI54] -> 631.182942122402 | AM54: of:=[.$B$3]*([.AL54]/([.AE54]-[.AL54])) -> 12.1673191029209
E55: 53 | F55: of:=[.E55]*[.$B$3] -> 13250 | G55: of:=[.E55]*[.$B$4] -> 600.49 | J55: of:=[.$B$7] -> 20 | K55: of:=(2*[.$B$6])-[.$B$7] -> 60 | L55: of:=-2*[.T55] -> -1400 | M55: of:=((-[.K55])+SQRT(([.K55]^2) - (4*[.J55]*[.L55])))/(2*[.J55]) -> 7 | N55: of:=[.M55]-1 -> 6 | Q55: 6 | R55: of:=[.Q55]+1 -> 7 | S55: of:=[.$B$6] + (([.R55]-1) * [.$B$7]) -> 160 | T55: of:=([.R55]/2)*([.$B$6]+[.S55]) -> 700 | U55: of:=[.T55]>=[.G55] -> true | V55: of:=[.Q55]*[.$B$9] -> 600 | W55: of:=[.F55]+[.V55] -> 13850 | X55: of:=[.W55]>=[.$B$1] -> false | Y55: of:=[.V55]/[.W55] -> 0.0433212996389892 | Z55: of:=1-[.Y55] -> 0.956678700361011 | AA55: of:=[.Y55]/[.Z55] -> 0.0452830188679245 | AB55: of:=[.$B$3]*[.AA55] -> 11.3207547169811 | AE55: of:=[.W55] -> 13850 | AF55: of:=(2*[.AE55]*[.$B$4]*([.$B$9]^2))/([.$B$3]*[.$B$7]) -> 627682 | AG55: of:=([.$B$9]^2)/(2*[.$B$7]) -> 250 | AH55: of:=(((2*[.$B$6])-[.$B$7])/[.$B$9])+((2*[.$B$4])/[.$B$3]) -> 0.69064 | AI55: of:=[.AG55]*[.AH55] -> 172.66 | AJ55: of:=[.AI55]^2 -> 29811.4756 | AK55: of:=SQRT([.AF55]+[.AJ55]) -> 810.859713883974 | AL55: of:=[.AK55]-[.AI55] -> 638.199713883974 | AM55: of:=[.$B$3]*([.AL55]/([.AE55]-[.AL55])) -> 12.0763200332858
E56: 54 | F56: of:=[.E56]*[.$B$3] -> 13500 | G56: of:=[.E56]*[.$B$4] -> 611.82 | J56: of:=[.$B$7] -> 20 | K56: of:=(2*[.$B$6])-[.$B$7] -> 60 | L56: of:=-2*[.T56] -> -1400 | M56: of:=((-[.K56])+SQRT(([.K56]^2) - (4*[.J56]*[.L56])))/(2*[.J56]) -> 7 | N56: of:=[.M56]-1 -> 6 | Q56: 6 | R56: of:=[.Q56]+1 -> 7 | S56: of:=[.$B$6] + (([.R56]-1) * [.$B$7]) -> 160 | T56: of:=([.R56]/2)*([.$B$6]+[.S56]) -> 700 | U56: of:=[.T56]>=[.G56] -> true | V56: of:=[.Q56]*[.$B$9] -> 600 | W56: of:=[.F56]+[.V56] -> 14100 | X56: of:=[.W56]>=[.$B$1] -> false | Y56: of:=[.V56]/[.W56] -> 0.0425531914893617 | Z56: of:=1-[.Y56] -> 0.957446808510638 | AA56: of:=[.Y56]/[.Z56] -> 0.0444444444444444 | AB56: of:=[.$B$3]*[.AA56] -> 11.1111111111111 | AE56: of:=[.W56] -> 14100 | AF56: of:=(2*[.AE56]*[.$B$4]*([.$B$9]^2))/([.$B$3]*[.$B$7]) -> 639012 | AG56: of:=([.$B$9]^2)/(2*[.$B$7]) -> 250 | AH56: of:=(((2*[.$B$6])-[.$B$7])/[.$B$9])+((2*[.$B$4])/[.$B$3]) -> 0.69064 | AI56: of:=[.AG56]*[.AH56] -> 172.66 | AJ56: of:=[.AI56]^2 -> 29811.4756 | AK56: of:=SQRT([.AF56]+[.AJ56]) -> 817.816284748598 | AL56: of:=[.AK56]-[.AI56] -> 645.156284748598 | AM56: of:=[.$B$3]*([.AL56]/([.AE56]-[.AL56])) -> 11.9874354991076
E57: 55 | F57: of:=[.E57]*[.$B$3] -> 13750 | G57: of:=[.E57]*[.$B$4] -> 623.15 | J57: of:=[.$B$7] -> 20 | K57: of:=(2*[.$B$6])-[.$B$7] -> 60 | L57: of:=-2*[.T57] -> -1400 | M57: of:=((-[.K57])+SQRT(([.K57]^2) - (4*[.J57]*[.L57])))/(2*[.J57]) -> 7 | N57: of:=[.M57]-1 -> 6 | Q57: 6 | R57: of:=[.Q57]+1 -> 7 | S57: of:=[.$B$6] + (([.R57]-1) * [.$B$7]) -> 160 | T57: of:=([.R57]/2)*([.$B$6]+[.S57]) -> 700 | U57: of:=[.T57]>=[.G57] -> true | V57: of:=[.Q57]*[.$B$9] -> 600 | W57: of:=[.F57]+[.V57] -> 14350 | X57: of:=[.W57]>=[.$B$1] -> false | Y57: of:=[.V57]/[.W57] -> 0.0418118466898955 | Z57: of:=1-[.Y57] -> 0.958188153310105 | AA57: of:=[.Y57]/[.Z57] -> 0.0436363636363636 | AB57: of:=[.$B$3]*[.AA57] -> 10.9090909090909 | AE57: of:=[.W57] -> 14350 | AF57: of:=(2*[.AE57]*[.$B$4]*([.$B$9]^2))/([.$B$3]*[.$B$7]) -> 650342 | AG57: of:=([.$B$9]^2)/(2*[.$B$7]) -> 250 | AH57: of:=(((2*[.$B$6])-[.$B$7])/[.$B$9])+((2*[.$B$4])/[.$B$3]) -> 0.69064 | AI57: of:=[.AG57]*[.AH57] -> 172.66 | AJ57: of:=[.AI57]^2 -> 29811.4756 | AK57: of:=SQRT([.AF57]+[.AJ57]) -> 824.714178124761 | AL57: of:=[.AK57]-[.AI57] -> 652.054178124761 | AM57: of:=[.$B$3]*([.AL57]/([.AE57]-[.AL57])) -> 11.9005832444498
E58: 56 | F58: of:=[.E58]*[.$B$3] -> 14000 | G58: of:=[.E58]*[.$B$4] -> 634.48 | J58: of:=[.$B$7] -> 20 | K58: of:=(2*[.$B$6])-[.$B$7] -> 60 | L58: of:=-2*[.T58] -> -1400 | M58: of:=((-[.K58])+SQRT(([.K58]^2) - (4*[.J58]*[.L58])))/(2*[.J58]) -> 7 | N58: of:=[.M58]-1 -> 6 | Q58: 6 | R58: of:=[.Q58]+1 -> 7 | S58: of:=[.$B$6] + (([.R58]-1) * [.$B$7]) -> 160 | T58: of:=([.R58]/2)*([.$B$6]+[.S58]) -> 700 | U58: of:=[.T58]>=[.G58] -> true | V58: of:=[.Q58]*[.$B$9] -> 600 | W58: of:=[.F58]+[.V58] -> 14600 | X58: of:=[.W58]>=[.$B$1] -> false | Y58: of:=[.V58]/[.W58] -> 0.0410958904109589 | Z58: of:=1-[.Y58] -> 0.958904109589041 | AA58: of:=[.Y58]/[.Z58] -> 0.0428571428571429 | AB58: of:=[.$B$3]*[.AA58] -> 10.7142857142857 | AE58: of:=[.W58] -> 14600 | AF58: of:=(2*[.AE58]*[.$B$4]*([.$B$9]^2))/([.$B$3]*[.$B$7]) -> 661672 | AG58: of:=([.$B$9]^2)/(2*[.$B$7]) -> 250 | AH58: of:=(((2*[.$B$6])-[.$B$7])/[.$B$9])+((2*[.$B$4])/[.$B$3]) -> 0.69064 | AI58: of:=[.AG58]*[.AH58] -> 172.66 | AJ58: of:=[.AI58]^2 -> 29811.4756 | AK58: of:=SQRT([.AF58]+[.AJ58]) -> 831.554854233922 | AL58: of:=[.AK58]-[.AI58] -> 658.894854233923 | AM58: of:=[.$B$3]*([.AL58]/([.AE58]-[.AL58])) -> 11.8156854737235
E59: 57 | F59: of:=[.E59]*[.$B$3] -> 14250 | G59: of:=[.E59]*[.$B$4] -> 645.81 | J59: of:=[.$B$7] -> 20 | K59: of:=(2*[.$B$6])-[.$B$7] -> 60 | L59: of:=-2*[.T59] -> -1400 | M59: of:=((-[.K59])+SQRT(([.K59]^2) - (4*[.J59]*[.L59])))/(2*[.J59]) -> 7 | N59: of:=[.M59]-1 -> 6 | Q59: 6 | R59: of:=[.Q59]+1 -> 7 | S59: of:=[.$B$6] + (([.R59]-1) * [.$B$7]) -> 160 | T59: of:=([.R59]/2)*([.$B$6]+[.S59]) -> 700 | U59: of:=[.T59]>=[.G59] -> true | V59: of:=[.Q59]*[.$B$9] -> 600 | W59: of:=[.F59]+[.V59] -> 14850 | X59: of:=[.W59]>=[.$B$1] -> false | Y59: of:=[.V59]/[.W59] -> 0.0404040404040404 | Z59: of:=1-[.Y59] -> 0.95959595959596 | AA59: of:=[.Y59]/[.Z59] -> 0.0421052631578947 | AB59: of:=[.$B$3]*[.AA59] -> 10.5263157894737 | AE59: of:=[.W59] -> 14850 | AF59: of:=(2*[.AE59]*[.$B$4]*([.$B$9]^2))/([.$B$3]*[.$B$7]) -> 673002 | AG59: of:=([.$B$9]^2)/(2*[.$B$7]) -> 250 | AH59: of:=(((2*[.$B$6])-[.$B$7])/[.$B$9])+((2*[.$B$4])/[.$B$3]) -> 0.69064 | AI59: of:=[.AG59]*[.AH59] -> 172.66 | AJ59: of:=[.AI59]^2 -> 29811.4756 | AK59: of:=SQRT([.AF59]+[.AJ59]) -> 838.339713719922 | AL59: of:=[.AK59]-[.AI59] -> 665.679713719922 | AM59: of:=[.$B$3]*([.AL59]/([.AE59]-[.AL59])) -> 11.732668543233
E60: 58 | F60: of:=[.E60]*[.$B$3] -> 14500 | G60: of:=[.E60]*[.$B$4] -> 657.14 | J60: of:=[.$B$7] -> 20 | K60: of:=(2*[.$B$6])-[.$B$7] -> 60 | L60: of:=-2*[.T60] -> -1400 | M60: of:=((-[.K60])+SQRT(([.K60]^2) - (4*[.J60]*[.L60])))/(2*[.J60]) -> 7 | N60: of:=[.M60]-1 -> 6 | Q60: 6 | R60: of:=[.Q60]+1 -> 7 | S60: of:=[.$B$6] + (([.R60]-1) * [.$B$7]) -> 160 | T60: of:=([.R60]/2)*([.$B$6]+[.S60]) -> 700 | U60: of:=[.T60]>=[.G60] -> true | V60: of:=[.Q60]*[.$B$9] -> 600 | W60: of:=[.F60]+[.V60] -> 15100 | X60: of:=[.W60]>=[.$B$1] -> false | Y60: of:=[.V60]/[.W60] -> 0.0397350993377483 | Z60: of:=1-[.Y60] -> 0.960264900662252 | AA60: of:=[.Y60]/[.Z60] -> 0.0413793103448276 | AB60: of:=[.$B$3]*[.AA60] -> 10.3448275862069 | AE60: of:=[.W60] -> 15100 | AF60: of:=(2*[.AE60]*[.$B$4]*([.$B$9]^2))/([.$B$3]*[.$B$7]) -> 684332 | AG60: of:=([.$B$9]^2)/(2*[.$B$7]) -> 250 | AH60: of:=(((2*[.$B$6])-[.$B$7])/[.$B$9])+((2*[.$B$4])/[.$B$3]) -> 0.69064 | AI60: of:=[.AG60]*[.AH60] -> 172.66 | AJ60: of:=[.AI60]^2 -> 29811.4756 | AK60: of:=SQRT([.AF60]+[.AJ60]) -> 845.070100997545 | AL60: of:=[.AK60]-[.AI60] -> 672.410100997545 | AM60: of:=[.$B$3]*([.AL60]/([.AE60]-[.AL60])) -> 11.6514626785316
E61: 59 | F61: of:=[.E61]*[.$B$3] -> 14750 | G61: of:=[.E61]*[.$B$4] -> 668.47 | J61: of:=[.$B$7] -> 20 | K61: of:=(2*[.$B$6])-[.$B$7] -> 60 | L61: of:=-2*[.T61] -> -1400 | M61: of:=((-[.K61])+SQRT(([.K61]^2) - (4*[.J61]*[.L61])))/(2*[.J61]) -> 7 | N61: of:=[.M61]-1 -> 6 | Q61: 6 | R61: of:=[.Q61]+1 -> 7 | S61: of:=[.$B$6] + (([.R61]-1) * [.$B$7]) -> 160 | T61: of:=([.R61]/2)*([.$B$6]+[.S61]) -> 700 | U61: of:=[.T61]>=[.G61] -> true | V61: of:=[.Q61]*[.$B$9] -> 600 | W61: of:=[.F61]+[.V61] -> 15350 | X61: of:=[.W61]>=[.$B$1] -> false | Y61: of:=[.V61]/[.W61] -> 0.0390879478827362 | Z61: of:=1-[.Y61] -> 0.960912052117264 | AA61: of:=[.Y61]/[.Z61] -> 0.0406779661016949 | AB61: of:=[.$B$3]*[.AA61] -> 10.1694915254237 | AE61: of:=[.W61] -> 15350 | AF61: of:=(2*[.AE61]*[.$B$4]*([.$B$9]^2))/([.$B$3]*[.$B$7]) -> 695662 | AG61: of:=([.$B$9]^2)/(2*[.$B$7]) -> 250 | AH61: of:=(((2*[.$B$6])-[.$B$7])/[.$B$9])+((2*[.$B$4])/[.$B$3]) -> 0.69064 | AI61: of:=[.AG61]*[.AH61] -> 172.66 | AJ61: of:=[.AI61]^2 -> 29811.4756 | AK61: of:=SQRT([.AF61]+[.AJ61]) -> 851.747307362929 | AL61: of:=[.AK61]-[.AI61] -> 679.087307362929 | AM61: of:=[.$B$3]*([.AL61]/([.AE61]-[.AL61])) -> 11.5720017150628
E62: 60 | F62: of:=[.E62]*[.$B$3] -> 15000 | G62: of:=[.E62]*[.$B$4] -> 679.8 | J62: of:=[.$B$7] -> 20 | K62: of:=(2*[.$B$6])-[.$B$7] -> 60 | L62: of:=-2*[.T62] -> -1400 | M62: of:=((-[.K62])+SQRT(([.K62]^2) - (4*[.J62]*[.L62])))/(2*[.J62]) -> 7 | N62: of:=[.M62]-1 -> 6 | Q62: 6 | R62: of:=[.Q62]+1 -> 7 | S62: of:=[.$B$6] + (([.R62]-1) * [.$B$7]) -> 160 | T62: of:=([.R62]/2)*([.$B$6]+[.S62]) -> 700 | U62: of:=[.T62]>=[.G62] -> true | V62: of:=[.Q62]*[.$B$9] -> 600 | W62: of:=[.F62]+[.V62] -> 15600 | X62: of:=[.W62]>=[.$B$1] -> false | Y62: of:=[.V62]/[.W62] -> 0.0384615384615385 | Z62: of:=1-[.Y62] -> 0.961538461538462 | AA62: of:=[.Y62]/[.Z62] -> 0.04 | AB62: of:=[.$B$3]*[.AA62] -> 10 | AE62: of:=[.W62] -> 15600 | AF62: of:=(2*[.AE62]*[.$B$4]*([.$B$9]^2))/([.$B$3]*[.$B$7]) -> 706992 | AG62: of:=([.$B$9]^2)/(2*[.$B$7]) -> 250 | AH62: of:=(((2*[.$B$6])-[.$B$7])/[.$B$9])+((2*[.$B$4])/[.$B$3]) -> 0.69064 | AI62: of:=[.AG62]*[.AH62] -> 172.66 | AJ62: of:=[.AI62]^2 -> 29811.4756 | AK62: of:=SQRT([.AF62]+[.AJ62]) -> 858.372573886189 | AL62: of:=[.AK62]-[.AI62] -> 685.712573886188 | AM62: of:=[.$B$3]*([.AL62]/([.AE62]-[.AL62])) -> 11.4942228598457
E63: 61 | F63: of:=[.E63]*[.$B$3] -> 15250 | G63: of:=[.E63]*[.$B$4] -> 691.13 | J63: of:=[.$B$7] -> 20 | K63: of:=(2*[.$B$6])-[.$B$7] -> 60 | L63: of:=-2*[.T63] -> -1400 | M63: of:=((-[.K63])+SQRT(([.K63]^2) - (4*[.J63]*[.L63])))/(2*[.J63]) -> 7 | N63: of:=[.M63]-1 -> 6 | Q63: 6 | R63: of:=[.Q63]+1 -> 7 | S63: of:=[.$B$6] + (([.R63]-1) * [.$B$7]) -> 160 | T63: of:=([.R63]/2)*([.$B$6]+[.S63]) -> 700 | U63: of:=[.T63]>=[.G63] -> true | V63: of:=[.Q63]*[.$B$9] -> 600 | W63: of:=[.F63]+[.V63] -> 15850 | X63: of:=[.W63]>=[.$B$1] -> false | Y63: of:=[.V63]/[.W63] -> 0.0378548895899054 | Z63: of:=1-[.Y63] -> 0.962145110410095 | AA63: of:=[.Y63]/[.Z63] -> 0.039344262295082 | AB63: of:=[.$B$3]*[.AA63] -> 9.83606557377049 | AE63: of:=[.W63] -> 15850 | AF63: of:=(2*[.AE63]*[.$B$4]*([.$B$9]^2))/([.$B$3]*[.$B$7]) -> 718322 | AG63: of:=([.$B$9]^2)/(2*[.$B$7]) -> 250 | AH63: of:=(((2*[.$B$6])-[.$B$7])/[.$B$9])+((2*[.$B$4])/[.$B$3]) -> 0.69064 | AI63: of:=[.AG63]*[.AH63] -> 172.66 | AJ63: of:=[.AI63]^2 -> 29811.4756 | AK63: of:=SQRT([.AF63]+[.AJ63]) -> 864.947094104605 | AL63: of:=[.AK63]-[.AI63] -> 692.287094104605 | AM63: of:=[.$B$3]*([.AL63]/([.AE63]-[.AL63])) -> 11.4180664722075
E64: 62 | F64: of:=[.E64]*[.$B$3] -> 15500 | G64: of:=[.E64]*[.$B$4] -> 702.46 | J64: of:=[.$B$7] -> 20 | K64: of:=(2*[.$B$6])-[.$B$7] -> 60 | L64: of:=-2*[.T64] -> -1760 | M64: of:=((-[.K64])+SQRT(([.K64]^2) - (4*[.J64]*[.L64])))/(2*[.J64]) -> 8 | N64: of:=[.M64]-1 -> 7 | Q64: 7 | R64: of:=[.Q64]+1 -> 8 | S64: of:=[.$B$6] + (([.R64]-1) * [.$B$7]) -> 180 | T64: of:=([.R64]/2)*([.$B$6]+[.S64]) -> 880 | U64: of:=[.T64]>=[.G64] -> true | V64: of:=[.Q64]*[.$B$9] -> 700 | W64: of:=[.F64]+[.V64] -> 16200 | X64: of:=[.W64]>=[.$B$1] -> false | Y64: of:=[.V64]/[.W64] -> 0.0432098765432099 | Z64: of:=1-[.Y64] -> 0.95679012345679 | AA64: of:=[.Y64]/[.Z64] -> 0.0451612903225806 | AB64: of:=[.$B$3]*[.AA64] -> 11.2903225806452 | AE64: of:=[.W64] -> 16200 | AF64: of:=(2*[.AE64]*[.$B$4]*([.$B$9]^2))/([.$B$3]*[.$B$7]) -> 734184 | AG64: of:=([.$B$9]^2)/(2*[.$B$7]) -> 250 | AH64: of:=(((2*[.$B$6])-[.$B$7])/[.$B$9])+((2*[.$B$4])/[.$B$3]) -> 0.69064 | AI64: of:=[.AG64]*[.AH64] -> 172.66 | AJ64: of:=[.AI64]^2 -> 29811.4756 | AK64: of:=SQRT([.AF64]+[.AJ64]) -> 874.068347213191 | AL64: of:=[.AK64]-[.AI64] -> 701.408347213191 | AM64: of:=[.$B$3]*([.AL64]/([.AE64]-[.AL64])) -> 11.3140658668665
E65: 63 | F65: of:=[.E65]*[.$B$3] -> 15750 | G65: of:=[.E65]*[.$B$4] -> 713.79 | J65: of:=[.$B$7] -> 20 | K65: of:=(2*[.$B$6])-[.$B$7] -> 60 | L65: of:=-2*[.T65] -> -1760 | M65: of:=((-[.K65])+SQRT(([.K65]^2) - (4*[.J65]*[.L65])))/(2*[.J65]) -> 8 | N65: of:=[.M65]-1 -> 7 | Q65: 7 | R65: of:=[.Q65]+1 -> 8 | S65: of:=[.$B$6] + (([.R65]-1) * [.$B$7]) -> 180 | T65: of:=([.R65]/2)*([.$B$6]+[.S65]) -> 880 | U65: of:=[.T65]>=[.G65] -> true | V65: of:=[.Q65]*[.$B$9] -> 700 | W65: of:=[.F65]+[.V65] -> 16450 | X65: of:=[.W65]>=[.$B$1] -> false | Y65: of:=[.V65]/[.W65] -> 0.0425531914893617 | Z65: of:=1-[.Y65] -> 0.957446808510638 | AA65: of:=[.Y65]/[.Z65] -> 0.0444444444444444 | AB65: of:=[.$B$3]*[.AA65] -> 11.1111111111111 | AE65: of:=[.W65] -> 16450 | AF65: of:=(2*[.AE65]*[.$B$4]*([.$B$9]^2))/([.$B$3]*[.$B$7]) -> 745514 | AG65: of:=([.$B$9]^2)/(2*[.$B$7]) -> 250 | AH65: of:=(((2*[.$B$6])-[.$B$7])/[.$B$9])+((2*[.$B$4])/[.$B$3]) -> 0.69064 | AI65: of:=[.AG65]*[.AH65] -> 172.66 | AJ65: of:=[.AI65]^2 -> 29811.4756 | AK65: of:=SQRT([.AF65]+[.AJ65]) -> 880.525681397198 | AL65: of:=[.AK65]-[.AI65] -> 707.865681397198 | AM65: of:=[.$B$3]*([.AL65]/([.AE65]-[.AL65])) -> 11.2415773342865
E66: 64 | F66: of:=[.E66]*[.$B$3] -> 16000 | G66: of:=[.E66]*[.$B$4] -> 725.12 | J66: of:=[.$B$7] -> 20 | K66: of:=(2*[.$B$6])-[.$B$7] -> 60 | L66: of:=-2*[.T66] -> -1760 | M66: of:=((-[.K66])+SQRT(([.K66]^2) - (4*[.J66]*[.L66])))/(2*[.J66]) -> 8 | N66: of:=[.M66]-1 -> 7 | Q66: 7 | R66: of:=[.Q66]+1 -> 8 | S66: of:=[.$B$6] + (([.R66]-1) * [.$B$7]) -> 180 | T66: of:=([.R66]/2)*([.$B$6]+[.S66]) -> 880 | U66: of:=[.T66]>=[.G66] -> true | V66: of:=[.Q66]*[.$B$9] -> 700 | W66: of:=[.F66]+[.V66] -> 16700 | X66: of:=[.W66]>=[.$B$1] -> false | Y66: of:=[.V66]/[.W66] -> 0.0419161676646707 | Z66: of:=1-[.Y66] -> 0.958083832335329 | AA66: of:=[.Y66]/[.Z66] -> 0.04375 | AB66: of:=[.$B$3]*[.AA66] -> 10.9375 | AE66: of:=[.W66] -> 16700 | AF66: of:=(2*[.AE66]*[.$B$4]*([.$B$9]^2))/([.$B$3]*[.$B$7]) -> 756844 | AG66: of:=([.$B$9]^2)/(2*[.$B$7]) -> 250 | AH66: of:=(((2*[.$B$6])-[.$B$7])/[.$B$9])+((2*[.$B$4])/[.$B$3]) -> 0.69064 | AI66: of:=[.AG66]*[.AH66] -> 172.66 | AJ66: of:=[.AI66]^2 -> 29811.4756 | AK66: of:=SQRT([.AF66]+[.AJ66]) -> 886.936004230294 | AL66: of:=[.AK66]-[.AI66] -> 714.276004230294 | AM66: of:=[.$B$3]*([.AL66]/([.AE66]-[.AL66])) -> 11.1705294739749
E67: 65 | F67: of:=[.E67]*[.$B$3] -> 16250 | G67: of:=[.E67]*[.$B$4] -> 736.45 | J67: of:=[.$B$7] -> 20 | K67: of:=(2*[.$B$6])-[.$B$7] -> 60 | L67: of:=-2*[.T67] -> -1760 | M67: of:=((-[.K67])+SQRT(([.K67]^2) - (4*[.J67]*[.L67])))/(2*[.J67]) -> 8 | N67: of:=[.M67]-1 -> 7 | Q67: 7 | R67: of:=[.Q67]+1 -> 8 | S67: of:=[.$B$6] + (([.R67]-1) * [.$B$7]) -> 180 | T67: of:=([.R67]/2)*([.$B$6]+[.S67]) -> 880 | U67: of:=[.T67]>=[.G67] -> true | V67: of:=[.Q67]*[.$B$9] -> 700 | W67: of:=[.F67]+[.V67] -> 16950 | X67: of:=[.W67]>=[.$B$1] -> false | Y67: of:=[.V67]/[.W67] -> 0.0412979351032448 | Z67: of:=1-[.Y67] -> 0.958702064896755 | AA67: of:=[.Y67]/[.Z67] -> 0.0430769230769231 | AB67: of:=[.$B$3]*[.AA67] -> 10.7692307692308 | AE67: of:=[.W67] -> 16950 | AF67: of:=(2*[.AE67]*[.$B$4]*([.$B$9]^2))/([.$B$3]*[.$B$7]) -> 768174 | AG67: of:=([.$B$9]^2)/(2*[.$B$7]) -> 250 | AH67: of:=(((2*[.$B$6])-[.$B$7])/[.$B$9])+((2*[.$B$4])/[.$B$3]) -> 0.69064 | AI67: of:=[.AG67]*[.AH67] -> 172.66 | AJ67: of:=[.AI67]^2 -> 29811.4756 | AK67: of:=SQRT([.AF67]+[.AJ67]) -> 893.300327773364 | AL67: of:=[.AK67]-[.AI67] -> 720.640327773364 | AM67: of:=[.$B$3]*([.AL67]/([.AE67]-[.AL67])) -> 11.100874315556
E68: 66 | F68: of:=[.E68]*[.$B$3] -> 16500 | G68: of:=[.E68]*[.$B$4] -> 747.78 | J68: of:=[.$B$7] -> 20 | K68: of:=(2*[.$B$6])-[.$B$7] -> 60 | L68: of:=-2*[.T68] -> -1760 | M68: of:=((-[.K68])+SQRT(([.K68]^2) - (4*[.J68]*[.L68])))/(2*[.J68]) -> 8 | N68: of:=[.M68]-1 -> 7 | Q68: 7 | R68: of:=[.Q68]+1 -> 8 | S68: of:=[.$B$6] + (([.R68]-1) * [.$B$7]) -> 180 | T68: of:=([.R68]/2)*([.$B$6]+[.S68]) -> 880 | U68: of:=[.T68]>=[.G68] -> true | V68: of:=[.Q68]*[.$B$9] -> 700 | W68: of:=[.F68]+[.V68] -> 17200 | X68: of:=[.W68]>=[.$B$1] -> false | Y68: of:=[.V68]/[.W68] -> 0.0406976744186047 | Z68: of:=1-[.Y68] -> 0.959302325581395 | AA68: of:=[.Y68]/[.Z68] -> 0.0424242424242424 | AB68: of:=[.$B$3]*[.AA68] -> 10.6060606060606 | AE68: of:=[.W68] -> 17200 | AF68: of:=(2*[.AE68]*[.$B$4]*([.$B$9]^2))/([.$B$3]*[.$B$7]) -> 779504 | AG68: of:=([.$B$9]^2)/(2*[.$B$7]) -> 250 | AH68: of:=(((2*[.$B$6])-[.$B$7])/[.$B$9])+((2*[.$B$4])/[.$B$3]) -> 0.69064 | AI68: of:=[.AG68]*[.AH68] -> 172.66 | AJ68: of:=[.AI68]^2 -> 29811.4756 | AK68: of:=SQRT([.AF68]+[.AJ68]) -> 899.619628287423 | AL68: of:=[.AK68]-[.AI68] -> 726.959628287422 | AM68: of:=[.$B$3]*([.AL68]/([.AE68]-[.AL68])) -> 11.0325661183918
E69: 67 | F69: of:=[.E69]*[.$B$3] -> 16750 | G69: of:=[.E69]*[.$B$4] -> 759.11 | J69: of:=[.$B$7] -> 20 | K69: of:=(2*[.$B$6])-[.$B$7] -> 60 | L69: of:=-2*[.T69] -> -1760 | M69: of:=((-[.K69])+SQRT(([.K69]^2) - (4*[.J69]*[.L69])))/(2*[.J69]) -> 8 | N69: of:=[.M69]-1 -> 7 | Q69: 7 | R69: of:=[.Q69]+1 -> 8 | S69: of:=[.$B$6] + (([.R69]-1) * [.$B$7]) -> 180 | T69: of:=([.R69]/2)*([.$B$6]+[.S69]) -> 880 | U69: of:=[.T69]>=[.G69] -> true | V69: of:=[.Q69]*[.$B$9] -> 700 | W69: of:=[.F69]+[.V69] -> 17450 | X69: of:=[.W69]>=[.$B$1] -> false | Y69: of:=[.V69]/[.W69] -> 0.0401146131805158 | Z69: of:=1-[.Y69] -> 0.959885386819484 | AA69: of:=[.Y69]/[.Z69] -> 0.0417910447761194 | AB69: of:=[.$B$3]*[.AA69] -> 10.4477611940299 | AE69: of:=[.W69] -> 17450 | AF69: of:=(2*[.AE69]*[.$B$4]*([.$B$9]^2))/([.$B$3]*[.$B$7]) -> 790834 | AG69: of:=([.$B$9]^2)/(2*[.$B$7]) -> 250 | AH69: of:=(((2*[.$B$6])-[.$B$7])/[.$B$9])+((2*[.$B$4])/[.$B$3]) -> 0.69064 | AI69: of:=[.AG69]*[.AH69] -> 172.66 | AJ69: of:=[.AI69]^2 -> 29811.4756 | AK69: of:=SQRT([.AF69]+[.AJ69]) -> 905.894847981817 | AL69: of:=[.AK69]-[.AI69] -> 733.234847981817 | AM69: of:=[.$B$3]*([.AL69]/([.AE69]-[.AL69])) -> 10.9655612391805
E70: 68 | F70: of:=[.E70]*[.$B$3] -> 17000 | G70: of:=[.E70]*[.$B$4] -> 770.44 | J70: of:=[.$B$7] -> 20 | K70: of:=(2*[.$B$6])-[.$B$7] -> 60 | L70: of:=-2*[.T70] -> -1760 | M70: of:=((-[.K70])+SQRT(([.K70]^2) - (4*[.J70]*[.L70])))/(2*[.J70]) -> 8 | N70: of:=[.M70]-1 -> 7 | Q70: 7 | R70: of:=[.Q70]+1 -> 8 | S70: of:=[.$B$6] + (([.R70]-1) * [.$B$7]) -> 180 | T70: of:=([.R70]/2)*([.$B$6]+[.S70]) -> 880 | U70: of:=[.T70]>=[.G70] -> true | V70: of:=[.Q70]*[.$B$9] -> 700 | W70: of:=[.F70]+[.V70] -> 17700 | X70: of:=[.W70]>=[.$B$1] -> false | Y70: of:=[.V70]/[.W70] -> 0.0395480225988701 | Z70: of:=1-[.Y70] -> 0.96045197740113 | AA70: of:=[.Y70]/[.Z70] -> 0.0411764705882353 | AB70: of:=[.$B$3]*[.AA70] -> 10.2941176470588 | AE70: of:=[.W70] -> 17700 | AF70: of:=(2*[.AE70]*[.$B$4]*([.$B$9]^2))/([.$B$3]*[.$B$7]) -> 802164 | AG70: of:=([.$B$9]^2)/(2*[.$B$7]) -> 250 | AH70: of:=(((2*[.$B$6])-[.$B$7])/[.$B$9])+((2*[.$B$4])/[.$B$3]) -> 0.69064 | AI70: of:=[.AG70]*[.AH70] -> 172.66 | AJ70: of:=[.AI70]^2 -> 29811.4756 | AK70: of:=SQRT([.AF70]+[.AJ70]) -> 912.126896654188 | AL70: of:=[.AK70]-[.AI70] -> 739.466896654188 | AM70: of:=[.$B$3]*([.AL70]/([.AE70]-[.AL70])) -> 10.8998180090859
E71: 69 | F71: of:=[.E71]*[.$B$3] -> 17250 | G71: of:=[.E71]*[.$B$4] -> 781.77 | J71: of:=[.$B$7] -> 20 | K71: of:=(2*[.$B$6])-[.$B$7] -> 60 | L71: of:=-2*[.T71] -> -1760 | M71: of:=((-[.K71])+SQRT(([.K71]^2) - (4*[.J71]*[.L71])))/(2*[.J71]) -> 8 | N71: of:=[.M71]-1 -> 7 | Q71: 7 | R71: of:=[.Q71]+1 -> 8 | S71: of:=[.$B$6] + (([.R71]-1) * [.$B$7]) -> 180 | T71: of:=([.R71]/2)*([.$B$6]+[.S71]) -> 880 | U71: of:=[.T71]>=[.G71] -> true | V71: of:=[.Q71]*[.$B$9] -> 700 | W71: of:=[.F71]+[.V71] -> 17950 | X71: of:=[.W71]>=[.$B$1] -> false | Y71: of:=[.V71]/[.W71] -> 0.0389972144846797 | Z71: of:=1-[.Y71] -> 0.96100278551532 | AA71: of:=[.Y71]/[.Z71] -> 0.0405797101449275 | AB71: of:=[.$B$3]*[.AA71] -> 10.1449275362319 | AE71: of:=[.W71] -> 17950 | AF71: of:=(2*[.AE71]*[.$B$4]*([.$B$9]^2))/([.$B$3]*[.$B$7]) -> 813494 | AG71: of:=([.$B$9]^2)/(2*[.$B$7]) -> 250 | AH71: of:=(((2*[.$B$6])-[.$B$7])/[.$B$9])+((2*[.$B$4])/[.$B$3]) -> 0.69064 | AI71: of:=[.AG71]*[.AH71] -> 172.66 | AJ71: of:=[.AI71]^2 -> 29811.4756 | AK71: of:=SQRT([.AF71]+[.AJ71]) -> 918.316653230246 | AL71: of:=[.AK71]-[.AI71] -> 745.656653230246 | AM71: of:=[.$B$3]*([.AL71]/([.AE71]-[.AL71])) -> 10.8352966195924
E72: 70 | F72: of:=[.E72]*[.$B$3] -> 17500 | G72: of:=[.E72]*[.$B$4] -> 793.1 | J72: of:=[.$B$7] -> 20 | K72: of:=(2*[.$B$6])-[.$B$7] -> 60 | L72: of:=-2*[.T72] -> -1760 | M72: of:=((-[.K72])+SQRT(([.K72]^2) - (4*[.J72]*[.L72])))/(2*[.J72]) -> 8 | N72: of:=[.M72]-1 -> 7 | Q72: 7 | R72: of:=[.Q72]+1 -> 8 | S72: of:=[.$B$6] + (([.R72]-1) * [.$B$7]) -> 180 | T72: of:=([.R72]/2)*([.$B$6]+[.S72]) -> 880 | U72: of:=[.T72]>=[.G72] -> true | V72: of:=[.Q72]*[.$B$9] -> 700 | W72: of:=[.F72]+[.V72] -> 18200 | X72: of:=[.W72]>=[.$B$1] -> false | Y72: of:=[.V72]/[.W72] -> 0.0384615384615385 | Z72: of:=1-[.Y72] -> 0.961538461538462 | AA72: of:=[.Y72]/[.Z72] -> 0.04 | AB72: of:=[.$B$3]*[.AA72] -> 10 | AE72: of:=[.W72] -> 18200 | AF72: of:=(2*[.AE72]*[.$B$4]*([.$B$9]^2))/([.$B$3]*[.$B$7]) -> 824824 | AG72: of:=([.$B$9]^2)/(2*[.$B$7]) -> 250 | AH72: of:=(((2*[.$B$6])-[.$B$7])/[.$B$9])+((2*[.$B$4])/[.$B$3]) -> 0.69064 | AI72: of:=[.AG72]*[.AH72] -> 172.66 | AJ72: of:=[.AI72]^2 -> 29811.4756 | AK72: of:=SQRT([.AF72]+[.AJ72]) -> 924.464967210765 | AL72: of:=[.AK72]-[.AI72] -> 751.804967210765 | AM72: of:=[.$B$3]*([.AL72]/([.AE72]-[.AL72])) -> 10.7719590163617
E73: 71 | F73: of:=[.E73]*[.$B$3] -> 17750 | G73: of:=[.E73]*[.$B$4] -> 804.43 | J73: of:=[.$B$7] -> 20 | K73: of:=(2*[.$B$6])-[.$B$7] -> 60 | L73: of:=-2*[.T73] -> -1760 | M73: of:=((-[.K73])+SQRT(([.K73]^2) - (4*[.J73]*[.L73])))/(2*[.J73]) -> 8 | N73: of:=[.M73]-1 -> 7 | Q73: 7 | R73: of:=[.Q73]+1 -> 8 | S73: of:=[.$B$6] + (([.R73]-1) * [.$B$7]) -> 180 | T73: of:=([.R73]/2)*([.$B$6]+[.S73]) -> 880 | U73: of:=[.T73]>=[.G73] -> true | V73: of:=[.Q73]*[.$B$9] -> 700 | W73: of:=[.F73]+[.V73] -> 18450 | X73: of:=[.W73]>=[.$B$1] -> false | Y73: of:=[.V73]/[.W73] -> 0.037940379403794 | Z73: of:=1-[.Y73] -> 0.962059620596206 | AA73: of:=[.Y73]/[.Z73] -> 0.0394366197183099 | AB73: of:=[.$B$3]*[.AA73] -> 9.85915492957746 | AE73: of:=[.W73] -> 18450 | AF73: of:=(2*[.AE73]*[.$B$4]*([.$B$9]^2))/([.$B$3]*[.$B$7]) -> 836154 | AG73: of:=([.$B$9]^2)/(2*[.$B$7]) -> 250 | AH73: of:=(((2*[.$B$6])-[.$B$7])/[.$B$9])+((2*[.$B$4])/[.$B$3]) -> 0.69064 | AI73: of:=[.AG73]*[.AH73] -> 172.66 | AJ73: of:=[.AI73]^2 -> 29811.4756 | AK73: of:=SQRT([.AF73]+[.AJ73]) -> 930.57266003252 | AL73: of:=[.AK73]-[.AI73] -> 757.91266003252 | AM73: of:=[.$B$3]*([.AL73]/([.AE73]-[.AL73])) -> 10.7097688004336
E74: 72 | F74: of:=[.E74]*[.$B$3] -> 18000 | G74: of:=[.E74]*[.$B$4] -> 815.76 | J74: of:=[.$B$7] -> 20 | K74: of:=(2*[.$B$6])-[.$B$7] -> 60 | L74: of:=-2*[.T74] -> -1760 | M74: of:=((-[.K74])+SQRT(([.K74]^2) - (4*[.J74]*[.L74])))/(2*[.J74]) -> 8 | N74: of:=[.M74]-1 -> 7 | Q74: 7 | R74: of:=[.Q74]+1 -> 8 | S74: of:=[.$B$6] + (([.R74]-1) * [.$B$7]) -> 180 | T74: of:=([.R74]/2)*([.$B$6]+[.S74]) -> 880 | U74: of:=[.T74]>=[.G74] -> true | V74: of:=[.Q74]*[.$B$9] -> 700 | W74: of:=[.F74]+[.V74] -> 18700 | X74: of:=[.W74]>=[.$B$1] -> false | Y74: of:=[.V74]/[.W74] -> 0.0374331550802139 | Z74: of:=1-[.Y74] -> 0.962566844919786 | AA74: of:=[.Y74]/[.Z74] -> 0.0388888888888889 | AB74: of:=[.$B$3]*[.AA74] -> 9.72222222222222 | AE74: of:=[.W74] -> 18700 | AF74: of:=(2*[.AE74]*[.$B$4]*([.$B$9]^2))/([.$B$3]*[.$B$7]) -> 847484 | AG74: of:=([.$B$9]^2)/(2*[.$B$7]) -> 250 | AH74: of:=(((2*[.$B$6])-[.$B$7])/[.$B$9])+((2*[.$B$4])/[.$B$3]) -> 0.69064 | AI74: of:=[.AG74]*[.AH74] -> 172.66 | AJ74: of:=[.AI74]^2 -> 29811.4756 | AK74: of:=SQRT([.AF74]+[.AJ74]) -> 936.640526349357 | AL74: of:=[.AK74]-[.AI74] -> 763.980526349357 | AM74: of:=[.$B$3]*([.AL74]/([.AE74]-[.AL74])) -> 10.6486911361757
E75: 73 | F75: of:=[.E75]*[.$B$3] -> 18250 | G75: of:=[.E75]*[.$B$4] -> 827.09 | J75: of:=[.$B$7] -> 20 | K75: of:=(2*[.$B$6])-[.$B$7] -> 60 | L75: of:=-2*[.T75] -> -1760 | M75: of:=((-[.K75])+SQRT(([.K75]^2) - (4*[.J75]*[.L75])))/(2*[.J75]) -> 8 | N75: of:=[.M75]-1 -> 7 | Q75: 7 | R75: of:=[.Q75]+1 -> 8 | S75: of:=[.$B$6] + (([.R75]-1) * [.$B$7]) -> 180 | T75: of:=([.R75]/2)*([.$B$6]+[.S75]) -> 880 | U75: of:=[.T75]>=[.G75] -> true | V75: of:=[.Q75]*[.$B$9] -> 700 | W75: of:=[.F75]+[.V75] -> 18950 | X75: of:=[.W75]>=[.$B$1] -> false | Y75: of:=[.V75]/[.W75] -> 0.0369393139841689 | Z75: of:=1-[.Y75] -> 0.963060686015831 | AA75: of:=[.Y75]/[.Z75] -> 0.0383561643835616 | AB75: of:=[.$B$3]*[.AA75] -> 9.58904109589041 | AE75: of:=[.W75] -> 18950 | AF75: of:=(2*[.AE75]*[.$B$4]*([.$B$9]^2))/([.$B$3]*[.$B$7]) -> 858814 | AG75: of:=([.$B$9]^2)/(2*[.$B$7]) -> 250 | AH75: of:=(((2*[.$B$6])-[.$B$7])/[.$B$9])+((2*[.$B$4])/[.$B$3]) -> 0.69064 | AI75: of:=[.AG75]*[.AH75] -> 172.66 | AJ75: of:=[.AI75]^2 -> 29811.4756 | AK75: of:=SQRT([.AF75]+[.AJ75]) -> 942.669335239033 | AL75: of:=[.AK75]-[.AI75] -> 770.009335239033 | AM75: of:=[.$B$3]*([.AL75]/([.AE75]-[.AL75])) -> 10.588692665442
E76: 74 | F76: of:=[.E76]*[.$B$3] -> 18500 | G76: of:=[.E76]*[.$B$4] -> 838.42 | J76: of:=[.$B$7] -> 20 | K76: of:=(2*[.$B$6])-[.$B$7] -> 60 | L76: of:=-2*[.T76] -> -1760 | M76: of:=((-[.K76])+SQRT(([.K76]^2) - (4*[.J76]*[.L76])))/(2*[.J76]) -> 8 | N76: of:=[.M76]-1 -> 7 | Q76: 7 | R76: of:=[.Q76]+1 -> 8 | S76: of:=[.$B$6] + (([.R76]-1) * [.$B$7]) -> 180 | T76: of:=([.R76]/2)*([.$B$6]+[.S76]) -> 880 | U76: of:=[.T76]>=[.G76] -> true | V76: of:=[.Q76]*[.$B$9] -> 700 | W76: of:=[.F76]+[.V76] -> 19200 | X76: of:=[.W76]>=[.$B$1] -> false | Y76: of:=[.V76]/[.W76] -> 0.0364583333333333 | Z76: of:=1-[.Y76] -> 0.963541666666667 | AA76: of:=[.Y76]/[.Z76] -> 0.0378378378378378 | AB76: of:=[.$B$3]*[.AA76] -> 9.45945945945946 | AE76: of:=[.W76] -> 19200 | AF76: of:=(2*[.AE76]*[.$B$4]*([.$B$9]^2))/([.$B$3]*[.$B$7]) -> 870144 | AG76: of:=([.$B$9]^2)/(2*[.$B$7]) -> 250 | AH76: of:=(((2*[.$B$6])-[.$B$7])/[.$B$9])+((2*[.$B$4])/[.$B$3]) -> 0.69064 | AI76: of:=[.AG76]*[.AH76] -> 172.66 | AJ76: of:=[.AI76]^2 -> 29811.4756 | AK76: of:=SQRT([.AF76]+[.AJ76]) -> 948.659831341035 | AL76: of:=[.AK76]-[.AI76] -> 775.999831341035 | AM76: of:=[.$B$3]*([.AL76]/([.AE76]-[.AL76])) -> 10.5297414274492
E77: 75 | F77: of:=[.E77]*[.$B$3] -> 18750 | G77: of:=[.E77]*[.$B$4] -> 849.75 | J77: of:=[.$B$7] -> 20 | K77: of:=(2*[.$B$6])-[.$B$7] -> 60 | L77: of:=-2*[.T77] -> -1760 | M77: of:=((-[.K77])+SQRT(([.K77]^2) - (4*[.J77]*[.L77])))/(2*[.J77]) -> 8 | N77: of:=[.M77]-1 -> 7 | Q77: 7 | R77: of:=[.Q77]+1 -> 8 | S77: of:=[.$B$6] + (([.R77]-1) * [.$B$7]) -> 180 | T77: of:=([.R77]/2)*([.$B$6]+[.S77]) -> 880 | U77: of:=[.T77]>=[.G77] -> true | V77: of:=[.Q77]*[.$B$9] -> 700 | W77: of:=[.F77]+[.V77] -> 19450 | X77: of:=[.W77]>=[.$B$1] -> false | Y77: of:=[.V77]/[.W77] -> 0.0359897172236504 | Z77: of:=1-[.Y77] -> 0.96401028277635 | AA77: of:=[.Y77]/[.Z77] -> 0.0373333333333333 | AB77: of:=[.$B$3]*[.AA77] -> 9.33333333333333 | AE77: of:=[.W77] -> 19450 | AF77: of:=(2*[.AE77]*[.$B$4]*([.$B$9]^2))/([.$B$3]*[.$B$7]) -> 881474 | AG77: of:=([.$B$9]^2)/(2*[.$B$7]) -> 250 | AH77: of:=(((2*[.$B$6])-[.$B$7])/[.$B$9])+((2*[.$B$4])/[.$B$3]) -> 0.69064 | AI77: of:=[.AG77]*[.AH77] -> 172.66 | AJ77: of:=[.AI77]^2 -> 29811.4756 | AK77: of:=SQRT([.AF77]+[.AJ77]) -> 954.612735930126 | AL77: of:=[.AK77]-[.AI77] -> 781.952735930126 | AM77: of:=[.$B$3]*([.AL77]/([.AE77]-[.AL77])) -> 10.4718067839256
E78: 76 | F78: of:=[.E78]*[.$B$3] -> 19000 | G78: of:=[.E78]*[.$B$4] -> 861.08 | J78: of:=[.$B$7] -> 20 | K78: of:=(2*[.$B$6])-[.$B$7] -> 60 | L78: of:=-2*[.T78] -> -1760 | M78: of:=((-[.K78])+SQRT(([.K78]^2) - (4*[.J78]*[.L78])))/(2*[.J78]) -> 8 | N78: of:=[.M78]-1 -> 7 | Q78: 7 | R78: of:=[.Q78]+1 -> 8 | S78: of:=[.$B$6] + (([.R78]-1) * [.$B$7]) -> 180 | T78: of:=([.R78]/2)*([.$B$6]+[.S78]) -> 880 | U78: of:=[.T78]>=[.G78] -> true | V78: of:=[.Q78]*[.$B$9] -> 700 | W78: of:=[.F78]+[.V78] -> 19700 | X78: of:=[.W78]>=[.$B$1] -> false | Y78: of:=[.V78]/[.W78] -> 0.0355329949238579 | Z78: of:=1-[.Y78] -> 0.964467005076142 | AA78: of:=[.Y78]/[.Z78] -> 0.0368421052631579 | AB78: of:=[.$B$3]*[.AA78] -> 9.21052631578947 | AE78: of:=[.W78] -> 19700 | AF78: of:=(2*[.AE78]*[.$B$4]*([.$B$9]^2))/([.$B$3]*[.$B$7]) -> 892804 | AG78: of:=([.$B$9]^2)/(2*[.$B$7]) -> 250 | AH78: of:=(((2*[.$B$6])-[.$B$7])/[.$B$9])+((2*[.$B$4])/[.$B$3]) -> 0.69064 | AI78: of:=[.AG78]*[.AH78] -> 172.66 | AJ78: of:=[.AI78]^2 -> 29811.4756 | AK78: of:=SQRT([.AF78]+[.AJ78]) -> 960.528747930014 | AL78: of:=[.AK78]-[.AI78] -> 787.868747930014 | AM78: of:=[.$B$3]*([.AL78]/([.AE78]-[.AL78])) -> 10.4148593491252
E79: 77 | F79: of:=[.E79]*[.$B$3] -> 19250 | G79: of:=[.E79]*[.$B$4] -> 872.41 | J79: of:=[.$B$7] -> 20 | K79: of:=(2*[.$B$6])-[.$B$7] -> 60 | L79: of:=-2*[.T79] -> -1760 | M79: of:=((-[.K79])+SQRT(([.K79]^2) - (4*[.J79]*[.L79])))/(2*[.J79]) -> 8 | N79: of:=[.M79]-1 -> 7 | Q79: 7 | R79: of:=[.Q79]+1 -> 8 | S79: of:=[.$B$6] + (([.R79]-1) * [.$B$7]) -> 180 | T79: of:=([.R79]/2)*([.$B$6]+[.S79]) -> 880 | U79: of:=[.T79]>=[.G79] -> true | V79: of:=[.Q79]*[.$B$9] -> 700 | W79: of:=[.F79]+[.V79] -> 19950 | X79: of:=[.W79]>=[.$B$1] -> false | Y79: of:=[.V79]/[.W79] -> 0.0350877192982456 | Z79: of:=1-[.Y79] -> 0.964912280701754 | AA79: of:=[.Y79]/[.Z79] -> 0.0363636363636364 | AB79: of:=[.$B$3]*[.AA79] -> 9.09090909090909 | AE79: of:=[.W79] -> 19950 | AF79: of:=(2*[.AE79]*[.$B$4]*([.$B$9]^2))/([.$B$3]*[.$B$7]) -> 904134 | AG79: of:=([.$B$9]^2)/(2*[.$B$7]) -> 250 | AH79: of:=(((2*[.$B$6])-[.$B$7])/[.$B$9])+((2*[.$B$4])/[.$B$3]) -> 0.69064 | AI79: of:=[.AG79]*[.AH79] -> 172.66 | AJ79: of:=[.AI79]^2 -> 29811.4756 | AK79: of:=SQRT([.AF79]+[.AJ79]) -> 966.408544871164 | AL79: of:=[.AK79]-[.AI79] -> 793.748544871164 | AM79: of:=[.$B$3]*([.AL79]/([.AE79]-[.AL79])) -> 10.3588709243354
E80: 78 | F80: of:=[.E80]*[.$B$3] -> 19500 | G80: of:=[.E80]*[.$B$4] -> 883.74 | J80: of:=[.$B$7] -> 20 | K80: of:=(2*[.$B$6])-[.$B$7] -> 60 | L80: of:=-2*[.T80] -> -2160 | M80: of:=((-[.K80])+SQRT(([.K80]^2) - (4*[.J80]*[.L80])))/(2*[.J80]) -> 9 | N80: of:=[.M80]-1 -> 8 | Q80: 8 | R80: of:=[.Q80]+1 -> 9 | S80: of:=[.$B$6] + (([.R80]-1) * [.$B$7]) -> 200 | T80: of:=([.R80]/2)*([.$B$6]+[.S80]) -> 1080 | U80: of:=[.T80]>=[.G80] -> true | V80: of:=[.Q80]*[.$B$9] -> 800 | W80: of:=[.F80]+[.V80] -> 20300 | X80: of:=[.W80]>=[.$B$1] -> false | Y80: of:=[.V80]/[.W80] -> 0.0394088669950739 | Z80: of:=1-[.Y80] -> 0.960591133004926 | AA80: of:=[.Y80]/[.Z80] -> 0.041025641025641 | AB80: of:=[.$B$3]*[.AA80] -> 10.2564102564103 | AE80: of:=[.W80] -> 20300 | AF80: of:=(2*[.AE80]*[.$B$4]*([.$B$9]^2))/([.$B$3]*[.$B$7]) -> 919996 | AG80: of:=([.$B$9]^2)/(2*[.$B$7]) -> 250 | AH80: of:=(((2*[.$B$6])-[.$B$7])/[.$B$9])+((2*[.$B$4])/[.$B$3]) -> 0.69064 | AI80: of:=[.AG80]*[.AH80] -> 172.66 | AJ80: of:=[.AI80]^2 -> 29811.4756 | AK80: of:=SQRT([.AF80]+[.AJ80]) -> 974.580666543309 | AL80: of:=[.AK80]-[.AI80] -> 801.920666543309 | AM80: of:=[.$B$3]*([.AL80]/([.AE80]-[.AL80])) -> 10.2820469240693
E81: 79 | F81: of:=[.E81]*[.$B$3] -> 19750 | G81: of:=[.E81]*[.$B$4] -> 895.07 | J81: of:=[.$B$7] -> 20 | K81: of:=(2*[.$B$6])-[.$B$7] -> 60 | L81: of:=-2*[.T81] -> -2160 | M81: of:=((-[.K81])+SQRT(([.K81]^2) - (4*[.J81]*[.L81])))/(2*[.J81]) -> 9 | N81: of:=[.M81]-1 -> 8 | Q81: 8 | R81: of:=[.Q81]+1 -> 9 | S81: of:=[.$B$6] + (([.R81]-1) * [.$B$7]) -> 200 | T81: of:=([.R81]/2)*([.$B$6]+[.S81]) -> 1080 | U81: of:=[.T81]>=[.G81] -> true | V81: of:=[.Q81]*[.$B$9] -> 800 | W81: of:=[.F81]+[.V81] -> 20550 | X81: of:=[.W81]>=[.$B$1] -> false | Y81: of:=[.V81]/[.W81] -> 0.0389294403892944 | Z81: of:=1-[.Y81] -> 0.961070559610706 | AA81: of:=[.Y81]/[.Z81] -> 0.0405063291139241 | AB81: of:=[.$B$3]*[.AA81] -> 10.126582278481 | AE81: of:=[.W81] -> 20550 | AF81: of:=(2*[.AE81]*[.$B$4]*([.$B$9]^2))/([.$B$3]*[.$B$7]) -> 931326 | AG81: of:=([.$B$9]^2)/(2*[.$B$7]) -> 250 | AH81: of:=(((2*[.$B$6])-[.$B$7])/[.$B$9])+((2*[.$B$4])/[.$B$3]) -> 0.69064 | AI81: of:=[.AG81]*[.AH81] -> 172.66 | AJ81: of:=[.AI81]^2 -> 29811.4756 | AK81: of:=SQRT([.AF81]+[.AJ81]) -> 980.376190857367 | AL81: of:=[.AK81]-[.AI81] -> 807.716190857367 | AM81: of:=[.$B$3]*([.AL81]/([.AE81]-[.AL81])) -> 10.2282516889373
E82: 80 | F82: of:=[.E82]*[.$B$3] -> 20000 | G82: of:=[.E82]*[.$B$4] -> 906.4 | J82: of:=[.$B$7] -> 20 | K82: of:=(2*[.$B$6])-[.$B$7] -> 60 | L82: of:=-2*[.T82] -> -2160 | M82: of:=((-[.K82])+SQRT(([.K82]^2) - (4*[.J82]*[.L82])))/(2*[.J82]) -> 9 | N82: of:=[.M82]-1 -> 8 | Q82: 8 | R82: of:=[.Q82]+1 -> 9 | S82: of:=[.$B$6] + (([.R82]-1) * [.$B$7]) -> 200 | T82: of:=([.R82]/2)*([.$B$6]+[.S82]) -> 1080 | U82: of:=[.T82]>=[.G82] -> true | V82: of:=[.Q82]*[.$B$9] -> 800 | W82: of:=[.F82]+[.V82] -> 20800 | X82: of:=[.W82]>=[.$B$1] -> false | Y82: of:=[.V82]/[.W82] -> 0.0384615384615385 | Z82: of:=1-[.Y82] -> 0.961538461538462 | AA82: of:=[.Y82]/[.Z82] -> 0.04 | AB82: of:=[.$B$3]*[.AA82] -> 10 | AE82: of:=[.W82] -> 20800 | AF82: of:=(2*[.AE82]*[.$B$4]*([.$B$9]^2))/([.$B$3]*[.$B$7]) -> 942656 | AG82: of:=([.$B$9]^2)/(2*[.$B$7]) -> 250 | AH82: of:=(((2*[.$B$6])-[.$B$7])/[.$B$9])+((2*[.$B$4])/[.$B$3]) -> 0.69064 | AI82: of:=[.AG82]*[.AH82] -> 172.66 | AJ82: of:=[.AI82]^2 -> 29811.4756 | AK82: of:=SQRT([.AF82]+[.AJ82]) -> 986.137655502517 | AL82: of:=[.AK82]-[.AI82] -> 813.477655502517 | AM82: of:=[.$B$3]*([.AL82]/([.AE82]-[.AL82])) -> 10.1753276718308
E83: 81 | F83: of:=[.E83]*[.$B$3] -> 20250 | G83: of:=[.E83]*[.$B$4] -> 917.73 | J83: of:=[.$B$7] -> 20 | K83: of:=(2*[.$B$6])-[.$B$7] -> 60 | L83: of:=-2*[.T83] -> -2160 | M83: of:=((-[.K83])+SQRT(([.K83]^2) - (4*[.J83]*[.L83])))/(2*[.J83]) -> 9 | N83: of:=[.M83]-1 -> 8 | Q83: 8 | R83: of:=[.Q83]+1 -> 9 | S83: of:=[.$B$6] + (([.R83]-1) * [.$B$7]) -> 200 | T83: of:=([.R83]/2)*([.$B$6]+[.S83]) -> 1080 | U83: of:=[.T83]>=[.G83] -> true | V83: of:=[.Q83]*[.$B$9] -> 800 | W83: of:=[.F83]+[.V83] -> 21050 | X83: of:=[.W83]>=[.$B$1] -> false | Y83: of:=[.V83]/[.W83] -> 0.0380047505938242 | Z83: of:=1-[.Y83] -> 0.961995249406176 | AA83: of:=[.Y83]/[.Z83] -> 0.0395061728395062 | AB83: of:=[.$B$3]*[.AA83] -> 9.87654320987654 | AE83: of:=[.W83] -> 21050 | AF83: of:=(2*[.AE83]*[.$B$4]*([.$B$9]^2))/([.$B$3]*[.$B$7]) -> 953986 | AG83: of:=([.$B$9]^2)/(2*[.$B$7]) -> 250 | AH83: of:=(((2*[.$B$6])-[.$B$7])/[.$B$9])+((2*[.$B$4])/[.$B$3]) -> 0.69064 | AI83: of:=[.AG83]*[.AH83] -> 172.66 | AJ83: of:=[.AI83]^2 -> 29811.4756 | AK83: of:=SQRT([.AF83]+[.AJ83]) -> 991.865654007638 | AL83: of:=[.AK83]-[.AI83] -> 819.205654007638 | AM83: of:=[.$B$3]*([.AL83]/([.AE83]-[.AL83])) -> 10.123251217888
E84: 82 | F84: of:=[.E84]*[.$B$3] -> 20500 | G84: of:=[.E84]*[.$B$4] -> 929.06 | J84: of:=[.$B$7] -> 20 | K84: of:=(2*[.$B$6])-[.$B$7] -> 60 | L84: of:=-2*[.T84] -> -2160 | M84: of:=((-[.K84])+SQRT(([.K84]^2) - (4*[.J84]*[.L84])))/(2*[.J84]) -> 9 | N84: of:=[.M84]-1 -> 8 | Q84: 8 | R84: of:=[.Q84]+1 -> 9 | S84: of:=[.$B$6] + (([.R84]-1) * [.$B$7]) -> 200 | T84: of:=([.R84]/2)*([.$B$6]+[.S84]) -> 1080 | U84: of:=[.T84]>=[.G84] -> true | V84: of:=[.Q84]*[.$B$9] -> 800 | W84: of:=[.F84]+[.V84] -> 21300 | X84: of:=[.W84]>=[.$B$1] -> false | Y84: of:=[.V84]/[.W84] -> 0.0375586854460094 | Z84: of:=1-[.Y84] -> 0.962441314553991 | AA84: of:=[.Y84]/[.Z84] -> 0.0390243902439024 | AB84: of:=[.$B$3]*[.AA84] -> 9.75609756097561 | AE84: of:=[.W84] -> 21300 | AF84: of:=(2*[.AE84]*[.$B$4]*([.$B$9]^2))/([.$B$3]*[.$B$7]) -> 965316 | AG84: of:=([.$B$9]^2)/(2*[.$B$7]) -> 250 | AH84: of:=(((2*[.$B$6])-[.$B$7])/[.$B$9])+((2*[.$B$4])/[.$B$3]) -> 0.69064 | AI84: of:=[.AG84]*[.AH84] -> 172.66 | AJ84: of:=[.AI84]^2 -> 29811.4756 | AK84: of:=SQRT([.AF84]+[.AJ84]) -> 997.56076286109 | AL84: of:=[.AK84]-[.AI84] -> 824.90076286109 | AM84: of:=[.$B$3]*([.AL84]/([.AE84]-[.AL84])) -> 10.0719995701515
E85: 83 | F85: of:=[.E85]*[.$B$3] -> 20750 | G85: of:=[.E85]*[.$B$4] -> 940.39 | J85: of:=[.$B$7] -> 20 | K85: of:=(2*[.$B$6])-[.$B$7] -> 60 | L85: of:=-2*[.T85] -> -2160 | M85: of:=((-[.K85])+SQRT(([.K85]^2) - (4*[.J85]*[.L85])))/(2*[.J85]) -> 9 | N85: of:=[.M85]-1 -> 8 | Q85: 8 | R85: of:=[.Q85]+1 -> 9 | S85: of:=[.$B$6] + (([.R85]-1) * [.$B$7]) -> 200 | T85: of:=([.R85]/2)*([.$B$6]+[.S85]) -> 1080 | U85: of:=[.T85]>=[.G85] -> true | V85: of:=[.Q85]*[.$B$9] -> 800 | W85: of:=[.F85]+[.V85] -> 21550 | X85: of:=[.W85]>=[.$B$1] -> false | Y85: of:=[.V85]/[.W85] -> 0.037122969837587 | Z85: of:=1-[.Y85] -> 0.962877030162413 | AA85: of:=[.Y85]/[.Z85] -> 0.0385542168674699 | AB85: of:=[.$B$3]*[.AA85] -> 9.63855421686747 | AE85: of:=[.W85] -> 21550 | AF85: of:=(2*[.AE85]*[.$B$4]*([.$B$9]^2))/([.$B$3]*[.$B$7]) -> 976646 | AG85: of:=([.$B$9]^2)/(2*[.$B$7]) -> 250 | AH85: of:=(((2*[.$B$6])-[.$B$7])/[.$B$9])+((2*[.$B$4])/[.$B$3]) -> 0.69064 | AI85: of:=[.AG85]*[.AH85] -> 172.66 | AJ85: of:=[.AI85]^2 -> 29811.4756 | AK85: of:=SQRT([.AF85]+[.AJ85]) -> 1003.22354218788 | AL85: of:=[.AK85]-[.AI85] -> 830.563542187882 | AM85: of:=[.$B$3]*([.AL85]/([.AE85]-[.AL85])) -> 10.0215508259483
E86: 84 | F86: of:=[.E86]*[.$B$3] -> 21000 | G86: of:=[.E86]*[.$B$4] -> 951.72 | J86: of:=[.$B$7] -> 20 | K86: of:=(2*[.$B$6])-[.$B$7] -> 60 | L86: of:=-2*[.T86] -> -2160 | M86: of:=((-[.K86])+SQRT(([.K86]^2) - (4*[.J86]*[.L86])))/(2*[.J86]) -> 9 | N86: of:=[.M86]-1 -> 8 | Q86: 8 | R86: of:=[.Q86]+1 -> 9 | S86: of:=[.$B$6] + (([.R86]-1) * [.$B$7]) -> 200 | T86: of:=([.R86]/2)*([.$B$6]+[.S86]) -> 1080 | U86: of:=[.T86]>=[.G86] -> true | V86: of:=[.Q86]*[.$B$9] -> 800 | W86: of:=[.F86]+[.V86] -> 21800 | X86: of:=[.W86]>=[.$B$1] -> false | Y86: of:=[.V86]/[.W86] -> 0.036697247706422 | Z86: of:=1-[.Y86] -> 0.963302752293578 | AA86: of:=[.Y86]/[.Z86] -> 0.0380952380952381 | AB86: of:=[.$B$3]*[.AA86] -> 9.52380952380953 | AE86: of:=[.W86] -> 21800 | AF86: of:=(2*[.AE86]*[.$B$4]*([.$B$9]^2))/([.$B$3]*[.$B$7]) -> 987976 | AG86: of:=([.$B$9]^2)/(2*[.$B$7]) -> 250 | AH86: of:=(((2*[.$B$6])-[.$B$7])/[.$B$9])+((2*[.$B$4])/[.$B$3]) -> 0.69064 | AI86: of:=[.AG86]*[.AH86] -> 172.66 | AJ86: of:=[.AI86]^2 -> 29811.4756 | AK86: of:=SQRT([.AF86]+[.AJ86]) -> 1008.85453639264 | AL86: of:=[.AK86]-[.AI86] -> 836.194536392636 | AM86: of:=[.$B$3]*([.AL86]/([.AE86]-[.AL86])) -> 9.9718838958443
E87: 85 | F87: of:=[.E87]*[.$B$3] -> 21250 | G87: of:=[.E87]*[.$B$4] -> 963.05 | J87: of:=[.$B$7] -> 20 | K87: of:=(2*[.$B$6])-[.$B$7] -> 60 | L87: of:=-2*[.T87] -> -2160 | M87: of:=((-[.K87])+SQRT(([.K87]^2) - (4*[.J87]*[.L87])))/(2*[.J87]) -> 9 | N87: of:=[.M87]-1 -> 8 | Q87: 8 | R87: of:=[.Q87]+1 -> 9 | S87: of:=[.$B$6] + (([.R87]-1) * [.$B$7]) -> 200 | T87: of:=([.R87]/2)*([.$B$6]+[.S87]) -> 1080 | U87: of:=[.T87]>=[.G87] -> true | V87: of:=[.Q87]*[.$B$9] -> 800 | W87: of:=[.F87]+[.V87] -> 22050 | X87: of:=[.W87]>=[.$B$1] -> false | Y87: of:=[.V87]/[.W87] -> 0.036281179138322 | Z87: of:=1-[.Y87] -> 0.963718820861678 | AA87: of:=[.Y87]/[.Z87] -> 0.0376470588235294 | AB87: of:=[.$B$3]*[.AA87] -> 9.41176470588235 | AE87: of:=[.W87] -> 22050 | AF87: of:=(2*[.AE87]*[.$B$4]*([.$B$9]^2))/([.$B$3]*[.$B$7]) -> 999306 | AG87: of:=([.$B$9]^2)/(2*[.$B$7]) -> 250 | AH87: of:=(((2*[.$B$6])-[.$B$7])/[.$B$9])+((2*[.$B$4])/[.$B$3]) -> 0.69064 | AI87: of:=[.AG87]*[.AH87] -> 172.66 | AJ87: of:=[.AI87]^2 -> 29811.4756 | AK87: of:=SQRT([.AF87]+[.AJ87]) -> 1014.45427477043 | AL87: of:=[.AK87]-[.AI87] -> 841.79427477043 | AM87: of:=[.$B$3]*([.AL87]/([.AE87]-[.AL87])) -> 9.92297846499363
E88: 86 | F88: of:=[.E88]*[.$B$3] -> 21500 | G88: of:=[.E88]*[.$B$4] -> 974.38 | J88: of:=[.$B$7] -> 20 | K88: of:=(2*[.$B$6])-[.$B$7] -> 60 | L88: of:=-2*[.T88] -> -2160 | M88: of:=((-[.K88])+SQRT(([.K88]^2) - (4*[.J88]*[.L88])))/(2*[.J88]) -> 9 | N88: of:=[.M88]-1 -> 8 | Q88: 8 | R88: of:=[.Q88]+1 -> 9 | S88: of:=[.$B$6] + (([.R88]-1) * [.$B$7]) -> 200 | T88: of:=([.R88]/2)*([.$B$6]+[.S88]) -> 1080 | U88: of:=[.T88]>=[.G88] -> true | V88: of:=[.Q88]*[.$B$9] -> 800 | W88: of:=[.F88]+[.V88] -> 22300 | X88: of:=[.W88]>=[.$B$1] -> false | Y88: of:=[.V88]/[.W88] -> 0.0358744394618834 | Z88: of:=1-[.Y88] -> 0.964125560538117 | AA88: of:=[.Y88]/[.Z88] -> 0.0372093023255814 | AB88: of:=[.$B$3]*[.AA88] -> 9.30232558139535 | AE88: of:=[.W88] -> 22300 | AF88: of:=(2*[.AE88]*[.$B$4]*([.$B$9]^2))/([.$B$3]*[.$B$7]) -> 1010636 | AG88: of:=([.$B$9]^2)/(2*[.$B$7]) -> 250 | AH88: of:=(((2*[.$B$6])-[.$B$7])/[.$B$9])+((2*[.$B$4])/[.$B$3]) -> 0.69064 | AI88: of:=[.AG88]*[.AH88] -> 172.66 | AJ88: of:=[.AI88]^2 -> 29811.4756 | AK88: of:=SQRT([.AF88]+[.AJ88]) -> 1020.02327208746 | AL88: of:=[.AK88]-[.AI88] -> 847.363272087456 | AM88: of:=[.$B$3]*([.AL88]/([.AE88]-[.AL88])) -> 9.87481495671964
E89: 87 | F89: of:=[.E89]*[.$B$3] -> 21750 | G89: of:=[.E89]*[.$B$4] -> 985.71 | J89: of:=[.$B$7] -> 20 | K89: of:=(2*[.$B$6])-[.$B$7] -> 60 | L89: of:=-2*[.T89] -> -2160 | M89: of:=((-[.K89])+SQRT(([.K89]^2) - (4*[.J89]*[.L89])))/(2*[.J89]) -> 9 | N89: of:=[.M89]-1 -> 8 | Q89: 8 | R89: of:=[.Q89]+1 -> 9 | S89: of:=[.$B$6] + (([.R89]-1) * [.$B$7]) -> 200 | T89: of:=([.R89]/2)*([.$B$6]+[.S89]) -> 1080 | U89: of:=[.T89]>=[.G89] -> true | V89: of:=[.Q89]*[.$B$9] -> 800 | W89: of:=[.F89]+[.V89] -> 22550 | X89: of:=[.W89]>=[.$B$1] -> false | Y89: of:=[.V89]/[.W89] -> 0.0354767184035477 | Z89: of:=1-[.Y89] -> 0.964523281596452 | AA89: of:=[.Y89]/[.Z89] -> 0.0367816091954023 | AB89: of:=[.$B$3]*[.AA89] -> 9.19540229885057 | AE89: of:=[.W89] -> 22550 | AF89: of:=(2*[.AE89]*[.$B$4]*([.$B$9]^2))/([.$B$3]*[.$B$7]) -> 1021966 | AG89: of:=([.$B$9]^2)/(2*[.$B$7]) -> 250 | AH89: of:=(((2*[.$B$6])-[.$B$7])/[.$B$9])+((2*[.$B$4])/[.$B$3]) -> 0.69064 | AI89: of:=[.AG89]*[.AH89] -> 172.66 | AJ89: of:=[.AI89]^2 -> 29811.4756 | AK89: of:=SQRT([.AF89]+[.AJ89]) -> 1025.56202913329 | AL89: of:=[.AK89]-[.AI89] -> 852.902029133294 | AM89: of:=[.$B$3]*([.AL89]/([.AE89]-[.AL89])) -> 9.82737449817609
E90: 88 | F90: of:=[.E90]*[.$B$3] -> 22000 | G90: of:=[.E90]*[.$B$4] -> 997.04 | J90: of:=[.$B$7] -> 20 | K90: of:=(2*[.$B$6])-[.$B$7] -> 60 | L90: of:=-2*[.T90] -> -2160 | M90: of:=((-[.K90])+SQRT(([.K90]^2) - (4*[.J90]*[.L90])))/(2*[.J90]) -> 9 | N90: of:=[.M90]-1 -> 8 | Q90: 8 | R90: of:=[.Q90]+1 -> 9 | S90: of:=[.$B$6] + (([.R90]-1) * [.$B$7]) -> 200 | T90: of:=([.R90]/2)*([.$B$6]+[.S90]) -> 1080 | U90: of:=[.T90]>=[.G90] -> true | V90: of:=[.Q90]*[.$B$9] -> 800 | W90: of:=[.F90]+[.V90] -> 22800 | X90: of:=[.W90]>=[.$B$1] -> false | Y90: of:=[.V90]/[.W90] -> 0.0350877192982456 | Z90: of:=1-[.Y90] -> 0.964912280701754 | AA90: of:=[.Y90]/[.Z90] -> 0.0363636363636364 | AB90: of:=[.$B$3]*[.AA90] -> 9.09090909090909 | AE90: of:=[.W90] -> 22800 | AF90: of:=(2*[.AE90]*[.$B$4]*([.$B$9]^2))/([.$B$3]*[.$B$7]) -> 1033296 | AG90: of:=([.$B$9]^2)/(2*[.$B$7]) -> 250 | AH90: of:=(((2*[.$B$6])-[.$B$7])/[.$B$9])+((2*[.$B$4])/[.$B$3]) -> 0.69064 | AI90: of:=[.AG90]*[.AH90] -> 172.66 | AJ90: of:=[.AI90]^2 -> 29811.4756 | AK90: of:=SQRT([.AF90]+[.AJ90]) -> 1031.0710332465 | AL90: of:=[.AK90]-[.AI90] -> 858.411033246498 | AM90: of:=[.$B$3]*([.AL90]/([.AE90]-[.AL90])) -> 9.78063888794911
E91: 89 | F91: of:=[.E91]*[.$B$3] -> 22250 | G91: of:=[.E91]*[.$B$4] -> 1008.37 | J91: of:=[.$B$7] -> 20 | K91: of:=(2*[.$B$6])-[.$B$7] -> 60 | L91: of:=-2*[.T91] -> -2160 | M91: of:=((-[.K91])+SQRT(([.K91]^2) - (4*[.J91]*[.L91])))/(2*[.J91]) -> 9 | N91: of:=[.M91]-1 -> 8 | Q91: 8 | R91: of:=[.Q91]+1 -> 9 | S91: of:=[.$B$6] + (([.R91]-1) * [.$B$7]) -> 200 | T91: of:=([.R91]/2)*([.$B$6]+[.S91]) -> 1080 | U91: of:=[.T91]>=[.G91] -> true | V91: of:=[.Q91]*[.$B$9] -> 800 | W91: of:=[.F91]+[.V91] -> 23050 | X91: of:=[.W91]>=[.$B$1] -> false | Y91: of:=[.V91]/[.W91] -> 0.03470715835141 | Z91: of:=1-[.Y91] -> 0.96529284164859 | AA91: of:=[.Y91]/[.Z91] -> 0.0359550561797753 | AB91: of:=[.$B$3]*[.AA91] -> 8.98876404494382 | AE91: of:=[.W91] -> 23050 | AF91: of:=(2*[.AE91]*[.$B$4]*([.$B$9]^2))/([.$B$3]*[.$B$7]) -> 1044626 | AG91: of:=([.$B$9]^2)/(2*[.$B$7]) -> 250 | AH91: of:=(((2*[.$B$6])-[.$B$7])/[.$B$9])+((2*[.$B$4])/[.$B$3]) -> 0.69064 | AI91: of:=[.AG91]*[.AH91] -> 172.66 | AJ91: of:=[.AI91]^2 -> 29811.4756 | AK91: of:=SQRT([.AF91]+[.AJ91]) -> 1036.55075881502 | AL91: of:=[.AK91]-[.AI91] -> 863.890758815023 | AM91: of:=[.$B$3]*([.AL91]/([.AE91]-[.AL91])) -> 9.73459056547134
E92: 90 | F92: of:=[.E92]*[.$B$3] -> 22500 | G92: of:=[.E92]*[.$B$4] -> 1019.7 | J92: of:=[.$B$7] -> 20 | K92: of:=(2*[.$B$6])-[.$B$7] -> 60 | L92: of:=-2*[.T92] -> -2160 | M92: of:=((-[.K92])+SQRT(([.K92]^2) - (4*[.J92]*[.L92])))/(2*[.J92]) -> 9 | N92: of:=[.M92]-1 -> 8 | Q92: 8 | R92: of:=[.Q92]+1 -> 9 | S92: of:=[.$B$6] + (([.R92]-1) * [.$B$7]) -> 200 | T92: of:=([.R92]/2)*([.$B$6]+[.S92]) -> 1080 | U92: of:=[.T92]>=[.G92] -> true | V92: of:=[.Q92]*[.$B$9] -> 800 | W92: of:=[.F92]+[.V92] -> 23300 | X92: of:=[.W92]>=[.$B$1] -> false | Y92: of:=[.V92]/[.W92] -> 0.0343347639484979 | Z92: of:=1-[.Y92] -> 0.965665236051502 | AA92: of:=[.Y92]/[.Z92] -> 0.0355555555555556 | AB92: of:=[.$B$3]*[.AA92] -> 8.88888888888889 | AE92: of:=[.W92] -> 23300 | AF92: of:=(2*[.AE92]*[.$B$4]*([.$B$9]^2))/([.$B$3]*[.$B$7]) -> 1055956 | AG92: of:=([.$B$9]^2)/(2*[.$B$7]) -> 250 | AH92: of:=(((2*[.$B$6])-[.$B$7])/[.$B$9])+((2*[.$B$4])/[.$B$3]) -> 0.69064 | AI92: of:=[.AG92]*[.AH92] -> 172.66 | AJ92: of:=[.AI92]^2 -> 29811.4756 | AK92: of:=SQRT([.AF92]+[.AJ92]) -> 1042.00166775298 | AL92: of:=[.AK92]-[.AI92] -> 869.341667752984 | AM92: of:=[.$B$3]*([.AL92]/([.AE92]-[.AL92])) -> 9.68921258212907
E93: 91 | F93: of:=[.E93]*[.$B$3] -> 22750 | G93: of:=[.E93]*[.$B$4] -> 1031.03 | J93: of:=[.$B$7] -> 20 | K93: of:=(2*[.$B$6])-[.$B$7] -> 60 | L93: of:=-2*[.T93] -> -2160 | M93: of:=((-[.K93])+SQRT(([.K93]^2) - (4*[.J93]*[.L93])))/(2*[.J93]) -> 9 | N93: of:=[.M93]-1 -> 8 | Q93: 8 | R93: of:=[.Q93]+1 -> 9 | S93: of:=[.$B$6] + (([.R93]-1) * [.$B$7]) -> 200 | T93: of:=([.R93]/2)*([.$B$6]+[.S93]) -> 1080 | U93: of:=[.T93]>=[.G93] -> true | V93: of:=[.Q93]*[.$B$9] -> 800 | W93: of:=[.F93]+[.V93] -> 23550 | X93: of:=[.W93]>=[.$B$1] -> false | Y93: of:=[.V93]/[.W93] -> 0.0339702760084926 | Z93: of:=1-[.Y93] -> 0.966029723991507 | AA93: of:=[.Y93]/[.Z93] -> 0.0351648351648352 | AB93: of:=[.$B$3]*[.AA93] -> 8.79120879120879 | AE93: of:=[.W93] -> 23550 | AF93: of:=(2*[.AE93]*[.$B$4]*([.$B$9]^2))/([.$B$3]*[.$B$7]) -> 1067286 | AG93: of:=([.$B$9]^2)/(2*[.$B$7]) -> 250 | AH93: of:=(((2*[.$B$6])-[.$B$7])/[.$B$9])+((2*[.$B$4])/[.$B$3]) -> 0.69064 | AI93: of:=[.AG93]*[.AH93] -> 172.66 | AJ93: of:=[.AI93]^2 -> 29811.4756 | AK93: of:=SQRT([.AF93]+[.AJ93]) -> 1047.42420995507 | AL93: of:=[.AK93]-[.AI93] -> 874.764209955069 | AM93: of:=[.$B$3]*([.AL93]/([.AE93]-[.AL93])) -> 9.6444885739525
E94: 92 | F94: of:=[.E94]*[.$B$3] -> 23000 | G94: of:=[.E94]*[.$B$4] -> 1042.36 | J94: of:=[.$B$7] -> 20 | K94: of:=(2*[.$B$6])-[.$B$7] -> 60 | L94: of:=-2*[.T94] -> -2160 | M94: of:=((-[.K94])+SQRT(([.K94]^2) - (4*[.J94]*[.L94])))/(2*[.J94]) -> 9 | N94: of:=[.M94]-1 -> 8 | Q94: 8 | R94: of:=[.Q94]+1 -> 9 | S94: of:=[.$B$6] + (([.R94]-1) * [.$B$7]) -> 200 | T94: of:=([.R94]/2)*([.$B$6]+[.S94]) -> 1080 | U94: of:=[.T94]>=[.G94] -> true | V94: of:=[.Q94]*[.$B$9] -> 800 | W94: of:=[.F94]+[.V94] -> 23800 | X94: of:=[.W94]>=[.$B$1] -> false | Y94: of:=[.V94]/[.W94] -> 0.0336134453781513 | Z94: of:=1-[.Y94] -> 0.966386554621849 | AA94: of:=[.Y94]/[.Z94] -> 0.0347826086956522 | AB94: of:=[.$B$3]*[.AA94] -> 8.69565217391304 | AE94: of:=[.W94] -> 23800 | AF94: of:=(2*[.AE94]*[.$B$4]*([.$B$9]^2))/([.$B$3]*[.$B$7]) -> 1078616 | AG94: of:=([.$B$9]^2)/(2*[.$B$7]) -> 250 | AH94: of:=(((2*[.$B$6])-[.$B$7])/[.$B$9])+((2*[.$B$4])/[.$B$3]) -> 0.69064 | AI94: of:=[.AG94]*[.AH94] -> 172.66 | AJ94: of:=[.AI94]^2 -> 29811.4756 | AK94: of:=SQRT([.AF94]+[.AJ94]) -> 1052.8188237299 | AL94: of:=[.AK94]-[.AI94] -> 880.158823729895 | AM94: of:=[.$B$3]*([.AL94]/([.AE94]-[.AL94])) -> 9.60040273578729
E95: 93 | F95: of:=[.E95]*[.$B$3] -> 23250 | G95: of:=[.E95]*[.$B$4] -> 1053.69 | J95: of:=[.$B$7] -> 20 | K95: of:=(2*[.$B$6])-[.$B$7] -> 60 | L95: of:=-2*[.T95] -> -2160 | M95: of:=((-[.K95])+SQRT(([.K95]^2) - (4*[.J95]*[.L95])))/(2*[.J95]) -> 9 | N95: of:=[.M95]-1 -> 8 | Q95: 8 | R95: of:=[.Q95]+1 -> 9 | S95: of:=[.$B$6] + (([.R95]-1) * [.$B$7]) -> 200 | T95: of:=([.R95]/2)*([.$B$6]+[.S95]) -> 1080 | U95: of:=[.T95]>=[.G95] -> true | V95: of:=[.Q95]*[.$B$9] -> 800 | W95: of:=[.F95]+[.V95] -> 24050 | X95: of:=[.W95]>=[.$B$1] -> false | Y95: of:=[.V95]/[.W95] -> 0.0332640332640333 | Z95: of:=1-[.Y95] -> 0.966735966735967 | AA95: of:=[.Y95]/[.Z95] -> 0.0344086021505376 | AB95: of:=[.$B$3]*[.AA95] -> 8.60215053763441 | AE95: of:=[.W95] -> 24050 | AF95: of:=(2*[.AE95]*[.$B$4]*([.$B$9]^2))/([.$B$3]*[.$B$7]) -> 1089946 | AG95: of:=([.$B$9]^2)/(2*[.$B$7]) -> 250 | AH95: of:=(((2*[.$B$6])-[.$B$7])/[.$B$9])+((2*[.$B$4])/[.$B$3]) -> 0.69064 | AI95: of:=[.AG95]*[.AH95] -> 172.66 | AJ95: of:=[.AI95]^2 -> 29811.4756 | AK95: of:=SQRT([.AF95]+[.AJ95]) -> 1058.18593621348 | AL95: of:=[.AK95]-[.AI95] -> 885.52593621348 | AM95: of:=[.$B$3]*([.AL95]/([.AE95]-[.AL95])) -> 9.55693979685298
E96: 94 | F96: of:=[.E96]*[.$B$3] -> 23500 | G96: of:=[.E96]*[.$B$4] -> 1065.02 | J96: of:=[.$B$7] -> 20 | K96: of:=(2*[.$B$6])-[.$B$7] -> 60 | L96: of:=-2*[.T96] -> -2160 | M96: of:=((-[.K96])+SQRT(([.K96]^2) - (4*[.J96]*[.L96])))/(2*[.J96]) -> 9 | N96: of:=[.M96]-1 -> 8 | Q96: 8 | R96: of:=[.Q96]+1 -> 9 | S96: of:=[.$B$6] + (([.R96]-1) * [.$B$7]) -> 200 | T96: of:=([.R96]/2)*([.$B$6]+[.S96]) -> 1080 | U96: of:=[.T96]>=[.G96] -> true | V96: of:=[.Q96]*[.$B$9] -> 800 | W96: of:=[.F96]+[.V96] -> 24300 | X96: of:=[.W96]>=[.$B$1] -> false | Y96: of:=[.V96]/[.W96] -> 0.0329218106995885 | Z96: of:=1-[.Y96] -> 0.967078189300412 | AA96: of:=[.Y96]/[.Z96] -> 0.0340425531914894 | AB96: of:=[.$B$3]*[.AA96] -> 8.51063829787234 | AE96: of:=[.W96] -> 24300 | AF96: of:=(2*[.AE96]*[.$B$4]*([.$B$9]^2))/([.$B$3]*[.$B$7]) -> 1101276 | AG96: of:=([.$B$9]^2)/(2*[.$B$7]) -> 250 | AH96: of:=(((2*[.$B$6])-[.$B$7])/[.$B$9])+((2*[.$B$4])/[.$B$3]) -> 0.69064 | AI96: of:=[.AG96]*[.AH96] -> 172.66 | AJ96: of:=[.AI96]^2 -> 29811.4756 | AK96: of:=SQRT([.AF96]+[.AJ96]) -> 1063.52596376393 | AL96: of:=[.AK96]-[.AI96] -> 890.865963763932 | AM96: of:=[.$B$3]*([.AL96]/([.AE96]-[.AL96])) -> 9.51408499760093
E97: 95 | F97: of:=[.E97]*[.$B$3] -> 23750 | G97: of:=[.E97]*[.$B$4] -> 1076.35 | J97: of:=[.$B$7] -> 20 | K97: of:=(2*[.$B$6])-[.$B$7] -> 60 | L97: of:=-2*[.T97] -> -2160 | M97: of:=((-[.K97])+SQRT(([.K97]^2) - (4*[.J97]*[.L97])))/(2*[.J97]) -> 9 | N97: of:=[.M97]-1 -> 8 | Q97: 8 | R97: of:=[.Q97]+1 -> 9 | S97: of:=[.$B$6] + (([.R97]-1) * [.$B$7]) -> 200 | T97: of:=([.R97]/2)*([.$B$6]+[.S97]) -> 1080 | U97: of:=[.T97]>=[.G97] -> true | V97: of:=[.Q97]*[.$B$9] -> 800 | W97: of:=[.F97]+[.V97] -> 24550 | X97: of:=[.W97]>=[.$B$1] -> false | Y97: of:=[.V97]/[.W97] -> 0.0325865580448065 | Z97: of:=1-[.Y97] -> 0.967413441955194 | AA97: of:=[.Y97]/[.Z97] -> 0.0336842105263158 | AB97: of:=[.$B$3]*[.AA97] -> 8.42105263157895 | AE97: of:=[.W97] -> 24550 | AF97: of:=(2*[.AE97]*[.$B$4]*([.$B$9]^2))/([.$B$3]*[.$B$7]) -> 1112606 | AG97: of:=([.$B$9]^2)/(2*[.$B$7]) -> 250 | AH97: of:=(((2*[.$B$6])-[.$B$7])/[.$B$9])+((2*[.$B$4])/[.$B$3]) -> 0.69064 | AI97: of:=[.AG97]*[.AH97] -> 172.66 | AJ97: of:=[.AI97]^2 -> 29811.4756 | AK97: of:=SQRT([.AF97]+[.AJ97]) -> 1068.83931233839 | AL97: of:=[.AK97]-[.AI97] -> 896.179312338389 | AM97: of:=[.$B$3]*([.AL97]/([.AE97]-[.AL97])) -> 9.47182406779064
E98: 96 | F98: of:=[.E98]*[.$B$3] -> 24000 | G98: of:=[.E98]*[.$B$4] -> 1087.68 | J98: of:=[.$B$7] -> 20 | K98: of:=(2*[.$B$6])-[.$B$7] -> 60 | L98: of:=-2*[.T98] -> -2600 | M98: of:=((-[.K98])+SQRT(([.K98]^2) - (4*[.J98]*[.L98])))/(2*[.J98]) -> 10 | N98: of:=[.M98]-1 -> 9 | Q98: 9 | R98: of:=[.Q98]+1 -> 10 | S98: of:=[.$B$6] + (([.R98]-1) * [.$B$7]) -> 220 | T98: of:=([.R98]/2)*([.$B$6]+[.S98]) -> 1300 | U98: of:=[.T98]>=[.G98] -> true | V98: of:=[.Q98]*[.$B$9] -> 900 | W98: of:=[.F98]+[.V98] -> 24900 | X98: of:=[.W98]>=[.$B$1] -> false | Y98: of:=[.V98]/[.W98] -> 0.036144578313253 | Z98: of:=1-[.Y98] -> 0.963855421686747 | AA98: of:=[.Y98]/[.Z98] -> 0.0375 | AB98: of:=[.$B$3]*[.AA98] -> 9.375 | AE98: of:=[.W98] -> 24900 | AF98: of:=(2*[.AE98]*[.$B$4]*([.$B$9]^2))/([.$B$3]*[.$B$7]) -> 1128468 | AG98: of:=([.$B$9]^2)/(2*[.$B$7]) -> 250 | AH98: of:=(((2*[.$B$6])-[.$B$7])/[.$B$9])+((2*[.$B$4])/[.$B$3]) -> 0.69064 | AI98: of:=[.AG98]*[.AH98] -> 172.66 | AJ98: of:=[.AI98]^2 -> 29811.4756 | AK98: of:=SQRT([.AF98]+[.AJ98]) -> 1076.23393163382 | AL98: of:=[.AK98]-[.AI98] -> 903.573931633825 | AM98: of:=[.$B$3]*([.AL98]/([.AE98]-[.AL98])) -> 9.41363027414509
E99: 97 | F99: of:=[.E99]*[.$B$3] -> 24250 | G99: of:=[.E99]*[.$B$4] -> 1099.01 | J99: of:=[.$B$7] -> 20 | K99: of:=(2*[.$B$6])-[.$B$7] -> 60 | L99: of:=-2*[.T99] -> -2600 | M99: of:=((-[.K99])+SQRT(([.K99]^2) - (4*[.J99]*[.L99])))/(2*[.J99]) -> 10 | N99: of:=[.M99]-1 -> 9 | Q99: 9 | R99: of:=[.Q99]+1 -> 10 | S99: of:=[.$B$6] + (([.R99]-1) * [.$B$7]) -> 220 | T99: of:=([.R99]/2)*([.$B$6]+[.S99]) -> 1300 | U99: of:=[.T99]>=[.G99] -> true | V99: of:=[.Q99]*[.$B$9] -> 900 | W99: of:=[.F99]+[.V99] -> 25150 | X99: of:=[.W99]>=[.$B$1] -> false | Y99: of:=[.V99]/[.W99] -> 0.0357852882703777 | Z99: of:=1-[.Y99] -> 0.964214711729622 | AA99: of:=[.Y99]/[.Z99] -> 0.0371134020618557 | AB99: of:=[.$B$3]*[.AA99] -> 9.27835051546392 | AE99: of:=[.W99] -> 25150 | AF99: of:=(2*[.AE99]*[.$B$4]*([.$B$9]^2))/([.$B$3]*[.$B$7]) -> 1139798 | AG99: of:=([.$B$9]^2)/(2*[.$B$7]) -> 250 | AH99: of:=(((2*[.$B$6])-[.$B$7])/[.$B$9])+((2*[.$B$4])/[.$B$3]) -> 0.69064 | AI99: of:=[.AG99]*[.AH99] -> 172.66 | AJ99: of:=[.AI99]^2 -> 29811.4756 | AK99: of:=SQRT([.AF99]+[.AJ99]) -> 1081.48484760537 | AL99: of:=[.AK99]-[.AI99] -> 908.824847605365 | AM99: of:=[.$B$3]*([.AL99]/([.AE99]-[.AL99])) -> 9.37273917097608
E100: 98 | F100: of:=[.E100]*[.$B$3] -> 24500 | G100: of:=[.E100]*[.$B$4] -> 1110.34 | J100: of:=[.$B$7] -> 20 | K100: of:=(2*[.$B$6])-[.$B$7] -> 60 | L100: of:=-2*[.T100] -> -2600 | M100: of:=((-[.K100])+SQRT(([.K100]^2) - (4*[.J100]*[.L100])))/(2*[.J100]) -> 10 | N100: of:=[.M100]-1 -> 9 | Q100: 9 | R100: of:=[.Q100]+1 -> 10 | S100: of:=[.$B$6] + (([.R100]-1) * [.$B$7]) -> 220 | T100: of:=([.R100]/2)*([.$B$6]+[.S100]) -> 1300 | U100: of:=[.T100]>=[.G100] -> true | V100: of:=[.Q100]*[.$B$9] -> 900 | W100: of:=[.F100]+[.V100] -> 25400 | X100: of:=[.W100]>=[.$B$1] -> false | Y100: of:=[.V100]/[.W100] -> 0.0354330708661417 | Z100: of:=1-[.Y100] -> 0.964566929133858 | AA100: of:=[.Y100]/[.Z100] -> 0.036734693877551 | AB100: of:=[.$B$3]*[.AA100] -> 9.18367346938776 | AE100: of:=[.W100] -> 25400 | AF100: of:=(2*[.AE100]*[.$B$4]*([.$B$9]^2))/([.$B$3]*[.$B$7]) -> 1151128 | AG100: of:=([.$B$9]^2)/(2*[.$B$7]) -> 250 | AH100: of:=(((2*[.$B$6])-[.$B$7])/[.$B$9])+((2*[.$B$4])/[.$B$3]) -> 0.69064 | AI100: of:=[.AG100]*[.AH100] -> 172.66 | AJ100: of:=[.AI100]^2 -> 29811.4756 | AK100: of:=SQRT([.AF100]+[.AJ100]) -> 1086.71039177879 | AL100: of:=[.AK100]-[.AI100] -> 914.050391778785 | AM100: of:=[.$B$3]*([.AL100]/([.AE100]-[.AL100])) -> 9.33239680718662
E101: 99 | F101: of:=[.E101]*[.$B$3] -> 24750 | G101: of:=[.E101]*[.$B$4] -> 1121.67 | J101: of:=[.$B$7] -> 20 | K101: of:=(2*[.$B$6])-[.$B$7] -> 60 | L101: of:=-2*[.T101] -> -2600 | M101: of:=((-[.K101])+SQRT(([.K101]^2) - (4*[.J101]*[.L101])))/(2*[.J101]) -> 10 | N101: of:=[.M101]-1 -> 9 | Q101: 9 | R101: of:=[.Q101]+1 -> 10 | S101: of:=[.$B$6] + (([.R101]-1) * [.$B$7]) -> 220 | T101: of:=([.R101]/2)*([.$B$6]+[.S101]) -> 1300 | U101: of:=[.T101]>=[.G101] -> true | V101: of:=[.Q101]*[.$B$9] -> 900 | W101: of:=[.F101]+[.V101] -> 25650 | X101: of:=[.W101]>=[.$B$1] -> true | Y101: of:=[.V101]/[.W101] -> 0.0350877192982456 | Z101: of:=1-[.Y101] -> 0.964912280701754 | AA101: of:=[.Y101]/[.Z101] -> 0.0363636363636364 | AB101: of:=[.$B$3]*[.AA101] -> 9.09090909090909 | AE101: of:=[.W101] -> 25650 | AF101: of:=(2*[.AE101]*[.$B$4]*([.$B$9]^2))/([.$B$3]*[.$B$7]) -> 1162458 | AG101: of:=([.$B$9]^2)/(2*[.$B$7]) -> 250 | AH101: of:=(((2*[.$B$6])-[.$B$7])/[.$B$9])+((2*[.$B$4])/[.$B$3]) -> 0.69064 | AI101: of:=[.AG101]*[.AH101] -> 172.66 | AJ101: of:=[.AI101]^2 -> 29811.4756 | AK101: of:=SQRT([.AF101]+[.AJ101]) -> 1091.91092841861 | AL101: of:=[.AK101]-[.AI101] -> 919.250928418614 | AM101: of:=[.$B$3]*([.AL101]/([.AE101]-[.AL101])) -> 9.29259083254927
E102: 100 | F102: of:=[.E102]*[.$B$3] -> 25000 | G102: of:=[.E102]*[.$B$4] -> 1133 | J102: of:=[.$B$7] -> 20 | K102: of:=(2*[.$B$6])-[.$B$7] -> 60 | L102: of:=-2*[.T102] -> -2600 | M102: of:=((-[.K102])+SQRT(([.K102]^2) - (4*[.J102]*[.L102])))/(2*[.J102]) -> 10 | N102: of:=[.M102]-1 -> 9 | Q102: 9 | R102: of:=[.Q102]+1 -> 10 | S102: of:=[.$B$6] + (([.R102]-1) * [.$B$7]) -> 220 | T102: of:=([.R102]/2)*([.$B$6]+[.S102]) -> 1300 | U102: of:=[.T102]>=[.G102] -> true | V102: of:=[.Q102]*[.$B$9] -> 900 | W102: of:=[.F102]+[.V102] -> 25900 | X102: of:=[.W102]>=[.$B$1] -> true | Y102: of:=[.V102]/[.W102] -> 0.0347490347490347 | Z102: of:=1-[.Y102] -> 0.965250965250965 | AA102: of:=[.Y102]/[.Z102] -> 0.036 | AB102: of:=[.$B$3]*[.AA102] -> 9 | AE102: of:=[.W102] -> 25900 | AF102: of:=(2*[.AE102]*[.$B$4]*([.$B$9]^2))/([.$B$3]*[.$B$7]) -> 1173788 | AG102: of:=([.$B$9]^2)/(2*[.$B$7]) -> 250 | AH102: of:=(((2*[.$B$6])-[.$B$7])/[.$B$9])+((2*[.$B$4])/[.$B$3]) -> 0.69064 | AI102: of:=[.AG102]*[.AH102] -> 172.66 | AJ102: of:=[.AI102]^2 -> 29811.4756 | AK102: of:=SQRT([.AF102]+[.AJ102]) -> 1097.08681315564 | AL102: of:=[.AK102]-[.AI102] -> 924.426813155641 | AM102: of:=[.$B$3]*([.AL102]/([.AE102]-[.AL102])) -> 9.25330928583627
E103: 101 | F103: of:=[.E103]*[.$B$3] -> 25250 | G103: of:=[.E103]*[.$B$4] -> 1144.33 | J103: of:=[.$B$7] -> 20 | K103: of:=(2*[.$B$6])-[.$B$7] -> 60 | L103: of:=-2*[.T103] -> -2600 | M103: of:=((-[.K103])+SQRT(([.K103]^2) - (4*[.J103]*[.L103])))/(2*[.J103]) -> 10 | N103: of:=[.M103]-1 -> 9 | Q103: 9 | R103: of:=[.Q103]+1 -> 10 | S103: of:=[.$B$6] + (([.R103]-1) * [.$B$7]) -> 220 | T103: of:=([.R103]/2)*([.$B$6]+[.S103]) -> 1300 | U103: of:=[.T103]>=[.G103] -> true | V103: of:=[.Q103]*[.$B$9] -> 900 | W103: of:=[.F103]+[.V103] -> 26150 | X103: of:=[.W103]>=[.$B$1] -> true | Y103: of:=[.V103]/[.W103] -> 0.0344168260038241 | Z103: of:=1-[.Y103] -> 0.965583173996176 | AA103: of:=[.Y103]/[.Z103] -> 0.0356435643564356 | AB103: of:=[.$B$3]*[.AA103] -> 8.91089108910891 | AE103: of:=[.W103] -> 26150 | AF103: of:=(2*[.AE103]*[.$B$4]*([.$B$9]^2))/([.$B$3]*[.$B$7]) -> 1185118 | AG103: of:=([.$B$9]^2)/(2*[.$B$7]) -> 250 | AH103: of:=(((2*[.$B$6])-[.$B$7])/[.$B$9])+((2*[.$B$4])/[.$B$3]) -> 0.69064 | AI103: of:=[.AG103]*[.AH103] -> 172.66 | AJ103: of:=[.AI103]^2 -> 29811.4756 | AK103: of:=SQRT([.AF103]+[.AJ103]) -> 1102.23839327071 | AL103: of:=[.AK103]-[.AI103] -> 929.578393270712 | AM103: of:=[.$B$3]*([.AL103]/([.AE103]-[.AL103])) -> 9.21454057911826
E104: 102 | F104: of:=[.E104]*[.$B$3] -> 25500 | G104: of:=[.E104]*[.$B$4] -> 1155.66 | J104: of:=[.$B$7] -> 20 | K104: of:=(2*[.$B$6])-[.$B$7] -> 60 | L104: of:=-2*[.T104] -> -2600 | M104: of:=((-[.K104])+SQRT(([.K104]^2) - (4*[.J104]*[.L104])))/(2*[.J104]) -> 10 | N104: of:=[.M104]-1 -> 9 | Q104: 9 | R104: of:=[.Q104]+1 -> 10 | S104: of:=[.$B$6] + (([.R104]-1) * [.$B$7]) -> 220 | T104: of:=([.R104]/2)*([.$B$6]+[.S104]) -> 1300 | U104: of:=[.T104]>=[.G104] -> true | V104: of:=[.Q104]*[.$B$9] -> 900 | W104: of:=[.F104]+[.V104] -> 26400 | X104: of:=[.W104]>=[.$B$1] -> true | Y104: of:=[.V104]/[.W104] -> 0.0340909090909091 | Z104: of:=1-[.Y104] -> 0.965909090909091 | AA104: of:=[.Y104]/[.Z104] -> 0.0352941176470588 | AB104: of:=[.$B$3]*[.AA104] -> 8.82352941176471 | AE104: of:=[.W104] -> 26400 | AF104: of:=(2*[.AE104]*[.$B$4]*([.$B$9]^2))/([.$B$3]*[.$B$7]) -> 1196448 | AG104: of:=([.$B$9]^2)/(2*[.$B$7]) -> 250 | AH104: of:=(((2*[.$B$6])-[.$B$7])/[.$B$9])+((2*[.$B$4])/[.$B$3]) -> 0.69064 | AI104: of:=[.AG104]*[.AH104] -> 172.66 | AJ104: of:=[.AI104]^2 -> 29811.4756 | AK104: of:=SQRT([.AF104]+[.AJ104]) -> 1107.36600796665 | AL104: of:=[.AK104]-[.AI104] -> 934.706007966653 | AM104: of:=[.$B$3]*([.AL104]/([.AE104]-[.AL104])) -> 9.17627348283382
E105: 103 | F105: of:=[.E105]*[.$B$3] -> 25750 | G105: of:=[.E105]*[.$B$4] -> 1166.99 | J105: of:=[.$B$7] -> 20 | K105: of:=(2*[.$B$6])-[.$B$7] -> 60 | L105: of:=-2*[.T105] -> -2600 | M105: of:=((-[.K105])+SQRT(([.K105]^2) - (4*[.J105]*[.L105])))/(2*[.J105]) -> 10 | N105: of:=[.M105]-1 -> 9 | Q105: 9 | R105: of:=[.Q105]+1 -> 10 | S105: of:=[.$B$6] + (([.R105]-1) * [.$B$7]) -> 220 | T105: of:=([.R105]/2)*([.$B$6]+[.S105]) -> 1300 | U105: of:=[.T105]>=[.G105] -> true | V105: of:=[.Q105]*[.$B$9] -> 900 | W105: of:=[.F105]+[.V105] -> 26650 | X105: of:=[.W105]>=[.$B$1] -> true | Y105: of:=[.V105]/[.W105] -> 0.0337711069418386 | Z105: of:=1-[.Y105] -> 0.966228893058161 | AA105: of:=[.Y105]/[.Z105] -> 0.0349514563106796 | AB105: of:=[.$B$3]*[.AA105] -> 8.7378640776699 | AE105: of:=[.W105] -> 26650 | AF105: of:=(2*[.AE105]*[.$B$4]*([.$B$9]^2))/([.$B$3]*[.$B$7]) -> 1207778 | AG105: of:=([.$B$9]^2)/(2*[.$B$7]) -> 250 | AH105: of:=(((2*[.$B$6])-[.$B$7])/[.$B$9])+((2*[.$B$4])/[.$B$3]) -> 0.69064 | AI105: of:=[.AG105]*[.AH105] -> 172.66 | AJ105: of:=[.AI105]^2 -> 29811.4756 | AK105: of:=SQRT([.AF105]+[.AJ105]) -> 1112.46998862891 | AL105: of:=[.AK105]-[.AI105] -> 939.809988628907 | AM105: of:=[.$B$3]*([.AL105]/([.AE105]-[.AL105])) -> 9.13849711158541
E106: 104 | F106: of:=[.E106]*[.$B$3] -> 26000 | G106: of:=[.E106]*[.$B$4] -> 1178.32 | J106: of:=[.$B$7] -> 20 | K106: of:=(2*[.$B$6])-[.$B$7] -> 60 | L106: of:=-2*[.T106] -> -2600 | M106: of:=((-[.K106])+SQRT(([.K106]^2) - (4*[.J106]*[.L106])))/(2*[.J106]) -> 10 | N106: of:=[.M106]-1 -> 9 | Q106: 9 | R106: of:=[.Q106]+1 -> 10 | S106: of:=[.$B$6] + (([.R106]-1) * [.$B$7]) -> 220 | T106: of:=([.R106]/2)*([.$B$6]+[.S106]) -> 1300 | U106: of:=[.T106]>=[.G106] -> true | V106: of:=[.Q106]*[.$B$9] -> 900 | W106: of:=[.F106]+[.V106] -> 26900 | X106: of:=[.W106]>=[.$B$1] -> true | Y106: of:=[.V106]/[.W106] -> 0.033457249070632 | Z106: of:=1-[.Y106] -> 0.966542750929368 | AA106: of:=[.Y106]/[.Z106] -> 0.0346153846153846 | AB106: of:=[.$B$3]*[.AA106] -> 8.65384615384615 | AE106: of:=[.W106] -> 26900 | AF106: of:=(2*[.AE106]*[.$B$4]*([.$B$9]^2))/([.$B$3]*[.$B$7]) -> 1219108 | AG106: of:=([.$B$9]^2)/(2*[.$B$7]) -> 250 | AH106: of:=(((2*[.$B$6])-[.$B$7])/[.$B$9])+((2*[.$B$4])/[.$B$3]) -> 0.69064 | AI106: of:=[.AG106]*[.AH106] -> 172.66 | AJ106: of:=[.AI106]^2 -> 29811.4756 | AK106: of:=SQRT([.AF106]+[.AJ106]) -> 1117.55065907546 | AL106: of:=[.AK106]-[.AI106] -> 944.890659075462 | AM106: of:=[.$B$3]*([.AL106]/([.AE106]-[.AL106])) -> 9.10120091062006
E107: 105 | F107: of:=[.E107]*[.$B$3] -> 26250 | G107: of:=[.E107]*[.$B$4] -> 1189.65 | J107: of:=[.$B$7] -> 20 | K107: of:=(2*[.$B$6])-[.$B$7] -> 60 | L107: of:=-2*[.T107] -> -2600 | M107: of:=((-[.K107])+SQRT(([.K107]^2) - (4*[.J107]*[.L107])))/(2*[.J107]) -> 10 | N107: of:=[.M107]-1 -> 9 | Q107: 9 | R107: of:=[.Q107]+1 -> 10 | S107: of:=[.$B$6] + (([.R107]-1) * [.$B$7]) -> 220 | T107: of:=([.R107]/2)*([.$B$6]+[.S107]) -> 1300 | U107: of:=[.T107]>=[.G107] -> true | V107: of:=[.Q107]*[.$B$9] -> 900 | W107: of:=[.F107]+[.V107] -> 27150 | X107: of:=[.W107]>=[.$B$1] -> true | Y107: of:=[.V107]/[.W107] -> 0.0331491712707182 | Z107: of:=1-[.Y107] -> 0.966850828729282 | AA107: of:=[.Y107]/[.Z107] -> 0.0342857142857143 | AB107: of:=[.$B$3]*[.AA107] -> 8.57142857142857 | AE107: of:=[.W107] -> 27150 | AF107: of:=(2*[.AE107]*[.$B$4]*([.$B$9]^2))/([.$B$3]*[.$B$7]) -> 1230438 | AG107: of:=([.$B$9]^2)/(2*[.$B$7]) -> 250 | AH107: of:=(((2*[.$B$6])-[.$B$7])/[.$B$9])+((2*[.$B$4])/[.$B$3]) -> 0.69064 | AI107: of:=[.AG107]*[.AH107] -> 172.66 | AJ107: of:=[.AI107]^2 -> 29811.4756 | AK107: of:=SQRT([.AF107]+[.AJ107]) -> 1122.60833579659 | AL107: of:=[.AK107]-[.AI107] -> 949.948335796595 | AM107: of:=[.$B$3]*([.AL107]/([.AE107]-[.AL107])) -> 9.06437464295624
E108: 106 | F108: of:=[.E108]*[.$B$3] -> 26500 | G108: of:=[.E108]*[.$B$4] -> 1200.98 | J108: of:=[.$B$7] -> 20 | K108: of:=(2*[.$B$6])-[.$B$7] -> 60 | L108: of:=-2*[.T108] -> -2600 | M108: of:=((-[.K108])+SQRT(([.K108]^2) - (4*[.J108]*[.L108])))/(2*[.J108]) -> 10 | N108: of:=[.M108]-1 -> 9 | Q108: 9 | R108: of:=[.Q108]+1 -> 10 | S108: of:=[.$B$6] + (([.R108]-1) * [.$B$7]) -> 220 | T108: of:=([.R108]/2)*([.$B$6]+[.S108]) -> 1300 | U108: of:=[.T108]>=[.G108] -> true | V108: of:=[.Q108]*[.$B$9] -> 900 | W108: of:=[.F108]+[.V108] -> 27400 | X108: of:=[.W108]>=[.$B$1] -> true | Y108: of:=[.V108]/[.W108] -> 0.0328467153284672 | Z108: of:=1-[.Y108] -> 0.967153284671533 | AA108: of:=[.Y108]/[.Z108] -> 0.0339622641509434 | AB108: of:=[.$B$3]*[.AA108] -> 8.49056603773585 | AE108: of:=[.W108] -> 27400 | AF108: of:=(2*[.AE108]*[.$B$4]*([.$B$9]^2))/([.$B$3]*[.$B$7]) -> 1241768 | AG108: of:=([.$B$9]^2)/(2*[.$B$7]) -> 250 | AH108: of:=(((2*[.$B$6])-[.$B$7])/[.$B$9])+((2*[.$B$4])/[.$B$3]) -> 0.69064 | AI108: of:=[.AG108]*[.AH108] -> 172.66 | AJ108: of:=[.AI108]^2 -> 29811.4756 | AK108: of:=SQRT([.AF108]+[.AJ108]) -> 1127.64332818494 | AL108: of:=[.AK108]-[.AI108] -> 954.983328184936 | AM108: of:=[.$B$3]*([.AL108]/([.AE108]-[.AL108])) -> 9.02800837712036
E109: 107 | F109: of:=[.E109]*[.$B$3] -> 26750 | G109: of:=[.E109]*[.$B$4] -> 1212.31 | J109: of:=[.$B$7] -> 20 | K109: of:=(2*[.$B$6])-[.$B$7] -> 60 | L109: of:=-2*[.T109] -> -2600 | M109: of:=((-[.K109])+SQRT(([.K109]^2) - (4*[.J109]*[.L109])))/(2*[.J109]) -> 10 | N109: of:=[.M109]-1 -> 9 | Q109: 9 | R109: of:=[.Q109]+1 -> 10 | S109: of:=[.$B$6] + (([.R109]-1) * [.$B$7]) -> 220 | T109: of:=([.R109]/2)*([.$B$6]+[.S109]) -> 1300 | U109: of:=[.T109]>=[.G109] -> true | V109: of:=[.Q109]*[.$B$9] -> 900 | W109: of:=[.F109]+[.V109] -> 27650 | X109: of:=[.W109]>=[.$B$1] -> true | Y109: of:=[.V109]/[.W109] -> 0.0325497287522604 | Z109: of:=1-[.Y109] -> 0.96745027124774 | AA109: of:=[.Y109]/[.Z109] -> 0.0336448598130841 | AB109: of:=[.$B$3]*[.AA109] -> 8.41121495327103 | AE109: of:=[.W109] -> 27650 | AF109: of:=(2*[.AE109]*[.$B$4]*([.$B$9]^2))/([.$B$3]*[.$B$7]) -> 1253098 | AG109: of:=([.$B$9]^2)/(2*[.$B$7]) -> 250 | AH109: of:=(((2*[.$B$6])-[.$B$7])/[.$B$9])+((2*[.$B$4])/[.$B$3]) -> 0.69064 | AI109: of:=[.AG109]*[.AH109] -> 172.66 | AJ109: of:=[.AI109]^2 -> 29811.4756 | AK109: of:=SQRT([.AF109]+[.AJ109]) -> 1132.65593875634 | AL109: of:=[.AK109]-[.AI109] -> 959.995938756338 | AM109: of:=[.$B$3]*([.AL109]/([.AE109]-[.AL109])) -> 8.99209247545919
E110: 108 | F110: of:=[.E110]*[.$B$3] -> 27000 | G110: of:=[.E110]*[.$B$4] -> 1223.64 | J110: of:=[.$B$7] -> 20 | K110: of:=(2*[.$B$6])-[.$B$7] -> 60 | L110: of:=-2*[.T110] -> -2600 | M110: of:=((-[.K110])+SQRT(([.K110]^2) - (4*[.J110]*[.L110])))/(2*[.J110]) -> 10 | N110: of:=[.M110]-1 -> 9 | Q110: 9 | R110: of:=[.Q110]+1 -> 10 | S110: of:=[.$B$6] + (([.R110]-1) * [.$B$7]) -> 220 | T110: of:=([.R110]/2)*([.$B$6]+[.S110]) -> 1300 | U110: of:=[.T110]>=[.G110] -> true | V110: of:=[.Q110]*[.$B$9] -> 900 | W110: of:=[.F110]+[.V110] -> 27900 | X110: of:=[.W110]>=[.$B$1] -> true | Y110: of:=[.V110]/[.W110] -> 0.032258064516129 | Z110: of:=1-[.Y110] -> 0.967741935483871 | AA110: of:=[.Y110]/[.Z110] -> 0.0333333333333333 | AB110: of:=[.$B$3]*[.AA110] -> 8.33333333333333 | AE110: of:=[.W110] -> 27900 | AF110: of:=(2*[.AE110]*[.$B$4]*([.$B$9]^2))/([.$B$3]*[.$B$7]) -> 1264428 | AG110: of:=([.$B$9]^2)/(2*[.$B$7]) -> 250 | AH110: of:=(((2*[.$B$6])-[.$B$7])/[.$B$9])+((2*[.$B$4])/[.$B$3]) -> 0.69064 | AI110: of:=[.AG110]*[.AH110] -> 172.66 | AJ110: of:=[.AI110]^2 -> 29811.4756 | AK110: of:=SQRT([.AF110]+[.AJ110]) -> 1137.64646336197 | AL110: of:=[.AK110]-[.AI110] -> 964.986463361971 | AM110: of:=[.$B$3]*([.AL110]/([.AE110]-[.AL110])) -> 8.9566175829962
E111: 109 | F111: of:=[.E111]*[.$B$3] -> 27250 | G111: of:=[.E111]*[.$B$4] -> 1234.97 | J111: of:=[.$B$7] -> 20 | K111: of:=(2*[.$B$6])-[.$B$7] -> 60 | L111: of:=-2*[.T111] -> -2600 | M111: of:=((-[.K111])+SQRT(([.K111]^2) - (4*[.J111]*[.L111])))/(2*[.J111]) -> 10 | N111: of:=[.M111]-1 -> 9 | Q111: 9 | R111: of:=[.Q111]+1 -> 10 | S111: of:=[.$B$6] + (([.R111]-1) * [.$B$7]) -> 220 | T111: of:=([.R111]/2)*([.$B$6]+[.S111]) -> 1300 | U111: of:=[.T111]>=[.G111] -> true | V111: of:=[.Q111]*[.$B$9] -> 900 | W111: of:=[.F111]+[.V111] -> 28150 | X111: of:=[.W111]>=[.$B$1] -> true | Y111: of:=[.V111]/[.W111] -> 0.0319715808170515 | Z111: of:=1-[.Y111] -> 0.968028419182948 | AA111: of:=[.Y111]/[.Z111] -> 0.0330275229357798 | AB111: of:=[.$B$3]*[.AA111] -> 8.25688073394496 | AE111: of:=[.W111] -> 28150 | AF111: of:=(2*[.AE111]*[.$B$4]*([.$B$9]^2))/([.$B$3]*[.$B$7]) -> 1275758 | AG111: of:=([.$B$9]^2)/(2*[.$B$7]) -> 250 | AH111: of:=(((2*[.$B$6])-[.$B$7])/[.$B$9])+((2*[.$B$4])/[.$B$3]) -> 0.69064 | AI111: of:=[.AG111]*[.AH111] -> 172.66 | AJ111: of:=[.AI111]^2 -> 29811.4756 | AK111: of:=SQRT([.AF111]+[.AJ111]) -> 1142.6151913921 | AL111: of:=[.AK111]-[.AI111] -> 969.955191392098 | AM111: of:=[.$B$3]*([.AL111]/([.AE111]-[.AL111])) -> 8.92157461680226
E112: 110 | F112: of:=[.E112]*[.$B$3] -> 27500 | G112: of:=[.E112]*[.$B$4] -> 1246.3 | J112: of:=[.$B$7] -> 20 | K112: of:=(2*[.$B$6])-[.$B$7] -> 60 | L112: of:=-2*[.T112] -> -2600 | M112: of:=((-[.K112])+SQRT(([.K112]^2) - (4*[.J112]*[.L112])))/(2*[.J112]) -> 10 | N112: of:=[.M112]-1 -> 9 | Q112: 9 | R112: of:=[.Q112]+1 -> 10 | S112: of:=[.$B$6] + (([.R112]-1) * [.$B$7]) -> 220 | T112: of:=([.R112]/2)*([.$B$6]+[.S112]) -> 1300 | U112: of:=[.T112]>=[.G112] -> true | V112: of:=[.Q112]*[.$B$9] -> 900 | W112: of:=[.F112]+[.V112] -> 28400 | X112: of:=[.W112]>=[.$B$1] -> true | Y112: of:=[.V112]/[.W112] -> 0.0316901408450704 | Z112: of:=1-[.Y112] -> 0.96830985915493 | AA112: of:=[.Y112]/[.Z112] -> 0.0327272727272727 | AB112: of:=[.$B$3]*[.AA112] -> 8.18181818181818 | AE112: of:=[.W112] -> 28400 | AF112: of:=(2*[.AE112]*[.$B$4]*([.$B$9]^2))/([.$B$3]*[.$B$7]) -> 1287088 | AG112: of:=([.$B$9]^2)/(2*[.$B$7]) -> 250 | AH112: of:=(((2*[.$B$6])-[.$B$7])/[.$B$9])+((2*[.$B$4])/[.$B$3]) -> 0.69064 | AI112: of:=[.AG112]*[.AH112] -> 172.66 | AJ112: of:=[.AI112]^2 -> 29811.4756 | AK112: of:=SQRT([.AF112]+[.AJ112]) -> 1147.56240597189 | AL112: of:=[.AK112]-[.AI112] -> 974.902405971893 | AM112: of:=[.$B$3]*([.AL112]/([.AE112]-[.AL112])) -> 8.88695475585273
E113: 111 | F113: of:=[.E113]*[.$B$3] -> 27750 | G113: of:=[.E113]*[.$B$4] -> 1257.63 | J113: of:=[.$B$7] -> 20 | K113: of:=(2*[.$B$6])-[.$B$7] -> 60 | L113: of:=-2*[.T113] -> -2600 | M113: of:=((-[.K113])+SQRT(([.K113]^2) - (4*[.J113]*[.L113])))/(2*[.J113]) -> 10 | N113: of:=[.M113]-1 -> 9 | Q113: 9 | R113: of:=[.Q113]+1 -> 10 | S113: of:=[.$B$6] + (([.R113]-1) * [.$B$7]) -> 220 | T113: of:=([.R113]/2)*([.$B$6]+[.S113]) -> 1300 | U113: of:=[.T113]>=[.G113] -> true | V113: of:=[.Q113]*[.$B$9] -> 900 | W113: of:=[.F113]+[.V113] -> 28650 | X113: of:=[.W113]>=[.$B$1] -> true | Y113: of:=[.V113]/[.W113] -> 0.031413612565445 | Z113: of:=1-[.Y113] -> 0.968586387434555 | AA113: of:=[.Y113]/[.Z113] -> 0.0324324324324324 | AB113: of:=[.$B$3]*[.AA113] -> 8.10810810810811 | AE113: of:=[.W113] -> 28650 | AF113: of:=(2*[.AE113]*[.$B$4]*([.$B$9]^2))/([.$B$3]*[.$B$7]) -> 1298418 | AG113: of:=([.$B$9]^2)/(2*[.$B$7]) -> 250 | AH113: of:=(((2*[.$B$6])-[.$B$7])/[.$B$9])+((2*[.$B$4])/[.$B$3]) -> 0.69064 | AI113: of:=[.AG113]*[.AH113] -> 172.66 | AJ113: of:=[.AI113]^2 -> 29811.4756 | AK113: of:=SQRT([.AF113]+[.AJ113]) -> 1152.48838414971 | AL113: of:=[.AK113]-[.AI113] -> 979.828384149706 | AM113: of:=[.$B$3]*([.AL113]/([.AE113]-[.AL113])) -> 8.85274943134461
E114: 112 | F114: of:=[.E114]*[.$B$3] -> 28000 | G114: of:=[.E114]*[.$B$4] -> 1268.96 | J114: of:=[.$B$7] -> 20 | K114: of:=(2*[.$B$6])-[.$B$7] -> 60 | L114: of:=-2*[.T114] -> -2600 | M114: of:=((-[.K114])+SQRT(([.K114]^2) - (4*[.J114]*[.L114])))/(2*[.J114]) -> 10 | N114: of:=[.M114]-1 -> 9 | Q114: 9 | R114: of:=[.Q114]+1 -> 10 | S114: of:=[.$B$6] + (([.R114]-1) * [.$B$7]) -> 220 | T114: of:=([.R114]/2)*([.$B$6]+[.S114]) -> 1300 | U114: of:=[.T114]>=[.G114] -> true | V114: of:=[.Q114]*[.$B$9] -> 900 | W114: of:=[.F114]+[.V114] -> 28900 | X114: of:=[.W114]>=[.$B$1] -> true | Y114: of:=[.V114]/[.W114] -> 0.0311418685121107 | Z114: of:=1-[.Y114] -> 0.968858131487889 | AA114: of:=[.Y114]/[.Z114] -> 0.0321428571428571 | AB114: of:=[.$B$3]*[.AA114] -> 8.03571428571429 | AE114: of:=[.W114] -> 28900 | AF114: of:=(2*[.AE114]*[.$B$4]*([.$B$9]^2))/([.$B$3]*[.$B$7]) -> 1309748 | AG114: of:=([.$B$9]^2)/(2*[.$B$7]) -> 250 | AH114: of:=(((2*[.$B$6])-[.$B$7])/[.$B$9])+((2*[.$B$4])/[.$B$3]) -> 0.69064 | AI114: of:=[.AG114]*[.AH114] -> 172.66 | AJ114: of:=[.AI114]^2 -> 29811.4756 | AK114: of:=SQRT([.AF114]+[.AJ114]) -> 1157.39339707811 | AL114: of:=[.AK114]-[.AI114] -> 984.733397078107 | AM114: of:=[.$B$3]*([.AL114]/([.AE114]-[.AL114])) -> 8.81895031744955